Timestamp,Subreddit,Post/Comment
2021-04-25 09:12:49,stocks,"Baba is taking it hard from the government. I think it’ll be fine. But the waters need to clear. The US exchange would want to keep Baba but China has plans of its own. 

I’m also long Baba on calls and share. I believe but we need more clarity. We need Xi to fucking chill and let’s China’s big dogs eat!"
2021-04-25 10:02:25,stocks,"I am 90% on BABA right now, trust me and hold. At least 320+ EOY. Market can remain irrational longer than you think."
2021-04-25 09:32:26,stocks,No it’s a beast and will most likely bounce back at least based on business operations. Government intervention could affect things but I think that’s been overblown. Your options could be dicey depending on the timeframe but I think the evaluation will follow the earnings over time.
2021-04-25 19:41:43,stocks,"Are all Americans heavily indoctrinated by their media?
All of the criticism about baba I have seen is about “communist China” or “delisting threats” lmao.

China was supposed to be the country that controls their citizens, not the us"
2021-04-25 08:44:45,stocks,Wait till earnings
2021-04-25 09:56:26,stocks,If you look at the baba umbrella the potential is limitless
2021-04-25 10:24:23,stocks,"If you have full faith, conviction and believe that relations between China and the US will eventually mend, then now is the time to accumulate shares. 

Could either make you a very rich person down the road or a very poor one. Good luck!"
2021-04-25 19:38:22,stocks,Just remember you don't actually own stock in the company.
2021-04-25 16:09:34,stocks,"I'm bullish on E-commerce, but not in a company where the ~~CEO~~ _founder & chairman_ will get kidnapped by his government, and blocked his Alipay IPO.

Plenty of other E-commerce companies to invest in.

If China ever starts these same kind of shenanigans with NIO, I'm selling my NIO shares too then

Bull-case thesis becomes compromised when the top executive can no longer innovate and has to tiptoe around broken glass. Too many other investing opportunities for me to deal with that nonsense."
2021-04-25 10:15:28,stocks,I recently bought into BABA for a large portion of my portfolio because it's inevitable.
2021-04-25 10:59:33,stocks,"As someone who had a 3-4 year abusive relationship with baba, just set your expectations beneath the floor"
2021-04-25 11:49:46,stocks,Yea I’m feeling the same frustration. I bought in around 270 and bought a couple more at 227 to bring my cost average down to around 260. I’m not going to give up the stock for at least 2-3 more quarters. It’s not down on fundamentals it’s down bc CHYNAAA 🤷🏿‍♂️
2021-04-25 13:54:44,stocks,"I've been holding since 2015.  Been doing well.  It's only the lots I picked up last year thats been underperforming.

I have not stopped using Aliexpress or Alipay when the opportunity arises.

I'm not seeing the problem.

The US China tension will blow over once most people in the US figure out China is the solution, not the problem.

Just go to wait out the Pres. Boomer and his little cold war."
2021-04-25 11:16:00,stocks,"As per Blackrock, global investors are underinvested in China. I advise that you buy the dip on BABA, JD, and BIDU until they’re 10% of your portfolio."
2021-04-25 11:26:02,stocks,"Can I ask a legitimate question here to all the bulls / investors?  Whereas big tech stocks in the US have all instituted dividends (Apple) or buybacks (many others), we have not seen this at all in China.  Sure, China is earlier in growth and thus sees better ROIC on their investments in growth than buying their own shares, but let’s fast forward a few years (even 10 if that makes you happy since we’ll be beaming in our buy/sell orders from the moon thanks to Elon).  Does anyone here legitimately think that the Chinese government would allow Alibaba, Tencent, Meituan, etc. to ever take money out of China and use it to pay shareholders who are predominantly overseas (via dividends or share buybacks)?  If not, what endgame are we all playing for or are we betting on price action?"
2021-04-25 08:56:29,stocks,Sure bet but timing is not certain. BABA needs Amazon type valuation.
2021-04-25 12:22:07,stocks,"It won’t, Chinese govt flexing their powers, doubt baba will ever get back to pre-ma power in China, will always be a power in China but not as strong"
2021-04-25 13:25:10,stocks,"Watch the documentary called:
The China Hustle

All of your questions will be answered"
2021-04-25 12:24:27,stocks,"This stock sucks. By accounts the company is extremely successful, but we can't sit here and pretend to know how to play the stock without having some knowledge of Chinese politics work. For that reason, I'm out."
2021-04-25 14:49:58,stocks,I was a BABA holder as well. It has taken grenade after grenade from the CCP. Was tired of watching and waiting for the negative news to stop so I sold as soon as it came back to even for me. I don’t think it gets delisted in the near future but I don’t want any part of any Chinese company’s stock for the foreseeable future.
2021-04-25 15:48:21,stocks,I ain't touching it.
2021-04-25 16:02:05,stocks,I remember being on the BABA train years ago. Was not a fun ride and $VOO looks like a billion times more attractive. I didn't sleep well at night holding $BABA
2021-04-25 16:17:10,stocks,All Chinese stocks are a bit risky right
2021-04-25 13:27:44,stocks,"Might end when they get delisted, and you can finally get closure. Might not.

I like Alibaba but I’d never buy BABA, because you’re not buying The actual company, you’re buying a Cayman Islands company which owns a Chinese holding company with a contract to some of Alibaba’s profits."
2021-04-25 16:38:51,stocks,"Get out of Chinese garbage man!

What BABA does is great, and if you owned part of the company like most stocks would be valuable. However, even though public, the company is a China property.  They can change the rules and nationalize at any moment with no payout to you.  If not for the CCP I would be super bullish on Chinese stocks.  However as long as they linger over them they are all fool's gold."
2021-04-25 11:39:57,stocks,"300+ isn’t going to happen. That being said BABA and China companies are only going up. The basic economic indicators are completely in BABA’s favor and the trade war has really clouded western investors judgement, who already overhype the “evil autocratic commies are going to intentionally destroy there own economy.” As a long time BABA, it’s only going up from here."
2021-04-25 13:43:36,stocks,The stock is certainly worth more but the geopolitical risks are definitely scary. Hope your risk pays off big time💰
2021-04-25 14:27:36,stocks,"I don't understand why people invest in company stock located half a world away, when you don't live there or aren't very familiar with the place.

I know people abroad invest in US stocks, I guess I get it, but damn. China has a bright future if handled correctly but I don't see why this decade is going to be ""it."" 

If you invested in what will eventually be the most successful company in, say, the African continent, in 20 years, why wouldn't you think there would be frustrations in the meantime even if your convictions were high?"
2021-04-25 15:07:45,stocks,"There’s still too much political instability. Plus, all that you “own” is shares in a Cayman Islands shell company, not the actual company. The audits aren’t reviewed by the PCAOB, either."
2021-04-25 13:18:42,stocks,It ended at 204.92
2021-04-25 13:22:59,stocks, chill out an have a coffee. If you look back at BABAs history the last time it had a major dip it lasted like two years and went down like 35%. This is a long term multi-year play you need diamond hands for BABA. It will pay off you are patient. Nothing is a “too good to be true” offer
2021-04-25 14:08:18,stocks,So i have 220calls right now. I am thinking about making it a spread so I don't get fucked by theta. The calls expire on september 17. Do you think I should sell the 260 270 or 280s?
2021-04-25 14:31:34,stocks,"Even the new electric car that BABA showed last week didn\`t help the stock.

[https://autoru-mag.s3.yandex.net/2021/04/21/fc168f2a4c0d4c599fe2b230b5474ae0.jpg](https://autoru-mag.s3.yandex.net/2021/04/21/fc168f2a4c0d4c599fe2b230b5474ae0.jpg)"
2021-04-25 14:35:10,stocks,It’s so hard to understand (for me) with all the news and confusion over Chinese equities
2021-04-25 14:46:03,stocks,I like your thoughts.  Just sell otm covered calls til it eventually gets to $300.
2021-04-25 15:00:21,stocks,Stocks don’t always go up. Just wait and be patient if you’re holding it long term.
2021-04-25 15:23:04,stocks,* abating
2021-04-25 16:04:44,stocks,You are talking about it AliBaba stock right?
2021-04-25 16:12:42,stocks,"if you followed the number one rule of trading, you probably wouldnt be making this post."
2021-04-25 16:15:44,stocks,"I have done heavy DD in baba and have taken a large stake in it at exactly 220$ level. That is a critical support at a multi year trend line. Baba is significantly undervalued and would be a 400$ stock if given the USA premium. Many funds do not want to go into baba do the the uncertainty (and want instant gains for their quarter) but are moving back into it recently. It will not move significantly to your 300$ price target until the ANT ipo goes through sometime this year no matter how good the core business is. ANT ipo is the key that shows investors that China has gotten their foot off them to allow for smooth sailings. For those saying increased competition, yes that is true but baba is such a significant preference for many sellers that it wouldn’t hurt their bottom line. In addition, the anti monopoly law now allows their services on weechat through tabaoo deals. I haven’t even mentioned their growing cloud business at 4% global market share that is not even factored into their stock price much at all. Do your own research. Again the 220$ is critical and has had many bounces. I know it’s frustrating but long term you will be paid off well. Short term it’s a pain in the ass seeing some positive news followed by “CCP ant, Jack ma xyz”"
2021-04-25 18:52:13,stocks,"Don't worry, Biden will not let anyone touch CCP investments / companies. Just hold for the next 4 years at least."
2021-04-25 19:02:43,stocks,"I was long on Microsoft for 6 years until it took off.
You will never get rich by getting frustrated like that lmao"
2021-04-25 19:10:46,stocks,i sold. figured i could catch up with just about any other position and then buy back in when i see a good entry point.
2021-04-25 19:15:07,stocks,Tomorrow
2021-04-25 19:37:38,stocks,When you stop investing in shitty jack ma led ccp backed company
2021-04-25 11:28:50,stocks,In about 10 years
2021-04-25 12:28:36,stocks,There is some great great value in this stock and I too am starting to wonder why it isn't rebounding quicker. Seems like it will move quick whenever it does
2021-04-25 12:41:05,stocks,BABA should hit 600 - 900 if it wasn't for the great leader.
2021-04-25 13:52:07,stocks,Another chance to buy. I’m trying to build out 100 shares
2021-04-25 14:38:33,stocks,How can a share price like that being delisted?
2021-04-25 15:41:52,stocks,This thing turned into a stranded wire
2021-04-25 16:03:27,stocks,"It's like 30% of my portfolio...down about 10%.

I'd love to buy more but don't want to have it dominate my portfolio."
2021-04-25 09:14:00,stocks,"Haha, frustrated long term holder"
2021-04-25 12:00:03,stocks,"Problem is CCP broke up ant financial, baba owned 50% of it, lost over 100B alone in that deal. Now CCP breaks up their media portion of the company and sell it, losing 10s of billions. And finally the few billion dollar fine."
2021-04-25 10:58:28,stocks,"A lot of people lie to ourselves and others that we are long on it, but even if they are its easier to look at color green than red every day"
2021-04-25 14:49:21,stocks,"Doesn’t “long” mean just that you are bullish on the stock going up, vs short"
2021-04-25 10:34:22,stocks,point well taken!
2021-04-25 16:51:58,stocks,Charlie Munger just picked up a 20% stake
2021-04-25 11:57:14,stocks,Free money still available
2021-04-25 12:50:01,stocks,Come on now. The face of a publicly traded company goes missing for days from time to time with the threat of being abducted by the CCP.
2021-04-25 11:56:29,stocks,Lol you don’t even own the shares when you buy them either.
2021-04-25 16:59:57,stocks,"No one was saying that 6 months ago, when BABA was at an ATH"
2021-04-25 12:24:35,stocks,Thanks wasn’t aware of this https://en.wikipedia.org/wiki/Regional_Comprehensive_Economic_Partnership?wprov=sfti1
2021-04-25 16:27:17,stocks,"Yah it’s crazy Baba was trading at a peg ratio of 0.85 a few weeks ago. It’s probably higher by now but still likely under 2. I haven’t seen any sign that earnings are slowing or that people are using Baba less. There’s probably a lot riskier investments than Baba out there. I’ve been hodling since the ipo, and there’s always some crazy thing happening between us and China that acts as a headwind and then people’s attention turn to something else. Next thing you know the China stock that was a turd in your portfolio is now you’re biggest winner. Just be patient"
2021-04-25 12:50:27,stocks,I'd love to hear you make the point in long form
2021-04-25 12:08:13,stocks,Very well done post.  Well said.
2021-04-25 10:15:54,stocks,BABA lagging is much more about BABA and CCP’s relations
2021-04-25 11:41:45,stocks,Why not the same for US stocks? The Chinese economy is much better prepared for a trade war than the US according to every analyst.
2021-04-25 12:58:48,stocks,The sole reason why I’d never touch it.
2021-04-25 15:56:22,stocks,"Yeah we have the same problem with JD too. Solid fundamentals, but the price keeps tanking although  it looks like it is about to recover now.

Not even aunt Cathie who keeps loading up more JD (it is 5% in a couple of ARK funds) can keep it going up.
Once the dilemma clears up both BABA and JD should go up in no time. I am hoping it will be done in the next 2-3 months."
2021-04-25 14:51:36,stocks,"Yeah wait until after China stops screwing around in the Pacific / Cold War 2.0.

Although I guess a bigger issue may be HK / Taiwan and their corporate / tech / military espionage against countries like the US.

You might as well try to invest in a state-owned Russian oil firm. Sure, there are differences. Also similarities."
2021-04-25 08:45:24,stocks,I miss 2020 prices.
2021-04-25 09:16:24,stocks,"For an index it’s pretty unlikely, but a lot of individual stocks are pretty volatile. In fact it would be very unusual if a stock like alibaba didn’t see a 30% difference between its high and its low within any 12 month period. Obviously it could go down just as easily as it could go up, so you can’t rely on it going up in a short amount on time, but it’s definitely not unrealistic. Consistently making 30% a year is unrealistic, but individual stocks often fluctuate that much."
2021-04-25 12:46:03,stocks,"He’s not trying to make an easy 30% here. He’s just expecting that a deeply undervalued company grows back up to fair value. And that can’t be measured in the percentage points it needs to go up by because 30% after it still won’t be an over valued stock. Forget FAANG, they’re American behemoths so they get to trade at a premium but Baba is undervalued even when compared to JD, Pinduoduo, Baidu and Tencent. That in my opinion is why there’s deep value in Baba and when the skies clear up, it will shoot up quickly to its fair value."
2021-04-25 08:50:10,stocks,"Yea, i hear you on a traditional ROI point of view, i'm looking for a return to prior valuations, maybe naively."
2021-04-25 13:32:28,stocks,It’s realistic if the stock is selling at a discount for specific reasons. I’ll let you decide whether or not you think it’s selling at a discount currently.
2021-04-25 11:50:03,stocks,In general you might be right but any decent valuation has BABA $300+ right now.   Very specific factors are keeping it down due to uncertainty. Once the uncertainty is lifted a stock can rise dramatically in short time.  I have no problem believing it can be 300 by end of year.
2021-04-25 11:41:44,stocks,This. Everyone seems to think every stock should double all of sudden.  Ridiculous expectations.
2021-04-25 10:38:22,stocks,If they are buying then why is there no pressure pushing the stock price up.
2021-04-25 12:48:55,stocks,"You are looking at the average of the consensus, which means if a couple of analysts put a big price target of $500, it will pull the average up.

A simple google search shows not 100% of analysis has BABA over $300."
2021-04-25 11:43:25,stocks,"It’s not crazy lol, that’s what it was last year"
2021-04-25 16:35:00,stocks,Tencent came very close in March.
2021-04-25 12:56:17,stocks,"Have more friends in China than I can count. They practically spend hours everyday on taobao. Their employers now use alibaba cloud. Sure other players are entering in big and strong but people need to realize that much of Chinese rural population is only now able to access the services of these tech giants. The scalability is still there and more and more Chinese are getting richer by the hour.

Note: having friends in China has really helped me financially. They recommended me Ehang, Nio and Pinduoduo before the stocks were even listed."
2021-04-25 11:52:45,stocks,"US always seems to get the news a tad late. From a friend that reads some of the Chinese news, rumors has it that well-respected billionaires surrounding Jack Ma are loading up on BABA. Guessing the US media won't be covering that either. 🤐"
2021-04-25 17:05:32,stocks,Good comment
2021-04-25 12:05:00,stocks,I have seen several “sum of the parts” valuations that have BABA share price well over $300 jist with their core e-commerce and cloud businesses. Everything else like Ant (fintech) not even included.
2021-04-25 19:25:57,stocks,"Yes,  I noticed also role vs roll, afterward, chose not to edit"
2021-04-25 09:44:44,stocks,"They settled with a slap on the wrist. That’s all it’s ever going to be. Baba is too important to China for Xi to cripple them. He just needs to save face. Same song and dance with US Congress and big tech. Obviously there are differences in the culture, but both governments know the value that these companies provide in a globally competitive market.

Capitalism is a drug and once you’re on the drip, you cannot get off without bloodshed and revolution. China isn’t doing that again anytime soon. 

I sleep well at night holding BABA. It’s probably the most undervalued company on the NYSE. Until big US investors start abandoning ship, I’m going to hold. Blackrock, Vanguard, and TRowe Price own over 35B worth of this stock."
2021-04-25 12:58:37,stocks,Same. 45% of portfolio is Baba
2021-04-25 09:41:55,stocks,"Yea, i hear you, options are Jan 2020 so a little bit of runway"
2021-04-25 08:51:11,stocks,"Agree, no firm date so far"
2021-04-25 18:08:20,stocks,What other investing opportunities are you invested in? Which ecommerce play do you think is better than baba?
2021-04-25 12:14:50,stocks,Price action through growth.  You nailed it.  Maybe share buybacks.
2021-04-25 09:11:29,stocks,"never gonna happen, China too risky to justify that"
2021-04-25 13:43:12,stocks,"If you prefer you can buy on the HK exchange, I believe."
2021-04-25 12:10:09,stocks,Isn’t “300 isn’t going to happen” and “it’s only going up” kind of contradictory?
2021-04-25 11:45:12,stocks,"> 300+ isn’t going to happen. 

Bruh that’s what it was last year"
2021-04-25 16:44:21,stocks,Can you wait a little while to sell? I would still like to accumulate more shares hahaha
2021-04-25 13:39:46,stocks,"Alibaba owns less than 33% of Ant Group. 
See ownership on [wiki](https://en.m.wikipedia.org/wiki/Ant_Group)."
2021-04-25 14:08:14,stocks,"Their media portion is such a tiny portion of their business. You have no clue what you talking about honestly. Evens without out it their earning wouldn’t even be effected in a major way at all.

That fine is pennies to a company like Alibaba. They will be more than fine. Their earnings isn’t the issue at all. The politics around it though."
2021-04-25 12:05:59,stocks,Do you have a source that details this information?
2021-04-25 16:51:00,stocks,"You are vastly overestimating their losses, how can they lose 100bn on a 33% stake in a company valued at 108bn."
2021-04-25 16:57:15,stocks,Your facts are wrong man. Where did you hear they owned 50% of Ant?
2021-04-25 14:56:13,stocks,"Sure, possibly,I guess it depends on OP's point of view."
2021-04-25 13:58:30,stocks,"If that old fart Charlie Munger can be patient with $BABA, so can you.

[https://www.fool.com/investing/2021/04/08/charlie-munger-just-bought-alibaba-stock-should-yo/](https://www.fool.com/investing/2021/04/08/charlie-munger-just-bought-alibaba-stock-should-yo/)"
2021-04-25 15:33:48,stocks,!RemindMe 3 months
2021-04-25 16:18:58,stocks,"Its hilarious how OP keeps ignoring the elephant in the room, and talks about anything else but that. This is the biggest red flag as to why many investors are not touching BABA."
2021-04-25 13:29:24,stocks,I wrote a longer post about it back in November but the short version is it makes BABA and the like able to sell all their e-commerce products throughout all signatory countries as if it was the home country.
2021-04-25 14:39:00,stocks,"Alright, this will be far from a comprehensive take but a few details/anecdotes should make the point pretty clear.

Mango supporters often believe that all criticism of his foreign policy is that its too hawkish and aggressive. But its not even an issue of what grand strategy he was attempting to execute because there simply wasn't one. There was no coherent ""trump doctrine"", just geopolitical button-mashing with nearly zero positive outcomes. A boxer who chooses to swing wildly at the turnbuckle in the neutral corner while getting their ass beat by a well-prepared opponent isn't having a bad fight because they chose to be too aggressive, they simply don't know what the fuck they're doing.

I'm not going to cite some of this stuff so feel free to fact check. If you want to save time, don't bother. I'm not bullshitting.

At the very beginning of 2017, many in security/intelligence/military circles were leery of sharing much intel at all with Donnie as they were sure he'd flip it to the Russians. But they last straw was in May of 2017 when he blabbed about the locations of nuclear submarines to [FUCKING DUTERTE](https://www.reuters.com/article/us-northkorea-missiles-submarines/trump-calls-north-korea-leader-madman-who-cannot-be-let-on-the-loose-transcript-idUSKBN18K15Y) of all fucking people. Nuclear warfighting/strategy is driven by calculations to the second of how quickly one can respond to a nuclear threat and counter-strike and/or destroy an opponents second-strike capability. The whole fucking point of heavily loaded nuclear subs that can stay out at sea indefinitely and are first/second strike weapons is *ambiguity*. It never makes sense to first-strike a country whose nuclear subs could be anywhere. The US has 14. Disclosing where 2 of them are just because you felt like it inherently destabilizing in a way that complicates (at a minimum) the balance of MAAD. This was a rocket kick at the US's goal for no fucking reason at all. And the Joint Chiefs, CIA, NSA, they were all done with his ass after that. Fortunately all his briefings had to be [in picture form](https://www.businessinsider.com/trump-looks-at-charts-in-intelligence-briefings-2020-5) and fit on 1 sheet of paper so it wasn't hard to not tell him anything important.

Ah gawd, this is already way too long. Here's some more funny stories real quick:

Donnie almost pulled the US out of the South Korean Free Trade Agreement on a whim one day. John Kelly snaked the piece of paper off of his desk and Donnie didn't notice. Did Donnie get mad the next day when his plan to blow-up the economic component of one of the US's most critical alliances in the pacific didn't happen? Nope. He forgot. So everyone just moved-on.

Donnie pissed and shat all over many of our alliances, but Australia, Japan, South Korea, and NATO were probably some of the most moronic own-goal type zero-upside shittings. Asking NATO members for $ was fucking stupid when Russia is clearly the most potentially aggressive adversaries in the region. Same with withdrawing missile defense tech from the ROK for no reason with no concession (it wasn't there for the North Korea fyi). Read the transcript of his call with the PM of Australia about the boat refugees and tell me Donnie's IQ is 3 digits.

His foreign policy was damage control done by John Kelly (until he quit to become the CEO of the baby jailing company that had been banking \~$740 a day/kid on the border). And then John Bolton (whose damage control amounted to 15 sneaky things done to try to trick Donnie into going to war with Iran...which ultimately Putin wouldn't allow Donnie to do). After Bolton quit, it was literally asleep-at-the-wheel foreign policy for several months.

Those months coincided with the time that the PRC was likely finishing negotiations of the RCEP. Its not an accident that they inked the thing just a few days after the Biden election was conclusive. RCEP was a brilliantly timed geopolitical execution by China to lock-in a tremendous soft-power advantage throughout the Pacific (including Latin America when you get down to it) that was created by the vacuous and mis-managed years of the dumbass donnie doctrine.

ok that's enough for now. its beer 30."
2021-04-25 15:45:56,stocks,Thanks!
