Timestamp,Subreddit,Post/Comment
04/01/2021,stocks,"I usually look at GMO’s Resources fund to see if they own it before buying any natural resources stocks. The fund owns the parent company for Vale since they can trade on the Brazilian exchange, which wasn’t convincing enough for me to buy it. The GMO Resources fund has jaw dropping alpha over the last five years and they know what they’re doing."
04/01/2021,stocks,"https://youtu.be/cC2uykZGXJc

☝🏻 Pretty much your post/question. Skip forward a few minutes to VALE analysis. Nothing major, but probably helpful. Should be successful in the near to mid term. Long hold should also be good. China is a factor, but not as much as people think in my opinion. The need for raw materials for infrastructure and EV will trump other geopolitical factors."
04/01/2021,stocks,"Commodity Supercycle, can you pick a wrong resource company? Biggest risk is probably a natural disaster / political instability. Best to diversify."
04/01/2021,stocks,"I bought in February,  300 shares at $17.69. Is this where I'm supposed to say that I like the stock?   They have some troubles that they are wrapping up after a disastrous dam collapse,  and they say they are focused on making changes to ensure it doesn't happen again.   Also Brazil isn't the best place to have a business located.   That said,  pristine perfect companies are very expensive.   Getting a good deal on a scratch and dent company is what I like.   If, IF they are resolving the remaining legal issues like they claimed and are making the operations safer, this could be a very good deal."
04/01/2021,stocks,[deleted]
04/01/2021,stocks,Thanks for the input gonna go look into GMO’s resource fund
04/01/2021,stocks,"> The GMO Resources fund has jaw dropping alpha 

people need to pay attention to Grantham and his crew."
04/01/2021,stocks,"I have a handful of shares, averaging around $17.20.  I agree with your opinions and it will be interesting to see if they can put the issues behind them."
04/01/2021,stocks,"Pardon my ignorance, why is having a massive float bad? Wouldn’t it just be less volatile?"
04/01/2021,stocks,"Last time I looked it was their number one holding was the Vale parent, I forget the name of it. That could be a fantastic sign to pick up Vale, but that parent owns some other things like oil I think. I wasn’t sure what it was that drove GMO to buy the parent over Vale so was hesitant to invest. Overall though probably a good sign, I’m just very cautious on resources since they’re so hard to value."
04/01/2021,stocks,"I pay a lot of attention for sure. The dudes that run that particular fund are solid, I think they run the climate change one as well (which has had great results). I think the funds are hit and miss - really depends who runs them, overall I’m a fan of GMO and Grantham. He’s sometimes early but rarely wrong."
04/01/2021,stocks,"Yeah I’m having a hard time valuing this $VALE. I really appreciate your feedback though, trying to learn more about doing research and I still don’t feel comfortable with my DD, so this helps a ton"
04/01/2021,stocks,"Oh finally, a word of caution, would not follow that fund blindly, some of their smaller holdings like Kosmos can rocket up and they’ll sell quickly. Like when I buy I usually go back a few months and look at 13F’s to figure out their trends and what they’re holding. Resources are really tough to get right. I’ve been burned a lot on them and am just simply not good at this sector. May be better off with an index fund like GNR."
04/01/2021,stocks,"Yeah absolutely, still have way more to research but thanks for the heads up"
2021-04-01 08:11:56,stocks,"Apple collaborating with Tesla Apple will begin using Tesla’s batteries at their new solar farm. 

This may lead to a long lasting relationship regarding battery technology. Tesla is more than a car company. It is a mass data collection company, battery innovation company, and lastly a car manufacturer. 

https://www.theverge.com/2021/3/31/22360839/apple-tesla-megapack-energy-storage-grid-solar-batteries"
04/01/2021,stocks,They have to be kicking themselves for not acquiring Tesla when they literally were provided the opportunity.
04/01/2021,stocks,It’s definitely interesting for me as a huge Tesla bull. It would be awesome to see if this develops into a long lasting and mutually beneficial partnership or arrangement of some sort. I also feel that this could bring a lot of good attention to Tesla’s battery business and energy storage as a whole.
04/01/2021,stocks,Is this an April fools joke?
04/01/2021,stocks,"> and lastly a car manufacturer 

Until the quarterly report rolls around and you have to hype up 100K sold vehicles (lol) in a vain attempt to justify the overvaluation. 

Then the next month when a quarter of them are recalled, Tesla will go back to being a mars colonization expedition first, a flamethrower manufacturer second, and a car company third."
04/01/2021,stocks,This reminds me of the recent tweet Elon made then deleted
04/01/2021,stocks,Where all the tesla haters at lmfao
04/01/2021,stocks,"> Tesla is more than a car company. 


Ok. 

> It is a mass data collection company, 

To sell more cars. 


> battery innovation company, 

To sell more cars. Plus they don’t make batteries. That’s Panasonic. 


> and lastly a car manufacturer. 


Selling cars."
04/01/2021,stocks,This may be interesting knowing Apple's MO they HAATTEEE using other companies for parts. The fact they have to rely on Elon for batteries means only 2 possibilities: 1. Discontinue iCAR; They know the EV car competition is light years ahead only way to catch up is to use all their capital reserve which is an insane gamble  2. They're continuing with the iCAR project but have to resort to using Tesla's batteries
04/01/2021,stocks,[deleted]
04/01/2021,stocks,"> Tesla is more than a car company. It is a mass data collection company, battery innovation company, and lastly a car manufacturer.

More than anything it's a huge PR operation in which the CEO puts his finger in the air to gauge public opinion and government policiy , then glues together a Proof Of Concept to sell to the public and investors the idea of innovation as well as taking those sweet government dollars.

Actually as Tesla became bigger it evolved from Proof of Concept to whitepaper to now it's just a tweet"
04/01/2021,stocks,[deleted]
04/01/2021,stocks,"Lol wtf are you talking about? The collaboration was a purchase of 85 batteries, how is an acquisition relevant?"
04/01/2021,stocks,"Facts. However Tesla wouldn't be where it is today if it was limited by Apple's guidelines. 

I mean, imagine giving Elon Musk a boss. And restrictions. lmao."
04/01/2021,stocks,"There was never any serious consideration to buying them, it's just another one of the many myth building stories Musk relays to the media similar to the sleeping on the factory floor, ~~months~~ ~~days~~ seconds away from bankruptcy,  etc."
04/01/2021,stocks,"Not really, cause at the time AAPL was trading around 15 times earnings and had yet to expand beyond hardware towards recurring revenue. The roadmap for their network of services didn't exist then."
04/01/2021,stocks,"Naw, they don't want to be too tied to a maniac like Elon"
04/01/2021,stocks,"In the Battery Day presentation Tesla said they want to produce 1,500GW of storage & solar in 2030. 

In 2020 they made 3GW. So there is massive annual growth ahead. When do you think that’ll start?

They seem to be too battery constrained at the moment & had to delay the Semi truck because of that."
04/01/2021,stocks,Mutually beneficial partnership is definitely not what Apple wants. Apple only wants vendors that they can ditch.
04/01/2021,stocks,"Nope, check the article date"
04/01/2021,stocks,They sold 85 batteries lol
04/01/2021,stocks,"Shhh, facts disturb the cirklejerk. Tesla is unique and will be the most powerful company ever, Panasonic will create their batteries for free and all other EVs/solar panel producers will surrender due to Elons pedo accusations /s"
04/01/2021,stocks,Ehhh... They use Samsung for their displays and have done so for eons.
04/01/2021,stocks,Sounds like you are pulling conclusions out of your ass.
04/01/2021,stocks,The Tesla batteries are not for iCar or any product. It’s for powering their office.
04/01/2021,stocks,It’s not uncommon for companies to partner up to use different parts on different vehicles. The previous generation Mazda’s have Ford parts in them from the factory.
04/01/2021,stocks,Do you know how similar batteries for cars and batteries for wind farms are? Genuinely curious. I’ve never thought about it before
04/01/2021,stocks,"If you’re still asking this question, in the way that you’re asking it, I doubt you’ll ever “get it”."
04/01/2021,stocks,"Ok, boomer."
04/01/2021,stocks,Some day you're going to hate how wrong you were about all of this.
04/01/2021,stocks,Know your market.
04/01/2021,stocks,[deleted]
04/01/2021,stocks,"Apple should also have acquired Netflix, but Tim only cares about the iPhone"
04/01/2021,stocks,Esp since tesla and apple r competitors
04/01/2021,stocks,Because they just paid millions for a product from a competitor and were offered the opportunity to purchase the company at 10% of its current price. They wouldn't take a meeting over the purchase but they just spent millions for their batteries. It's funny.
04/01/2021,stocks,"They're ramping up production of that new battery line right now. The whole package isn't just the cells or power modules themselves but the manufacturing process that can produce them cheaper and quicker than anybody else. For the rest of the production it's just a matter of building more battery factories. Production rates should be growing exponentially over this decade.

Tesla's mission statement doesn't mention cars or transportaion at all: ""to accelerate the world's transition to sustainable energy."" This deal with Apple isn't a fluke: it's precisely the direction the company's ultimately taking. Cars are simply where Tesla's getting started just like Amazon used to only sell books and Apple used to only make desktop computers."
04/01/2021,stocks,"I’ve read somewhere that Tesla is building factories that will have the production capacity of more than 50% of all batteries produced globally, so if that pans out Tesla would be the most dominant battery producer in the world. Still too far into the future to make any realistic predictions on their battery production though."
04/01/2021,stocks,"Ahh yes.  Like cirrus logic, which has had 80% of its revenue from AAPL for what, like 20 years?

Apple is a very sticky customer."
04/01/2021,stocks,"Pretty sure Apple is usually a sticky partner, but we’ll see."
04/01/2021,stocks,"And they didn't even make the batteries, they just integrated Panasonic batteries into packs. Tsla doesn't make batteries yet."
04/01/2021,stocks,Do companies usually put in huge first orders for a product? Don't think so.
04/01/2021,stocks,If they’re lithium ion batteries The actual cells themselves should be exactly the same. Just packaged in different packs for use.
04/01/2021,stocks,This☝🏾
04/01/2021,stocks,[deleted]
04/01/2021,stocks,"I was around when promotional assholes like Larry Ellison used the same media and PR techniques to convince consumers and investors that they'd be taking down Microsoft

In the end the epilogue is always the same , the loud asshole gets KO, and sure enough Microsoft mopped the floor with Oracle

Larry Ellison AKA Elon's best buddy and Tesla board member"
04/01/2021,stocks,Loved it. Miss the 90s
04/01/2021,stocks,Apple and Netflix' MO is completely different imo. It wouldn't have worked anyway
04/01/2021,stocks,Not yet.
04/01/2021,stocks,By that logic every company should buy any company they may buy a future product from?
04/01/2021,stocks,You think it's funny that they spent millions of dollars for a factory installation instead of billions of dollars on the company that makes these installations as a tiny side gig?
04/01/2021,stocks,Agreed
04/01/2021,stocks,"This is a good point. Elon himself has also stated that he expects the energy side of the business to be equal to or bigger than the car side of the business, and if you believe what a lot of the bulls are predicting for 2030-2035 they expect Tesla to be racking in well in excess of 250b $ in revenue just from their car sales in a decade, so Elon expects energy to rival that.. insane if it comes to fruition. Some hyper bulls that even I see as being was too optimistic somehow project as much as 500-750b $ in annual cad revenue (they basically expect Tesla to have 20-25% of global car sales in the future) which is absolutely insane, but just imagine if it did come to fruition , and then imagine the energy sector eclipsed that... 

Of course it’s all back of the napkin estimates and wishful thinking today, but in the future who knows what Tesla will achieve."
04/01/2021,stocks,Uhhhhu
04/01/2021,stocks,That’s pretty cool. So they come in blocks or something and scale up or down as needed?
04/01/2021,stocks,"It really depends what part of the country you live in. I’m in New England and I see at least one a day when I’m out and about. Mostly driven by guys in suits with no tie, or housewives. It doesn’t have to make sense."
04/01/2021,stocks,"No you don't, dumbass."
04/01/2021,stocks,"Maybe so, but this time they’re not taking anyone down, they have the competitive advantage. 
Elon is definitely a bit of a wackadoodle, but the man is smart & it’ll be hard for anyone to catch Tesla. They’ve been in the EV & TaaS game longer than anyone and all the data they’ve collected for years ahead of their competition is their advantage.
Not to mention they’re “not just a car company”."
04/01/2021,stocks,Microsoft buys coke to stock their employee break rooms. I think Microsoft should have bought coke.
04/01/2021,stocks,"It fascinates me because of how the drive to produce cheap, high-quality batteries in huge quantities for cars turns into an overall surplus of power storage. It's like how plastics really owe their existence to oil being cheap and plentiful as an energy source. We're just seeing the tip of the iceberg for how much things are going to change in the next decade just due to batteries. We'll look back at the cost of energy the same way we look back now on the cost of long-distance across the country a couple decades ago compared to now when you can video chat with anybody around the globe for $0/minute."
04/01/2021,stocks,?????
04/01/2021,stocks,"Inside every battery you know of, are smaller battery cells. Those cells have a pretty typical voltage (can't remember what). So to make a 5v battery or a 9v battery, you just stack up those smaller cells in series until you have the output you want. 

Same thing at most scales (I say most because there may be outliers to this). So exactly like you said, need more power, have more cells."
04/01/2021,stocks,[deleted]
04/01/2021,stocks,"> They’ve been in the EV 

That only means they lost money until now.

As Tesla longs always tell the shorts: ""Being early means being wrong""

> Not to mention they’re “not just a car company”.

Dude they barely sell cars when you count their sales as % of global auto sales, when you count their other smoke and mirrors products as a % of say batteries for domestic use then you'd need to get to the 5th decimal place to find a number which isn't zero."
04/01/2021,stocks,Microsoft buys Columbia. Coked up Microserfs!
04/01/2021,stocks,Haha that’s a good example and yeah you’re right. I saw estimates somewhere that with renewable energy and battery storage America will be able to safely generate 3x the amount of energy that is needed today. That’s a lot of excess energy! Just having such an enormous amount of excess energy is going to create so many future projects and services that we can’t even think of today.
04/01/2021,stocks,where are you? china?
04/01/2021,stocks,"Yes, china"
2021-04-01 07:49:59,stocks,"How do I calculate dividends? Want to see if I am doing this correctly Lets use a common ETF to make things easy. ""QQQ""

See if I am doing this correct. Lets start at the beginning of 2017 to the beginning of 2018

I have $1000

$119 at the beginning of January 2017. I bought  1000/119= 8 shares = $952    Buying power $48

 03/17/2017  dividend is $0.27415 per share 

$0.27415 x 8 = $2.19

 06/16/2017 dividend is $0.37842 per share 

$0.37842 x 8 = $3.02 

 09/18/2017 dividend is  $0.31938 per share 

$0.31938 x 8 = $2.55

12/18/2017 dividend is $0.32941 per share

 $0.32941 x 8 = $2.63

&#x200B;

Sell stock at $157 beginning of  January 2018.  157\*8= $1256 plus buying power $48 plus dividend  total of $10.39 = $1314.39 

&#x200B;

&#x200B;

Is this correct or am I doing it completely wrong? 

&#x200B;

Thank you

&#x200B;

Source 

[https://www.nasdaq.com/market-activity/funds-and-etfs/qqq/dividend-history](https://www.nasdaq.com/market-activity/funds-and-etfs/qqq/dividend-history)"
04/01/2021,stocks,"If the dividend was reinvested each time, your calculation is slightly off to not account for those small share fractions.

But otherwise, yeah, that looks right."
04/01/2021,stocks,"Question about that, How can I re invest the dividends since the stock price is well over the dividend return? For example, the stock price is $119 and my first dividend pay out is $2.19, how can I re invest $2.19 when the stock costs $119?"
04/01/2021,stocks,"Oh I see what you mean, you meant if my dividends pays out more than the cost of the stock I can re invest it so it will change the calculations a bit. I got it"
04/01/2021,stocks,"No. Many brokerages will have an automatic reinvestment program that will invest your dividends immediately for fractional shares. TD, for example, has DRIP which I am enrolled in for all my stocks that pay dividends."
04/01/2021,stocks,"oh, interesting. I will need to call my broker. Thank you, that is very helpful"
04/01/2021,stocks,"I just checked their website, apparently they dont have that feature sadly."
04/01/2021,stocks,"Out of curiosity, I have thought about doing the DIRP plan through TD. Does it mean it will only buy that stock?

So if I have 10 shares of $T and I get 5.20 every 3 months, will it just buy me 1/6th of a share of $T automatically? Because it seems that TD does not allow you to buy partial shares."
04/01/2021,stocks,I believe TD allows fractional shares only from DRIP
2021-04-01 07:48:23,stocks,"Can someone explain the 80% divergence between DISCA/DISCB today? DISCA: no change on almost ~30 million volume

DISCB: +80%??? volume went from 3k daily to 1.3mil today

My understanding from this https://finance.yahoo.com/news/discovery-class-b-stock-surges-185813683.html
is that there's little difference between the stocks (mostly voting rights) and the huge divergence is due an arb squeeze, maybe related to the Archegos liquidations. But then no more details on that, can anyone shed more light into how that squeeze (or anything else) happened?"
04/01/2021,stocks,All I know is I chose the wrong DISC
04/01/2021,stocks,"arb squeeze

Total number of shares outstanding of each class of the 

Registrant’s common stock as of October 26, 2020:

Series A Common Stock, par value $0.01 per share - 160,318,208 

Series B Common Stock, par value $0.01 per share - 6,512,378 

Series C Common Stock, par value $0.01 per share - 324,172,931"
04/01/2021,stocks,"Wild guess based on difference in voting rights, hostile takeover. Absolutely zero evidence to back that up."
04/01/2021,stocks,100% with you on that one...unfortunately
2021-04-01 07:20:22,stocks,"FUBO has big upside from recent selloff From it's peak of roughly $62 a few short months ago, to it's current $22 it has been a wild ride. Fubo is an incredible streaming service especially when it comes to sports. As a user and subscriber myself what they offer for $65 a month well worth it in addition to the $18 sports package. That to me is personally enough to ever need at a much cheaper price that cable. I'm just some stoner in my 20's what more would I need? Now imagine a shit ton of us starting to cut cable and move towards these streaming services? 

There is a growing market of ""cord cutters"" that is going to be in the millions. If Fubo can grow their marketing and grab a large chunk that will help its revenue grow substantially. Revenue that just topped 100m for it's first quarter ever. It should be noted that FUBO reacted positively to earnings and then the tech fuckery began. 

With their acquisition of Vigtory, a sports betting company, their goal to achieve a single platform tv screen and betting screen is extremely tangible. Imagine the amount of guys in their 20s and 30s who'd sign up for this shit. Not only would they be added subscribers, but they could go from a $65 a month subscriber to a few hundred or a few thousand. This is hopefully going to be implemented in the fall or early winter. 

With the recent rotation out of growth stocks, FUBO will rip back, as many of these stocks have fallen 50-60%, people will quickly rotate into them again. I don't see it being a slow bleed for much longer. With these sharp drops due to the selloff, it's looking attractive with a decent short float of 35%. This could very easily trigger a decent sized squeeze. 

Institutions love FUBO as well. It's riding at 63% institutional ownership at this point despite the beatdown. You would see them have exited their positions by now if this doesn't bounce back hard. 

$80+ EOY book it.

No, this isn't financial advice, I just love the fucking stock and think this it's just criminally undervalued at the current share price. 

Plays: 400 Shares Long , 10 $50c 11/19"
04/01/2021,stocks,Damn...I straight up read the headline as FUBU. And said whhhaaaaattt?
04/01/2021,stocks,Got 5000 shares at around $32.51 / share.
04/01/2021,stocks,"Everyone commenting in here probably doesn’t have Fubo. The service is great compared to any competitor. Hulu TV and Sling have been losing subscribers slowly because they either don’t have any channels or the picture is terrible. Their main competitor is YouTube TV, but Fubo is in a very good position against them right now. YouTube TV has more than doubled their prices over the past couple years, and still doesn’t have as many channels as Fubo. Fubo makes more money per subscriber than any other live streaming service, and their only going to continue to make more as they focus more on ad revenue (up 174% QoQ) and obviously through their sports betting addition. Bookies make a fuck ton of money, meaning they could potentially run their subscriptions at a loss and keep the price at $65, while getting the Turner channels back. At that point, there’d really be no reason to stay on other competitors."
04/01/2021,stocks,What's your cost basis on those 400 shares?
04/01/2021,stocks,"I love the stock too, major fubo bull here, 100 eoy"
04/01/2021,stocks,"1.4B market cap, insane room for growth it seems..."
04/01/2021,stocks,"Just out of curiousity, marketwatch has their IPO lockup expiration listed as 4/6/2021.  What effect will this have on the stock?  I was in Palantir when lockup expired and there was a decent sell off from insiders.  I've been watching FUBO for a while now and would like to jump in, I'm just not sure what the lockup expiration will bring.  Anyone care to comment?"
04/01/2021,stocks,"Fubo has always been heavily shorted at least since this year.

They've been on record saying that they don't make money and their last earnings was terrible, TERRIBLE.

$65 a month is expensive.

Their youtube channel had been not doing shit until they got lucky and added Gilbert Arenas and his basketball podcast last summer which saw a boom to their weekly sub count. But still currently not even at 50K lol


Last year during the pandemic when many many many many new and rising content creators on youtube/twitch/social media were able to hit it big Fubo did not. That tells you all you need about that company's marketing ability."
04/01/2021,stocks,100 shares at $29.90 reporting for duty sir. Confidently held through these last few days. Wish I would’ve doubled down. Any drop below $20 and i’m most certainly doubling down.
04/01/2021,stocks,"Company will forever struggle to be profitable. They lose money with every subscriber. Yes advertising will grow, but they need to raise pricing on their packages (there’s a reason all competitors have done this) to reach profitability and that will put pressure on subscriber numbers. 

They are not the only company innovating in sports betting on TV and in some ways they are disadvantaged by having to link their book to the streaming service. 

I also think they will soon compete with bundles from the platforms they rely on to reach their consumers, Amazon l, Roku, Samsung etc. This will hurt their growth. 

Yeah not for me."
04/01/2021,stocks,Worth noting that Viacom cbs aka paramount+ now has access to a whole lot of european soccer leagues for $5 a month or $10 with ads. I own both companies but added more to viacom for this reason.
04/01/2021,stocks,Just bought a few dozen. Lets get this FUBO rolling big big!
04/01/2021,stocks,"Don't be a boobo, buy some FUBO!"
