Timestamp,Subreddit,Post/Comment
2021-05-04 05:17:26,stocks,Thats why I don't take advices on stocks subs seriously anymore. These immature kids memeing every single day from that sub to this sub and misleading new comers who are genuinely seeking for advices.
2021-05-04 01:58:08,stocks,"There is only 1 advice to follow:

Diamond hands rocket emoji"
2021-05-04 08:35:52,stocks,"such great choices... take advice from me, the 8 year veteran. Start with VOO (safe, low returns but safe returns) and begin reading daily to learn as much as possible, until you've learned enough just deposit $ into VOO"
2021-05-04 08:38:13,stocks,Holy shit. /thread/
2021-05-04 04:42:43,stocks,"I am from Europe, but it seems most people migrate to Fidelity. They seem to operate in an ethical way (as far that is possible in finance), are setup to handle any meme storm and I've read great things about their customer service."
2021-05-03 23:17:16,stocks,"to clear the air, I simply want to understand how stocks work. I am neither in any position currently to buy stocks nor do I feel a need to, however I have relatives who have stocks in their wills which are to be left to me and I figure I should understand how stocks work before I'm ever faced with having to handle them myself. 

&#x200B;

Furthermore it is worth mentioning situations have changed drastically since that post. At the time the situation I was in was *very* unstable with there being a threat of eviction hanging over my head and a sibling as well. Since that post I can say gladly my savings are back in a decent situation and while my credit currently has not improved I am working on it through means besides a credit card and am averaging about 2000 a month and am no longer living with family. 

Just to clear the air on that, though I do thank you for your, hopefully, concern."
2021-05-04 09:14:38,stocks,Yeah I’m totally with you. I’ve been investing in VTI or similar since 2016 and gradually ramped up my knowledge since then. It’s definitely best to start safe and simple. And thankfully an average of 10% returns for decades is not bad at all. It just looks bad compared to DOGE and GME.
2021-05-04 04:44:15,stocks,"Thanks,  I'm very close to getting Fidelity but don't believe they do any crypto."
2021-05-04 09:23:48,stocks,"Yep but you could of lost 50% chasing Gme , doge etc. never know when it’s gonna go the other way. Seems like whenever I go for a casino stock is the time it dumps out. 

I did well on Gme getting in at like 80 and selling at 150 but I felt that fear of missing out feeling as it went higher and higher."
2021-05-04 00:00:00,stocks,"Why is NVDA worth so much more than AMD? I'm newer to the game so maybe someone can help me with this.  I am sure I am missing something basic but, looking at their revenue, NVDA is not much more than AMD.  NVDA shows $5 billion for quarterly revenue January 21 and AMD is showing $3.44 billion for the same time period. So roughly, 1.5 times as much revenue.

NVDA is shown being valued at $370 billion and AMD at $97 billion.  That means NVDA is worth almost 4 times as much with only 1.5 times the revenue.  Why is this?  

I like AMD and have been invested since March of last year and plan to keep buying more, but I just wonder why they are worth so much less.  Again, I am sure I am missing something very fundamental here so any input is greatly appreciated."
2021-05-03 23:01:40,stocks,"Other can answer with the more intangible items. From a financial perspective, let's take a look at the 10K's of each company (since this is the last filing of NVDA). Over the last fiscal year, here are some key stats:

Revenue:

NVDA: $16.7B / AMD: $9.7B (hrmmm this seems closer than 4x like you mention, more like 1.7x)

Gross Profit:

NVDA: $10.3B / AMD: 4.3B (Interesting, it appears NVDA has better margins so now we are close to 2.5x)

Income Before Taxes:

NVDA: $4.4B / AMD: $1.3B (Now we are all the way up to 3.4x, so getting close to 4x. This shows AMD has lower margins, and higher comparative expenses).

Net Income:

NVDA: $4.3B / AMD:$ 2.5B (Woah we dropped down to 1.72x. If we look, this is due to AMD having carryover losses and Tax carry forwards that reduced AMD's tax burden and net them returns instead of paying taxes hence why they have more net income than they earned).

So what can we conclude on this? Don't just look at revenue. A company can have an insane amount of revenue, but if they are inefficient or have too many operating expenses, they could potentially have  little to no revenue. Next, comparatively, if we ignore the losses and credits AMD took to boost their net income, NVDA is actually coming close to that 4x difference we are seeing in valuation. That and all the intangibles others are mentioning, and AMD's recent pull back, attribute to the difference."
2021-05-03 23:07:45,stocks,"AMD has only relatively recently obtained such growth. With regards to personal computing, Intel has led on the central processor front for decades in terms of market share, partnerships with oems, and performance. At the same time, NVIDIA has dominated the consumer/professional/gaming graphics card segment, in terms of market share, technology, and performance. 

After building my AMD based PC in 2019, started really paying attention to parts, and news regarding AMD's products. Wife was convinced to buy in at a measly 30-40 a share, IIRC. And they have since performed beyond expectations. Their consumer products do not quite make the very top in terms of overall performance, but their value proposition in consumer products has yielded high growth in terms of adoption, and they are starting to secure deals with OEMs. 

TL;DR AMD is David vs Goliath on the two most important fronts AMD has. If you can consider them a David lol. But they're accelerating in terms of development and market share. I'm so long on AMD."
2021-05-03 22:50:52,stocks,"Look at net income.

553m vs 1.46b

Profit = Revenue - Expenses"
2021-05-04 04:21:22,stocks,"As someone in an industry that largely depends on video cards (game design), I can give a simple answer. NVDA has a relative monopoly on the space, and have been making partnerships to ensure that their cards are a standard for developers. AMD is beating Intel in the processor space, but demands have expanded much more towards the video card sector recently for various reasons, and I sort of feel like Intel is destined to be a Compaq that has been too slow to adapt.

That said, I think AMD can seriously challenge NVDA, but they need a serious focus on that area which is difficult."
2021-05-04 05:47:40,stocks,"I think there’s a big elephant in the room that no one is talking about. 

Market cap = share count * share price

Amd is about to print a large amount of shares to purchase Xilinx. This means their market cap should increase even at a stable share price. AMD will by 74% amd stockholders, 26% Xilinx stock holders."
2021-05-03 23:27:31,stocks,"Simply said look at their businesses as well. Speculate forward.

What is next for AMD, producing a better chip ? Their stock price rise seems to be more about can Intel shit itself even more.

What is next for Nvidia, artificial intelligence ?

'' On September 13, 2020, Nvidia announced that it had entered into a definitive agreement to purchase Arm Inc. from SoftBank Group Corp. (TSE:9984) for $40 billion.10 Arm is a U.K.-based semiconductor and software design company specializing in CPU architecture. Nvidia says the acquisition will help it to expand its AI capacities and advance a range of technologies from cloud computing and smartphones to self-driving cars and the internet of things (IoT).11 Nvidia noted in its annual FY 2021 filings that the transaction is expected to close some time in the first quarter of calendar year 2022.12 ''

Looks like Nvidia has always been more universal and are pushing for something big, if they succeed that will be quite the money banger.

Which company would people rather buy for next 5 - 20 years ? Will AMD still be producing better chips than their last one ? Is AMD going to be around or are Intel, Apple and Nvidia going to push breakthrough things AMD can't possibly match ? AMD is quite scarier and riskier investment in that regard. Nvidia on the other hand has bigger stronghold with their GPUs and have a lot of speculative things that could pay off big time.

Disclaimer, i own fuck ton of both equally."
2021-05-04 00:16:13,stocks,I wonder if the market has even properly priced in the chip shortage. I own a lot of NVDA and I'm afraid of a downfall.
2021-05-04 06:48:59,stocks,"My personal opinion is that most analysts and investors aren't that into electronics and tech and dont see the upcoming potential of AMD.
We saw huge impact in the CPU marked with AMDs chiplet technology and following AMDs roadmap its the plan to do the same thing in the GPU market. The upcoming RDNA3 chiplet graphics cards are said to be very, very fast and even much faster what NVidia can offer. There are some very promising leaks and the chiplet designs makes it possible to cut the time to market so AMD could probably be 3-6 monts ahead of Nvidia with even better products in the next GPU cycle.
This leads to better public recognition, probably higher prices and margins and after all higher revenue in graphics segment.

Also AMD is switching to 5nm next year when intel just try to improve its 10nm process. The 6nm APU Rembrandt and the 5nm version 1 year later will surely gain more market share in mobile and OEM market.

For me its most likely that Intel and Nvidia will loose market share to AMD and AMD will increase margins over time.

I think its possible to double the revenue in die upcoming 1.5 years."
2021-05-04 06:52:56,stocks,"Smart money likes to keep retail investor with FUD, so retail will sell low buy high. They can easily manipulate the stock since all stands to gain if they keep the stock low enough to accumulate enough position before letting the retail investor knows that AMD is actually good and everyone should buy. Then they sell to those eager retail and the cycle begins again"
2021-05-03 22:48:18,stocks,"NVDA GPUs are, and have been, the industry standard. AMD just starting to take up some more market share with Ryzen and Thread ripper. 

NVDA market cap is about 3.5x bigger than AMD. NVDA revenue is 16b vs AMDs 10b. They also do a whole lot more. Including AI, Neural Net, and computing for self driving. They have both powerful cpu and gpu chips. 

Not only does NVDA have more going on right now, they also have a stronger future roadmap for growth."
2021-05-04 00:05:36,stocks,"Both companies are highly overvalued....the question is which one has more future potential/risk?  NVidia GPUs reliably outsell AMD GPUs, but lets call that a wash....AMD CPUs beat intel lately(usually not forever), but have super high margins so not very profitable and both chips are likely to be made obsolete by ARM based CPUs from apple and now Nvidia if they make the ARM acquisition....and that's the big one, if Nvidia gets into the CPU race, offering an Apple M1 like product for windows, that's a big hit to AMD(and intel).  Nvidia network compute growth has almost matched it's graphics in just a couple years, so the hype is strong...AMD is kinda running out of steam after beating Intel down the last few years.  given a long enough time period, both will likely meet their price valuations and even go higher, but in a shorter term they are very risky to any market correction.  I will add, AMD does not have a dividend unlike Nvidia(or Intel) so it's a bit harder to hold for very long periods."
2021-05-04 01:08:58,stocks,I’d say give it a few more years  for them to surpass Nvidia. AMD was always the budget room heater until ryzen and the graphics cards timed with the early ryzen releases were meh. A lot of new architecture they haven’t yet mastered
2021-05-03 22:46:39,stocks,I believe NVDA makes software for self driving cars.
2021-05-04 01:57:56,stocks,AMD has a lot of comparatively low margin console contracts. Those are good for revenue and pays off a lot of overhead but just isn't as high margin as standalone GPUs or CPUs.
2021-05-04 04:40:26,stocks,They shit money
2021-05-04 05:46:41,stocks,Look at free cash flow and EBITDA. Nvidia is a fair bit higher. I kind of eye balled it but it looked around 4x higher over past 5 years.
2021-05-04 07:25:52,stocks,"At this point in time if you want to be serious about machine learning/ai. You are going to use a nvidia card. Amazon, Microsoft, Google, facebook, salesforce, all using nvidia cards for their machine learning needs. It boils down to software support for nvidia over amd. There's no reason why  amd cannot make their software suite better. But nvidia cards are the industry standard. Idk too much about the gaming market."
2021-05-04 07:57:38,stocks,AI
2021-05-04 07:13:36,stocks,"NVDA is an innovative company with trustworthy growth prospects.

AMD is an historical fuckup that got lucky in a couple of big ways and barely avoided a bankruptcy.

But the biggest reason they're valued differently is that NVDA is vastly more profitable, making as much net profit in a quarter as AMD makes in a year."
2021-05-03 23:06:15,stocks,"This is fantastic and has really helped out.  Thank you!  

Do you have any thoughts long term on AMD stock price wise?  Are you bullish on them?"
2021-05-04 06:02:11,stocks,"On the other hand AMD more than 3x their net income last quarter and this will probably go on for the next few quarters as well, much faster than NVDA."
2021-05-04 07:38:59,stocks,Thanks for this response!
2021-05-04 08:30:47,stocks,Prime example is RBLX. In terms of revenue and profits. Almost 1b in revenue but all said and done it’s -200million. Always have been an AMD fan. Will be getting to amd soon.
2021-05-04 05:08:52,stocks,"With the latest ryzen 5000 processors, they do make the very top in terms of overall performance. In this moment amd has the cpus to buy it you want the best performance."
2021-05-03 23:37:38,stocks,Also long AMD.  I have been buying everytime they dip below $80.
2021-05-03 22:56:38,stocks,"Are those the quarterly numbers? Looking at 2020 their net incomes are nearly the same, 2.5 for AMD vs 2.8 for NVDA.

Edit: I see they are the quarterly ones. Thanks!"
2021-05-04 10:13:53,stocks,"That's not the whole story. Most people are buying NVDA or AMD because they expect growth, not just stagnation at current net income levels.

TSLA has lower net income than both AMD and NVDA, but it's market cap is 650B. That's not to mention the loads of other companies with high valuations that are losing money."
2021-05-04 07:43:08,stocks,Same I paper handed my puts but will be riding intel down
2021-05-04 08:04:51,stocks,"AMD has serious supply chain issues, since their silicon flies off the shelves faster than TSMC can produce. NVidia has Samsung fabs to help them out. This will hamper growth for at least another two quarters.

Nvidia has huge additional revenue with their quasi monopolistic AI accelerator chips. This revenue is used to pay an army of software engineers, which is the reason that AMDs software is seen as inferior. For a decade they couldn't compete in that space against Intel and NVidia.

That said, I'm [absolutely bullish on AMD](https://money.cnn.com/quote/forecast/forecast.html?symb=AMD). As soon supply chain normalizes, they will have insane revenue numbers. Due to the new revenue they can finally afford to attack Nvidia and Intel on their home turfs, which is software and mobile devices. AMD laptops are the best deal currently, but nearly unavailable in many regions. People take the Intels instead."
2021-05-04 06:49:32,stocks,this is what is holding down the AMD share price. the massive stock dilution for the xilinx buyout
2021-05-04 03:59:32,stocks,"That ARM acquisition has got some issues though...

&#x200B;

[https://www.theguardian.com/business/2021/apr/19/uk-government-investigation-nvidia-arm-takeover](https://www.theguardian.com/business/2021/apr/19/uk-government-investigation-nvidia-arm-takeover)"
2021-05-03 23:35:20,stocks,One thing I know for sure is I know very little lol.  Thanks for the write up!
2021-05-04 00:45:56,stocks,"It's not just about their competition doing poorly (Intel). It's also about their markets growing. And growing they are big time. There is more demand on CPUs and GPUs today than there ever was in history, and it won't be met for a long, long time despite gradually expanding production capacities. At the moment they are merely able to prioritize product lines that are the most profitable AND still can't produce enough for their products to be actually available at retail. They are really selling every single chip they can make before it reaches store shelves, and there are many markets they aren't able to even start targeting due to overwhelming demand elsewhere."
2021-05-04 03:03:48,stocks,"They upped guidance, if there was a real shortage they wouldn't."
2021-05-04 08:13:58,stocks,Appreciate the insight. Do you happen to have any quick links I could skim through to get up to speed with AMD?
2021-05-04 08:16:56,stocks,"I have to slightly disagree with the analyst sentiment. [Based on this](https://money.cnn.com/quote/forecast/forecast.html?symb=AMD), they clearly see the market potential, but not in the short term. As long supply chain issues aren't resolved and their 'quality of life' product improvements don't reach the customer for another six month, there is nothing the management can do. If cargo shipping is still restricted, crypto mining buys bulk product at a huge discount, they just have to wait until things normalize. Then there will a explosion of revenue."
2021-05-03 22:51:38,stocks,"I see AMD revenue at 9.7b for 2020 and NVDA at 10.7b for 2020 (according to wikipedia for both) which leads me back to my original question of why they are worth so much more?

Edit: Correction, 10.9 b for NVDA but still not a big difference.  Your point about the future roadmap for growth does make a lot of sense."
2021-05-04 05:45:00,stocks,"> and both chips are likely to be made obsolete by ARM based CPUs  

Could you expand on why will ARM make x86 obsolete?"
2021-05-04 07:58:51,stocks,"Google also offers their TPUs at a lower cost than using Nvidia.

Plus

""Google's TPU Pods are Breaking Records — And We Aren't Surprised""

https://blog.bitvore.com/googles-tpu-pods-are-breaking-benchmark-records"
2021-05-04 08:22:47,stocks,"This is also what irks me a little. NVidia found a way into the cloud business and creates hefty revenue and pays 100s of software engineers with it. Which in turn creates a better quality of life for their gaming cards.

AMD has nothing like this. They seem to have *some* help from Microsoft XBOX/cloud divisions, but that is not even in the same ballpark. The hope is, that AMD can put Xilinx's leadership in the (cloud) network sector to some good revenue, so they can afford more people on the software side."
2021-05-04 07:34:28,stocks,Doesn’t that AMD description kind of remind you of another company that’s currently worth a couple trillion dollars?
2021-05-03 23:19:01,stocks,"I don't own any shares currently; however, I may be moving capital over soon as I think the market is overselling them. They have a strong CEO and will likely continue gaining market share from NVDA and and INTC. In my opinion, I would consider them a good long play."
2021-05-04 06:17:42,stocks,"Plus, AMD won the console wars meaning they can expect 8 years of growth and increased profitability."
2021-05-04 10:17:37,stocks,"Yes, yes. We know.  Fundamentals don't matter for growth stocks, or something."
2021-05-04 10:26:03,stocks,"AMD obtains all Xilinx's assets and liabilities, thus effectively neutralizing the effects of the dilution. A stock for stock acquisition is the cheapest and most efficient way to acquire a target company."
2021-05-04 07:58:46,stocks,Yep. I give it a 90% chance this doesn't get approved.
2021-05-03 22:56:58,stocks,"Nvidia has gpu monopoly. Their profits are way higher than amd, for whom main revenue is still cpu."
2021-05-03 22:55:09,stocks,"AMD 2021 10B // 2020 7B

NVDA 2021 16B // 2020 12B

Just confirmed on yahoo finance instead of googles shit results and edited post. NVDA also has about 2x the earnings for 2021. 

They have more and make more money so they command a higher price. Plus add more hype and that’s the extra 1x (plus the 2x price vs AMD on fundamental value) in my opinion"
2021-05-04 06:08:41,stocks,"https://www.toptal.com/apple/apple-m1-processor-compatibility-overview

All someone has to do is make a windows compatible m1 chip which apparently it already is(but Apple doesn’t care to release it for windows)....Nvidia would be in the best position to do so.  x86 days are numbered..."
2021-05-04 08:30:24,stocks,"The only companies over 1T are Google, Microsoft, Amazon, Apple, and Saudi Aramco, and only SA is over 2T.

The one you're probably talking about isn't as big as NVDA any more."
2021-05-03 23:34:19,stocks,"Ditto, I hold some now for a long play - thinking 5-10 years.

I remember when AMD PCs were rare, now they’re common, and AMD made the chips for the new Xbox and PS5 too. They’re capturing market share like mad."
2021-05-03 22:59:59,stocks,Exactly. NVDA doesn’t really have any one to compete with on GPU because they’re the best. Just straight out. AMD still competing in the chip space with INTC and now AAPL with the arm chips
2021-05-03 23:02:06,stocks,Makes sense.. thanks!
2021-05-04 09:06:58,stocks,"Apple has a >$2T USD market cap, SA does not"
2021-05-04 09:45:08,stocks,Apple’s market cap is over 2 trillion. They also almost went bankrupt.
2021-05-03 23:39:47,stocks,That's originally why I bought into them.  I liked the fact that all the next gen consoles had their chips.  Hopefully see some more big news like that in the future.
2021-05-04 06:10:45,stocks,"They've been also supplying GPUs to Xbox One and PS4, this ain't exactly some new field opening them to extra growth. Although they are doing good work capturing the market and getting back on the PC map with Ryzens especially."
2021-05-03 23:01:55,stocks,Definitely makes sense. Thanks for the input!
2021-05-03 23:03:08,stocks,"Forgot to ask, wasn't AMD trying to break into the GPU game as well or did I just imagine that?"
2021-05-04 10:21:09,stocks,"That's on me. I misread the table. Sidescroll foul.

Um, what about AMD makes you think they have the capability to invent the iPod and iPhone?

You may be thinking of NVDA, which is all up in the AI/ML world.

AMD is also second banana in M&A, overpaying for XLNX while NVDA is overpaying for ARM, which is a way better thing to overpay for. And NVDA might not have to pay for it, while AMD is hip deep in buyer's remorse."
2021-05-03 23:52:30,stocks,"Wouldn't suggest turning into a bag holder. Never buy a stock while it's in the middle of free fall.

Look at the overall markets, if nasdaq takes a break, ALL TECH TAKES A BREAK WITH IT."
2021-05-03 23:11:52,stocks,"They have GPUs. The Radeon cards. They're used in Macs. I'm not a fan. They're ok for budget gaming, but for any creative application NVDA is much more optimized. Cuda cores, AI denoising, direct transcoding, etc. They're also just less glitchy in general. That's why NVDA dominates the space. Just no real competition."
2021-05-04 10:42:51,stocks,"My point is that you can’t dismiss a company because of some past mistakes. AMD is growing fast, has great leadership, and products people love. Those are some good ingredients for future success."
2021-05-03 23:56:13,stocks,"I bought most of my positions for AMD back when they were $40-$50 so I am not worried about their current price.

I've been adding to my position little by little recently, when they have been below $80."
2021-05-04 02:11:11,stocks,I just want to point out that the nasdaq is majority made up of the tech you're referring to. The nasdaq falling does not cause tech to fall.
2021-05-04 08:08:42,stocks,"Gamedevs are saying, that AMDs software game was upped recently with the new revenue. Having a couple of 100 software engineers sitting around makes a huge difference, but they cost a lot. Supply chain issues for all their chips hamper their possible growth. They could annoy Nvidia in the low end a lot and push for more market share, but the product can't reach the customer. In a year or two, AMD will attack Nvidia, especially in the mass market. Getting CPU and a marketable GPU from one vendor is cheaper for builds and we will see that."
2021-05-04 08:41:11,stocks,"For gaming the Radeon Cards are pretty equivalent to the Nvidia cards, and AMD actually makes the Radeon cards themself, they aren't selling of production rights."
2021-05-04 00:48:34,stocks,"It should be safer than most if the market takes a bit of a break. Market can't go up forever without a break. Historically improbable.

Don't forget, you can sell high and buy back lower. It's not till death do you part."
2021-05-04 02:25:25,stocks,"I know, it happens in unison."
2021-05-04 00:00:00,stocks,"Why don't most people report April? title says is. If they know that april is the best month for stocks, between April and May, why don't a lot of companies pile into April and ride the wave? That way, they don't announce earnings when it's crappy like the beginning of May? I feel like all these companies are getting unfairly hit because ""April"" is the month to buy and ""May"" is the month to sell. All tech starting in May is getting hammered, when I feel there's nothing that changed from Friday to Today. Big players control narrative, so it scared maybe one financial firm to start a sell off?"
