Timestamp,Subreddit,Post/Comment
2021-04-24 21:45:56,stocks,"I can't see any special distributions.  The common shares have received 0.20 per quarter for the last 4 quarters.

The 26% number you get if you add the dividends from all 4 series, then divide by the price of the preferred share. Likely a software or input error."
2021-04-24 20:59:53,stocks,"Same here. 

One thing I don't like is the fact blackrock/van/street has NO stake in it. It's VERY difficult to find a worthwhile company they DON'T have a piece of."
2021-04-24 21:48:31,stocks,Fair enough. I wasn't seeing any news on a massive dividend increase.
2021-04-25 00:00:00,stocks,"How to diversify into stocks that aren't at all time highs? I'm trying to diversify out of tech and growth stocks. But it seems areas where I could do so are at all time highs such as bank stocks, airline stocks, many dividend stocks such as PEP, PG, JNJ.

And what making this harder is that same sector of tech/growth seems to be where the deals are since many of those are now 50% and higher off their highs. Even with the rally they had the last three trading days."
2021-04-24 21:07:49,stocks,"Some not at ATH: JD, BABA, Tencent, cresco, curaleaf, trulieve, green thumb, amd, tdoc, trade desk, many money."
2021-04-25 06:35:41,stocks,Look at value investing
2021-04-24 21:57:41,stocks,"Tobacco, oil, banks, REITs. 

But don’t overdue it on the lesser risk side. Whenever the next bear market comes, take a deep breath and remember that you’re investing long term. It helps to set aside some monthly income to add through bull and bear alike."
2021-04-24 22:06:44,stocks,"Non-US stocks, even ones of really good companies, are not at all time highs. Look at the charts for Germany (EWG) , or Australia (EWA). Emerging markets are in similar position."
2021-04-24 23:24:10,stocks,"Right now there are plenty of stocks at attractive valuations. MO, T, PFE, EBAY, BABA... you just have to do some deeper digging."
2021-04-25 01:53:11,stocks,"So many answers... pretty much every possible answer has been presented except how to teach you to recognize value which is basically what you are looking for. Look into value investing. Learn more about valuation both of stocks and of markets.

Do yourself a favor and look up the PE of the S&P500 so you can understand the current risks (see [https://www.multpl.com/s-p-500-pe-ratio](https://www.multpl.com/s-p-500-pe-ratio)). As you might suspect, its in historic bubble territory however some people think its not a real bubble for various reasons. You need to decide for yourself. I think there is a definite tech bubble and I assume you sort of feel the same.

I personally dont see a lot of value either.  If I had to recommend some safety I would say maybe beat up stuff with good prospects in the future or some safe growth such as:  
OTGLY (beat up due to bad game release recently)  
AMZN (have their hands in a lot and more growth coming)

Or solid dividend plays. I really like the healthcare REITs:  
VTR (healthcare REIT)  
NHI (healthcare REIT)

Or perhaps some old school non-cyclical stuff that hasnt moved much in a few years such as:  
GIS (historically good div growth, has been sideways a while)  
KMB (same as GIS)

But im piling up cash more than buying and just cycling through short term treasuries."
2021-04-25 08:20:20,stocks,"who cares if its ATH or not? If you are investing in a good stock which you plan on holding for years you wont even notice . MSFT is at its ATH atm but im 100% convinced that its a good investment , because its a good company with good fundamentals"
2021-04-25 15:03:19,stocks,"Pick any stock, set a limit order for 1% below its ATH, then kick back and crack open a cold one after pattinf yourself on the back."
2021-04-24 20:08:15,stocks,MMP and MPLX are energy stocks that pay the highest dividends in that sector.  Both undervalued right now.  MMP is sensitive to oil price while MPLX is sensitive to natural gas.  I usually rotate my oil stocks after summer
2021-04-24 21:54:12,stocks,"You should be skeptical of companies that are not trading close to their all time high. Those big rallies you see are undervalued companies adjusting to their fair market value. Sure, finding deep value like that is always the goal, but investing in a solid large company that is still growing despite being at an all time high (AAPL, GOOG, AMZN etc) will just lead to more all time highs most weeks you hold the stock.

You need stable reliable positions anchoring the growth of your portfolio before you get more speculative."
2021-04-24 22:04:36,stocks,If stocks weren’t at all time highs then no one would ever invest
2021-04-24 23:01:05,stocks,"Find sectors primed for growth and invest in companies in those sectors that have not yet ripped. This method requires a lot of patience because you need to do a lot of DD, but that is what the market rewards. I am heavy into mining and batteries, and have looked for and continue to look for companies with growth potential. Regardless of which sectors you settle on it requires on patiently completing your own DD by economic sector, then by company. Also, invest in what you know."
2021-04-25 00:51:19,stocks,"There are quite a few quality non-tech stocks that are off their all time highs, some of my favorite are DIS, CVX, SPG, BA, MRK"
2021-04-25 01:24:40,stocks,"Make ""price within 50% of 52 week low"" one of your screen criteria. You'll find all kinds of candidates."
2021-04-25 01:27:41,stocks,"Look into relative strength index/RSI, it's a technical indicator that indicates if something is ""overbought"" or ""oversold"" based on historical data. It's not perfect, but the idea is basically to guess when a dip or increase is coming based on the idea that if the RSI goes above 70 the price will start to drop soon or if below 30 it will start to go back up soon. Basically RSI wants to equilibrate at 50 and the stock will go up or down based on that. 

Generally for high conviction stocks I either 1) wait until RSI indicates that is' a good time to buy (below 50 is perfect but 50s and 60s can be okay too. If I find an opportunity to buy below an RSI of 40 that's the dream) or 2) put a limit buy for slightly below current price.

There are limits of course as the market isn't just a math game. It's very easy to get into a value trap just looking at RSI. Alternatively, sometimes stocks hit the ""overbought"" cut off at 70 and keep climbing into ridiculous territory in the 80s and 90s. Happened with HD recently."
2021-04-25 08:28:39,stocks,Focus on the sectors that will continue to grow then buy companies in that sector. Tesla and Amazon have stayed overvalued for more than 4 years now.
2021-04-25 09:25:48,stocks,I am thinking of putting some money into VPU (vanguard utilities).
2021-04-25 11:10:40,stocks,"the problem with these ""value"" stocks is that the market has already identified everything.  Most of them are being used as a covered call cash cow which will drive you mad (GILEAD).  Is it undervalued?  yes...does it matter? No because you can write calls all day and collect premiums essentially risk free."
2021-04-25 12:36:51,stocks,"""how to diversify out of good stocks (thus at ATH) into shit stocks""

clown

msft was at ATH 95% of the last 10 years of something for example..."
2021-04-25 13:29:40,stocks,"OTC baby, I can guarantee they’re not at all time highs..."
2021-04-25 14:17:29,stocks,"buy high, sell higher"
2021-04-25 00:46:55,stocks,"JP Morgan, American Express, and Exxon Mobil are good buys right now"
2021-04-25 12:49:51,stocks,I LIKE REITS!
2021-04-24 21:49:14,stocks,"Copper and steel for all the energy changes planned.

Oil because energy change is going to take much longer than many people expect."
2021-04-24 22:55:19,stocks,"I am having a little short term success on some mining stocks, and expect it to have great long term performance. If OP looks around through the various subs there is great DD on different stocks."
2021-04-25 12:04:00,stocks,"But with this, also be realistic about expectations.  Like if a company has $100M in revenue and assets and you expect them to double in size over ten years.... buying a share priced at $300M is not a wise investment."
2021-04-25 01:16:31,stocks,NIO will very likely increase 50% in the next year.
2021-04-25 12:50:53,stocks,What about small and mid-cap stocks?
2021-04-25 15:04:45,stocks,"But also take into consideration that the ""all time high"" you're referring to is referenced to dollars. The inflation adjusted value of the dollar is at an all time low. You have to look at both the numerator and the denominator when trillions of dollar are added to the economy, and most of them directly to the financial ecosystem, every three months."
2021-04-24 21:01:09,stocks,"OP, you could always SHORT something at it's ATH..."
2021-04-25 01:14:16,stocks,"Steel has been treating me so well, new 52W high last week even amid all the drama and in my personal opinion we’re only just starting.  

Learnt so much about this industrial sector and it’s actually really interesting how they can add to the green deal/decarbonization plans with new ways of producing/plants."
2021-04-25 09:06:15,stocks,Solid state batteries will be mass produced and replace oil for cars in three to four years. Not only that but bye 2030 gas engines will be outlowd bye the U.S and its allies. Hydrogen technology will also be mass produced for semi trucks and aeroplanes.
2021-04-24 22:42:31,stocks,"If you want to lower volatility, get into banks, oil and gas (pipelines are key), ETFs, corp bonds, mezzanine assets (usually through ETFs like CHY), etc.

Look into long term stable sectors and invest in long term companies you like after doing your DD."
2021-04-25 14:28:04,stocks,I'm new to this and invested a small amount in NIO. Just curious why this person was downvoted? Do many think it is a poor investment?
2021-04-25 16:54:18,stocks,"There are probably good companies out there but I dont know of any that are cheap right now. 

Ive been doing a deep dive into eV related small caps and though I did buy some GOEV recently, I am probably getting out of that this week. Im not impressed with the 10 or so companies I have researched. I cant believe the amount of lying the CEOs do these days...

I do own a bunch of KRUS. A micro cap restaurant, but the current price is on the high side. Though it is in approaching rapid expansion phase. I also have ENPH but thats no longer a mid cap..."
2021-04-24 23:24:46,stocks,"Yeah. Short SPY, and BRK.B. Let us know how that works out for you."
2021-04-24 21:28:35,stocks,[deleted]
2021-04-24 21:29:44,stocks,"Selling CSPs isn't the worst idea in situations where you'd like to buy shares but not at the current price.  If the price drops, you get in at your target price.  If not, no big deal except tying up cash for a bit.  Either way, you make a bit on the premium at the very least."
2021-04-25 10:56:30,stocks,Yep. Nucor is finishing a plant that is strategically located to supply steel for the decarbonization effort.
2021-04-25 11:24:35,stocks,"Assuming all that happened, a tremendous amount of oil would have to be used in the next 10 years from mining to manufacturing to delivery. EV cars take significantly more energy than ICE. So much so that EV doesn’t break even with ICE until 60k-100k miles depending. 

All that would also drive the price of copper and steel much higher, which is an equally sized position for me as oil. So I’m totally fine with this event.

On the other hand, the price of copper and steel will probably slow the timeline. EV cars take up to 3x more copper according to Freeport Mcmoran, 3x-10x according to copper.org.

The infrastructure is not in place to sell all these EV cars. That will take a huge push if it’s going to be this decade. That’s more copper again. 

Nobody seems to be factoring in used cars. People keep their cars for a decade and then sell them to other people. IIRC the average age of cars on the road is about 16 years. So, widespread adoption will require used EVs. 

Not many are considering the weather limitations on EV. I live in Colorado. The current batteries aren’t good when the temp is below 30F or 20F. 

Finally, a lot of money can still be pulled out of a declining industry. Nobody can see the future so maybe some oil companies take over a big part of the green energy. There are 6000 products the use oil. Look at the plastic we through away.


Who has outlawed gas cars? California and other places have outlawed the sale of new gas cars. Used gas cars can be sold and driven. Gas cars can be bought in Nevada and Oregon then registered in California."
2021-04-25 16:58:22,stocks,ARVL + PNGO + PLYBY + FNKO + AB/ML+ HIMX + GE/VO + BBKCF + KAVL + FCSMF + FTMDF are some I recommend
2021-04-25 04:03:14,stocks,Here to report!.. not great.
2021-04-24 21:35:42,stocks,But they seem to be ok with puts
2021-04-25 13:11:46,stocks,"I like Nucor because of their balance sheet, however for the full potential and total picture I like MT and CLF."
2021-04-25 12:51:18,stocks,I'm guessing you haven't read about how ssb's work. Ssb's don't use copper and they are made to withstand high weather temperature along with high air pressure. This video explains it better https://youtu.be/3PyXQ0UXk9w.
2021-04-25 17:19:53,stocks,"lol, bad timing. SPY looks to be heading for a guaranteed 420 before a POSSIBLE dip. No guarantees in life though."
2021-04-24 21:43:54,stocks,Puts have a maximum loss.
2021-04-25 13:54:24,stocks,"How does the electricity get from the battery to the motor? Copper. The additional copper is not in the battery but because of the battery driving the motor. 

I said cold not high temperatures. Historically, solid state batteries were poor in the cold. Recent advancements may change that. But it looks like the soonest ssb to market will be 2025. That’s assuming no setbacks during R&D.

I’m not arguing against the transition. I’m arguing that widespread EV ownership won’t come until the 2030s. And with it will come higher copper demand."
2021-04-24 21:59:18,stocks,That’s why I’d prefer a put. I don’t think I could stomach a potential catastrophic loss.
2021-04-25 00:00:00,stocks,"The traditional stock bond ratio Hello, 


Given the current low rate environment, bonds have become a lackluster investment. Rates have reached the lowest they have had ever, and it seems we have bottomed rates.

Here’s my thought. Why have bonds at all right now? If rates rise, won’t the principle value of the bond go down? I mean unless you hold the bond until maturity, which long term bonds suck right now.

Wouldn’t it be better to have cash over bonds right now? At least with Cash, you have opportunity to buy at a discount when we see a correction.


I’m not saying to go out and time the market: being all in cash and just waiting for the sky to fall. But what I’m saying is hold more cash than under normal times, at least in replacement to those shi**y low rate bonds. 

Thoughts r / stocks?"
2021-04-24 22:08:54,stocks,"Congrats, you just figured out what most money managers haven’t. Right now equities > cash > government bonds. The people on this thread harping about how their 1% bond return beats cash aren’t weighing their downside risk. Smarter people than I have written about this - 

https://www.bridgewater.com/research-and-insights/why-in-the-world-would-you-own-bonds-when"
2021-04-24 20:38:05,stocks,...is dead. At present I don't see a logical argument for bonds. This will change in the future most likely.
2021-04-25 08:35:07,stocks,Bonds are getting their ass kicked this year
2021-04-25 10:18:42,stocks,"Bonds work as substitute for cash deposit. If you are holding cash, you are only covered up to a certain small limit if the bank/broker fails for whatever reason. If you are holding bonds, it's like a deposit with the government that is covered up to the full amount. So if you are Apple and have 250 billion in cash, you aren't going to put it all in a checking account.

Bonds are probably not useful in a small individual investment portfolio right now, because of the low expected returns in the near future."
2021-04-25 12:02:40,stocks,"Bonds are for when near retirement, and you don't want volatility. Low rate beats no rate and who wants to work longer and put off retirement due to a market correction?

If young be aggressive and do 0 percent bonds"
2021-04-25 08:59:47,stocks,I tried this but the price of the bond ETF was crashing.
2021-04-25 08:55:39,stocks,"I’m close to retirement so it’s hard to think about anything when beta is greater than zero.

But a controlled burn rate of 2 or 3 percent because of negative real rates can’t be my only option. Especially if my taxes get raised.

So even as I approach retirement bonds don’t make sense for me, at least yet. I also use the bond proxy idea. I keep about 30% in my proxies. I don’t have 40% in the proxy because dividends on safe bets are so low."
2021-04-25 00:00:00,stocks,"Resource(s) for finding the price of a stock in several countries/indexes? Example: Seeing the share value of Alibaba on the US, Shanghai, Japan, Germany, etc. indexes. Where could I search for stock quotes on the Shanghai/other world indexes for example?  

Does such a resource exist?

The share price does not have to be converted to the same currency for all the indexes necessarily. Some people will say Bloomberg terminal but that is expensive and hard to find is there anything else potentially? Resource doesn't have to apply to all markets necessarily."
2021-04-25 11:49:19,stocks,"It's not a pretty solution, but you could search for a company in Tradingview (use the company name, not the ticker!)  and compare the prices of the specific stock on all the listed exchanges. 

I hope someone has a secret website for this, though. After a few companies it'd be a hassle to compare the prices manually"
2021-04-24 22:26:03,stocks,I am not an expert but I like the question. I believe you’d need to research in which stocks exchanges said stock is traded/listed. Note that indexes are different from the stock exchanges...
2021-04-25 14:14:50,stocks,Excellent resource! Thank you!
2021-04-25 14:17:41,stocks,Glad to be helpful! May I ask what the reason for this price comparison is? Or differently: how do you think you can benefit from this?
2021-04-25 00:00:00,stocks,"How would I go about shorting a selection of sports clubs/the industry in general? With all the recent news on the European Super League disaster and stricter regulation on English Football clubs, on top of the pandemic is going to cause clubs a lot of damage.

Despite being familiar with the concept, I've never shorted anything before. 

How would I go about doing this? Is their a platform that offers this to some degree?"
2021-04-25 08:29:25,stocks,Hope you’re prepared to lose it all dummy!
2021-04-25 00:00:00,stocks,"Ultimate HUYA DD This is my excuse to dodge parenthood & stuff so I better make it a long one.

PART I:

1. Fundamentals: Can't post pictures here but look it up on YCharts. 

I generally use PS Ratio for growth tech stocks. Definition: PS Ratio = Price / Revenue Per Share (Note: YCharts uses the Trailing Twelve Months (TTM) Revenue Per Share in the denominator). Most growth tech companies are as low as 10 on the low side up to 30. Generally I try to catch companies I'm bullish on around 10; 2.7 is stupid low. This is the biggest streaming company in China and is avidly sought after by Tencent. Massive market and massive growth industry. Their PS is crazy low. The Price to Book Value is also fucking awesome for a growth tech company. Value investors look for companies less than 3 and this fits that parameter. This company is also jacked to the gills with cash. Check out their balance sheet. As of Q4 2020 their total assets are 12.4B and their total liabilities are 2.6B. They have 3.2B in pure cash. Year over year this company is putting out blow out numbers but their Q4 contracted a bit vs their Q3 of last year. But seriously: 3.2B in cash and the market cap is just over 4B. What kind of absurd mismatch is this especially when it is a money printing business too.

2) Technical/Price-Action/Analyst stuff: (had a picture from TD Ameritrade analyst reports)

6 Analysts projections: upper-bound is $29 and the median price target is $25.66. The stock jumped today a bit on news that the stock just got a buy rating: HUYA shares are trading higher after 86 Research upgraded the stock from Hold to Buy and announced a price target of $22 per share. We all know analysts are a bunch of pencil pushing idiots so take that with a grain of salt. Currently the price is $18.5 AH and it hasn't traded this low since July of 2020. The price was north of $35 as recent as a couple months ago. It has been consolidating at the $18 level waiting for news which brings us to the meat and potatoes of this post.

3: Proposed merger and Arbitrage strategy: The two biggest streaming companies in China are HUYA and DOYU. The King Maker aka Tencent is trying to merge these companies as they will dominate and have 80% market share if the merger is successful. Tencent has a major stake in both companies and a huge vested interest strategically as they are a video game company (among other things) and this would have vertical integration characteristics. If the merger goes through each DOYU share will be converted to .75 HUYA shares. The arbitrage strategy here is going long shares on DOYU and people shorting the hell out of HUYA. The amount of short interest on HUYA shows that the market is confident the merger will go through. If it DOESN'T go through then HUYA will no longer be shorted and the stock will sky rocket. If the merger DOES go through then you'll have a stake in the biggest streaming company in the biggest streaming market on planet earth.

4) Headwinds: China used BABA to send a message to monopolistic behavior. This was great news for the HUYA/DOYU merger because the uncertainty surrounding Beijeng's agenda was lifted a bit. Major companies, including Tencent, came out publicly to say they will make concessions where necessary. I expect this will hasten the negotiations between Tencent and Beijeng to get this through. The current time table for this merger to happen is the first half of 2021, which we are well on our way to the 2nd half. It is possible for this to happen in the 2nd half if negotiations stall. The other slight headwind is that DOYU is embroiled in some online gambling concerns but this is completely short run shit that gives me a better discount.

5) Institutional ownership: 52.4% of outstanding shares are owned by institutions. The two biggest players are ARK and Morgan Stanley. Fintel shows Morgan Stanley increasing their HUYA stake by 169% in the most recent filing to 22,095,743 shares (32% of the comany). Ark has the next most with 11,600,993 shares for 13.99%. (Check Fintel Huya Institutional ownership for this info)

6) Short Interest: Check the massive SI on this ticker. (Check shortsight for this info. free to subscribe and get daily updates)

34.4% of the float is shorted and 52.4% of the outstanding shares are owned by institutions. That leaves a fairly small left-over float size to publicly trade.

Mama CWood loves the stock. Massive institutional ownership with Morgan Stanley just making a huge investment. Pending merger. Artificially suppressed aka arbitrage short. I LIKE THE STOCK. I am playing the HUYA side with long calls and shares. It is a win win if the merger does or does not go through.

PART II:

The fact that institutional ownership shows as 121.4% everywhere for HUYA stock made me go down this rabbit-hole. (this is found in many places, google it to confirm)

I really wanted to be lazy and gloss over this fact but not today. If you check out the following link: [https://www.nasdaq.com/market-activity/stocks/huya/institutional-holdings](https://www.nasdaq.com/market-activity/stocks/huya/institutional-holdings)

You  will see the current institution stat is: 100,952,393 Total Shares  Held. This makes sense as the current share float to the public  (including institutions) is around 83.491 million shares. (121.4% of the  float). (I had this picture from shortsight data but can't post pictures on this thread).

34.4% of the float is  shorted which is 28.72 million shares. Let's be conservative here and  assume that 100% of the shorted shares are institutions playing the  arbitrage strategy. Subtracted 28.72 from the public float of 83.491  gives us 54.771 remaining shares. Now the fucking crazy part is that if  you take the overall institutional ownership of 100,952,393 Total Shares  Held minus 28,720,000 you get 72,232,393 shares held as long holds. The  float size is 83,491,000 and if you subtract out 72,232,393 you get  11,258,607 shares remaining. This 4.4 billion dollar market cap has  11.256 million shares out of the 83.491 million shares owned by us  retail gamblers.

Practically the  entire company is owned by inside investors and institutions with an  incredibly small amount left over for us to play with. It is insanely  shorted. The fundamentals are the prettiest thing I've ever seen when it  comes to analyzing stocks.

Now I just need to decide if I sell out of literally everything and put it into HUYA"
2021-04-25 09:24:42,stocks,"Great analysis. Chinese authorities is cracking down hard on anti competitive behavior at the moment. If the combined market share of DOYU and HUYA is 80% after the merger, that may be cause for authorities to block the merger. In that case it would be a play on HUYA only. Which is still not a bad position as you have shared."
2021-04-25 06:15:45,stocks,Why don’t value investors look at growth
2021-04-25 10:27:52,stocks,Do you read? Huya is a growth stock that's found itself in a position of value.
