Timestamp,Subreddit,Post/Comment
2021-05-04 10:12:00,stocks,"Yes. Depending on what happens today, they'll be up 14.5% YTD. More states are going to legalize sports betting and they are well positioned to grab a sizable chunk of this business."
2021-05-04 10:12:45,stocks,yeah i bought some today
2021-05-04 10:39:35,stocks,I'm looking to get in right before football season.. hopefully be in the low 50's
2021-05-04 10:13:10,stocks,Yes but not as much as PLTR
2021-05-04 10:14:07,stocks,this is not a winner's mentality
2021-05-04 10:28:10,stocks,Been tempted to sell (bought in at $103) but have to smack myself. I love this company.
2021-05-04 07:20:37,stocks,What about new technologies? EV + Mining for batteries and chips + semiconductors + clean energy + cyber security + plant-based meat?
2021-05-04 07:30:37,stocks,"I'm very much think there's going to be great gains in the commodities associated with growth / infrastructure. Plays like steel (CLF, MT, etc) and lithium (PLL, LAC)."
2021-05-04 09:00:19,stocks,"This AMD drop has to be among the more obvious ""Buy The Dip"" situations I've seen in some time."
2021-05-04 08:50:21,stocks,"I might buy some AMD, I use their products"
2021-05-04 09:06:56,stocks,74-73$/share looks interesting to me. What entry point are you looking for ?
2021-05-04 10:00:59,stocks,"""SPY is close to its ATH"""
2021-05-04 10:09:38,stocks,"You forgot ""Relax guys, this is what you have to do"" can't wait for fucking village elders posts to calm the crowds"
2021-05-04 08:08:51,stocks,Signs of a healthy speculative economy
2021-05-04 08:15:33,stocks,Lol same I’m glad I’m not alone wishing my whole port had been Eth since Feb
2021-05-04 08:13:05,stocks,Literally me too :/
2021-05-04 08:43:22,stocks,Wait. Ground is shifting beneath us. Give it a second to find solid footing.
2021-05-04 08:31:36,stocks, Money is rotating into commodities. Personally I like steel for a bunch of reasons. In particular I like CLF and MT.
2021-05-04 10:06:09,stocks,Sometimes the correct move is to not buy anything. Wait.
2021-05-04 09:07:24,stocks,Roth duh
2021-05-04 09:49:10,stocks,Nothing I'm following is. But all digital currencies are going up
2021-05-04 09:59:59,stocks,PSLV
2021-05-04 09:58:08,stocks,"You only get taxed at the higher rate on the income above the threshold. So if you're right on the cusp, it won't really make a difference."
2021-05-04 09:56:40,stocks,"You can only deduct $3k from income. You can rollover the rest for future years. 

And that 12 to 22% is only on marginal income, not on your total. So not sure you will save anything."
2021-05-04 09:44:37,stocks,Amazon apple and Microsoft
2021-05-04 09:44:28,stocks,"Amazon is out, most likely to be hit with regulation IMO."
2021-05-04 10:06:04,stocks,"Apple Microsoft   


Apple is a bit more interesting currently in terms of buy in prices. However, you have to take into account the chip shortage. They are pushing there services more and more in the last few years, so i think they can be resilient even if the shortage continues for the next 2-3 years."
2021-05-04 09:51:25,stocks,"yep. I got 15 CZR to sell next week but not in thia dip.

sold 13 yesturday for 97.5"
2021-05-04 10:17:53,stocks,I bought CRSR at the top at $44 and it honestly hurts...
2021-05-04 10:25:37,stocks,"> but who knows where the floor even is? Same with VIAC and NVIDIA. Insane “deals”, but who knows when this stops…..

buy some and avg down"
2021-05-04 10:28:50,stocks,Yes.
2021-05-04 10:21:03,stocks,Agree with you
2021-05-04 06:35:45,stocks,"Ugh who would have expected Doge to be a hedge

Good for you"
2021-05-04 06:38:48,stocks,"High energy people are dragging the market down. Wait until people start caring about inflation interest and bond yields and just start investing in individual companies.

Once people only worry about individual stocks and stop thinking about the market as a whole the correction might end"
2021-05-04 06:47:43,stocks,"Only the speculative small caps never recovered, my small cap value ETF is at all time highs."
2021-05-04 09:43:16,stocks,Look at the bright side. You coulda started in Early February when everything was at ATH and got slaughtered.
2021-05-04 09:46:33,stocks,Aye same
2021-05-04 10:17:08,stocks,"My guess is you are 30 or younger. Your time horison is more than 20 years. Take a look back at any point in past. if you buy and hold for 20 years or more even if you were to have bought before a crash, you would doing very well.

Ex: if you bought in 2007 right before the crash (almost -40% loss in just a year),

sp500 in 2007: 1477  
sp500 in 2008: 1220   
sp500 in 2020: 2600 (+76% since 2007)

Plus you are a probably gonna keep adding to your positions as you get older. So its no problem.

I just wanted to show you this to prove that you are perfectly fine. As long as your time horizon in 15 or more, you have nothing to worry about. When you start getting close to retirement, then you need to think about transitionning into very stable/safe strategies.

The BEST thing you did was starting investing when you did. Don't worry about it :)"
2021-05-04 09:58:41,stocks,"Inflation, markets were hitting all time highs, you name it."
2021-05-04 10:06:54,stocks,I don’t care if it dips more. I’m holding shares and will take the opportunity to buy more
2021-05-04 10:07:46,stocks,No. I hope the bleeding continues so I can add to certain positions and average down.
2021-05-04 10:06:38,stocks,"Yeah, when I bought during painfully red days I ended up in green as the market always bounces back."
2021-05-04 10:07:16,stocks,"I mean sure I hope so just like I hope a pallet full of cash would land on my balcony. 

Doesn't mean I expect it lol"
2021-05-04 10:07:57,stocks,We are due for a 2008 style crash at this point.
2021-05-04 08:56:27,stocks,"People who bought high are scared and are allowed to be.

AMD, AMZN, others have been effectively sideways for months and it's frustrating 

Furthermore, to add insult to injury, indexes are near ATHs and DOGE coin is at ATHs so there's frustration"
2021-05-04 09:28:32,stocks,"a lot of new investors are realizing the true meaning why it's damn near impossible to play individual stocks consistently - because a lot of times stock behavior makes absolutely NO sense in the short term and they appeal to their emotions.

Apple now has a 30% lower P/E than the restaurant company that owns burger king and Popeyes. Which one do you think has better margins? better future potential?

A lot of new retail investors will instead dump apple and buy into these overvalued value plays, missing out on long term growth."
2021-05-04 09:09:48,stocks,It’s frustrating when meme coins like dogecoin is going ham right now for no reason while every stock with fundamentals are dipping every week for months
2021-05-04 09:05:04,stocks,"It's not just one day, it's been like this for months now."
2021-05-04 08:28:59,stocks,"If you're new to investing you shouldn't be using leverage.  Find a new, responsible broker."
2021-05-04 08:33:12,stocks,"It doesn't work that way. You would be buying more shares at the current price.

I strongly advise you not to use leverage at this point in your investing career. Especially not 15 times leverage, that is obscene."
2021-05-04 09:52:24,stocks,I feel like it probably wasn't a good idea to buy yesterday
2021-05-04 09:53:26,stocks,Could easily drop toward the 50MA over the week imo
2021-05-04 10:08:28,stocks,APD gang 👊 easy life long holding
2021-05-04 10:14:07,stocks,Waiting. There’s no rush and this may continue for a bit.
2021-05-04 10:13:57,stocks,CRSR smashed earnings and is down 5%
2021-05-04 09:59:48,stocks,Inflation is a bitch
2021-05-04 09:59:58,stocks,The p/e is never above 35 so until earning catch up with the price it won’t go up. Appl and many others got ahead of themselves last year.
2021-05-04 10:01:28,stocks,Apple isn’t going to “grow” they’re a trillion dollar company.
2021-05-04 10:42:04,stocks,Oils my only green today
2021-05-04 09:53:46,stocks,It was under 130 for like mid February to very recently
2021-05-04 09:58:59,stocks,Wasn’t it 125 before the split? Wow
2021-05-04 10:07:26,stocks,Inflation fears probably.
2021-05-04 10:11:30,stocks,Crypto hype
2021-05-04 10:08:41,stocks,Agreed. I'm not rushing in to buy anything just yet. Feels like we have the strong possibility for another 3-4% down from here.
2021-05-04 10:18:00,stocks,Stocks were way overbought in anticipation of good earnings. Companies that missed earnings got hammered while those that beat still are down a bit.
2021-05-04 08:59:34,stocks,"You said the market was going to have a 5-6% correction a month ago. You said all the technical indicators were there showing the correction had an extremely high likelyhood of happening.  You said you bought a bunch of SPY puts when SPY was 411. Now the SPY is 416-418.

But hey...I'm sure THIS month will be the month the crash happens right!!??"
2021-05-04 10:24:12,stocks,Be careful. Implied Volatility (70%) is *so* high you can get squished even if the underlying moves towards your call. You're mostly paying for a pile of IV.
2021-05-04 10:13:42,stocks,Hedge funds aren't moving their money out of blue chip companies and putting it into a meme cryptocurrency.
2021-05-04 10:36:33,stocks,#cashgang
2021-05-04 10:41:52,stocks,everything.
2021-05-04 10:10:36,stocks,Because you’re young and new and think this is a “crash”
2021-05-04 09:58:28,stocks,"Well first off, this isnt a crash, we are just a couple % off All time high for QQQ and SPY (2-3%). This isn't even a correction territory.  


Second we were at ATH for the SP500 yesterday. So to answer your question, the reason we are seeing red days every month is that we keep hitting ATH every month. This is a pretty healthy thing for the market. Don't despair my friend."
2021-05-04 09:55:07,stocks,SPY is 1% below ATH.
2021-05-04 10:22:10,stocks,I just had to pay all my bills yesterday and have no free cash left :(
2021-05-04 10:10:07,stocks,TQQQ
2021-05-04 09:28:36,stocks,I hope you're wrong
2021-05-04 09:43:31,stocks,What’s the point of these predictions if you do them right before open and can see where futures are headed?
2021-05-04 10:32:47,stocks,Hold it.
2021-05-04 10:23:44,stocks,CCL?
2021-05-04 06:29:52,stocks,"The enormous P/E is coming from the fact that interest rates are super low. Money in a bank account used to grow with higher interest, now it goes to a savings account to die. This ain't your daddy's equities market"
2021-05-04 08:35:52,stocks,"Have my upvote sir.

I don’t care how good a company is, buying something at ATH in this market is asking for trouble IMO."
2021-05-04 06:33:32,stocks,Ok Dad
2021-05-04 09:00:41,stocks,Dude you post about AMZN being terrible every single day.  Its not healthy.  You need to get help.
2021-05-04 08:30:31,stocks,Considering that today looks like a day where the underlying index probably falls 1.5% itself at some point...don’t think today’s the day to talk any ****.
2021-05-04 08:43:49,stocks,AMZN will be fine
2021-05-04 08:44:09,stocks,Never bet against Amazon 😭
2021-05-04 08:29:07,stocks,Can't believe people recommend the company taking over the world. If Amazon isn't a premier stock the market is a joke.
2021-05-04 10:12:24,stocks,"I prefer sector specific ETFs. Stock research is so time consuming that ETF research is just more efficient. 

""Don't look for a needle in a hay stack, buy the haystack"". -John Bogle"
2021-05-04 10:11:54,stocks,"80% of money in a brad market etf imo

play with the other 20%"
2021-05-04 10:13:40,stocks,"For me, either broader index ETFs or individual stocks. Sector ETFs tend to have higher fees and I used to find myself buying them specifically for 1-3 holdings. So I just bought those holdings instead"
2021-05-04 10:39:51,stocks,Too soon.  Wait a month or two this isn't gonna be quick.
2021-05-04 10:40:38,stocks,I've got multiple expirations at this point. Just have to have the right goal with each one. Whether it's just a point or two bounce or getting back up there into the mid 80s I think. I mean everything sucks but at least AMD is the best performing of my semi watchlist today
2021-05-04 07:33:11,stocks,Might be 5 percent again if you hold too long
2021-05-04 07:32:07,stocks,"You should sell like 50% and let it run with some sort of a stop loss. 2100 is a lot of money, you wouldn't want to see that money go back to where it began."
2021-05-04 08:59:54,stocks,"I ditched Baba before and during the March correction. We still don't know the full extent of what the Chinese government intends to do with this company. Sadly, Baba has become a stayaway until we have better guidance for what the future holds there, regulation-wise."
2021-05-04 07:52:53,stocks,"ENPH is one to watch. P/E is high, but their PEG ratio is low, essentially analysts are expecting big growth from them. If you're fine with buying european stocks, VWS is another with solid earnings to its name. They have an OTC stock which you can buy if it gets you lower commissions"
2021-05-04 07:28:10,stocks,Spce
2021-05-04 08:59:29,stocks,I will focus on oversold growth stocks
2021-05-04 09:31:33,stocks,I have ARKK call option which I’m sure is toast
2021-05-04 10:03:42,stocks,Lock in those losses bud
2021-05-04 10:19:39,stocks,"I did this last week and was down around 15%. Really happy I sold, as I'd be even more fucked today. Also dropped my PBW.

A hard lesson learned for sure, but I just don't forsee them recovering anytime soon."
2021-05-04 10:13:37,stocks,"This is the real answer, my cost basis is $99 on this POS"
2021-05-04 10:13:14,stocks,Im glad I got out of that before losing my shirt
2021-05-04 08:43:58,stocks,Shit. Even caught me off gourd. I've enjoyed spending all my money catching falling knives thou.. and when we do have green days.. OH they are GLORIOUS
2021-05-04 08:45:51,stocks,Same. Now if I could just be more productive..lol. I spend the early morning on premarket chat.. launch into work at the bell and causally peek during the day.
2021-05-04 07:50:41,stocks,"CRSR is a small volume stock. I don't think anyone would buy large amount pre-market because it would manipulate the price too much. We'll see what it does when market opens. Holding my 120 shares until it hit 45$ again, however long that takes. Its a profitable growing company, consistently beating earnings, good balance sheet (reduced debt this quarter) - no harm in holding."
2021-05-04 08:28:35,stocks,Hmmmmmm. Good pointers here. I havent seen that confirmed but if its true thanks for the heads up
2021-05-04 07:15:42,stocks,Oh just their trailing 12 month eps went up 5x and quarterly earnings are almost up 5x. Over 2x from before pandemic
2021-05-04 10:02:22,stocks,"No, they're a PC hardware and peripherals company. Keyboards, mice, headsets, and as well internal gaming PC components."
2021-05-04 09:59:53,stocks,"Not mobile gaming at all. They make different pc peripherals, controllers, and have tons of pc parts. Also have streaming gear. Extremely undervalued company"
2021-05-04 10:00:31,stocks,"Not mobile gaming. Corsair sells computer peripherals: mice, keyboards, headphones, RAM, power supplies, etc."
2021-05-04 10:01:35,stocks,"Corsair is in PC gaming hardware, not mobile gaming"
2021-05-04 10:38:20,stocks,Eth?
2021-05-04 10:12:44,stocks,"I'm gonna say no. Not sure if its because they have too much cash at this point or if they just got lucky with their 2020 picks, but it seems clear that they have no clue wtf they're doing. 

Yoloing into COIN at its absurd launch price? Selling good stocks to buy speculative crap when those stocks are in the middle of a correction? Tying ARKX to a separate ARK etf (PRNT)?

Cathie's recent moves have me very skeptical of her actual investment skills. I think she did well during the speculative bubble of 2020 but prior to that her etf returns seemed pretty meh"
2021-05-04 10:09:28,stocks,I honestly don’t even know. The market been so bad since February that anything you invest in won’t see growth
2021-05-04 10:07:59,stocks,\>D
2021-05-04 10:21:13,stocks,Lol
2021-05-04 09:11:49,stocks,"Same here lol, bought 4 calls when it dropped to $79 now it just looks like bears are taking control, amd is actually undervalued and beat earnings.."
2021-05-04 09:45:05,stocks,We are really struggling to get this inflation that everyone talks about non stop since Biden took over. People do realize deflation is a bigger problem and we've been hearing about hyperinflation 10 years now right? We literally need inflation and all that we have is the promise that it's coming.
2021-05-04 09:55:02,stocks,"What I don’t get is if people are worried about inflation, how is cash better?  Why sell?"
2021-05-04 10:06:34,stocks,I sell options today was ok
2021-05-04 10:10:53,stocks,"Yeah, if the Nasdaq is not bouncing, you're going to see ARKK fail where it bounced back in March. While ARKK doesn't have to follow them tit for tit, it'd help if it was doing well.

And to be honest, the Nasdaq is in serious trouble imo. I don't really think it revisits its intraday low from March 5th, but given that tech earnings have been front ran apparently the last few times, it definitely could have more to go."
2021-05-04 10:22:43,stocks,I feel attacked.
2021-05-04 10:06:42,stocks,"Yep.  Def my plan and it's worked wonderfully.  But, it's still bullshit collusion and price manipulation at the top."
2021-05-04 10:09:12,stocks,If you're naïve enough to think that its that easy to move the mega cap price this drastic overnight...then sure!
2021-05-04 10:05:55,stocks,"Respectfully, bullshit.  ""Taking profits"" doesn't move the stock price like that in mage cap.  It takes collusion along with playing the financial media.  John Q Public can take his $500, or $500,000 profit all day long and the price won't move."
2021-05-04 09:18:59,stocks,"Im up 60% atm, was up almost 100% at some point. It’s a constant rollercoaster"
2021-05-04 10:04:44,stocks,I'm down 10% over the past week
2021-05-04 09:58:42,stocks,Already have some JPM. Went ahead and added some BRK-B and MT. And I’m watching SBUX and LOW. Not all Dow stocks and maybe not all “boomer” ones but things I’ve been eyeing to offset my tech
2021-05-04 09:46:38,stocks,Speculative tech lately goes down when the market is down and goes down when the market is up. Not a great time.
2021-05-04 09:47:50,stocks,"Yeah, i feel like my entire portfolio is filled with longish term “bright future” stocks but damn it’s hard when all my money is divided up among them so i can’t sell them off yet and go somewhere new until one finally pops off and make the gains they are predicted on going to"
2021-05-04 10:24:27,stocks,What exactly did you buy? get something like AAPL and you will end up in green
2021-05-04 10:13:14,stocks,Inflation fears maybe ?
2021-05-04 09:44:39,stocks,"Sell in June, see you soon


Sell in July, just go die


Sell in August, eaten by locusts


Sell in September, green you’ll see never

Sell in October, mangled in a snow blower

Sell in November, it’s a life ender

Sell in December, wait to be dismembered"
2021-05-04 08:41:54,stocks,Kinda like how christmas shopping is starting in September now? lol. Enough societal pressure alreadYYY! :-D
2021-05-04 10:07:50,stocks,"Anyone in their 20s or younger (bulk of meme stock investors and crypto buyers) are too young to really remember impact of 2008, and have just seen a massive bull run in the last decade. Similar to me in early 30s remembering but not really experiencing the tech crash from the 90s. 

All this investment winning has led to greed and overconfidence. A LOT of people are putting in money either on margin or that they cant afford to lose. Spend any time in a crypto community and you will here shit like ""10% - 20% returns? enjoy getting rich at 60 lol!"". People are not satisfied right now making 8%, 12%, 15%, etc. it's absurd.

As Buffet says, a lot of people are going to be caught swimming naked when the tide goes out"
2021-05-04 06:03:43,stocks,Out of curiosity what has you worried?
2021-05-04 06:05:17,stocks,"Genuine question - what are you hoping / planning for?

Even after yesterday's close, ETSY is still up roughly 283%, year on year.  If it's undervalued, what do you see as being a fair value?"
2021-05-04 08:55:12,stocks,Mining for REM and Li is not doing good atm either lol.
2021-05-04 10:32:18,stocks,Woof. Hang in there brother and average down where possible.
2021-05-04 10:35:47,stocks,"It's the best time to buy it in nearly a month, but could it be a better time later this week?"
2021-05-04 10:13:03,stocks,Down over 6% today too
2021-05-04 10:14:37,stocks,"Way to plug/pump a completely unrelated stock.

This sub is hilarious."
2021-05-04 10:14:29,stocks,It’s not is it
2021-05-04 10:36:25,stocks,Earnings and outlook should be good.
2021-05-04 10:05:03,stocks,Just wait. Wait until CPI data on the 12th releases. 74/75 is very a reasonable entry point
2021-05-04 08:49:11,stocks,"What your think about REMX, PICK, and COPX"
2021-05-04 10:24:58,stocks,Alright. Angel on the right shoulder wins.
2021-05-04 09:58:13,stocks,Boomer stocks that I want to buy are up or flat. Dumb.
2021-05-04 10:03:11,stocks,Not really.
2021-05-04 09:45:14,stocks,Google has actual monopoly though.
2021-05-04 06:54:18,stocks,"Incorrect. Russell 2k has not recovered, so yes you're specific value small cap etf is the outlier"
2021-05-04 09:45:21,stocks,👀
2021-05-04 10:23:06,stocks,"Thanks for the advice, I’m 20 btw"
2021-05-04 10:19:15,stocks,Didn't that happen last year?
2021-05-04 10:09:20,stocks,o fuck u serious? sell
2021-05-04 09:02:45,stocks,"I just want to know which stocks are pushing the indexes to ATHs, cause mine certainly aren't"
2021-05-04 10:12:51,stocks,"That's the key issue is people who bought in within the last several months haven't seen any returns at all for the most part. At least nothing of note. Every time it looks like it's finally going to break loose, it pulls back. It is very frustrating for many. It is easy to shrug off for the folks that are up 50 - 60% because they got in last year or even further back."
2021-05-04 09:12:14,stocks,I just think that shows how some people have unrealistic expectations and are also impatient.
2021-05-04 09:06:37,stocks,Then why bail now?
2021-05-04 09:09:11,stocks,MSFT was at it's high one week ago and is down less than 5% since. During a general down week.
2021-05-04 09:14:28,stocks,Tech hit all time highs in Jan and Feb. That won’t happen every month
2021-05-04 09:00:15,stocks,"Yeah, that would be utter nonsense if it worked like that. Infinite free money if one of your stocks goes up by a cent."
2021-05-04 10:16:41,stocks,"yep, this has been long overdue and a 1% spy drop is probably not the right time"
2021-05-04 10:04:43,stocks,Pe is sub 30 now.  At todays price its somewhere at 27.
2021-05-04 10:15:13,stocks,Would stocks not inflate as well?
2021-05-04 10:10:07,stocks,Inflation headlines will be with us for months no need to rush in now
2021-05-04 09:25:22,stocks,I was early and I have paid for that.  Now it’s my turn.
2021-05-04 10:34:52,stocks,Ended up just doing it on spy
2021-05-04 10:03:56,stocks,"SPY hits ATH almost every week: ""This is normal""

SPY goes down 1%, red day ""JFC the market is crashing"""
2021-05-04 10:02:59,stocks,Just angry that I thought I buy the dip then this shit happens a week later
2021-05-04 09:57:53,stocks,Sure but pretty much everything else is bleeding like crazy and had not recover since yet since the last one.
2021-05-04 10:13:07,stocks,i’m liking the dip today for a potential buy. isn’t that a short term etf though?
2021-05-04 10:24:41,stocks,This is the way
2021-05-04 09:07:47,stocks,"Jesus Christ you weren't kidding, I could only read a few comments back in their history. That's a terrifying glimpse into someone's mental health."
2021-05-04 09:06:56,stocks,"And I will continue to, because of people like you pumping it up every single day.  People should know this stock sucks."
2021-05-04 10:40:34,stocks,Good advice. Thx
2021-05-04 07:34:55,stocks,Nah doge has too big of a cult following now. If I lose it all I wouldn't be mad anyway this was a gamble originally but it feels less so now. Doge is on a steady climb upwards. 1 dollar is gonna happen sooner then alot of people think. Even at 1 dollar that's only 128 billion market cap. 5 to 10 dollars can and probably will happen
2021-05-04 07:33:00,stocks,Nah I'd be selling too low here. I do plan on selling half eventually though
2021-05-04 08:27:16,stocks,Skipped that one actually. Was semi hard at 24.. but I think it keeps sliding and revenue projections are a little ..... not there. Could pop if youre a 2-5 year hold and maybe an average ALL the way down.
2021-05-04 09:49:21,stocks,When you buy the dip but it dips further....
2021-05-04 10:20:22,stocks,Mines fucking $107. I bought right near the top and haven’t been able to average down much. I wonder if I should just sell and reallocate at this point
2021-05-04 08:05:01,stocks,This stock has a pattern of going slightly above 40 and then selling of to 35 or a little higher every week. I had enough of the pattern and sold at 41 long ago but dont be surprised if you see this go to 40 and then back to 35 just hours later
2021-05-04 08:14:13,stocks,Probably worded my comment a bit wrong. With the earnings being better I expected a bit more than 56 cents up. We saw a nice steady rise leading into the financials being released in February but it felt like it was widely expected to be a blow out. Think I was too optimistic on a pre market knee jerk reaction if there was a good estimates beat this morning. Hopeful for the rest of the day! Sitting at a $37 average. Relatively new to the stock market so maybe looking at historic data and trends over volume and general sentiment.
