Timestamp,Subreddit,Post/Comment
2021-06-07 10:40:34,stocks,Google could not afford to have lunch that day - they took all it's pocket money /s.
2021-06-07 11:38:49,stocks,WON'T SOMEONE THINK OF THE GOOGLE
2021-06-07 09:21:23,stocks,We just call that an expense.
2021-06-07 10:24:07,stocks,"Exactly. It's almost like the gov is saying ""alright, here is a BS fine so people get off your case for a while, and see you again in 4 years when we'll pretend to fine you again to keep activists off the scent"".

This type of news should be a boost to the stock. A confirmation that the gov has no plans to get in Google's way."
2021-06-07 10:40:18,stocks,"Not really since Google only makes ~$500 million revenue per year from France. So $200 million is a significant chunk, it will have Google be reluctant to invest in other markets"
2021-06-07 11:14:33,stocks,Is the payout in full ? Damn 200 million is such a big number.
2021-06-07 13:17:37,stocks,And it seems like every other country in the world is giving them this fine every month for the same bs reason. Just because google makes a lot of money doesn't mean it's okay for france to fine them willy nilly. They're just trying to tax google and leech off their revenue because Europe is so behind in the tech space and can't compete.
2021-06-07 10:24:51,stocks,*thousand dollar bills
2021-06-07 09:06:55,stocks,Does it maybe mean underpayment as in not paying taxes in quarterly installments? You can overpay in some quarters and underpay in others
2021-06-07 11:55:56,stocks,">  $104 is less than 0.1% of the tax that I paid

Sneaking in the little humble brag there at the end, very nice"
2021-06-07 09:08:27,stocks,France fines germany gives
2021-06-07 18:23:05,stocks,"TBF, taxation, subsidies and antitrust fines are three completely different matters. And you should remember that the German competition authority is currently also investigating Amazon (as well as Google and Facebook)."
2021-06-07 17:25:43,stocks,"No, 99% not. These big tech names (Google, Facebook as an example) are so ingrained in our daily lives that society cannot go without them, giving them the power position. I’d even argue that if Google / Facebook would get banned in a developed country, protests would break out lol."
2021-06-07 14:54:09,stocks,"That’s not quite what’s happening. A company is paying through Google’s services to run Display advertising and the algorithm is supposed to identify the best possible placements and SSPs. By prioritising their own placements so they can make more money there is an ethical issue as the client, who has paid Google to run media for them, is being mislead."
2021-06-07 12:53:39,stocks,So... Business as usual for France?
2021-06-07 13:34:29,stocks,It's France. It's all they do.
2021-06-07 10:43:28,stocks,Nah bruh. We just don't dig that ***savage capitalism*** shit.
2021-06-07 08:40:50,stocks,No
2021-06-07 09:27:04,stocks,"It’s always just a slap on the wrist, it’s mostly symbolic so they can pretend like they are actually doing something about it, if slap them with a 10 billion dollar fine, let’s see if they repeat the same thing again then.."
2021-06-07 10:43:40,stocks,Dude France will have no way to collect anymore than this amount on a US company. They will just do business elsewhere. Google ain’t bound by a small country with only ~$500 million revenue. If UK/EU as a whole or US starts fining Google then they will actually be able to collect a large fine
2021-06-07 08:45:59,stocks,No.
2021-06-07 09:28:40,stocks,"Maybe maybe not, could also be seen as a positive bc one less legal issue to deal with moving forward."
2021-06-07 10:43:47,stocks,Only you man only you lol
2021-06-07 15:52:38,stocks,I assume you are talking about the apps that give you a free trial and then charge you when its over. At least you have the option of making apps that dont do that on android. On ios you have to make trials that way or your app wont be published/would be removed
2021-06-07 08:53:30,stocks,Source on that please. [VW was fined one billion EUR in Germany alone.](https://www.dw.com/en/vw-ordered-to-pay-1-billion-fine-for-dieselgate-in-germany/a-44211594)
2021-06-07 12:07:28,stocks,Fines like these are basically a weekly occurance in the EU anymore.
2021-06-07 18:44:33,stocks,Because it's insignificant
2021-06-07 08:05:46,stocks,\*quarter of a billion
2021-06-07 12:02:35,stocks,At this point the EU can basically list fines on American tech companies as part of their GDP.
2021-06-07 08:27:54,stocks,Poor Google.
2021-06-07 13:01:23,stocks,"They'll never recover from this! Quick, subsidize them before it's too late!"
2021-06-07 19:08:04,stocks,"[They “only” had $6B in net income in 1Q.](https://abc.xyz/investor/static/pdf/20210428_alphabet_10Q.pdf?cache=5a1a556)

But they’re sitting on $136B of cash so this is about a quarter of a percent of that."
2021-06-07 10:28:50,stocks,"Reminds me of an Onion headline from a few years back: ""Google disables it's search for two hours as a show of force to make mortals realize their weakness"""
2021-06-07 11:03:05,stocks,SACRE BLU!!
2021-06-07 10:28:02,stocks,American tech companies should do that. It’s crazy how many countries think they’re calling the shots when a big chunk of their population is dependent on their services. Imagine if Google and Gmail was pulled from France for a mere 24 hours because of French policy. That would be a PR nightmare for the French government.
2021-06-07 09:27:36,stocks,Straight out of the discretionary fund!
2021-06-07 09:57:20,stocks,Damn affordable one too
2021-06-07 10:41:17,stocks,A footnote inconvenience.
2021-06-07 09:27:29,stocks,"""Cost of doing business""."
2021-06-07 10:04:17,stocks,"That's what I think it is but the IRS has a lot of power to make those calls but in general they don't have the details on when I make the money.  In general, you should pay tax with the 1040ES as you go.  Realistically I can make $500 in the first 6 months and nothing in the last 6 months and pay the tax in 4 equal payments.  The IRS doesn't know that in the first 6 months, I underpaid and then overpaid the last 6 months (and that shouldn't matter).

I want the IRS to tell me why there was an underpayment penalty when at the end, I ended up paying more than I supposed to.  I just can't get anyone on the line."
2021-06-07 12:18:02,stocks,"It's not about bragging.  Initially, I called because I figure spending an hour waiting on the phone (while doing something else) is totally worth it to save $100.  But on the other side, the percentage is small enough that I won't change anything in my standard of living so it's not worth it in that point of view and the 1 hr waiting got me nowhere initially."
2021-06-07 09:11:07,stocks,">many paid Amazon about the same amount last year instead of collecting taxes

and germans pay\^\^"
2021-06-07 17:31:41,stocks,Agreed.
2021-06-07 15:14:33,stocks,"So the question becomes, was it in the fine prints and is Google allowed to prioritise their own ads if they say so in the fine prints?

Because if they sell 'the best ad placement' without disclaimers and then not give the best ad placement, that's obviously wrong."
2021-06-07 13:21:51,stocks,We all need to learn from France
2021-06-07 11:17:02,stocks,Half of Google’s annual revenue from France seems significant to me.
2021-06-07 13:57:19,stocks,"I mean, the EU fined Google $9B a few years ago - for the same thing, anti competitive practices."
2021-06-07 09:41:36,stocks,"Yeah if your acting on this information now, you might as well do the opposite of what you were planning. Your the last to know; might as well be the first to change direction rather than last in!"
2021-06-07 09:09:54,stocks,"He's talking out of his ass, it's easily verified in a couple minutes of searching that they paid in the tens of billions in fines in the US alone."
2021-06-07 11:09:49,stocks,"Thanks, done. I had a million instead of a billion in mind. Mea culpa."
2021-06-07 18:45:34,stocks,267 million bucks! I dream of a day where I can blow that much and not feel it.
2021-06-07 11:54:52,stocks,Your right thats my bad with the typo. However it still doesnt change the context of the comment
2021-06-07 15:24:52,stocks,US companies have a hard time in the EU. They make billions of euros yet very often no profit so they don't pay taxes. Poor corporations
2021-06-07 10:48:53,stocks,Let's do a fundraising to help Google get over it.
2021-06-07 12:37:38,stocks,NOT !!!!!!
2021-06-07 14:58:47,stocks,They’ll just take even more of your digital footprint and make up the loses.
2021-06-07 13:19:48,stocks,Not today at least.
2021-06-07 12:51:04,stocks,"I tried to find this on their site, was it maybe a tweet? I want to save that link if you can find it please!!"
2021-06-07 10:35:30,stocks,The onion is the only news source I trust. Specially when Brooke Alvares is reporting💀
2021-06-07 12:40:54,stocks,😂 🤣 😅
2021-06-07 10:32:46,stocks,"""hey let's give the megacorps that already wield more influence than most states *even more* power"" yeah great idea that'll totally not end in corporate neofeudalism"
2021-06-07 10:47:35,stocks,Is Google the only tech company in the world? I live in the US and I don’t use any Google products. I think the French would be ok too.
2021-06-07 15:09:22,stocks,"It's France lmao, if Google does this, there will be a gouvernmental-backed copy cat of Google, but subsidised to the extreme (well, Qwant but with more funds) with no business model first, and when it has secured its monopoly thanks to politics, will go private and beat Google in rentability. See the SNCF, see EDF, see Areva, Dassault ..."
2021-06-07 15:34:21,stocks,Call 8335585245 (irs) I just got through in less than five minutes (holy hell right ) couldn’t believe my ears
2021-06-07 13:48:44,stocks,Never let $5 sit on the ground.
2021-06-07 18:31:32,stocks,"Your last statement is correct.
Google’s Display platform (DV360) is supposed to leverage multiple placements and SSPs, including non Google, to get the best placement for your campaigns needs. But if they found the algorithm isn’t fair then that’s dishonest and unethical to both the advertiser and the other SSPs.

Really impressive they actually dug into it, the inner workings of programmatic are complicated and often these things are never looked at by government agencies as they’re not up to scratch on the tech"
2021-06-07 17:08:04,stocks,I agree. It is good to learn from other country's mistakes.
2021-06-07 17:16:14,stocks,Right?! Everyone here is posting google's global revenue/earnings figures but we're just talking about France here.
2021-06-07 09:52:32,stocks,"This, but I would’ve said it more harshly and combative. You’re more kind."
2021-06-07 16:24:57,stocks,Agreed.
2021-06-07 15:58:24,stocks,"I have no sympathy for these corporations, but to me that sounds like there needs to be a fix to the tax system, not a shake down for money every other month."
2021-06-07 12:46:36,stocks,After school bakesale?
2021-06-07 13:30:37,stocks,Go fund me!
2021-06-07 18:42:53,stocks,"Good idea, the go fund me for AOCs grandma did pretty well recently. I bet we could raise 10x that to help save google!"
2021-06-07 12:40:07,stocks,No.
2021-06-07 15:49:34,stocks,"Here you go: https://www.youtube.com/watch?v=ntICHMV-WMA

It's the second story of their weekly roundup."
2021-06-07 10:55:44,stocks,"we’re in r/stocks not r/politics or r/whatithinkcompaniesshoulddo. I think google can make more money and avoid future fines and taxes if they held their ground and leveraged their products to get better positions in foreign countries. Many countries bully American tech companies into complying when they could just as easily fight and win. I am simply speaking about google and how a certain decision could benefit its stock. 

Also in a side note, I don’t really dislike the idea of living in a “corporate neofeudalism” if that means I’m free of government overreach and can live to be own devices."
2021-06-07 10:49:07,stocks,What browser do you use to browse the web? Which search engine? Which email client? YouTube? Also many French content creators and companies depend on Adsense for their careers.
2021-06-07 16:16:57,stocks,"The number on my notice is 800-829-8374.  Eventually, I was asked to enter my 6 digit caller ID (notice ID) on the letter.  After doing that, I have an option to ""question about the amount you owed"".  Picking that option gets me ""we are sorry, due to the high call volume, we can't serve you right now, please call again in the next business day"".  Either that or the long wait time and getting that same msg."
2021-06-07 14:46:17,stocks,Well if you lose $300 worth of your time to get back $5 on the ground then I'd say it wasn't worth it.
2021-06-07 16:35:41,stocks,"This is not a tax issue, they abused their position. A tax reform should be coming as well, but it's important to understand it's unrelated."
2021-06-07 17:56:16,stocks,[deleted]
2021-06-07 14:10:54,stocks,Car wash with IT
2021-06-07 19:24:17,stocks,you can sell them their tracking cookies
2021-06-07 16:43:32,stocks,Google is about as far from “Poor” as one can get ......
2021-06-07 11:03:35,stocks,You think people are going to respond positively to Google refusing to follow French laws? I'm sure the French people will be rallying around using Google then! State of this sub sometimes.
2021-06-07 11:05:56,stocks,"Sorry, but with the amount of influence corporations - especially massive multinationals like Google - wield over society, you can't pretend they're not political actors. Economics and politics aren't separate on any level, but the link between the two is at its most blatant with these behemoths.

And yeah, replacing a government that's at least nominally democratic with a bunch of corporate executives is ***definitely*** gonna improve the amount of freedom in your life lmao"
2021-06-07 11:40:28,stocks,"This fine is a joke to Google. They'll pay this one and a new one each year as the simple cost of doing business while maintaining a monopoly in these countries and pulling in FAR FAR more in revenue. At this level, businesses will stick to whatever the most profitable pathway is and won't act on pride and emotions."
2021-06-07 11:36:13,stocks,"LOL yes nothing more beneficial for an undertaking's position than exiting giant markets and letting competitors take it over.

Maybe give a call to Google's business strategy team, they're gonna love this!"
2021-06-07 14:03:21,stocks,">!American tech companies should do that.

>we're in r/stocks not r/politics or r/whatithinkcompaniesshoulddo. I think...

🤔"
2021-06-07 10:57:44,stocks,"YouTube wasn’t originally a Google product, it was just purchased by them but ok I get your point. But to answer your question I use safari or Mozilla and Apple’s email client. And there’s plenty of others out there like Bing, Edge, yahoo, Duck Duck Go. IE is also still around I believe. So yeah I think we would all survive"
2021-06-07 15:01:29,stocks,But if it had 3 $100 bills glued to the back it would be.
2021-06-07 19:04:25,stocks,It kind of is a tax issue though. France can’t/won’t tax them so they fine them instead.
2021-06-07 17:18:19,stocks,"That's literally what I said. I think you responded to the wrong guy. I never made the connection to taxes, it was the guy I was responding to that brought them up."
2021-06-07 18:06:16,stocks,"Yeah, the sarcasm was obvious. Hence why I said if they're shaking down companies to compensate for lost taxes, they should fix the root of the problem."
2021-06-07 19:49:51,stocks,"My ""no"" wasn't disagreeing with the sentiment, it was in regards to the cringe that I felt at you saying ""NOT!!!"" in response to the other guy."
2021-06-07 11:00:19,stocks,"Yes, we can survive. I use Safari and Firefox, and DDG and iCloud email. However, my point is many cannot. There are people whose livelihoods depend on google through Adsense revenue and companies that use google as their entire marketing department. In addition to many companies and people that depend on google tools for their business."
2021-06-07 11:04:14,stocks,"This guy uses BING!  

Oh wait, he just says you COULD use Bing! hahah"
2021-06-07 15:26:31,stocks,Never let $305 sit on the ground.
2021-06-07 15:31:58,stocks,Not sure if it would still be legal tender at that point.
2021-06-07 11:15:21,stocks,But how would Google benefit from flexing on France? Let’s remember that it is the European Union and I doubt that They would allow Google to pull their services as a show of force. By disrupting French businesses they would also disrupt businesses in other countries. Yes they could do it but the EU would make them pay heavily.
2021-06-07 19:35:13,stocks,How about a tree fiddy?
2021-06-07 00:00:00,stocks,"Q: CHPT announced redemption of all it's public warrants. How will this affect the share price? My question is: How will this event affect the share price, when company redeems all of it's public warrants?  
*""On June 4, 2021, ChargePoint Holdings, Inc. (the ?Company?) mailed a Notice of Redemption in respect of the redemption of all of its outstanding public warrants to purchase one share of the Company?s common stock that were issued under the Warrant Agreement, dated as of July 25, 2019 (the ?Warrant Agreement?), by and between Switchback Energy Acquisition Corporation (?Switchback?) and Continental Stock Transfer & Trust Company, as warrant agent, as part of the units sold in Switchback?s initial public offering, and that remain outstanding following 5:00 p.m. New York City time on July 6, 2021 for a redemption price of $0.01 per warrant. ""*"
2021-06-07 06:34:06,stocks,Lots of people make money by shorting CHPT back to 20$. When the news are dry and market conditions are uncertain this tends to have severe corrections
2021-06-07 08:29:14,stocks,Redeeming warrants sounds a lot like share buy back.. They dont want their stock to get diluted or for people to get it on the cheap when they grow over years. If they're redeeming ( EVEN AT A LOW PRICE) that means they have the money.. I think its good news. In any event.. If CHPT craters.. I'll average down. Ive seen their stations in several national and state parks.. I'm not sure how bullish you can be other than federal and state governments buying your product.
2021-06-07 08:05:25,stocks,It may tank
2021-06-07 06:46:47,stocks,Sever correction to which way?
2021-06-07 08:31:12,stocks,!remindme 1 week.
2021-06-07 08:32:01,stocks,"I will be messaging you in 7 days on [**2021-06-14 12:31:12 UTC**](http://www.wolframalpha.com/input/?i=2021-06-14%2012:31:12%20UTC%20To%20Local%20Time) to remind you of [**this link**](https://www.reddit.com/r/stocks/comments/nu92h7/q_chpt_announced_redemption_of_all_its_public/h0wh7ex/?context=3)

[**1 OTHERS CLICKED THIS LINK**](https://www.reddit.com/message/compose/?to=RemindMeBot&subject=Reminder&message=%5Bhttps%3A%2F%2Fwww.reddit.com%2Fr%2Fstocks%2Fcomments%2Fnu92h7%2Fq_chpt_announced_redemption_of_all_its_public%2Fh0wh7ex%2F%5D%0A%0ARemindMe%21%202021-06-14%2012%3A31%3A12%20UTC) to send a PM to also be reminded and to reduce spam.

^(Parent commenter can ) [^(delete this message to hide from others.)](https://www.reddit.com/message/compose/?to=RemindMeBot&subject=Delete%20Comment&message=Delete%21%20nu92h7)

*****

|[^(Info)](https://www.reddit.com/r/RemindMeBot/comments/e1bko7/remindmebot_info_v21/)|[^(Custom)](https://www.reddit.com/message/compose/?to=RemindMeBot&subject=Reminder&message=%5BLink%20or%20message%20inside%20square%20brackets%5D%0A%0ARemindMe%21%20Time%20period%20here)|[^(Your Reminders)](https://www.reddit.com/message/compose/?to=RemindMeBot&subject=List%20Of%20Reminders&message=MyReminders%21)|[^(Feedback)](https://www.reddit.com/message/compose/?to=Watchful1&subject=RemindMeBot%20Feedback)|
|-|-|-|-|"
2021-06-07 00:00:00,stocks,"r/Stocks Daily Discussion Monday - Jun 07, 2021 These daily discussions run from Monday to Friday including during our themed posts.

Some helpful links:

* [Finviz](https://finviz.com/quote.ashx?t=spy) for charts, fundamentals, and aggregated news on individual stocks
* [Bloomberg market news](https://www.bloomberg.com/markets)
* StreetInsider news:
  * [Market Check](https://www.streetinsider.com/Market+Check) - Possibly why the market is doing what it's doing including sudden spikes/dips
  * [Reuters aggregated](https://www.streetinsider.com/Reuters) - Global news

If you have a basic question, for example ""what is EPS,"" then google ""investopedia EPS"" and click the investopedia article on it; do this for everything until you have a more in depth question or just want to share what you learned.

Please discuss your portfolios in the [Rate My Portfolio sticky.](https://www.reddit.com/r/stocks/search?sort=new&q=Rate+My+Portfolio+-+r%2FStocks+Quarterly+Thread&t=all&restrict_sr=on).

See our past [daily discussions here.](https://www.reddit.com/r/stocks/search?q=author%3Aautomoderator+%22r%2Fstocks+daily+discussion%22&restrict_sr=on&sort=new&t=all)  Also links for:  [Technicals](https://www.reddit.com/r/stocks/search?q=author%3Aautomoderator+title%3Atechnicals&restrict_sr=on&include_over_18=on&sort=new&t=all) Tuesday, [Options Trading](https://www.reddit.com/r/stocks/search?q=author%3Aautomoderator+title%3Aoptions&restrict_sr=on&include_over_18=on&sort=new&t=all) Thursday, and [Fundamentals](https://www.reddit.com/r/stocks/search?q=author%3Aautomoderator+title%3Afundamentals&restrict_sr=on&include_over_18=on&sort=new&t=all) Friday."
2021-06-07 12:43:19,stocks,The meme stock daily thread has gambling addiction and suicide hotline numbers on it while this one doesnt. I see what y'all did there
2021-06-07 10:04:32,stocks,"every meme stock is crushing it this morning, no wonder everything else is down 😩"
2021-06-07 14:11:42,stocks,Do you also have a stock on your watchlist that you wanna buy but it just keeps going up every fucking day?🙄
2021-06-07 16:16:17,stocks,"Can’t believe the gains held. This is the first day my portfolio closed at a profit since February. 

These past few months have been a wild ride."
2021-06-07 11:57:31,stocks,Look BABA I'm not giving up on you ($244 cost basis) but... wat doink
2021-06-07 12:41:41,stocks,Lots of shilling of crap stocks in here today.
2021-06-07 14:07:08,stocks,what's up with CLOV? why is it up 24% today?
2021-06-07 15:33:00,stocks,I'm just happy to be slightly green.
2021-06-07 11:44:12,stocks,"gotta love this casino, a hydrogen stock and an alternative fuels stock both opened flat today but are now 15% up just cos why not? Meanwhile, the major indices decline lol"
2021-06-07 15:35:23,stocks,"Oh wow. My Plug and Castle stocks have been doing really well today.

... I'm scared."
2021-06-07 06:45:12,stocks,"Not sure what I'm doing today, either buying more COST, or looking at BLK & BX. Probably BX to be honest. Would like to get a footing in there."
2021-06-07 08:25:30,stocks,What are people's thoughts on MAXN? Seems like it found a bottom from it's huge slide
2021-06-07 11:28:19,stocks,"Why are all gaming companies like Logitech, turtle beach up like 40-50% YTD and CRSR is down? This is ridiculous. I have like 40k invested in CRSR and I’m down 30%."
2021-06-07 08:12:52,stocks,"I see people buying stock in pre-market, is pre-market available for retail traders?

how are these people buying?"
2021-06-07 08:13:29,stocks,"Yellen could’ve said that a deflationary environment without as much regulation is what she prefers and I don’t know if that’d change the fact that TNX will likely be up at least slightly today and there will probably be some inflation jitters, which isn’t blameable on only one administration.

Sorry."
2021-06-07 10:45:42,stocks,"My portfolio over the last few weeks is really starting to perform like I envisioned. I’ve beaten the indexes almost everyday during that time, and my portfolio has been positive on the days when all of the indexes were red. I’m pretty excited about it."
2021-06-07 11:45:13,stocks,"I love Cloudflare (NET) - it's been going up steadily lately, starting to worry it might be over valued - any thoughts on that? I think long term it's still a good buy though."
2021-06-07 13:02:54,stocks,I'm now in some bizarro world where at least for the past 2 weeks my lil ole growth stocks are green while the indexes are red. So weird but I'll take it.
2021-06-07 16:10:53,stocks,anybody in on CLOV? if so can you tell me more about it?
2021-06-07 07:05:01,stocks,You gotta love it when DAX hits a new ATH and all your stocks are red except Daimler.
2021-06-07 08:58:10,stocks,"I own 2.5 million shares in icon lab ($icon) who have just filed for administration in the UK. What happens with my investment now? It was a high risk gamble with £500 so I'm not bothered about losing the money, I'm just interested in the process."
2021-06-07 10:01:26,stocks,Ugh. The 5% of my portfolio that is microcap stocks are all absolutely mooning. The other 95% is tanking. Of course.
2021-06-07 11:23:07,stocks,Will Netflix go up ever again?
2021-06-07 13:18:11,stocks,Anyone here invested in the Alzheimer stock plays? All spiking on the FDA announcement for first new drug approval in 20 years.
2021-06-07 13:19:25,stocks,"A couple days ago, saw work horse at $10. Saw SI at 40%. Dumped $200 into it. 2 hrs later, it ran up 40%. LMAO"
2021-06-07 13:37:22,stocks,biogen stock..holy smokes
2021-06-07 17:42:03,stocks,EXPI up 8 percent today! Did it just break through the resistance? Target price 60?
2021-06-07 07:05:02,stocks,is anyone here on SoFi?
2021-06-07 07:36:57,stocks,"lets say stock price is 10$, I put sell price at 11$, but the price went from 10$ to 12$, will my order execute and sell at 12$? or it will wait unit it goes down to 11$?

I want to put sell order at X price OR HIGHER,"
