Timestamp,Subreddit,Post/Comment
2021-04-25 12:12:17,stocks,"> Most people on my social media are already posting all about these so I can see it catching on and being popular

yeah, at $100 for 4, it really is a pretty cool little device. when the world finally opens up again, i'll probably pick up a 4 pack to throw in my suitcases for the next time i go to japan so i can find them at bag check easier.

with any luck, there will be a good black friday day and i can get them even cheaper than that."
2021-04-25 17:49:01,stocks,I think it was a silly move by Apple. I doubt 10B. Tile is already screaming anti trust. This won't end well.
2021-04-25 09:20:21,stocks,This says more about how stupid your friends are than anything else.
2021-04-25 00:52:39,stocks,Yes. So where can I get these apple charging bricks. Asking for a friend.
2021-04-25 01:11:27,stocks,😭
2021-04-25 08:12:06,stocks,😭😂
2021-04-25 11:18:11,stocks,"You know whats really fucked up, samsung copied that ""no charging brick"" nonsense for their new phones - so i didnt get the brick and needed a new wire too.

Got my mom a new low end samsung trade in this week and guess what - the low end phone **not only** has the charging brick, it also has a headphone jack!

This whole thing is just a scam to make more money off of the people who can afford the more expensive products.

edited to correct some phone typing errors in bold"
2021-04-25 02:17:20,stocks,It’s also cheaper than a Tile for everyone complaining about that
2021-04-25 08:33:25,stocks,"""It aint about who did it first it about who did it right."""
2021-04-25 15:37:44,stocks,"Tile testified that Apple has rejected some of their features that Apple is now using. I wouldn't say Apple is better, but Apple set rules so that Tile can't win

[https://youtu.be/6RWDFDzvv9Q?t=2507](https://youtu.be/6RWDFDzvv9Q?t=2507)"
2021-04-25 11:19:32,stocks,"As the saying goes, “Good artists create. Great artists steal. “"
2021-04-25 09:40:11,stocks,"
There really aren't enough iphones out there anymore to make this special."
2021-04-25 17:18:54,stocks,The big deal here is the integration with iOS. So when ANY iOS device sees an AirTag the location is updated on the server. So now your AirTags have millions of receivers across the country.
2021-04-25 08:31:59,stocks,Apple has a reputation for taking existing products and making them not suck
2021-04-25 00:37:41,stocks,And I don't know anybody that has used them (tile)in years. I don't think this product is going to be a big deal
2021-04-25 05:56:05,stocks,"but these are better, and integrated into the Apple ecosystem."
2021-04-24 23:58:14,stocks,But Apple fans will buy them even with a 30% Apple premium lol
2021-04-25 00:04:47,stocks,"Yes but Apple Fans will brag about having the Apple logo on it because well I don't want to insult anybody.

There was a guy on CNBC bragging how he was going to buy at least a dozen of the Damned things"
2021-04-25 02:10:19,stocks,"I’m by no means an Apple fanboy but these will be so much better than tiles because these will be using a much bigger network to locate an item. A lost tile will only be found if a phone with tile comes near. An airtag will be found if any (newish ?) iPhone comes near, no tile app needed."
2021-04-25 12:01:46,stocks,Try $1
2021-04-25 09:54:10,stocks,"Well I see these tiles in the dollar store for 4$ Canadian, constantly. 

Apple is selling an apple logo. Everything else is secondary to their customers."
2021-04-25 10:14:16,stocks,"""Revolutionary""
 - OP_Penguin fanboys"
2021-04-25 09:53:00,stocks,">Airpods are great quality 


Lmfao, ok fanboy. Keep telling yourself that."
2021-04-25 12:09:04,stocks,"> Apple blocked FB from tracking user then introduce AirTag, being like:
> 
> No one should invade users' privacy, except us.

they did address this in the unveiling presentation and talked about what they did to protect people's privacy with these."
2021-04-25 09:23:00,stocks,Wtf does that even have to due with market cap
2021-04-25 08:35:56,stocks,These are cheaper and better than Tile so I fail to see what you’re whining about
2021-04-25 10:28:13,stocks,Are you from 1996? What do you think a smartphone does?
2021-04-25 12:07:11,stocks,"> What’s the difference between this and tile

everyone has heard of apple, and they're very good at marketing their products.

i had to google tile after seeing your post because i have literally never heard of them before. brand recognition matters. most people probably don't know tile exists, but everyone is going to know about air tags."
2021-04-25 14:43:55,stocks,Large network makes it easier to find a lost item.
2021-04-25 11:38:27,stocks,"This one is made by Apple, so it’s instantly cooler and all iPhone users will buy them. Good for Apple, bad for  tile"
2021-04-25 19:45:17,stocks,"Yeah, I wonder why they didn’t make these rechargeable"
2021-04-25 14:46:14,stocks,"It's because none of your criticisms are backed up with evidence. It's just your hatred for a company. It's okay bro, your life will be better if you stop being so angry and hateful. I promise."
2021-04-25 11:52:18,stocks,"People are downvoting you because you’re just pathetic. Blocked, by the way."
2021-04-25 14:45:02,stocks,Send me a link to anything with same features as the airtag and is cheaper. You can't.
2021-04-25 17:26:16,stocks,"I believe apple is doing this passively in the background. iOS see an AirTag, uploads the MAC to the cloud with a location. IF you own that MAC then you can see the location history.  

TILE and your phone have been blasting MAC addresses for decades. This is just organized collection.

Still kinda creepy though."
2021-04-25 09:36:32,stocks,"If they own Apple phones, that are newer, and don't care about privacy"
2021-04-25 14:35:26,stocks,This doesn't use any storage.
2021-04-25 15:49:50,stocks,theres actually a company selling a glasses neck strap that has a spot for an airtag at the back of the neck loop.
2021-04-25 07:17:42,stocks,Every Apple device that passes any air tag it will update the air tags location in the background
2021-04-25 03:33:58,stocks,Just retrace your steps and Bluetooth in an open area would easily find it.
2021-04-25 11:25:48,stocks,"Any apple device will pick it up. 

So yknow, %13 of the global market."
2021-04-25 12:52:39,stocks,$95 for a 4 pack at costco
2021-04-25 18:29:04,stocks,I could see some kind of anti-trust being an issue but I guess we’ll have to see. I just think people will buy and opt into this but could be wrong
2021-04-25 09:30:30,stocks,And how many stupid people are out there...... quite a bit so maybe they just buy it. I won’t be so relax champ.
2021-04-25 09:29:05,stocks,"Google Apple MagSafe charger.

It should come with the new iPhones but Apple being Apple...."
2021-04-25 14:25:51,stocks,That’s not a scam. You’re literally getting better and faster technology for money. They are also status symbols. That’s capitalism.
2021-04-25 13:10:55,stocks,"In return, their phone prices have gone down to account for the change."
2021-04-25 09:06:20,stocks,I bought 4 tiles on Amazon for $36 on sale a few months ago so definitely not cheaper. But I do like the apple software much better.
2021-04-25 19:02:54,stocks,Technically more expensive than Tile when you factor in the cost of the little carrying cases that you have to buy to actually attach them to anything. The tags themselves don't have any loops or anything you can use to put them on your keys or bag or whatever.
2021-04-25 11:27:05,stocks,Thats not a saying it's just some bullshit they use to justify their lack of talent. Ive never heard anyone say that seriously.
2021-04-25 14:40:24,stocks,You are such an idiot. Point me to a time when there was more active iPhones in than there are in the world right now. There's 1 billion fyi.
2021-04-25 19:54:13,stocks,sound black mirrorish
2021-04-25 09:18:17,stocks,"Apple hasn't done anything noteworthy since the ipod which is why they're still desperately attaching that brand to new products. 

What's this, the iTile? Or the tilePod? Lmfao"
2021-04-25 09:06:22,stocks,Really REALLY depends on your perspective I guess.  An iPhone is just a shittier more restricted version of a regular cell phone in every way.  Most of their products are just more restrictive versions of already existing products that don't allow consumers to utilize their product fully.
2021-04-25 11:09:54,stocks,That’s what people said about AirPods. And the HomePod. Oh
2021-04-25 09:16:12,stocks,"""Better""

Nope"
2021-04-25 00:34:45,stocks,30% premium? Isn’t this cheaper than tile and has replaceable batteries?
2021-04-25 00:52:39,stocks,What's the comparable product that's 30% cheaper?
2021-04-25 00:36:12,stocks,Yeah tile already had this for years and there are a ton of knockoffs. But the apple brand will sell this like hotcakes.  And the legion of fans will deem this as a revolutionary creation.
2021-04-25 00:00:01,stocks,"Could be, I wonder how fast the race to the bottom will be with other venders as well- to me it interesting and I will likely get it. I don't think it is that huge for them personally"
2021-04-25 00:38:21,stocks,"Exactly, that argument could apply to nearly every product they make. Apple brand loyalty is so powerful."
2021-04-25 01:27:40,stocks,Lying lol
2021-04-25 09:39:33,stocks,"There was a guy on cnbc who owned Apple stock. 

Ftfy"
2021-04-25 05:12:07,stocks,Same never owned an Apple product before but if I ever wanted an item tracker I'd definitely buy the Airtag over a Tile because of the network size.
2021-04-25 05:58:01,stocks,"I believe it's any apple device, including laptops. Anything that has FindMy support."
2021-04-25 05:02:46,stocks,"That would be a security nightmare! And it will also drain my battery way faster.

You are telling me other people can use my IPhone to search for their lost keys?

Surely you can only search in your own network for your lost keys."
2021-04-25 09:22:39,stocks,"So what less than %5 of people have iPhone.

Edit: sorry, 13%

Smartphones running the Android operating system hold an 87 percent share of the global market in 2019 and this is expected to increase over the forthcoming years. The"
2021-04-25 07:24:31,stocks,Fair point!
2021-04-25 19:04:53,stocks,Tile's network is already massive and most people shouldn't have any problem locating their lost items with it.
2021-04-25 14:42:57,stocks,Lmao you are such a liar. There is nothing with similar features for anything less than 20 dollars. Get the hatred out your heart it's not a good look.
2021-04-25 11:36:35,stocks,Introducing - Chick by Penguin
2021-04-25 09:54:15,stocks,That’s funny. I don’t own them. It was an assumption. I said I was thrift ;)
2021-04-25 09:20:01,stocks,That's just untrue
2021-04-25 14:35:11,stocks,"No, all iPhones on the find my network can do this, this includes old ass iPhones. You don't know how the technology works, please stop replying to every comment with your ignorance."
2021-04-25 11:09:18,stocks,Oh no I could actually help someone
2021-04-25 19:18:23,stocks,Why would it? I was commenting on their limiting storage to profit from cloud storage. Not sure why you needed to correct something that wasn’t be referenced by my comment but go for it.
2021-04-25 11:12:51,stocks,Well that sounds like a security nightmare that is the precursor to an orwellian nightmare
2021-04-25 12:11:42,stocks,Privacy much?
2021-04-25 09:15:09,stocks,"How many people will actually turn that feature on though 

How many people even use iPhone anymore?"
2021-04-25 10:32:02,stocks,"So, %13 of smartphone users. 


Not impressed fanboys."
2021-04-25 08:44:22,stocks,Or get AirTags and let technology do the heavy lifting
2021-04-25 12:07:48,stocks,Who pissed in your oats.
2021-04-25 11:33:09,stocks,So other people's devices are being used to locate my stuff. Can't see how that could go wrong
2021-04-25 17:59:36,stocks,$89 for four if your work is a PerksatWork participant
2021-04-25 09:34:19,stocks,[removed]
2021-04-25 09:56:26,stocks,"Apple customers being Apple customers. 

Seriously when I see a customer with an iPhone I charge them AT LEAST %10 extra. Drive an audi or BMW? Thats another %10 overcharge."
2021-04-25 14:32:52,stocks,You are now paying the same and not even getting the charging block or a headphone jack. All while they claim its for the environment but still give that stuff to the lower end phones - so clearly its just to get higher phone tier people to pay more for no real gain.
2021-04-25 11:48:47,stocks,"Depends on the tile, also that’s on sale, not standard price"
2021-04-25 09:55:01,stocks,[deleted]
2021-04-25 19:40:07,stocks,"Good point, I only see myself needing that for keys, everything else, like a backpack I’d put it actually in the bag, but still a good point."
2021-04-25 13:19:18,stocks,"The saying is actually “good artists copy, great artists steal”. And yes, it is a saying."
2021-04-25 12:36:58,stocks,It’s in the tittle 🤦🏻‍♂️
2021-04-25 11:44:35,stocks,"Long time android user here, I also have an iPhone for work and I'm impressed with it. This is just not true, I don't get why people refuse to understand an iPhone's appeal"
2021-04-25 12:24:24,stocks,"Airpods have been a huge success.  

Homepod has not"
2021-04-25 13:58:23,stocks,AirPods are huge lmao way to counter your own point.
2021-04-25 14:38:52,stocks,Why don't you show a better product?
2021-04-25 09:33:42,stocks,Feel free to short Apple.
2021-04-25 03:51:53,stocks,[deleted]
2021-04-25 09:07:10,stocks,"But they need the holder to be attached to anything, which costs extra. But! You don't have to buy apples holder, there are already third party holders."
2021-04-25 11:20:08,stocks,Idk but samsung gave me this exact product for free with my new phone earlier this year
2021-04-25 09:16:30,stocks,Nope
2021-04-25 09:38:27,stocks,"Legion?

Not anymore."
2021-04-25 00:27:34,stocks,I’ve spoken to several people about this product and at least one said they will get them and the other said they will tag their dog after they upgrade their phone
2021-04-25 09:38:56,stocks,Except its been dying pretty quick
2021-04-25 07:51:10,stocks,"Not at all. It connects via Bluetooth if I recall correctly. Information transmitted is only about the Air Tag itself and once the network identifies the location of that air tag - the owner is notified of its last pinged location. 

Passers by’s phones act as an antenna of sorts for the network to pick up a particular air tags last location. You’re not actually sharing anything more than you normally share with apple by using them. And those whose phones may ping an air tag are not holding specific data on owner of the lost air tag unless specified. 

It only has to be pinged as a nearby device in range of a recent iPhone’s Bluetooth. I’m not sure there is any proper transfer of personal data. 

Although you can also configure them to alert a passer by of your lost item and can opt to push a message to their phone to request retrieval and contact from them."
2021-04-25 05:59:18,stocks,"Huh?

All it does is connect to a device and send the location back to you, so even if your keys are in a remote area, if someone with an Apple device walks by, it'll be able to use it's network to get back to you."
2021-04-25 05:13:52,stocks,Nope
2021-04-25 10:18:35,stocks,"There are 113 million iPhone users in the US, with an even greater number of Apple devices.

Do you get bored of commenting apple hate 20 times in one thread? I feel bad for you."
2021-04-25 09:58:05,stocks,Sure you don't. On the internet nobody ever lies. Lmfao
2021-04-25 14:43:15,stocks,Its true.
2021-04-25 11:17:57,stocks,That some1 who finds your lost keys can call you? DA FUQ
2021-04-25 12:37:13,stocks,"On the surface, I agree. But we’re well past that point with phones, smart devices, smart watches, etc. But in actuality, Apple does not use or store the Find My data for Airtags so only the owner knows this information."
2021-04-25 17:14:05,stocks,"The time to think about that was 10 years ago, we are way past that."
2021-04-25 13:02:03,stocks,What privacy?? You hear of the patriot act? We don’t have privacy to begin with
2021-04-25 13:16:07,stocks,Explain how your privacy in invaded.
2021-04-25 09:44:22,stocks,"Off the top of my head, just a billion or so people"
2021-04-25 14:33:54,stocks,"1 billion iPhones are active in the world. Apple broke their revenue numbers last quarter and is expected to sell the most iPhones ever with the 12 series release. Keep being ignorant tho, it's funny."
2021-04-25 11:12:39,stocks,"45% of smartphones are iPhones... 100% of iPhones are sold by 1 company... that company also makes tons of other great selling devices...all devices are interconnected in the Apple ecosystem...every apple device in said eco system will update air tags EVERY-TIME they pass ANY AIRTAG...

I do not understand why ur so but hurt at yet another great product and perfectly fits into what Apple does. Also if u find an air tag it has the owners personal info to return it to them, like dam dude ur fucking stupid man."
2021-04-25 09:43:39,stocks,Thanks apple marketing employees!
2021-04-25 13:33:25,stocks,Not how it works.
2021-04-25 09:34:52,stocks,Have a good day winner :)
2021-04-25 13:13:38,stocks,Bro I see you replying to every single comment on this thread complaining and attacking people for liking Apple. Like why are you so bitter? Are you just having a bad day or is Apple living in your head this much lol
2021-04-25 11:42:58,stocks,[deleted]
2021-04-25 10:12:40,stocks,?? I like the software better on the Find My app than the tile app.
2021-04-25 09:37:37,stocks,Oh gee thanks boss
2021-04-25 03:54:33,stocks,ok? I agree with you but we don’t need to lie lol
2021-04-25 01:12:32,stocks,"Oh shit. Dogs, that’s a good one. Now I’ll probably get one"
2021-04-25 09:17:00,stocks,That says more about how stupid your friends are.
2021-04-25 14:39:50,stocks,Where is your evidence lmao.
2021-04-25 09:21:57,stocks,You’re literally just making things up. All of this is conjecture.
2021-04-25 09:21:02,stocks,If they're willing to give up their privacy
2021-04-25 10:36:38,stocks,[removed]
2021-04-25 09:59:16,stocks,We’re not talking about my dick.
2021-04-25 19:06:30,stocks,"It's not true. The tags don't have any loops or anything to attach them to your items. You have to pay extra for a little carrying case for them, making them more expensive than Tiles."
2021-04-25 11:54:33,stocks,"Your 'lost' keys are a set of 'found' keys for someone else.

Same goes for your wallet.

You really can't imagine people using these things maliciously if they ping their location to every passing iphone?"
2021-04-25 13:55:12,stocks,"Haha, of course they store the data. Otherwise it wouldn't be possible for other devices to update/access it."
2021-04-25 13:58:49,stocks,I think Snowden already did that.
2021-04-25 14:00:21,stocks,900 M per Tim Cook. Not bad for second place.
2021-04-25 10:31:27,stocks,"Smartphones running the Android operating system hold an 87 percent share of the global market in 2019 and this is expected to increase over the forthcoming years.

You're wrong."
2021-04-25 09:45:55,stocks,[removed]
2021-04-25 09:48:15,stocks,Long time Tile user. I've got the Tile that has a replaceable button battery and it works great for finding my keys around the house but I don't see how you can compare that to what the AirTags / 3rd party equivalents claim to do.
2021-04-25 13:45:09,stocks,The other guy said any apple device would pick it up
2021-04-25 14:36:36,stocks,Steve Jobs fucked his wife before he died.
2021-04-25 16:08:19,stocks,Buddy must've tried shorting it and lost a ton of money lol
2021-04-25 13:09:53,stocks,That's why he charges prices that he charges.
2021-04-25 11:50:07,stocks,Not to mention it integrates better than a tile with other apple products
2021-04-25 16:50:35,stocks,"It’s not hard to find content that explains how they will work. I made none of this up. It’s similar to how Australia was using Bluetooth apps to be able to contact tract. 

No personal information exchanged just data relating to Bluetooth devices being “pinged” or discovered at a time they crossed paths."
2021-04-25 10:37:18,stocks,"I don’t like AAPL or their products, but I do feel bad for sad liars."
2021-04-25 10:09:10,stocks,[removed]
2021-04-25 12:05:47,stocks,I’m sure Apple hasn’t thought of any of this. They are know for not thinking products thru
2021-04-25 14:00:51,stocks,"Semantics. From Apple:

“No location data or location history is physically stored inside AirTag. Communication with the Find My network is end-to-end encrypted so that only the owner of a device has access to its location data, and no one, including Apple, knows the identity or location of any device that helped find it.”"
2021-04-25 09:50:02,stocks,Around 113 million people just in the US.
2021-04-25 10:31:31,stocks,"What is your problem mate?

Looking through this whole thread is a dumpster fire if you trying to fight the world.

Maybe chill out and drink some apple juice"
2021-04-25 09:47:28,stocks,200 million sold last year alone but ok
2021-04-25 09:49:48,stocks,"No, you aren't. You're probably an apple employee.  

Because they're %99 identical and work exactly the same."
2021-04-25 13:46:33,stocks,Not how it works. There's instructional and demo videos on youtube you know? It just bounces a signal off other apple devices to update the general location which only the owner can see. You can also mark your own airtag as lost so that if someone else finds it they can call or text you. Other people can't use their phones to track down your lost airtag.
2021-04-25 10:13:39,stocks,How is that creepy? You called me a liar and I made a joke about lying about my dick as if that's the only thing I lie about. That's a joke. Not a come-on or an intrusion. You know how joked work right?
2021-04-25 14:28:44,stocks,">No location data or location history is physically stored inside AirTag.

No shit.

>Communication with the Find My network is end-to-end encrypted so that only the owner of a device has access to its location data, and no one, including Apple, knows the identity or location of any device that helped find it

""They don't store the data"" != ""The data Apple stores is encrypted"""
2021-04-25 09:58:26,stocks,[removed]
2021-04-25 10:33:29,stocks,[removed]
2021-04-25 09:50:33,stocks,[removed]
2021-04-25 09:52:56,stocks,Sounds like you've figured me out.
2021-04-25 13:50:04,stocks,"So it's consistently emiting a signal that other devices can pick up? That's exactly how I assumed it would work

A malicious person could easily use that to go play find-n-seek for valuable items like keys and wallets

And now a central figure is not only tracking your movement with your phone, they could now tracking your actual proximity to other people and devices. One step closer to a orwellian nightmare"
2021-04-25 10:28:08,stocks,[removed]
2021-04-25 14:40:14,stocks,"If it’s not physically stored on an Airtag, and no one has access to the location data or knows what or where it is save the owner, I’m not sure of your Orwellian concerns here."
2021-04-25 10:05:37,stocks,typical ape lol
2021-04-25 10:34:57,stocks,Not sure you’re achieving what you think you are achieving.
2021-04-25 10:39:10,stocks,"As much as I love shitting on apple these days it isn't very justifiable. More than 50% of Americans are IOS users. About 50% of those that use reddit are American. 

Your 13% world stastic kinda means jackshit around here."
2021-04-25 09:53:10,stocks,[removed]
2021-04-25 10:15:39,stocks,And?
2021-04-25 13:52:00,stocks,">So it's consistently emiting a signal that other devices can pick up? That's exactly how I assumed it would work

>A malicious person could easily use that to go play find-n-seek for valuable items like keys and wallets

Did you literally not read my last comment or something? That's not how it works. 

> It just bounces a signal off other apple devices to update the general location *which only the owner can see.*"
2021-04-25 14:32:35,stocks,You don't know how the technology works yet you speak so confidently on it. A malicious person could not use it to play find n seek for valuable items. This is because only the owner of the airtag can see it's location. Other iPhone users dont have a way of knowing where and when their iPhone pinged an airtag. You are actually stupid.
2021-04-25 10:47:56,stocks,This is a learning opportunity for both of us.  Trying to understand you.
2021-04-25 10:53:03,stocks,"Also, my boyfriend wants to know what's a fucktard?"
2021-04-25 14:46:15,stocks,"I don't have Orwellian concerns. Of course no location data is stored on the tag itself, that would be pointless and require more on-device computing than the device is capable of. The tags use a rotating set of public keys and a private key on the ""finding"" device. That private key is subject to the same limitations of E2E encryption of iMessage -- if you use iCloud backup, the *effective* private key becomes your password and Apple does theoretically have the ability to decrypt the data."
2021-04-25 10:08:51,stocks,[removed]
2021-04-25 10:41:23,stocks,[removed]
2021-04-25 10:16:55,stocks,"""Caught in a lie? Resort to childish insults"""
2021-04-25 14:37:12,stocks,"It emits a signal, probably one that would would easily to tell whether it's an airbag or not

Signal would be weaker when your farther away, stronger when your closet. You don't need to sign into Apple's portal and see the location reported there. 

You'd just listen for the signal and play hot and cold until you find one, and guess where people put airtags? On valuable things they don't want to lose. Find an airbag, find a valuable item.... They already do these type of things with all kinds of stuff

You don't know how technology works and you speak so confidently on it"
