Timestamp,Subreddit,Post/Comment
04/01/2021,stocks,"Welcome to r/stocks!

For stock recommendations please see our portfolio sticky, sort by hot, it's the first sticky, or see [past portfolio stickies here.](https://www.reddit.com/r/stocks/search?q=author%3Aautomoderator+%22Rate+My+Portfolio%22+-+r%2FStocks+Quarterly+Thread&restrict_sr=on&include_over_18=on&sort=new&t=all)

For beginner advice, brokerage info, book recommendations, even advanced topics and more, please read our [Wiki here.](https://www.reddit.com/r/stocks/wiki/index)

If you're wondering **why a stock moved** a certain way, check out [Finviz](https://finviz.com/quote.ashx?t=spy) which aggregates the most news for almost every stock, but also see [Reuters](https://www.reuters.com/), and even [Yahoo Finance](https://finance.yahoo.com/).

Also include *some* [due diligence](https://www.investopedia.com/terms/d/duediligence.asp) to this post or it may be removed if it's low effort.

*I am a bot, and this action was performed automatically. Please [contact the moderators of this subreddit](/message/compose/?to=/r/stocks) if you have any questions or concerns.*"
04/01/2021,stocks,"Microsoft, they are probably the next company to jump a lot and after today’s news they will go even higher!"
04/01/2021,stocks,"Apple, Microsoft, Amazon are three companies everyone should have in their account, especially at that age"
04/01/2021,stocks,"I like $PHIL, $SRMX and $HMBL. They are just ones for you to look at not financial advice. Put your money in what fits for you.

Edit: $TGGI for the bonus look

Edit 2: Cole’s Notes

$HMBL : put Facebook market place, YouTube, ticket master, crypto, paypal all in one app is Humbl

$SRMX : working with Microsoft and T-mobile on IOT. Has a 5G chip that is already compatible with 6G. Their products can turn your house into iron mans house.

$PHIL : Building a Dimond exchange comparable to Dubai’s. Industrial packing wrap. Lux fund. Gold mines.

$TGGI : Healthy nano wine from China.

Edit 3:
If it was not obvious this is an over simplification of all the companies, do your own DD, I might of missed or miss interpreted the info."
04/01/2021,stocks,"For a safer long term bet... Alphabet, Amazon.

For possible bigger gain short term and good to hold long... SNOW and Fastly since they are both down 40+% from their 52-week high??

Would welcome opinion/thoughts on those pics. I actually picked up some SNOW and Fastly the other day with that thought. Would like to add to my Alphabet and Amazon position for long term."
04/01/2021,stocks,Save and move out?
04/01/2021,stocks,COIN
04/01/2021,stocks,What was the news today? I saw the 20 billion contract yesterday
04/01/2021,stocks,And Disney.
04/01/2021,stocks,+1 for humbl
04/01/2021,stocks,"I just moved back in actually. Figured i could save 15-20k a year on rent and just put that towards my future! 

I'll move out when i can afford 10 Cybertrucks :-)"
04/01/2021,stocks,Nice good luck.... Disney apple smh etf might be a few decent ones to start a little research on
04/01/2021,stocks,Smooth brain.
04/01/2021,stocks,"Opinions are like assholes, everyone’s got one"
04/01/2021,stocks,[deleted]
04/01/2021,stocks,"lmao, tbh there so many people trying to predict or explain how the market works that it makes me stay off reddit sometimes😂"
04/01/2021,stocks,So are people!
04/01/2021,stocks,So true. I’ve done much better selling to open vs buying to open.
04/01/2021,stocks,"Well since we're all trying to put our hard-earned money somewhere, I think it makes sense to have a general notion of what you're doing and why, no?

As I said, I was just sharing the way I see things.  It's not the right way or the best way or any of that.  Just sharing where I'm at with it and hoping to generate discussion."
04/01/2021,stocks,At this point for me it’s just entertaining.... this guy is new to investing and thinks he’s a genius playing 50 percent stocks 50 percent in a retirement account
04/01/2021,stocks,Yeah I was not saying that toward you personally. Did 1 year in economic and got my college degree in finance. It's always nice to hear what people have to say but the thing is that so many people say different things while there's obviously some factors that aren't evaluated by some and etc that those market explanations always have flaws and can't always be accurate.
04/01/2021,stocks,"I have no idea where you got that I think I'm a genius, given the multiple disclaimers I put in my post.  I just felt like sharing where I'm at with it at the moment."
04/01/2021,stocks,"I agree with you, and I mentioned that in my post, actually!  Like I said, I don't expect this to change the game or anything, lol.  It's just fun for me to share and see what I get back.

Fair enough, I can see that you weren't directing it at me.  You didn't even reply to me directly.  The other guy though said ""he (me) thinks he's a genius"".  Lol.  With those kinda folks around it's hard not to assume that people aren't being twats most of the time.

All the best."
04/01/2021,stocks,"If I invest in Skynet now, do I get to vote against the destruction of the human race?"
04/01/2021,stocks,Maybe buy stock in the company that shot the commercial instead 🤔
04/01/2021,stocks,"Serious opinion, it looks like a camera on wheels.  I'm always questioning if it can be weaponized and then realize the stupidity of that question. Of course it will. Will it be allowed to roam amongst the civilian population.  Of course it will. The science isn't why I'm against it, it's the applications that are a no for me."
04/01/2021,stocks,"Damn it is skynet isn't it Lol

All in on this one.  Maybe instead of extinction I can become a cyborg."
04/01/2021,stocks,"The commercial was shot using the camera from another knightscope vehicle.  They are becoming sentient,  they are creating their own standards of society and beauty. Soon they will divide into jock, cheerleaders and dorks."
04/01/2021,stocks,Another reason for a 50 bmg
04/01/2021,stocks,"True there is an ethical side to all of this, but with cops as bad as they are maybe it's a utilitarian dilemma?"
04/01/2021,stocks,"Yeah, it *would* be cool but then I would have to own one."
04/01/2021,stocks,"I don't see the pope or the dali llama being in charge of these things,  worst case scenario is mall cops with a robot army."
04/01/2021,stocks,"I guess I'm a little skeptical, I used to work in retail and now I work in an Amazon FC and the company succeeded in the fulfillment center logistics by being efficient and they do a good job at it. Contrast that with a store and there's only so much you can do: if you have humans coming in, rooting around, moving stuff around and pawing at things you have to pay another human to put the shit back and reorganize it. It's just hard for that business model to to operate anywhere near the margins that a warehouse does. Then you factor in that the real estate in a storefront, even in a decaying mall, is so much more than the exurbs where they can plop down the FCs and make them 5 stories tall. 

The space in a fulfillment center just doesn't cost much, the inventory that's kept in a pod in the middle of a massive floor that's only accessed by robots and people fixing the robots, and the stuff is stored so much more densely than it could be in a physical retail environment. If the issue is that Amazon has capital tied up in stuff they're not turning over fast enough, why not try to squeeze the suppliers further- so the stuff gets shipped to Amazon's warehouse but Amazon doesn't own it or pay for it until its' sold? They do that with a lot of third-party vendors already. 

If Amazon's looking at it I assume they have a strategy to do it well, but it just seems like they're expanding into a lower-margin business just because."
04/01/2021,stocks,"Interesting. I think the idea of a true pop up store, like no renovations needed just operate which whatever space they can get their hands on without needing to pay for renovations and cosmetic renovations would be a good idea."
04/01/2021,stocks,"Not sure how this becomes successful. Instead of cheap DC space, now it occupies retail space and is only stuff people have said they don’t want online, people have to physically show up to get it, and it needs to be organized better than the random stocking they do in their DC. The only way I see this succeeding is if they basically can guarantee some good stuff at cheap prices and/or a great experience, but both will take much more effort than I think they are expecting"
04/01/2021,stocks,Oh my god! My SHW is down 66%! And why do I have 3 times as many shares?
04/01/2021,stocks,3-to-1 split.
04/01/2021,stocks,It’s called a split man... they split their shares u know like Apple and a lot of other cray big companies have done so everyone stock isn’t 879897 for a share
04/01/2021,stocks,Painting the world in *RED*
04/01/2021,stocks,A simple google search would have saved you time
04/01/2021,stocks," This post is not on the level 😂

I own SHW. The extra shares should be coming soon enough into the trading account.

Duck duck go and maybe some due diligence next time? Lol

🚀🌕"
04/01/2021,stocks,tom hanks
04/01/2021,stocks,I know little with the stock market so if you can buy fractional stocks why do they need to split it?
04/01/2021,stocks,"Why do that, when I can be called a moron by internet strangers"
04/01/2021,stocks,Majority of market is based on whole shares. lol
04/01/2021,stocks,I like your style
04/01/2021,stocks,If your broker is fucking around with April fools joke then its time to get a new broker.
04/01/2021,stocks,It's closed for Good Friday.
04/01/2021,stocks,My portfolio finally went back into the green today so  I get 3 days for the market not to mess that up for me :)
04/01/2021,stocks,It's real
04/01/2021,stocks,Plot twist: This post is an April fools joke.
04/01/2021,stocks,Nobody tell him.
04/01/2021,stocks,Google market holidays
04/01/2021,stocks,"I wish I could award you a banana award. 

&#x200B;

gonna be so boring."
04/01/2021,stocks,"It’s a typo, they meant “It’s closed for good, Friday.” 

Stock market will be closed and no longer operating as of tomorrow. Sucks to see it go but fun while it lasted! Can’t have a stock market crash without a stock market."
04/01/2021,stocks,[deleted]
04/01/2021,stocks,I'm going to enjoy waking up tomorrow without having the anxiety of checking my stocks before work. 😅
04/01/2021,stocks,Closed for a handful of holidays. Quick google search will tell you which.
04/01/2021,stocks,You can buy bonds until noon if you want
04/01/2021,stocks,Yes it’s closed. WTF am I supposed to do between 9:30 and 4? 😂
04/01/2021,stocks,how young are you?
04/01/2021,stocks,Def open. If for some reason you can’t trade might be the hedgies
04/01/2021,stocks, Dumb ass holiday
04/01/2021,stocks,Get up real early to do dd before market open tomorrow
04/01/2021,stocks,Does anyone know if equities futures is open for tomorrow ?
04/01/2021,stocks,https://youtu.be/E-Iveaww5WM?t=137
04/01/2021,stocks,It’s open bro be sure to set ur alarm 7:00 EST sharp they open early on Good Friday
04/01/2021,stocks,This is the way
04/01/2021,stocks,Dam so we gotta wait till Tuesday
04/01/2021,stocks,Thats not true. Market is open on Monday.
04/01/2021,stocks,Nice. Almost forgot what day it is.
04/01/2021,stocks,This shit here is great
04/01/2021,stocks,"Dumb ass-holiday

[xkcd: Hyphen](https://xkcd.com/37/)

---

^^Beep ^^boop, ^^I'm ^^a ^^bot. ^^- ^^[FAQ](https://pastebin.com/raw/vyWra3ns)"
04/01/2021,stocks,[deleted]
04/01/2021,stocks,But it’s real
04/01/2021,stocks,Good shit
04/01/2021,stocks,Good bot
04/01/2021,stocks,Lmao
04/01/2021,stocks,TV/Film insider here -- before investing I would look into the recent WGA agreement and WME's plans to phase out packaging and reduce production ownership before investing. This whole movement towards big growth for these companies was predicated on the fact that they would be able to act as producers (as well as recent expansions into sports as you note) and in my view they have been a bit crippled recently. The agency had a big round of layoffs a few months ago.
04/01/2021,stocks,Who the hell is going to be “excited” for this IPO?
04/01/2021,stocks,Let me know if there are any other features I could add to it such like the local search and the dividend tracker.
04/01/2021,stocks,SPY average gains for April being 1.51%. This March was 3.64% and today alone was 1.18%. This year's should be interesting
04/01/2021,stocks,"While I'm sure WFC (Wells Fargo) investors would love the stock to have a PT of $75, I think you might have meant WDC? :)"
04/01/2021,stocks,Wasn't expecting to buy anything today but snagged 10 shares of PSFE. Interesting stock. I like their involvement in sports betting and anonymous card transactions. Trying to get a reasonable price point with the lockup ending the 18th of may or june
04/01/2021,stocks,Trading options in this market is definitely going to be fickle compared to buy anything and everything territory
04/01/2021,stocks,"Whoops you are totally right, thanks for pointing that out, was a typo"
04/01/2021,stocks,"Welcome to r/stocks!

For beginner advice, brokerage info, book recommendations, even advanced topics and more, please read our [Wiki here.](https://www.reddit.com/r/stocks/wiki/index)

If you're wondering **why a stock moved** a certain way, check out [Finviz](https://finviz.com/quote.ashx?t=spy) which aggregates the most news for almost every stock, but also see [Reuters](https://www.reuters.com/), and even [Yahoo Finance](https://finance.yahoo.com/).

Please direct all simple questions towards the stickied Daily Discussion and Quarterly Rate My Portfolio threads (sort by Hot, they're at the top).

Also include *some* [due diligence](https://www.investopedia.com/terms/d/duediligence.asp) to this post or it may be removed if it's low effort.

*I am a bot, and this action was performed automatically. Please [contact the moderators of this subreddit](/message/compose/?to=/r/stocks) if you have any questions or concerns.*"
04/01/2021,stocks,"They have some challenges due to continued effects from the pandemic. If you don't mind holding for the long term, this could be worth buying on the dips.

Don't expect major progress until 2022 so there's plenty of time to buy low."
04/01/2021,stocks,"They’ve underperformed the market for a decade. Low yield dividend, no real growth potential. I’ve held them before and was unenthused after further research. I would look at AWK or ECL instead for a water play."
04/01/2021,stocks,Thank you!
04/01/2021,stocks,"Would've been a good day if most of today's overall market gains didn't happen in pre-market. 2 days in a row, pre-market prop up based on no volume."
04/01/2021,stocks,Thanks
04/01/2021,stocks,fantastic recap once again
04/01/2021,stocks,"Beam, no contest.

Edit: I own all 3, edit, beam, crspr heaviest in that order."
04/01/2021,stocks,"In order of largest %, I hold BEAM, CRSP, NTLA. CRSP is the furthest ahead, and likely to be the first to true clinical applications. BEAM seems to possibly have the best technology. I recently got into NTLA when they announced they had a base editor as well, and the stock didn’t really move that much so it seemed like a good buy.

I follow a channel on YouTube called Crispr talk where the guy posts regular updates in the field. He is of the opinion that should these therapeutics eventually work, the potential market will be so huge that many companies could succeed."
04/01/2021,stocks,"I have positions in Beam and Crispr. Crispr seem to be the furthest along and have had a lot of successful trials whereas Beam are newer, but have an edge with base editing, although there's a bit of controversy about that atm because NTLA have also just said they have discovered base editing and there's an argument over patents. 

It's really hard to pick a winner in this field and things are going to get murkier from here. I've heard smart people say it's an FDA lottery and it's just pure luck. I've heard smart people say no no no, it's a rising tide lifts all ships situation and all these companies will be winners in the long run. I've heard someone from ARKG basically state it's a combination of these two things and that luck will play a factor, which is why they've got so many small positions in so many companies rather than a few large conviction holdings like they have in other portfolios. Holdings like Teladoc and Exact Sciences could even be seen as stable anchors to protect the fund against the volatility of the smaller genomics holdings.

Who the winner is? Well that's the trillion dollar question (maybe literally). I like Beam, they are maybe the most disruptive right now, but that can change quickly and there's certainly a lot of risk at this early stage."
04/01/2021,stocks,I have ARKG so I don't have to choose in a field I realistically know nothing about.
04/01/2021,stocks,I would buy all 3
04/01/2021,stocks,"Exactly my sentiment. Let me know what you pick, I have some yolo money that i am looking to put into genomics."
04/01/2021,stocks,BEAM
04/01/2021,stocks,Watching this closely.
04/01/2021,stocks,"Of those 3 I would say BEAM. 

EDIT had some management issues iirc and CRSP is the most expensive one. 

Secret tip: CLLS

I am so heavy in CLLS it is ridicolous. Nobody knows them because everybody went out buying the 3 you mentioned, but actually CLLS has most of the gene editing patents. They are scaling their production atm. They basically have an off the shelf cure for cancer. Yeah you read that right. It's a fucking joke that they are trading at 800m. Cherry on top is that they have a 65% stake in CLXT. Which is swinging between 200-400mio market cap. Ark has 20% stake in CLLS btw"
04/01/2021,stocks,I went off the board and chose TWST
04/01/2021,stocks,Bio nano is my genomics play.
04/01/2021,stocks,[deleted]
04/01/2021,stocks,[deleted]
04/01/2021,stocks,That’s a really bold claim. Anything to back it up?
04/01/2021,stocks,"I like TWST, I own a lot"
04/01/2021,stocks,"I won't try to replicate excellent info out there on crspr vs base editing, but the latter promise to be the better tech, and that is beam (and to a new extent, ntla, which I unfortunately only own 50 shares of). Edit is the best value at current prices, crsp the worst, imo. I'd own more beam but thought I was smart when I sold half at $65 (as I entered under 20, and more than tripled in a few months). Oops."
04/01/2021,stocks,Which one exactly?
04/01/2021,stocks,CLLS having cancer cure.
04/01/2021,stocks,"It's called car-t cell therapy and actually known to work for a few years now. The thing is it is basically only used as a last resort at the moment and the therapy doesn't work for every kind of tumor afaik.

I am no medical professionel, but if you are interested in how it works you can google it or watch a few videos. The CEO of CLLS held a TED talk: https://youtu.be/8dnnnYCgbP4"
04/01/2021,stocks,"IP is rock solid, doing loads of stuff in computing (games with frontier developments) moving slowly away from the old tabletop model. 

Only concern would be valuation, not checked out what its trading at recently so can’t comment. Thats a dyodd thing.

Edit: cant comment in the difference but afaik gaw.l is the main stock"
04/01/2021,stocks,"Don't know your answer, but be wary of stocks that end with 'F'... That means foreign and some brokers charge as much as $50 a trade. Make sure of any fee before purchase and you're going to have to pay again when you sell."
04/01/2021,stocks,GAW.L is GW share listed on LSE. GMWKF is ADR on American exchange.
04/01/2021,stocks,"I think they will still be sticking primarily to the tabletop, but their new pushes into media, partnering with fan made animators, partnerships with Marvel to make comics and new video games will bring a lot of new players into the hobby. Speaking to store managers they had higher sales over the quarentine even with stores closed since everyone was locked inside with stimulus to fund their hobbies."
04/01/2021,stocks,Thanks for the heads up. I'll look into the fees from by broker.
04/01/2021,stocks,Float are the shares that are currently available in the market which is different than shares outstanding which are the number of shares that have been issued.  The float can change without issuing completely new shares.  These could be shares that were held by the company that are issued as part of stock options to employees or other shares that were otherwise restricted that are no longer restricted.
04/01/2021,stocks,Thank you. I appreciate your time.
04/01/2021,stocks,"1% per day is insane, that comes out to roughly a 3700% return in a year. The fact that you think that seems ""doable"" means you need to do a ton more research before fully diving in."
04/01/2021,stocks,"As another person stated, 1% daily is outrageous, especially if you’re targeting a 1% profit which you’d have to adjust for your future tax obligation. Better just focus on building long-term and not get too cute in my opinion. Have to look at the effort-return trade off too."
04/01/2021,stocks,"Ok, you already got some flak for the '1% per day' thingy so I'm not going to add to that. 

However; why would you want to swing trade in the first place? You'll just be paying more transaction fees and as I read your post you're only doing it with a few hundred dollars so even if you get a good result percentage wise, your 'hourly wage' would still be shite.

Besides, 'buy and hold' has been proven to be more effective than speculation on what will go up within the next few days."
04/01/2021,stocks,Even .1% every day is high and pretty unsustainable. 1.001^252 = 1.286... ~29% return. Doable but really fucking hard to sustain over 10 years.
04/01/2021,stocks,"Well, yes and no. You are not going for a 3700% return, but 1% a day 252 times ( the number of trading days) just 1%."
04/01/2021,stocks,"check your math there friend. 

Day 1: $100 invested, 1% profit is $1

Day 2, $101 invested, 1% profit is $1.01

Day 3, $102.01 invested, 1% profit is (rounded) $1.02

Day 4, $103.03 invested, 1% profit is (rounded) $1.03

Day 5 $104.06 AND, I am not going to keep this up

five day return alone is: 4%...

Long story short, exactly 1% a day yields an annual return of 1242.4% If you started with $100 and earned 1% over every possible weekday (I didn't bother to deduct holidays) you would have $1242 in profit, and a final investment balance of $1342.

If you are saying you will take $100, make $1, pocket that dollar then only re-invest the $100, then... well you will still make $252, you'd feel silly, and you have a 252% annual return even if you didn't reinvest. 

Clearly you are overlooking the fact that nobody on earth makes an annual return of 252%, let alone 1200%. the flaw is you cannot sustain that every day and you likely never pick a group of stocks that in aggregate after all the up days and down days, lands you at those kinds of returns."
04/01/2021,stocks,"going for 1% per day is still compounding, 1% per day for 252 days is still a 1200% return. It doesn't matter that you're reducing the resolution to only look at individual days, it still comes out to a 1200% yearly return which is ludicrous. Just start with Paper Money for a few months and see how you do."
