Timestamp,Subreddit,Post/Comment
2021-05-22 01:03:19,stocks,"Most of 2020 big gainers are doing very bad. Fastly is down 50%. Arkk etf is down like 35%. Lmnd dropped like 50%. Some semiconductors dropped 10-20%. Tsla, nio, crsr, and pltr dropped. Many ppl who were investing for the longterm in growth stocks saw amazing growth. Then smart money dumped hard after interest rate fears. So many newtimers are bummed out. Spy is close to ath but growth stocks got absolutely hammered"
2021-05-21 22:23:09,stocks,"I've had Tesla for 3+ years and have bought since January. Tesla is notoriously volatile and if you aren't able to handle 30% swings then don't invest. It's really that simple. 

People blame the stocks, market rotations and any short term media induced noise instead of taking a step back and realizing you are investing for the long term and that means patience. 

Practical advice is make sure you actually understand the risk and volatility of your portfolio. Most would fail here because we think we know until things go to shit and then you're freaking out. There's a reason over half of my portfolio is in index funds. Not because I think they'll provide a higher return (yes I know this is debatable) but mainly because I don't want 5% daily swings. 

If you make mistakes, welcome to investing and an otherwise teachable moment. Learn from it and move on."
2021-05-22 14:11:59,stocks,"Step 1. Buy speculative stock
Step 2. Post video on YouTube
Step 3. Let that baby pump
Step 4. Sell
Step 5. Continue to say it's a great investment
Step 6. Explain how it's users fault for being a bag holder and not exiting

Difference with Tesla is it lasted almost a year and when you start getting tips from the taxi man you know to bail."
2021-05-22 19:39:32,stocks,"I agree and it’s very subjective, some people have only experienced the bul market of 2020 ( like me ) but fortunately I’ve had to deal with many things in life so my psychological endurance is able to handle red days. However, as many have only their previous experience to go off, this market environment may be deemed ‘ crazy’."
2021-05-22 08:54:24,stocks,"Yeah, I personally don‘t understand where all the people have the money from to buy all the dips"
2021-05-21 21:23:21,stocks,"Same here. The red days were nice at first to give me an opportunity to increase my positions for cheaper, but I've now used up all of the available cash that I had to buy the dips, so I'm ready to start seeing more green again."
2021-05-22 13:04:47,stocks,Yep. 70% of my port is this right now. And zero capital.
2021-05-22 08:53:09,stocks,"Totally agree. But try seeing the other side: as you call them great companies, you believe in their business model and probably want to hold them for some time. As they stay cheap, you have more time to accumulate and buy more shares. Nothing annoys me more than a company I own beeing overvalued."
2021-05-21 22:10:05,stocks,that’s a symptom of the market being wayyy overblown.
2021-05-21 20:37:22,stocks,"Maybe that’s the trick? Wait for earning reports. If they’re great, wait for the next day to buy when they’ll be cheaper."
2021-05-22 09:17:31,stocks,Why would you choose 5 months and not 6?
2021-05-22 16:47:16,stocks,PLTR is only negative because of stock compensation if that tapers it will start going higher.
2021-05-21 21:25:14,stocks,Yeah AMZN and AAPL are total meme stocks lulz
2021-05-22 16:46:17,stocks,The big meme stock you can't say here without getting stopped by the bot and accused of playing games is up to $180 though
2021-05-22 01:03:23,stocks,"Also just general volatility. We're seeing 1%+ market swings per day often, which isn't all that common in normal times."
2021-05-22 09:25:51,stocks,Right? Just a pretentious ass post from OP.
2021-05-22 00:59:32,stocks,"Being up is a success, if you'd bought a whole-world recently you'd still be a few percent down on the pound despite being flat on the dollar"
2021-05-21 20:37:08,stocks,Most of the major stock indices would like to have a word with you
2021-05-21 20:41:48,stocks,You're objectively wrong for American market.  VTI up a whopping 16% over last 6 months.  The market has been green!
2021-05-21 20:03:10,stocks,Too much negativity bro
2021-05-22 09:27:32,stocks,You must be fun at parties
2021-05-21 21:31:39,stocks,This time is different? Hope that is sarcasm.
2021-05-22 14:41:31,stocks,The thing that never changes is peoples attitudes. An aging brain seems to consistently lead to a failure of imagination. The world certainly changes. And if everybody listened to their parents and grandparents we’d still be living in caves.
2021-05-22 05:12:05,stocks,Were out of eyes to bat.
2021-05-22 11:13:43,stocks,"Margin accounts, I don't trade on margin, I'm not ballsy enough"
2021-05-21 23:56:53,stocks,"I had been transferring money into the brokerage when possible, then biweekly to match when I'm paid, now I've split the auto-transfer in half but set it up to be weekly. Having some money available to buy dips is nice even if it's not a ton and it makes the red days easier. 

Being able to try and take advantage of things like VFC's -9% day today (I bought some at -8%) is nice whether or not a given investment works out as expected."
2021-05-21 20:56:25,stocks,You can do whatever you think works. I just thinks its illogical that a stock gets hammered while the company is performing above all expectations
2021-05-22 10:38:19,stocks,5 months into 2021
2021-05-22 02:10:32,stocks,Imagine thinking people won’t buy iPhones and stupid shit on Amazon even though the economy is opening up. I’d argue more people go and get the new iPhone because they have jobs now.
2021-05-22 05:27:12,stocks,"This is not a bear market. It's barely even a correction. It's so ridiculous that 100%+ growth in 9 months followed by a few percent pullback is considered a bear market. You just made 80%, fuckin enjoy it. 2020 will not happen again for a loong time. Selling for a loss is never ideal, but it's up to you. People are always making money. That's how it works. Moving money can make sense. Dont think that your picks alone represent  macroeconomic trends. You dont need to short to avoid losing, just dont triple down on gme."
2021-05-21 21:26:51,stocks,Cybertruck will sell like hot cakes
2021-05-21 21:33:16,stocks,"Well let's be real, Ford needed to do something to stay competitive, they have been behind in the EV race and needed a win"
2021-05-22 13:05:48,stocks,but fords EV is dead from the start where are they going to get microchips for them they have thousands and thousands of cars and trucks now filling up parking lots and the Kentucky Speedway they cant even deliver to dealerships without their procressors or microchips they need to run. when the new 2022 models come out they will still have their new 2021 models sitting useless in parking lots taking up space. They will have to eat a loss for the devalue of them just to get rid of them to move the 2022 new line of cars and trucks out. Whos going to pay full price for a truck thats a year oldand will loose thousands in value soon as you sign the papers Elon dont have that problem his probem is he cant build the cars fast enough to make delivery on time. He could easily redseign the Mars Rover body on his truck. If im not mistaken he already has a huge order for that ugly ass battery powered box on wheels
2021-05-22 05:15:58,stocks,"Name a period of time in the last 5 years where volatility was less prominent. Normal is an empty word that has no place in market analysis.  If you only try to play the ""normal market""  you are living in a fantasy."
2021-05-22 08:27:31,stocks,"Mainly faangm semis and fintech,  my annual financial contributions also  helped with capital growth"
2021-05-22 04:03:12,stocks,"we’re talking about stocks here, buddy"
2021-05-21 21:43:08,stocks,You figured it out (;
2021-05-22 05:59:41,stocks,me who started investing just before lockdown and has only known volatility: “3%-5% is considered a dip?”
2021-05-22 00:49:59,stocks,it was also illogical that stock prices sky rocketed the past year. maybe it was overvalued even after blowing away expectations?
2021-05-22 13:34:05,stocks,People are no Homo oeconomoecus. Markets are more psychology than they are Hard facts. Maybe people expected even netter news ? There is so much to consider. I know it doesnt makes sense but think about the psychology.
2021-05-22 12:14:08,stocks,Well then Amazon is up..
2021-05-22 08:03:10,stocks,"This can be true and apple can still be way overbought at the same time you know. 

For example look at cisco, great growth company in the 90s and early 20s then the dot com bubble happened in 00. In 21 years they have been included in the NASDAQ, DOW and sp500, enterprises still use them to connect to the internet and they have beaten earnings every year, generates around 11 billion NET income making them a  220 billion company. Cementing them the worlds most valuable internet network company.

But still even after 21 years, those that bought at the top in 00 have yet to see all time highs again. Not saying apple is stagnant I'm saying good companies don't necessarily mean good investments depending when you bought and at what price you brought. Companies can be overvalued despite being great companies because the market is not the economy."
2021-05-21 21:37:25,stocks,"I absolutely agree. Im still not going to buy their stock, and i do own tesla stock. But I have talked to at least 4 people who were disappointed in the moon truck, and are now interested in the f150 lightning."
2021-05-22 09:24:20,stocks,Google “reversion to the mean”. Gonna blow your mind how math works.
2021-05-22 03:38:14,stocks,"Trolling, insults, or harassment, especially in posts requesting advice, is not tolerated. Additionally, wishes bodily harm upon an individual."
2021-05-22 05:16:03,stocks,If only we had a way to measure several stocks at once.
2021-05-22 12:01:34,stocks,The VTI is a collection of every stock in America.
2021-05-21 22:12:01,stocks,I laughed out loud when I read that part but then the boomer part had me wondering.
2021-05-22 03:35:59,stocks,"Trolling, insults, or harassment, especially in posts requesting advice, is not tolerated."
2021-05-22 03:16:42,stocks,Preach
2021-05-22 13:19:28,stocks,"Apples pe is 25, hardly overvalued. They also have 90 billion dollars cash on hand. Strange to see a company with the metrics trade sideways for 6 months, although it’s probably just taking a breather for it’s next run higher."
2021-05-22 05:23:36,stocks,this conversation ends here.
2021-05-22 03:52:58,stocks,"Sorry my bad, thought this was r/wsb"
2021-05-21 20:57:47,stocks,why are you crying?
2021-05-22 00:00:00,stocks,"How to recognize long trends in the market in real time for large cap stocks and ETFs? I bought VOO for 383.5 and AAPL for 126.8. I thought these are dips but they shares went down so much now. I am not going to sell. But i feel scared if they don't go up anymore. And when they do go up, i feel scared about losing my profits i end up selling on marginal profits. It's been a harrowing experience trying to day trade with stocks. I learnt the ichamoku trading strategy but that absolutely went South today when i bought VOO. Just soon as i bought, it just.... Went down. I am not looking to become rich in a week. I am looking to earn like 100 dollars a month while investing 20k.


How to recognize bad days at stock markets like today? And good days like yesterday in real time?"
2021-05-22 00:00:00,stocks,China stocks current crackdowns by Government What’s going on with chinas private tutoring crackdown? Certain stocks like TAL and EDU have been affected by this. Are they going to try to minimize the growth of these booming companies or are they going to be more heavily supervised on what they are teaching? I haven’t been able to find too much about it that would help clarify what exactly is going to happen or might happen.
2021-05-21 21:11:43,stocks,I dunno but my TAL puts expired in June 2020 and this is bullshit.
2021-05-22 08:17:39,stocks,"It's a crackdown on false advertising and the limitation of after school classes. It has nothing to do with the curriculum. 

The ministry of education doesn't want classes after 9pm on school days. One source talked about a ban on classes during the weekends, which would have a detrimental impact on the online K-12 tutoring business model. 

The goal is to put less pressure on children and lessen the financial burden on parents. The government wants to stop the decline of the birth rate and doesn't care about the impact on after school tutoring companies.

Sources:

https://finance.yahoo.com/news/beijing-slaps-fines-tutoring-apps-033128016.html

https://www.reuters.com/business/finance/exclusive-china-planning-new-crackdown-private-tutoring-sector-sources-2021-05-12/

Also for TAL, don't simply dismiss the allegations of accounting fraud."
2021-05-21 21:15:53,stocks,"I sold 12.5 puts on EDU expiring June 18th, and now it’s even lower than that..... at the time I didn’t realize what China had done. Robinhood didn’t post the article to their app. I thought it was just due to inflation fears/bad quarter. Then I did some outside research and find out about the private education crackdown. Hopefully the restrictions doesn’t affect the companies too much."
2021-05-22 00:00:00,stocks,"Has anyone been having issues with Fidelity Trader Pro freezing and crashing at Market open? I have been experiencing issues with Fidelity Trader Pro platform freezing between market open and the first 5min of trading. This has cost me a lot of money. I reported it to Fidelity yesterday which the tech told me to restart the platform within 5min of market open. He said they have been getting a lot of reports of this. We'll same thing happened today and screwed me out of a lot of money. I called Fidelity spoke with a ""Supervisor"" who told me this is the first they are hearing of this and there is no notes in my account so they can't actually prove I called and reported this issue. I told them they need to make my account right which obviously they declined comment. I know it is not my computer which the Supervisor obviously tried to blame"
2021-05-21 23:50:22,stocks,Come back to Robinhood
2021-05-21 20:48:01,stocks,"Yes, it happens to me everyday.  Right as market opens it gets scrambled or something.  I have to restart right at opening to get proper numbers or after 5 to 10 minutes it starts alerting of the news not coming up and it crashes.  Sound familiar?"
2021-05-21 21:15:33,stocks,I use it and can’t say I’ve experienced this.
2021-05-21 23:52:26,stocks,Vlad did dm me saying he missed me...
2021-05-21 20:54:09,stocks,Sounds very similar. Have you called in to report it?
2021-05-21 20:57:42,stocks,"No. I thought it was a weird blip in the system, but for me i started to see it right away and just adjusted to what i have to do to get around it.  Plus i figured the way my stocks look it was just more bad luck on my side. Lol."
2021-05-21 21:20:01,stocks,Haha that's fair but they need to know their servers suck
2021-05-22 00:00:00,stocks,"Universal stock dips I'm somewhat new to trading and have noticed that every so once in a while all the stocks that I would watch would all simultaneously dip by a large amount forcing me to pull out while I can and losing a hefty sum of my days earning and generally just messes with my flow. 

Is there any reason for this and further more is there anyway to detect it before I start losing huge amounts of money?"
2021-05-22 00:00:00,stocks,"Long term holds- should I be using trailing stop limits continuously with a high bar to maximize any return on fluctuations? So for example say I buy an oil and gas which has a nice dividend and it’s in the $15 to $20 range, is it advisable to constantly update a trailing limit of $1.50 so if there’s some fantastic news about oil and it shoots up to $22 and falls again, I automatically get the sale at $20.50?"
2021-05-21 21:44:17,stocks,Trailing stops are best used for short term trading on volatile stocks to ensure earnings. With long term investment you are better off to let it ride through the dip and wait until you hit your target
2021-05-22 00:00:00,stocks,Does anyone have any recommendations for Gold/Silver stocks to get into? Hi all just wondering if anyone has any precious metal stock recommendations to get into? They seem to be getting stronger now and would like to start getting into them. I would like to hear about those that have already grown and those that havent grown that much yet. Thank you
2021-05-21 22:10:24,stocks,"Just google ""largerest gold miner by market cap"" and look at the list."
2021-05-22 17:28:31,stocks,FCX - copper and gold in one company
2021-05-22 00:00:00,stocks,"r/Stocks Discuss Overlooked Stocks Friday - May 21, 2021 It's lunchtime, Wall St time; time to discuss overlooked stocks that no one is talking about:  Overlooked & possibly undervalued stocks.

All the rules of r/Stocks still apply, so please see the sidebar or [click here.](https://www.reddit.com/r/stocks/about/rules)

**But here's the twist** you can't bring up meme stocks that have been hotly discussed in the past several weeks.  Those stocks that everyone has been talking about, you can't bring up here or they'll be autoremoved.  Why?  It's to keep this thread pure & focused.

The current [list of meme stocks can be found here.](https://www.reddit.com/r/stocks/wiki/meme-stocks)  So don't mention these stocks in this post or your comment will be removed.

Need ideas on which stocks to discuss, [try a screener like this one.](https://finviz.com/screener.ashx?v=111&f=cap_largeover,fa_epsqoq_o10,fa_grossmargin_o70,fa_salesqoq_o10&ft=2)

Important links:

* [Previous discussions on overlooked stocks](https://www.reddit.com/r/stocks/search?q=author%3Aautomoderator+title%3Aoverlooked&restrict_sr=on&include_over_18=on&sort=new&t=all)
* [General discussions](https://www.reddit.com/r/stocks/search?q=author%3Aautomoderator+title%3Adiscussion&restrict_sr=on&include_over_18=on&sort=new&t=all)
* [Rate my portfolio threads](https://www.reddit.com/r/stocks/search?q=author%3Aautomoderator+title%3Arate+my+portfolio&restrict_sr=on&sort=new&t=all)
* [Check out our wiki](https://www.reddit.com/r/stocks/wiki/index)

After discussing your stock here, feel free to create a post on r/Stocks with all the information you might have just learned.

Thanks & enjoy!"
2021-05-21 23:12:54,stocks,"If Netflix can compete with Microsoft, good on them.

They desperately need to expand from being a pure play, which has kept me away from them thus far."
2021-05-21 23:23:06,stocks,"Such a tired plot line at this point. ""Big media company wants to try video games"".  


Spoiler: It ends badly every time."
2021-05-22 01:16:43,stocks,"This is outside their scope. 

Stick with what you know."
2021-05-22 05:57:05,stocks,Oh hell no. Considering how they slaughter re-filming of certain movies you can already expect a black Chinese African crippled pansexual slaverobot as new Witcher or what not
2021-05-22 03:31:37,stocks,GameStop is probably better positioned for the video game market.
2021-05-21 22:33:30,stocks,"When the Xbox’s development was announced, much the same was said....

Then, everyone saw the Halo trailers.

The rest, is history. It can happen again, but I’m not convinced of it just yet. Whomever the Exec winds up being would be your clue."
2021-05-22 09:55:13,stocks,">If you compare Netflix to Disney, it's easy to see Netflix doesn't take advantage of IP the way Disney does. Disney has games, merch, theme parks oriented around its characters. Netflix has built all these universes, but they only go as far as a few seasons of streaming.

As far as I understand, Netflix doesn't necessarily own the IP's of those Netflix Originals. afaik Netflix Original typically means they order the production or license existing content to have exclusive distribution rights in a given country; doesn't mean they fully own the IP. Netflix Original can mean multiple things: self-produced/co-produced content (like with Stranger Things still doesn't necessarily mean they own the IP) or licensed original programming that is exclusive to Netflix (though not necessarily worldwide).

It doesn't mean they also acquire the IP under the contract they signed with the production company/creators/IP owners even for co-produced content.

Case in point for some of the most popular shows on Netflix:

* Stranger Things is owned by the Duffer brothers (creators and exec producers of the series)
* Cobra Kai is owned by Sony Pictures
* The Crown is owned by Left Bank Pictures (Sony Pictures Television)
* Lucifer is owned by Warner Bros./DC Entertainment

Same thing for some of the older popular shows like House of Cards, Orange Is the New Black, Narcos. All owned by external production companies.

Netflix biggest advantage over the other streaming services is by far and away their brand."
2021-05-22 08:28:54,stocks,WB games has been a success tho?
2021-05-21 21:17:41,stocks,"Whatever Epic Games was doing is an example of how not to do it, and at the moment looks like they slowed down to halt and already burned through their money while they conquered absolutely nothing.

What you said is a neat point, everyone wants a peace of gaming cake, yet nobody actually offers anything that gamers want. Yet another generic and mediocre title is just not the way, especially if there are better alternatives to play instead. If they ever inovated, put out something groundbreaking, offered something people can get only there and nowhere else, then i would believe.

Honestly they do take a risk with wanting the peace of cake, yet when actually developing anything gaming related they stop making the risks entirely for some reason. Amazons and Googles take on it leaves people scratching their heads and saying ''who the fuck asked for this ?''

On smaller scale even Blizzard and Valve are struggling with chasing trends to have that peace of cake, later to realize it didn't bring insta billions and abbandon their games.

If Netflix originals are any kind of indicators, then i have absolutely no trust in their next adventure."
2021-05-21 21:07:10,stocks,"Who needs stadia ? I think Microsoft made even better version of it, barely anyone cared."
2021-05-21 20:26:16,stocks,"Have you tried the shitty Netflix Minecraft game? Or any of their choose your own adventure?

It's to much like work"
2021-05-21 20:26:46,stocks,GameStop isn't a development studio dumby lol
2021-05-22 05:06:30,stocks,Do they need to be more successful in order to capture service revenue?
2021-05-22 07:28:05,stocks,wow isn't a licensed mmo :p
2021-05-21 22:33:07,stocks,"It gone be not profitable many many years , would be better just partnered with sony and make good quality games , but they can try they got large users numbers free ads they can make it work in long run ."
2021-05-22 14:24:26,stocks,"The bigger thing about Microsoft, Sony steam, and Nintendo as that you use their console for the most part and its automatic or easy to use their games. I’d think Netflix would be targeting people that don’t use/own these consoles."
2021-05-21 23:56:34,stocks,"I got whooshed hard here. Why is this funny? It's not impossible to create a new genre or improve and popularize an old genre. 

Mobas and battle royals are relative new dogs. Sure dotas been around a while but it got popular way later... and with the help of LoL growing. Then there's shit like rocket league where who TF knows what that is but it's super competitive and good/fun."
2021-05-21 21:44:15,stocks,"Netflix only shows their own productions and doesn't act as a content provider? Nope

edit: all the typos"
2021-05-22 08:24:42,stocks,"I think he is pointing out that this isn't a new genre. Bandersnatch was a choose your own adventure game. You used to be able to get them on VHS, and there are probably a couple million on Newgrounds. Bandersnatch was an innovative experience for the typical Netflix viewer because of Netflix' reach."
2021-05-21 21:03:09,stocks,"That is streaming industry though, not video games."
2021-05-21 21:05:07,stocks,"Since you are the first one i ever ever hear mention it, i don't have high hopes.

Unless there is inovation or something groundbreaking, i don't see much hope for another generic title."
2021-05-22 03:20:00,stocks,But it's not really comparable to either steam or epic cause those sites does not provide streaming of games.
2021-05-22 03:16:09,stocks,"Yeah and it gets a lot of revenue thanks to, zonder others, the gaming industry:
- twitch tournaments;
- twitch prime loot; and
- sponsored streams for both the steamer and the platform Twitch.

It's not a gaming platform like Microsoft, Sony or steam, but saying it horribly failed at entering the industry might be short-sighted.
It succeeded immensely in entering the industry through alternative means and who knows: something like a twitch-integrated gaming platform might take off."
2021-05-21 21:27:03,stocks,"Yes, ignorance is bliss."
2021-05-22 10:02:41,stocks,Steam provides streaming of their games with steam link...
2021-05-22 13:01:07,stocks,"Steam link streames from your computer to tv, not from google servers, so not the same thing."
2021-05-22 14:06:10,stocks,Never said they were the same thing. You said steam didn't provide streaming of games which is wrong
2021-05-22 15:55:47,stocks,"Yeah but when i said steam wasnt comparable to stadia its because stadia provides a streaming service that lets you plsy games without a computer with a graphics card, on your tv without owning a console for severla 100 dollars, or on your phone while still playing quality pc games. Yes steam has ""streaming"" but not the variant that offers the convenience and quality of stadia."
2021-05-21 21:47:24,stocks,Algos
