Timestamp,Subreddit,Post/Comment
7/1/2021 0:00,stocks,"Are we due a market correction? We’ve had unprecedented amounts of QE to stimulate the U.S and other economies, inflation is here and likely to continue/grow for some time. The last period where central banks pursued similar policy was after the 08 crash, if you look at the charts from this period the recovery was a bumpy road around a year after the we reached bottom there were fairly significant market corrections in most the U.S markets (Nasdaq, SP500 etc) of around 10% or over, and a similar trend a year after again! We’ve had an unusually long bull run how much longer can this go on? Markets are at an all time high but the economy hasn’t even recovered yet. Long term macro we will of course see growth but at some point before the end of the year there will be a correction, what are your views on this?"
7/1/2021 9:38,stocks,"Anything anyone says on this topic is speculating, if you’re bearish hold more cash if not it’s business as usual."
7/1/2021 10:30,stocks,">but the economy hasn’t even recovered yet

earnings definitely say otherwise. covid was literally the greatest thing to happen for tech companies"
7/1/2021 10:50,stocks,"You can never know for sure until after the fact, just make sure you have enough of an emergency fund for whatever happens next few months, all I know is it's a crazy volatile time"
7/1/2021 9:45,stocks,"CNBC hasn't called it, so no."
7/1/2021 9:37,stocks,After 2008 it took over 2 years to reach pre crash levels however we’re already well above these levels
7/1/2021 10:52,stocks,"Yes.

We're due for an upwards correction."
7/1/2021 9:41,stocks,"You can still try to analyse and make predictions, after the Covid crash you could have easily predicted the markets will bounce back"
7/1/2021 9:47,stocks,Don’t listen to CNBC
7/1/2021 12:30,stocks,Bruh.
7/1/2021 9:58,stocks,There's literally been 5 posts about a crash or bear market this morning. You aren't going to predict what happens.
7/1/2021 9:55,stocks,Literally every crash has came back so thank you for your insight Sherlock Holmes.
7/1/2021 9:53,stocks,"Yes, you can always make predictions but that’s all they’ll be is predictions. No one actually knows what will happen (short term) other than the big guys. This is why I stick with long term goals, the meme of “stocks only go up” is not completely a meme in the long term. (As long as you’re buying solid companies)"
7/1/2021 9:56,stocks,"What are you talking about? Basically No one predicted the recovery and boom we have had. Not even the biggest perma bulls predicted this. 

Now there were plenty of us waiting for the bottom and managed to do well, but that is not the same as easily predicting the fastest recovery in modern history."
7/1/2021 9:48,stocks,I surely do.  They will announce a crash 2 weeks in advance.
7/1/2021 10:52,stocks,The point is about timing entries if there will be a correction soon then it’s smart to wait for it or sell and buy lower
7/1/2021 10:51,stocks,Yes thats why I said long term macro is 100% bullish (I.e 5 years) there has been years where we close lower than the start of the year too
7/1/2021 11:23,stocks,"1. No one knows what will happen period

2. No stock only goes up permanently. Not even the SP500 will go up permanently. All things die eventually."
7/1/2021 10:53,stocks,I said with 100% certainty that we will recover? I’m not talking about predicting the exact speed but when huge established companies and whole economies suddenly lost major chunks of value due to a temporary pandemic you could have easily said that we will recover
7/1/2021 10:56,stocks,Right.. you’ll never buy at the lowest or sell at the highest so as you see opportunities throughout the year you should add. Don’t need to wait for a “crash”. Also you will not be able to time a crash.
7/1/2021 13:52,stocks,"There’s been at least one post daily about this for many months, probably years.  Eventually someone will be right and will feel like a genius, but that’s only because a broken clock is right twice a day."
7/1/2021 11:37,stocks,"Number two is a little off, for the s&p to die the world would need to actually end"
7/1/2021 13:49,stocks,"Kind of a pointless comment. Nothing in life is permanent. But if you live with that over your head, it’s pretty depressing."
7/1/2021 11:48,stocks,Entire markets and of course entire nations collapse all the time. It’s not inconceivable that the stock market could completely collapse. Another possibility that is far more likely than considered is a crash worse than the Great Depression that could take decades or a lifetime to recover from. Such a crash would take common stocks back to being considered a risky fringe investment vehicle like they were during and immediately after the Great Depression. The stock market is not the safe free money people think it is right now.
7/1/2021 12:01,stocks,Did stocks ever come back after the Great Depression or are they all still that low?
7/1/2021 0:00,stocks,"Investing Advice So since.last November.I have started to put my savings into stocks. At first I was playing around with lots of penny stocks and having an even number of wins and losses.

But now I feel I would like to invest my money in some company/ETFs that I can really set and forget and maybe put money into some riskier growth areas.

At the moment I have money in Apple, AMD, Microsoft be it very small positions.

Then I have some money in riskier stocks but ones I believe will be go up over the next few years and these are companies I do believe in. I canrlt name them or my post gets deleted.

I can afford to add a few hundred £ each month but want that money to now go into less speculative stocks.

I've been reading on here and have heard people mention stocks like MU, AMAT and TSM.

ATM all my safe stocks are in tech companies but I would like to diversify and that's why I am looking for advice.

Many Thanks."
7/1/2021 9:14,stocks,PSTH
7/1/2021 11:10,stocks,"I personally like APPL, MSFT, and AMD, although only have stock in AAPL atm since I needed to liquidate MSFT shares for another investment. 

Overtime, you will gain more confidence and ability to identify individual companies, and I prefer them over ETF's since ETF's imo are the epitome of 'diworseification' the idea that too many random companies will result in an average return. 

Trust your instincts, but be careful to slowly scale up your risk tolerance overtime as your confidence slowly scales up. The worst thing to do in stocks is to outsmart yourself."
7/1/2021 9:20,stocks,Diversification of sectors and stocks is the best way for risk management on a high level
7/1/2021 9:15,stocks,May I ask why? I've just read the description in T212. It has me a bit confused
7/1/2021 19:06,stocks,"Im the opposite. Over time, i invest more in ETFs than individual stocks. 



Why? Because i become wiser and learn that people rarely outsmart the market. 


>	too many random companies will result in an average return.



Stock picking usually results in **lower than average returns**. The evidence for this is out there.



>	Trust your instincts, but be careful to slowly scale up your risk tolerance overtime as your confidence slowly scales up



Dont trust instincts/emotions, thats how you lose money. Trust logic and numbers."
7/1/2021 9:23,stocks,Are there any stocks in any specific sectors you'd recommend? So I can go and do my own research on them.
7/1/2021 10:27,stocks,"Lots of embedded value, SPARC warrents are a new concept on the market, no opportunity cost but rights to nav price for a future merger. I beleive in the team running the show, pershing square. If you were to buy now you would be getting on before the record date l (late july early aug), meaning you would receive umg shares (great value and growth), psthr shares ( a smaller spinoff spac that has an extended timeline), sparc warrents ( tradeable rights to a future, potentially 10 bil dollar, acquisition), and additional psthr warrents. There's a comprehensive breakdown on the daily discussion at r/psth.

The most tangible part of this at the moment is UMG. Universal music group is a behemoth in the industry with great potential for more growth. 

I sold a substantial portion of my shares recently after learning the rough timeline sothat I could get into a short term trade. I plan to fully reinvestin psth before the record date, hopefully with added capital."
7/1/2021 19:20,stocks,"If that works for you, then good on you for finding the investment an investment vehicle that suits you. 

I'm not 100% anti-ETF, I just like to bring balance to the discussion and remind people to review individual stocks in ETF's because some ETF's you might want to steer clear of if too many individual companies are no good."
7/1/2021 9:40,stocks,"You could invest in sector ETFs so it gives you exposure. e.g. xlf for financial.    
Ark has some funds doing some sectors e.g. arkf for finance.     
If you want stocks then I'd check here.    
It has stocks in buckets of each sector and sorted by size for the bigger ones.    

https://finviz.com/map.ashx?t=sec_all     
    
Probably some good picks right now are energy, construction, finance, but I don't know personally.    
Energy should be up today as oil demand rising and price going up    
    
Regarding those you mention I'm in MU. It's selling off after earnings as CEO and others can sell openly now so often it creates pressure. but had a nice beat and future forecasts 10% above analyst expectations and I can see going to 90 in the next month personally with new price targets of 110-130 for the year."
7/1/2021 19:24,stocks,"Im not using myself as an example. Im using millions of data as an example. 



The data shows that index funds outperform stock picking most of the time. That isnt about me but rather the entire market. 




Based on this, stock pickers (including professionals) likely to receive returns below the average.





My decisions are based on data, not instinct"
7/1/2021 0:00,stocks,"Leaving town for a couple weeks and won't have internet access. Where to park 35k while I'm gone? (safe or relatively safe plays only) In order to come back to a possible 3-5% gain.  I'm thinking about maybe some big names that are on a bit of a down swing now, or have constant reliable growth...  T,  CCL, X, FB, ASO ... any thoughts?   I would add MSFT  or AAPL but those seem to be on up swings currently."
7/1/2021 9:56,stocks,Cash. It’s only 1 week. Don’t be a tweak lol.
7/1/2021 11:00,stocks,"3-5% (safely) in a couple of weeks while laying on a beach not paying attention. Man, investors have gone full bore complacent."
7/1/2021 8:29,stocks,Cash
7/1/2021 8:38,stocks,Let it sit but make sure you have access to it while you are gone incase of emergency
7/1/2021 9:18,stocks,Are you going to hell?
7/1/2021 8:37,stocks,Verizon?
7/1/2021 13:16,stocks,Cash
7/1/2021 8:28,stocks,$CORN $AMD $T $KO $TESLA dont do too much tsl like 5K others 10
7/1/2021 8:37,stocks,$TELL
7/1/2021 8:38,stocks,VTWAX
7/1/2021 8:44,stocks,li auto calls
7/1/2021 9:20,stocks,$WMT and $WMT
7/1/2021 9:35,stocks,GOOGLE is my cash park
7/1/2021 10:46,stocks,"I've hitched my hopes onto $VRT. Steady gains for the past 3 years (not counting the all-encompassing covid crash). It appears to be a longer play than the few weeks you'll be gone, just food for thought."
7/1/2021 12:02,stocks,"And he mentions ATT as a possible buy. Good luck getting a 3% gain on that boomer dividend stock in the next 2 years, never mind 2 weeks."
7/1/2021 9:28,stocks,Is it $TESLA tsl or perhaps $TSLA
7/1/2021 0:00,stocks,"r/Stocks Daily Thread on Meme Stocks Thursday - Jul 01, 2021 The meme stock scheduled posts will run Mon to Fri and won't be a sticky; you're probably seeing this because automod sent you here or you woke up early Wall St time; good morning!

------

Welcome traders who just can't help them selves discuss the same exact stock that's been discussed 100s of times a day.  I get it, you want to talk about what's popular, what's hot, and that 1.. single.. stock you like.. well here you go!  Some helpful links just for you:

* [Previous meme stock threads](https://www.reddit.com/r/stocks/search?q=author%3Aautomoderator+title%3A%28common+OR+meme%29&restrict_sr=on&include_over_18=on&sort=new&t=all)
* [Previous discussions on overlooked (and possibly undervalued) stocks](https://www.reddit.com/r/stocks/search?q=author%3Aautomoderator+title%3Aoverlooked&restrict_sr=on&include_over_18=on&sort=new&t=all)
* [General discussions](https://www.reddit.com/r/stocks/search?q=author%3Aautomoderator+title%3Adiscussion&restrict_sr=on&include_over_18=on&sort=new&t=all)
* [The **original GME megathread**](https://www.reddit.com/r/stocks/comments/layb68/rstocks_gme_megathread/) with a ton of useful information
* [Use Finviz for aggregated news on your favorite stock](https://finviz.com/quote.ashx?t=gme)

An important message from our mod u/TCGYT [regarding meme stocks.](https://www.reddit.com/r/stocks/wiki/meme-stocks-warning)

Lastly if you need professional help:

* Problem Gambling:  Call/Text: 1-800-522-4700 or [chat online now.](https://WWW.NCPGAMBLING.ORG/CHAT)
* Crisis Hotline (24/7): 1-800-273-TALK (8255) (Veterans, press 1) or Text “HOME” to 741-741"
7/1/2021 10:42,stocks,"Not what I would call a meme stock, but I bought into SCR awhile ago. Since the Canadian single-game betting legislation passed the Canadian Senate and the company was already solid in my view, I am curious as to why the stock is dropping over the past week. It jumped after the news but then was down again. I’m holding for the long haul."
7/1/2021 19:23,stocks,Thoughts on HITI? Down a bit in the past few days after reporting earnings
7/1/2021 0:00,stocks,"Nio Posts Record Monthly-Deliveries In June Chinese electric vehicle maker Nio said on Thursday deliveries more than doubled in June on a year-on-year basis, and climbed back sharply sequentially despite the ongoing global semiconductor chip shortage. 

The Shanghai-headquartered EV maker delivered 8,083 vehicles in June, up about 116% when compared with year-ago numbers, and also reported a 20.4% jump from May, when sales were hurt due to the volatile chip supplies.

This is the highest number of monthly deliveries posted by Nio ever.

https://www.google.com/amp/s/www.cnbc.com/amp/2021/07/01/nio-shakes-off-chip-shortage-with-more-than-8000-deliveries-in-june.html"
7/1/2021 7:51,stocks,Glad I doubled down on them when they dipped a couple months ago. Great long term potential.
7/1/2021 8:43,stocks,NIO is TSLA's only real competition at the moment IMO and they are based in China so they will sell and produce. I have like 20% of my portfolio in them at \~32
7/1/2021 10:12,stocks,"I worry about NIO. They're growing production at roughly the same rate as Tesla, yet they are valued the same as Tesla was little over a year ago despite being about 5 years behind them in terms of production numbers.

I believe they'll be a serious player in the EV space in 5-10 years, but I don't see how they'll grow beyond their current market cap."
7/1/2021 17:28,stocks,"ITT people defensing insane EV valuations because ""tHeY aLsO mAkE BaTtErIeS and shit""

EV pretty much has the same hype as cars had in the early 1900s when they first came out. Few manufacturers are still arround, very few in fact. Car stocks is too competitive and their margins are slim as f.

Established car manufacturers that also make EV now has a good chance of making it. But most of these new companies will not exist in 10 years."
7/1/2021 19:52,stocks,I refuse to put my money into any Chinese company.
7/1/2021 11:22,stocks,"Ah, so that's why it tanked. Market's logic, figures."
7/1/2021 12:09,stocks,It is currently valued at 85billion dollars. What do you expect to see long term?
7/1/2021 13:22,stocks,7k shares @ 8.08. Let’s get this bread.
7/1/2021 19:52,stocks,">NIO is TSLA's only real competition at the moment




I find that hard to believe since its not Nio that stole Teslas thunder in Europe. EU is ahead of the curve but we'll see a similar progression world wide unless Tesla gets back on their A-game...even legacy manufacturers start to outsell them at EVs."
7/1/2021 10:09,stocks,"My biggest worry about NIO is that I haven't seen a reason why they would be able to become more profitable than traditional automakers. They have great potential as a company, but I fail to see how they could ever be worth more than $100B (roughly their current valuation). Tesla has robotaxis that could make them a multi-trillion dollar company and the most profitable company in the world, what does NIO have to grow beyond their current valuation?"
7/1/2021 11:07,stocks,"Xpeng has more potential that NIO as a stock, IMO and better cars."
7/1/2021 14:05,stocks,We are up 12% in 5 days. Today is just some profit taking.
7/1/2021 17:24,stocks,"Up 550% on the year, ""jUsT taNKeD"". Come on dude"
7/1/2021 12:10,stocks,[deleted]
7/1/2021 13:23,stocks,Let us pay our bills kin
7/1/2021 11:36,stocks,"NIOs market cap is 86 billion, they sold 43k cars last year
Honda’s market cap is 55 billion, they sold 4.8 MILLION cars last year.

They’re already priced as if they are one of the biggest auto manufacturers in the world. It’s an interesting company but I just can’t buy it at that valuation"
7/1/2021 10:11,stocks,"As Tesla releases new technologies and pays to have them approved NIO, like many companies in China, will ride the coattail and begin producing them as well. Whether that’s robo taxis or self driving cars. 

They are the Chinese competitor, it’s what Chinese competitors do."
7/1/2021 11:57,stocks,I agree on this
7/1/2021 12:34,stocks,I’ll look into it! Thanks
7/1/2021 14:26,stocks,"Makes sense, especially since the largest automative company in the world right now is at a $300bn market share. 

Based on worldwide car sales."
7/1/2021 13:16,stocks,God speed
7/1/2021 14:20,stocks,Based on what? How will they have higher margins than existing automakers?
7/1/2021 15:41,stocks,"haha Honda makes cars, yes just cars you see on the road. Nio makes ev technology, solar, clean infrastructure which is like cold war in the green revolution. nio is not just a car company, tesla is not just a car company. these are tech companies and you invest in such or sit back and keep questioning why the stock price overperforms so much while stating flawed fundamentals that aren't looking at the companies goal."
7/1/2021 13:25,stocks,then buy Honda and look back in 5 years to see who was right
7/1/2021 17:42,stocks,"I don't think you are comparing the right companies, Honda's cars start at $21k and Nio's cars start at $58k. Tesla sold 550k cars in 2020 and they're priced like they sold the amount of units Honda sold. NIO sold 43k and they're priced like they sold the amount of units Tesla sold. Imo if you're comparing NIO to any company other than Tesla you're comparing apples and oranges, hell NIO even steals Tesla's creative properties, rips their website, etc. Honda doesn't even have a till electric vehicle"
7/1/2021 14:06,stocks,"That's a flawed comparison though. You can't just compare units for units. If NIO were geared up to sell 5 million cars a year by 2030 but at much higher margins than Honda, it would make sense that people had started taking their money out of Honda and into NIO.

That said, that's clearly not the case here. NIO very well may sell 5 million cars a year by 2030, but I've seen nobody explain why they would be able to sell them at higher margins. Therefore, at best it would make sense for NIO to also be valued at 55 billion, minus 10-20 billion for the uncertainty of them having to prove that they can actually sell 5 million cars a year."
7/1/2021 17:58,stocks,"I love how this comment is the one being downvoted.

A lot of hype investors are going to get burned because they were told by social media stock gurus that Nio is the next big thing."
7/1/2021 10:13,stocks,"Well, that's the problem here. You can't copy robotaxis as the software runs on a neural network that you cannot simply extract from the car."
7/1/2021 10:18,stocks,"Then don’t invest in them. Don’t know what to tell you. They are legitimate competition and their shares haven’t even split, whereas companies like Ford that have been around forever have. $60 is going to be nothing in 10 years after the shares have split once or twice and the company is giving the EV market a run for their money since they are some of the first and only legitimate competition. That’s my opinion anyway"
7/1/2021 10:56,stocks,"Shares splitting does nothing. All that matters is market cap, and what percent of that you're buying.

If I had 200 bucks and put 100 in one pile and 100 in another I haven't created any value."
7/1/2021 14:09,stocks,"I'm genuinely trying to understand where the valuation comes from. All I'm getting in response are flawed arguments or people going 'tHeN dOn'T iNvEsT iN tHeM oMg1!"".

I very well would like the bull case for NIO to be true because I DO want to invest in them. Like I said, they seem like a great company long term. Just not at this valuation, unless someone can explain me what I'm missing.

Also, wtf do the stock price and stock splits have to do with anything? They're literally irrelevant for valuations and say nothing about a company. You think they're going from $90B market cap to a few hundred because ""$60 dollars isn't a high stock price?"" If that is your argumentation you really shouldn't be investing."
7/1/2021 12:26,stocks,I agree. But shares splitting is representative of all those things. It’s a quick way to point out how far along Ford is and that each of their $60 shares aren’t equivalent.
7/1/2021 14:12,stocks,"Look man. I'm not a perfect investor. This is how I'm looking at it and I was in at $1500 when shares were $32 and I'm doing really well with it and have high hopes for the future. Sounds like you've done your research and made your decision. So don't invest my man. Don't invest in companies you don't think are worth your time. I've been trading for just 3 years and I don't know everything nor am I claiming to.   


You're obviously getting heated about this and I'm sorry my advice isn't what you were looking for. Don't know what to tell you outside of that."
7/1/2021 14:18,stocks,"I'm the one getting heated? :'D

Again, I DO think NIO is worth my time. I'm just trying to figure out why people think it's worth $90 billion. To make sure there's nothing I'm missing.

So far all you've given back to me is ""I bought low"", ""I think the share price will increase"" and ""the company will do well in the future"". What are the fundamentals why you think this company is worth well over $50B (which is roughly where you bought in at)? 

> I'm doing really well with it and have high hopes for the future.

Hope isn't a strategy, and putting money into a stock based on hope doesn't make you an investor, it makes you a gambler. I just want to know why you think their profit margins and earnings will be high enough to justify a significantly higher valuation than $90B."
7/1/2021 0:00,stocks,"Looking at british petroleum. Confused on its name It's description is confusing me. On RH it states British petroleum for BP. Which is obv. But on tos, ticker BP says BP ADR sponsored. And on market watch it says BP PLC ADR.

They are all the same right? Why is it named differently?"
7/1/2021 5:51,stocks,"They are all the same. Officially the company is called BP plc with headquarters in London. So all shares of $BP are traded as ADR (American Deposit Receipt) on a 1:6 ADR ratio. This means for every 1 share of BP from the NYSE, represents 6 shares of BP on the LSE (London Stock Exchange).

tl:dr BP = BP ADR Sponsored = BP PLC ADR. Actual ticker is BP.:XLON or BPAQF:OTC Pink"
7/1/2021 8:25,stocks,"ADR is an American Depository Receipt, it is a certificate issued by a bank representing a specific # of shares. It allows foreign companies to be traded on US exchanges. It looks like TOS and market watch are transparent in telling you that this is an ADR. Plc (Public limited company) just looks like an adjective that describes the company is publicly traded."
7/1/2021 8:06,stocks,Next do British American Tobacco BTI.
7/1/2021 7:53,stocks,TIL
7/1/2021 12:17,stocks,Thanks internet stranger
7/1/2021 0:00,stocks,"ETF for Kids to Cash in 13 years help Hey guys, I’m looking for help picking an ETF for my twin boys. Here are the relevant facts. 

- Currently age 5, want to cash out when they are 18
- Purpose is to give them cash for use on life stuff, NOT college. They already have 529s and college will be fully funded. 
- I want higher risk than SPY or a fund that merely tracks 
- It’s about $10k to invest. 

Ideas

- ARKK - yes it’s been hammered but the high growth over 13 years HAS to be good right? 

- XLK - very FAANG heavy 

- something like ARKG where 13 years is enough time for genomics to really boom

- Would a consumer cyclicals like XLY grow enough? 

- Maybe iDrive?  


What are y’all’s thoughts? I can do 50/50 too, but I want to keep it simple with own or two max."
7/1/2021 6:18,stocks,"Stick with passive as much as you can **with earnings.** $QQQ is a great choice but this is probably a bad time to lump sum a huge amount in this overvalued market unless you want to cost-average it.

Avoid ARK funds, the majority of its holdings don't make money."
7/1/2021 6:58,stocks,Their is a reason everything is compared to S&P. That being said you can set all kinds of fund accounts on Fidelity or others and select you level of risk for the investment. I would not ever put my money in arkk long term.
7/1/2021 7:15,stocks,VOO
7/1/2021 10:38,stocks,TQQQ & UPRO are great.
