Timestamp,Subreddit,Post/Comment
2021-04-30 19:50:16,stocks,Geez....way to ruin a stock. Please stop talking about my stock picks here. I lose money most of the time they are mentioned.
2021-04-30 19:48:31,stocks,"I was in it and think it’s a great long hold. I compare them with Trane (TT) price. Carrier just broke from United Technology just over a year ago and should eventually become more like Trane. I’ll get back in it after I hit on AMC. Liquidated most all my holdings to go big with AMC. Not a financial advisor, just my opinion.  Good luck on your portfolio."
2021-04-30 19:51:55,stocks,I like it. Good long term play that will become even more vital as the planet warms up
2021-04-30 19:00:09,stocks,I did find one which was When ACE insurance bought out CHUBB a few years ago. CHUBB was trading at $94. And the buyout was $123 per share.
2021-04-30 19:47:56,stocks,And I have Aerojet Rocketdyne right now which is getting bought by Lockheed. I suspect they will just buy us out of the shares as opposed to giving us shares of LHM but I don’t know.
2021-04-30 19:07:13,stocks,"When I got my first free robinhood stock they gave me sprint. Sprint got bought out by t mobile. 

In my case they just put the money in my account. My only experience,  sorry.

https://investor.t-mobile.com/news-and-events/t-mobile-us-press-releases/press-release-details/2020/T-Mobile-Completes-Merger-with-Sprint-to-Create-the-New-T-Mobile/default.aspx

Under the terms of the transaction, Sprint shareholders will receive a fixed exchange ratio of 0.10256 T-Mobile shares for each Sprint share, or the equivalent of approximately 9.75 Sprint shares for each T-Mobile share.Apr 1, 2020"
2021-04-30 19:42:01,stocks,I had Orbital Sciences which became Orbital ATK and I think I recall getting fewer shares worth more. Then it was bought by Northup Gruman....
2021-04-30 19:03:49,stocks,"Many major funds have a higher allocation of tech - some between 20-40% and that’s with a total market diversification. What is your rationale for 10% tech?

Also, what about consumer staples or energy/transportation?"
2021-04-30 18:58:38,stocks,"i'll be honest this is probably the worst ive ever seen.

rebalance so you have 50% DOGE, 50% GME

Obligatory rocket emoji"
2021-04-30 19:29:38,stocks,"You're missing energy/materials that are both doing extremely well right now,  but they move similar to cyclical stocks where you're overweight so I guess it's alright. 

I think the theory is to periodically reballance so when your cyclical stocks run you would sell some and buy the cheap stuff like health care or defensive.   I don't sell much,  I put my paycheck contributions in whatever is light to attempt the same thing."
2021-04-30 19:06:29,stocks,"Tech seems low.  Consumer cyclical seems very high. 

How does it compare to a total market index?


https://investor.vanguard.com/mutual-funds/profile/portfolio/vtsax"
2021-04-30 18:52:26,stocks,"Do you have EV + mining for batteries and chips + semiconductors + clean energy? 
Or stocks related to a more efficient grid + railroad + construction of bridges ?"
2021-04-30 19:05:50,stocks,"This is straight out from yahoo so the terms might be different. But regardless of that, consumer staples are included in consumer defensive and cyclicals. 10% techs include aapl and msft. 22% is mostly google."
2021-04-30 18:59:25,stocks,Lmaoo no thanks. I don’t want to throw away my money AND my life. No thank you.
2021-04-30 18:56:31,stocks,I have EV and clean energy stocks. Not sure about the other ones.
2021-04-30 18:59:02,stocks,"Good!

http://imgur.com/a/6S47cDA"
2021-04-30 18:23:06,stocks,"Interesting portfolio. What individual stock picks did you sell off?

It seems your investments didn't match your risk tolerance. Glad you were able to find something more suitable for you!"
2021-04-30 19:36:29,stocks,"Just buy Ornamental gourd futures, you'll be all set."
2021-04-30 19:45:01,stocks,">Tobacco stocks are good business no matter what is going on

Questionable"
2021-04-30 19:24:27,stocks,Just sell 2024 covered calls and use the money for hookers and blows..not rocket science
2021-04-30 18:07:33,stocks,[deleted]
2021-04-30 18:54:41,stocks,"Do you have EV + mining for batteries and chips + semiconductors + clean energy? 
Or stocks related to a more efficient grid + railroad + construction of bridges ?

The government is spending billions of $$ so it's a huge chance to hop on the bandwagon"
2021-04-30 18:35:55,stocks,"Yeah, actually it's funny, my individual picks were *too* defensive.  I was looking for companies that I figured would do well in all sorts of markets.  The problem was that I think I overestimated the chance of a big pullback, and I underestimated how much better index funds would do compared to my picks.

I sold the following: COST, FDP (Fresh Del Monte), NSRGY (Nestle), more mining stocks (NEM and GOLD), some energy companies with entries into renewables (NEE, EDPFY, IBDRY).  Also sold a ton of lower conviction tobacco plays (MO, JAPAY, TPB, SWMAY, UVV).   IDEXY - Inditex and SONY too.  I think that covers it.  Overall it was a small gain on my rotation out.

My portfolio was kind of all over the place and, though I did plenty of research, there was not much rhyme or reason to it.  Index funds just made more sense and since I love tobacco plays I think I found a nice niche for them with my current allocation.

Thanks for your kind words!"
2021-04-30 19:48:00,stocks,The advice I'm receiving here is tremendous.
2021-04-30 19:47:47,stocks,"Do you have any reasoning or data to support that, or is it just a value judgement? (And I'm not referring to economic value)."
2021-04-30 19:31:10,stocks,Interesting approach here...
2021-04-30 18:08:48,stocks,"I'm his number 1 fanboy.

Lol, not even, I just read some of his investment tips the last couple of months and they made sense to me.  Guy is humble.  Knows he doesn't know what's gonna happen all the time.  I like that about him.

[https://en.wikipedia.org/wiki/Ray\_Dalio](https://en.wikipedia.org/wiki/Ray_Dalio)"
2021-04-30 18:21:09,stocks,hes a smart rich guy who is considered a legendary investor
2021-04-30 18:55:59,stocks,"I've got them all, in my index funds.

=\]

And a small stake in miners as well."
2021-04-30 19:52:15,stocks,Back in Feb 2020 I bought healthcare and consumer staples to weather covid. Shit still took a beating and took longer to recover than my index funds.
2021-04-30 19:39:28,stocks,Give me an upboat then
2021-04-30 18:16:59,stocks,Ah does he have a good track record? Wasn't trying to be a dick I just didn't know who he was
2021-04-30 18:58:26,stocks,Until recently I was also all over the map. Then a few weeks ago decided to concentrate in a few sectors and also sold a few solid stocks
2021-04-30 18:56:52,stocks,Good !
2021-04-30 19:44:34,stocks,"Sorry man, you can't just ask for 'em like that!"
2021-04-30 18:20:02,stocks,"I don't know the exact info myself, like I said I'm not a follower or anything, but here's what Wikipedia says:

""Dalio is regarded as one of the greatest innovators in the finance world, having popularized many commonly used practices, such as risk parity, currency overlay, portable alpha and global inflation-indexed bond management.""

From [another source](https://achievement.org/achiever/ray-dalio/#:~:text=In%201975%2C%20Dalio%20founded%20the,net%20worth%20is%20%2418%20billion):

""In 1975, Dalio founded the investment management firm, Bridgewater Associates, which forty years later, became the largest hedge fund in the world, with $160 billion in assets under management."""
2021-04-30 19:05:19,stocks,"Nice!  No portfolio is perfect, but seems like having a solid plan is the best way to go.  I hope it works out for you!"
2021-04-30 18:33:06,stocks,"The biggest problem is that PLTR's execs selling shares doesn't really result in voting ownership % loss through PLTR's share structure. 


The problem with this is really that it allows the execs to be able to view the shares as cash without consequence (adverse to share holders).


Otherwise great company."
2021-04-30 18:01:29,stocks,[deleted]
2021-04-30 18:47:10,stocks,"Actually, people are overlooking the fact that most of Karp's sellings are Sale+OE( Sale of securities on an exchange or to another person (after option exercise), not shares. They have an expiration date on them, he is bound to offload some of his contracts to offset that big taxation."
2021-04-30 18:08:52,stocks,Well I’ll give you a quick summary then. He has around 69 million option contracts around 0.35-0.85 expiring on 12/03/2021. He sold like   ~ 10 million so far to pay taxes so he still have a good chunk of options left. Lets see if he gonna pull a dfv or just die with the rest of the dinosaur
2021-04-30 18:16:21,stocks,"Could you explain what the possibilities are regarding his option contracts? As I understand, if he exercises the contracts before 12/3, he will buy the x amount of shares at a 0.35-0.85 price?"
2021-04-30 18:09:07,stocks,"69? Nice. 

I am a bot lol."
2021-04-30 18:28:11,stocks,[deleted]
2021-04-30 18:22:54,stocks,"Yea basically. If you see the filing form most PLTR executives get paid out in stocks and options as their ""salary"". This is a way to incentivize them to grow the company. On page 188 [https://www.sec.gov/Archives/edgar/data/0001321655/000119312520250103/d904406ds1a.htm#rom904406\_15](https://www.sec.gov/Archives/edgar/data/0001321655/000119312520250103/d904406ds1a.htm#rom904406_15) , Karp was awarded options:  9/22/2009  60,897,579 contracts at  0.103  and  1/24/2011 8,000,000 at 0.85. Now disclosure he has already sold some of these options to offset taxes and expenses. He wants to hold these contracts in order to have a big stake in the company. As of now, he has roughly 3.45% ownership without exercising them."
2021-04-30 18:51:51,stocks,If you ACTUALLY look at history post it's just a meme picture of Cathie Wood being superman...right before the spike on PLTR to 40 lol. I had monthly contracts back then.
2021-04-30 18:53:50,stocks,Since when is 25$ bagholding lol ?? It will easily hit that again in case you think he wouldn't be able to get out.
2021-04-30 18:49:28,stocks,"Got it, thanks for the explanation. I don't know much about options 🙏🙏"
2021-04-30 18:11:45,stocks,Is being bored a factor in investing?
2021-04-30 18:12:06,stocks,TSMC
2021-04-30 18:41:15,stocks,"You think FAANG is boring? These companies are constantly innovating and pushing the boundaries of what is possible. Sure growth will slow but so will volatility. Any new tech developed is bound to be involved in some way in one of these companies. I'd add Microsoft to that list too

These companies are leading the innovations in AI, VR, AR, which will chamge the world as we know it. Even if  those innovations fail, Apple will not fail. Microsoft will not fail.

These companies are only borimg because we can't see the future"
2021-04-30 18:20:14,stocks,isn't boring good?
2021-04-30 18:02:51,stocks,"MSFT AMZN AAPL FB GOOGL will continue to dominate long after we're dead.

And so won't ASML LRCX TSM and HD and UNH."
2021-04-30 18:05:21,stocks,Semiconductor equipment companies.
2021-04-30 18:47:36,stocks,OP thinks making money is boring. 🤣
2021-04-30 17:54:57,stocks,Space. It's the last frontier we have yet to conquer. Imagine landing on an asteroid and mining it for precious metals than coming back to earth. Stuff you watch in movies isn't that far fetched. Just takes time.
2021-04-30 18:33:59,stocks,Hydrogen all the way
2021-04-30 19:04:11,stocks,"The challenge is predicting which is the next big boring thing to dominate our lives for years to come.

Crypto?

Batteries?

Porn?

Drugs?"
2021-04-30 19:47:56,stocks,"I think there is a lot of status quo bias here. It is easy to see that Buffett has lost his edge because his fund is too big. Apple, et al, have similar issues, their next idea has too be huge or it does do enough to keep them on top, they must eat more snd more market share or implode with their growth focus, and a few bad ideas, or even no new good ideas could cause a cascading effect.

Will Google’s AI pay off huge, or forever be a few years away; will Facebook be on top of the next trend, or bring us the next beta max; will Amazon’s increasingly unreliable ratings, predatory practices snd poor public relations drive us to the millions of competitors that are here and/or coming - focussed on niche markets snd a better experience?

The problem with success is that it demands more success. Large utilities or telecoms have massive entry barriers, but disruptive tech is difficult in conception but the barrier to entry is lower everyday.

My kids are just as happy watching teenagers play with dolls on YouTube as they are watching cartoons; and YouTube is not necessary to that equation. 

I think it’s a good question, all technologies have at their core their own extinction; they push us further but there is always some aspect that is lacking. Have the big players become too large to pivot and too bureaucratic to innovate? 

For my money, I think Apple has. Phone sales (number of units) has fallen while prices rise, innovation has stalled, brand is waning as others catch up, and without something new to capture the imagine become a “dad” or “mom” product rather than cool.

But of course just my opinion, and I invest in broad market ETFs mostly, so what do I know? Probably not much."
2021-04-30 19:32:50,stocks,"Starlink and Kuiper, but not available yet"
2021-04-30 19:28:59,stocks,AMAT
2021-04-30 18:06:39,stocks,ASML ftw
2021-04-30 18:34:14,stocks,"If you had invested in tech to early you wouldn't have become rich, similar with space. Being the first is not necessarily the best as of right now your options are limited to very few companies that space isn't really their main focus. I would wait a few years on this idea"
2021-04-30 18:25:13,stocks,"SHOP

PLBY

ASML

COIN

ENPH

This is what you're telling me to buy?"
2021-04-30 19:35:54,stocks,"Perhaps for heavy duty machinery though even sl it won't blow anyone away (lol). Might be okay for whatever company ""wins"" the market but it's obviously not as well suited for personal cars hence the EV race."
2021-04-30 19:39:16,stocks,Is there a ETF or public company for porn?
2021-04-30 18:28:05,stocks,Also LRCX.
2021-04-30 18:27:12,stocks,Ftw ?
2021-04-30 19:05:12,stocks,I agree 100%
2021-04-30 19:03:46,stocks,No. None of those. I'm thinking 50 years from now when I'm dead. What kinda stocks are our kids gonna buy.
2021-04-30 18:42:54,stocks,"Abbreviation ""for the win"". 

Funny enough I had to explain to my dad that YOLO ment ""You only live once"", he was about to buy the stock YOLO because of WSB."
2021-04-30 19:02:29,stocks,"This is a small contract and this should correspond to a 2% drop.   The bigger the contract, the bigger the drop in stock price.."
2021-04-30 18:15:14,stocks,Cool. I expect a 5% decline
2021-04-30 18:10:56,stocks,"A $32m contract is almost nothing to SMC, but what it shows is that work can be done efficiently and quickly for the space force by Palantir, and that is something that interests me."
2021-04-30 19:42:29,stocks,Yay a new contract!😍Looking forward to a red day on monday...
2021-04-30 18:30:06,stocks,"me A. Bghodlr too.... too late, but any confirmation bias helps the depression"
2021-04-30 19:59:31,stocks,Hopefully it’s some tech they’ll use to put me out of my misery for holding these bags
2021-04-30 19:21:00,stocks,Why did they go public if they dont give a fuck about us share...bagholders
2021-04-30 18:36:16,stocks,"More money for karp, none for you"
2021-04-30 18:06:00,stocks,This can cover 2.95% of the CEOs salary for just last year... Not literally but equivalently.
2021-04-30 18:54:57,stocks,"I’m trying to take solace in this being just one long consolidation phase. 😂 Its a relatively small position in the scheme of things, but I like the stock enough that this price action hurts."
2021-04-30 19:06:05,stocks,Sad thing is that this will probably push the stock down.  Big complaint seems to be in their reliance on government contracts.  Still think that all of this will make the future of the company/stock very bright but don't see this making Monday a substantial rise.
2021-04-30 17:46:40,stocks,"You do know that a 32 million dollar contract is worth like 0.05/ share at face value based on their cap.  It's not really news, these deals are expected and that's why they trade so high."
2021-04-30 18:36:51,stocks,"Don't be modest, at least 8% drop next week."
2021-04-30 19:53:58,stocks,I always click on palantir posts on this sub just so I can upvote the inevitable joke about the price going down. It’s so fucking true and funny. I laugh to hide the tears
2021-04-30 19:21:33,stocks,"Down .5% in after hours, so you were close, just misplaced the decimal"
2021-04-30 18:43:18,stocks,I hate how accurate this is
2021-04-30 19:08:06,stocks,I hate it when you’re right.
2021-04-30 18:35:41,stocks,lol
2021-04-30 19:29:47,stocks,Yeah $32m is tiny for a listed company like Palantir.
2021-04-30 18:37:45,stocks,"You realize they didn't pay him a billion dollars, right?  
They just gave him shares as part of his compensation, right before the price skyrocketed."
2021-04-30 18:50:55,stocks,"This comment is really only downvote worthy if the downvote is based on tone. He’s correct that the valuation isn’t great at this point in time. This is a known and commonly discussed point, even among people who are, as I am, very bullish on Palantir in the long term. 

Near term, this stock is likely to trade sideways for awhile based on the valuation. I don’t expect it to bear significant fruit for 1-2 years, and consider it a long term stock."
2021-04-30 18:15:16,stocks,[This](https://finance.yahoo.com/news/palantir-reports-revenue-growth-47-120000510.html) says their average revenue per customer last year was $7.9 million. That seems like a better comparison for the $32.5 M than randomly dividing it by their market cap.
2021-04-30 18:47:36,stocks,"Alright then, 15%"
2021-04-30 19:54:32,stocks,I come here to cry with everyone else. Crying alone is no fun
2021-04-30 19:52:45,stocks,"Lol every time they announce a contract the first thing that's always mentioned is how small it is, no matter the amount.

Don't you clowns realize that a lot of small contracts is much better than one big one for a company that is still in infancy and has like a 90% retention rate?"
2021-04-30 18:40:07,stocks,"That's why I said not literally, just put it in perspective but people here didn't get that for some reason"
2021-04-30 19:06:59,stocks,Thank you for having an open mind.
2021-04-30 18:18:51,stocks,"The point is,  the pltr crew can downvote all they want,  but the reality is the company is trading very expensive.  They're trading 10x 2025 projected sales.  They need to stop getting excited every time a small contract is announced. Plus they need to prove commercial growth."
2021-04-30 19:54:18,stocks,"Is there a list of contracts that Palantir has collected?

It'd be cool to build a google sheet showing total contracts accepted showing total revenue vs seeing individual contracts."
2021-04-30 19:34:02,stocks,Objectivity is useful 🤙🏻
2021-04-30 18:31:01,stocks,Do you still have your shorts? Just wondering.
2021-04-30 18:32:35,stocks,I know it’s trading expensive but that doesn’t mean this particular contract is a nothingburger. No one analyzed the Microsoft JEDI deal by dividing the $10B by their $2 trillion market cap and saying “that’s only half a percent”.
2021-04-30 19:55:22,stocks,"Literally everyone says this every time they announce a contract. And they've announced like 30 contracts since going public.

To sum up: you're dumb."
2021-04-30 19:59:18,stocks,Hopefully not all the contracts are public knowledge at this point.
2021-04-30 18:35:16,stocks,Yup
2021-04-30 18:36:44,stocks,Microsoft also didn't spend almost 20 years in business failing to sell products
2021-04-30 18:57:38,stocks,"PLTR has a forward P/E of about 150, similar to TSLA. Obviously very expensive but evidence of a strengthening moat isn’t something to take lightly. In the long term maybe a market cap any larger than IBM’s isn’t realistic but that’s still 3x from here."
2021-04-30 19:05:40,stocks,"Forward p/e is a dumb metric.  Your comparing future unknown  earnings to today's price. Their guidance is 30% compounded annual growth for the next 4 years.  That's 16 quarters of pretty high standards to hit.  One or two misses,  and that derails their 2025 projection."
2021-04-30 19:58:24,stocks,"Yeah, you realize it also works both ways, right?

What if instead of missing they announce a completely blow out year? Lmfao

They grew revs 50% this year, without being well known or a big player in the public sector, and we have clowns like you saying 30% is optimistic. 

Based on the fact that they grew revs 50% ...IN A YEAR WITH A GLOBAL PANDEMIC AND LOTS OF COMPANIES LOSING MONEY..... I'd say it's more like that they blow the 30% out if the water rather than underperform."
2021-04-30 17:54:20,stocks,"For your peace of mind and to make sure you're not overwhelmed, kept it as simple as possible. Buy 2 index funds: one index fund for Total US Stock Market and one index Fund for International Index Fund.

Don't think too much about it or focus on doing anything extraordinary. Do this and contribute regularly to these two funds. Focus on your health and do good to others, this money and the additional money you invest will grow over time as businesses all over the world will grow and become successful. 

You seem a little overwhelmed and it seems you're getting conflicting advice from others. That's understandable. Do this, and control what you can: which is your deeds and inner peace. Everything else will fall into place over time.

This is financial advice, and I wish you the very best is everything you do, sir! 🙋🏾‍♂️🤝"
2021-04-30 18:11:52,stocks,"If you don't understand what you are doing and want to be involved while you learn

Vti is your friend, voted best etf for the broad market

You can hold nothing but vti in your portfolio and you will be in excellent shape/diversified among over 3000 companies and will likely beat the returns of a lot of people who try to go their own way to beat ""the market""

Vti is ""the market"""
2021-04-30 17:46:58,stocks,Definitely look at ETF’s
2021-04-30 17:46:01,stocks,"Do a search for ""ethical ETF"" for a set of diversified investments that fill your requirements."
2021-04-30 18:19:03,stocks,passive index funds tend to inevitably have “unethical business” in their portfolio. I do notice my bank provides indications on how much one etf may be exposed to weaponry and other practices.
2021-04-30 19:04:56,stocks,[https://etfdb.com/esg-investing/social-issues/sharia-compliant-investing/](https://etfdb.com/esg-investing/social-issues/sharia-compliant-investing/)
2021-04-30 19:40:04,stocks,"Voo, vti, vxus.  Those index funds run by vanguard are some of the best performing total market funds.  Buy some with 3k minimum (imo you can obviously decide what your risk tolerance is on your own) and experiment with the rest."
2021-04-30 17:43:49,stocks,"Isn’t everything typically negative for humans as you are directly competing against others when you trade?

A zero sum game"
2021-04-30 17:43:24,stocks,"Look up ESG etfs, they are diversified and don't include the ones you mentioned."
2021-04-30 19:35:13,stocks,Buying stocks is gambling. But you can’t buy stocks about gambling?
2021-04-30 19:19:00,stocks,Give it to me
2021-04-30 19:43:08,stocks,Save it for The Crash lol
2021-04-30 18:51:24,stocks,Half in SPY and half in QQQ
2021-04-30 19:37:58,stocks,"Diversify 3k into safe long term assets that don’t move much, but have solid holdings ... my fav would be DRIV
Put 500 into spy weeklies"
2021-04-30 19:56:53,stocks,BBKCF look it up
2021-04-30 17:56:17,stocks,Thank you so much for your kindness and advice.
2021-04-30 18:18:05,stocks,Agreed. Excellent advice for a new investor
2021-04-30 18:56:20,stocks,I agree with the advice and I hate to point it out but a total market fund will have him technically owning a lot of stuff that might pose a religious conflict.
2021-04-30 18:56:26,stocks,This is the way. Good advice sir!
2021-04-30 17:56:53,stocks,Thank you :)
2021-04-30 17:56:39,stocks,Will look this up
2021-04-30 19:07:46,stocks,"Nah, economics does not have to be zero sum. You can create wealth. Source: maritime history in grad school a long time ago hahaha."
2021-04-30 18:31:09,stocks,some stocks that are sold are being liquidated for any sort of reason but not necessarily because it's a losing position.  wouldn't be negative if someone wants to sell so they can yolo in another stock
2021-04-30 17:57:16,stocks,Thank you 🙏🏻 first time to hear about ESG etfs
2021-04-30 19:57:08,stocks,"You are correct. The OP might benefit from checking out World and US Islamic indexes

https://www.msci.com/documents/10199/c0b90e16-5746-4cdc-b033-1ec7da64386e"
2021-04-30 18:06:14,stocks,"Just as a warning, a lot of ""esg"" funds aren't actually esg and have like exxon in them and are basically the same as sp500 but collect higher fees. make sure u do ur own research"
2021-04-30 18:08:10,stocks,Thanks for the heads up. I’ll look it up.
2021-04-30 17:51:45,stocks,"Holy cats!  $800,000 a quarter for one guy as a travel stipend?   Thats almost $9,000 a day!  Is he traveling to Mars or Jupiter?"
2021-04-30 17:36:33,stocks,Karp has way too many payoffs. Sucks for us shareholders. His contract is a very sweet self serving deal. At first it appeared as an investor that having Karp with this much influence and say was good for the company because he can make the right decisions but it appears now that its more to do with doing what he wants and job security.
