Timestamp,Subreddit,Post/Comment
2021-04-26 00:00:00,stocks,"NCLH Norwegian voting for increase of ordinary shares +100% from 490k to 980k shares Not financial advice.  Always seek professional advice from your financial advisor.

NYSE: NCLH

News:  Recently received proxy vote information for Norwegian Cruise Lines, as follows:

Items:

1. Election of class II directors, nominees Adam M Aron and Stella David and Mary E Landry.
2. Approval, on a non-binding, advisory basis, of the compensation of our named executive officers.

3)approval of an increase in our authorizes share capital to increase the number of ordinary shares authorized for issuance from 490,000,000 to 980,000,000.

4)Approval of an amendment to our 2013 Performance incentive Plan (our ""Plan"") including an increase in the number of shares available for grand under our plan.

5) Ratification of the appointment of PricewaterhouseCoopers LLP as our independent registered public accounting for for the year ending Dec 31 2021 and the determination of PWC remuneration by our audit committee

So, its looking like Norwegian is looking to eventually Dilute their shares through selling more shares, adding +100%, as I read it.

This is for the 2021 Annual General Meeting.

Vote by May 19, 2021, 11:59 PM ET

Edit, can s mod change title from numerical k values to MM please."
2021-04-25 21:52:28,stocks,"Not necessarily. They have to be authorized to increase shares for doing it but that doesn't necessarily mean they plan on raising the maximum, or necessarily any at all. Sort of like cash buybacks, the company will be authorized to spend $x on buybacks but they can chose to do so at their discretion.

Definitely not bullish news but my guess is it's probably an emergency type provision if the covid recovery doesn't go as expected. Only time will tell though."
2021-04-25 23:39:47,stocks,"If they're asking for assurance, it's likely they will sell them


Also, op, it's 490 million to 980 million, not thousand."
2021-04-26 03:43:38,stocks,Seems like this would be a terrific buying opportunity if it dips significantly. What would be a great price point to get in on NCL?
2021-04-25 22:16:39,stocks,"I agree, which is why they're looking for approval for said increase.  The actual issuance will come later."
2021-04-25 22:55:24,stocks,Anyone know about how long before this would take effect?
2021-04-26 06:14:36,stocks,I am a share holder this is all true. I voted on it al ready.
2021-04-26 01:38:55,stocks,Is this financial advice?
2021-04-26 00:20:46,stocks,When’s the vote being tallied?
2021-04-26 05:17:42,stocks,wheres the article? been searching and found nothing
2021-04-26 02:47:04,stocks,"> Definitely not bullish news

Theoretically share issuance should not be bullish or bearish. They can use the money to pay off debt / reduce interest expense / stave off bankruptcy.

Edit: I’m not sure why I’m so downvoted. Just look at the GameStop stock issuance news making the stock skyrocket: https://www.reddit.com/r/stocks/comments/mz87ma/gamestop_completes_atthemarket_equity_offering/"
2021-04-26 01:13:14,stocks,"Correct, I'm not seeing thousands?"
2021-04-26 05:06:30,stocks,Curious aswell
2021-04-26 08:46:25,stocks,"Lol, less now than it will be in the future when you sell!

It's tough to say how this stock will recover from the pandemic and related shut down.  They have a fleet of ships to get running and bookings, plus an outbreak on a ship would spell disaster.

Be careful with all your investments,  as always, but be extra prudent here.

As always, see professional advice for investing."
2021-04-25 23:26:09,stocks,"I think/hope that it's more likely than not they don't issue. Unless the government expands the sailing ban past the current date, which I think is also less likely than the government shortening the ban as long as the cruise companies only allow vaccinated people on board. They also are something like 100 million shares from the current maximum which would be about $2.9 billion in capital they could raise. So it'd be pretty surprising and frankly unnecessary to do significant further dilutions unless there's an absolute worse case scenario and covid comes back or the vaccines don't work long term or something crazy like that. Knock on wood, lol."
2021-04-25 23:28:30,stocks,It's gonna immediately impact the share price
2021-04-26 01:40:01,stocks,">Not financial advice.  Always seek professional advice from your financial advisor.

This is reddit - you should always seek professional advice from a proper financial advisor."
2021-04-26 01:11:56,stocks,"Vote by May 19, 2021, 11:59 PM ET"
2021-04-26 08:43:35,stocks,I received this vote information as a shareholder.
2021-04-26 03:36:10,stocks,"but in practice the supply and demand surrounding the shares themselves would be expected to push the price down some

that is, there are not unlimited buyers of NCLH so the scaling up of the offering outpaces demand"
2021-04-26 13:28:58,stocks,"Sure, but you also have to ask why a company is raising capital.

Like, are they planning a big acqusition? Then the news might be bullish longterm.

With cruise lines, we all know they are raising capita cause they have to to survive. Which is bearish af"
2021-04-26 14:29:47,stocks,"I think share issuance in itself is definitively bearish. It's a dilutive effect. If the market cap stays the same then share price has to decrease. They might use the funds in a way to offset that bearishness, although I think it'd be pretty rare for a company to have a bullish way to raise capital by diluting their shares, most healthy companies would not need to do so."
2021-04-26 02:54:23,stocks,The title
2021-04-26 05:17:49,stocks,You are my financial advisor now!
2021-04-26 15:41:30,stocks,This is zero surprise to the market.
2021-04-26 15:43:40,stocks,"> If the market cap stays the same then share price has to decrease.

You have the same company, but now with a cash injection after an issuance. In a rational market, market cap will go up.

Note: “theoretically” this balances with shares outstanding increasing keeping stock price the same."
2021-04-26 03:27:28,stocks,Ty!  Edit requested to mods
2021-04-26 15:58:31,stocks,"Hmm, yeah so if you ignore literally everything else about the context of share issuances and put yourself in a nonexistent hypothetical world, company raises money and the market value of the company goes up by the same amount. 

I wonder if rational markets would ever factor in the rest of the context though? You know, like the context specific factors that determine the market value of the company in the first place."
2021-04-26 09:22:58,stocks,They can't edit titles.
2021-04-26 12:49:01,stocks,"Oh, neither can I.

I'll watch for that in thr future"
2021-04-26 00:00:00,stocks,"Can you buy the same stock through multiple brokers? Are there any rules regarding buying the same stock through multiple brokers.
The reason I would like to do this is because I would like to buy the same stock for both long term investment and also use the same stock for borderline day trading? Thanks"
2021-04-25 20:08:57,stocks,"If you sell at a loss, technically you lose the write off it you buy again within 30 days.  Might make taxes more difficult or get caught in an audit if you don’t account for that. 

Other than that, play ball"
2021-04-25 21:25:04,stocks,You can also have multiple accounts with the same broker. I have a daily trading account and two IRAs all with the same broker. Easier to have on one app/platform
2021-04-25 20:40:42,stocks,The wash rule will apply across accounts.
2021-04-25 22:06:54,stocks,Are you just trying to avoid the pattern day trader (PDT) rule?
2021-04-25 23:06:56,stocks,I do the same thing one account for long term holds and one account for swing trading
2021-04-25 20:03:08,stocks,Yep nothing wrong at all.
2021-04-25 20:06:05,stocks,Yup. I have $XM in two different accounts. Was even sent shareholder voting materials for both brokerage accounts separately.
2021-04-25 20:10:52,stocks,"Yes, if you can buy two houses thru two different real estate agents you can buy two stocks with different brokers"
2021-04-25 21:40:56,stocks,Wash rule still applies across multiple brokers.
2021-04-25 20:13:45,stocks,"Thanks, I didn’t think about that."
2021-04-26 01:24:40,stocks,"Keep in mind: you only lose the tax write off if you keep that stock that you bought again through the end of the tax year. If you sell it for another loss 30 days before December 31, then you can write off the aggregate loss."
2021-04-25 22:29:44,stocks,"Thanks, I didn’t know you could do that."
2021-04-25 22:34:34,stocks,"No, For example, buy a stock at $10 for long term and also swing trade as the stock rises without losing my original $10 cost per share stock price. Not sure if I’m explaining it right."
2021-04-25 23:14:40,stocks,"Yes, this is exactly what I am planning on doing."
2021-04-25 20:07:07,stocks,Thanks for the quick reply.
2021-04-25 20:09:41,stocks,Ok thanks I know many people would probably consider this to be a stupid question.
2021-04-25 20:47:46,stocks,You mean 2 different Lenders not agents lmao
2021-04-26 02:43:48,stocks,Roth IRA and a brokerage account is what I have. Works well my roth is long term growth. While the brokerage account is the fun one.
2021-04-25 22:37:27,stocks,I'm confused admittedly. Maybe a bit OCD? Trying to keep the numbers aligned?
2021-04-25 20:37:57,stocks,"No worries. Ask away. If you have any more questions or need some guidance on books to read, DM me."
2021-04-25 23:13:24,stocks,Basically wanting to have low entry cost per share for long term hold and also swing trade the same stock. Kinda like getting your cake and eating it too.
2021-04-25 23:16:14,stocks,"Why not just buy more shares with one broker and keep those ""untouchable""?"
2021-04-25 23:50:16,stocks,"Because some stocks are great for long term holds and swing trading at the same time. If I only use one broker I can’t do both with the same stock. If I buy more shares and want to leave them untouchable, or long term, I can’t swing trade because you can’t do both at the same time.
In other words for example buy 1000 shares at $8 through Fidelity for long term hold or “untouchable “. I also found that this stock has huge price fluctuation every time news comes out, which is great for swing trading. I will use Robinhood to use for swing trading as the price of stock rises over time, thus not effecting my $8 cost per share for much later in the future when the stock price is possibly $300 per share and I want to finally cash in."
2021-04-26 10:58:03,stocks,"But you can do both with the same stock. When you sell your ""swing trade"" stocks, you can choose which shares to sell. Just don't sell your ""long term"" shares."
2021-04-26 11:58:15,stocks,Doesn’t your cost per share rise when you start buying at higher rates to swing trade?
2021-04-26 12:06:04,stocks,"Yes, over all ""lots.""   But should be able to see cost for each lot separately too. And can choose which lot to sell from when selling. At least you can with E\*Trade. I'd imagine all are like that since they are tracked separately for tax purposes - when purchased, how much gain or loss, etc."
2021-04-26 12:25:48,stocks,"Ok thanks, I’m with Fidelity and I’ve never seen an option on which stock lots to sell. 
I will have to do some more research on this, maybe I will have to contact Fidelity to see how this is done."
2021-04-26 12:50:17,stocks,"How do I initiate a trade for specific shares?

On the Trade Stocks, Trade Options, or Enter Funds to Sell or Buy pages, select the Choose Specific Shares check box, then click Continue when you've specified the rest of your order details.

[https://www.fidelity.com/webcontent/ap002390-mlo-content/20.01/help/learn\_trading\_specific\_shares.shtml](https://www.fidelity.com/webcontent/ap002390-mlo-content/20.01/help/learn_trading_specific_shares.shtml)"
2021-04-26 13:53:22,stocks,"Cool, thanks for all your help."
2021-04-26 00:00:00,stocks,"Wanted: Stories of bag holding I was wondering if anyone had any interesting stories of bag holding. Was it worth it to hold on or do you wish you cut your losses?

I was and somewhat still am bullish on a bioplastics company Danimer Scientific (**DNMR***).

I bought in three different times, but my cost basis is around $38 to date. It ran all the way up to $64, but has plummeted to $23 after bad press (WSJ article) and a short campaign (Spruce Point Capital).

I’m thinking I’ll hopefully make the money “lost” back in the next two years, as I think it’s over sold currently. This has always been a five year min play for me, however, the amount of bad press does worry me. Anyone have any words of wisdom?"
2021-04-25 21:29:41,stocks,I bought Microsoft in 1998 and bag held through the dot com bubble and Steve Ballmer years (dark days for us MSFT shareholders). I admit I/we got very lucky with Satya but MSFT is a company I believe in.
2021-04-25 20:16:08,stocks,Let you know in 1 to 1 million days with Aphria bought at $28.
2021-04-25 20:37:45,stocks,I bought RKT at 40. Averaged down to 23. Now have 1500 shares and holding that bag
2021-04-25 20:45:24,stocks,"I like options because it automatically forces me to ""cut your losers"".

It might be a knife to the heart, but it still counts as a ""cut"".

Position sizing is life."
2021-04-26 00:49:49,stocks,If HYLN goes to zero I’ll lose 11k. I’ll let u know 😅
2021-04-25 21:38:11,stocks,"I bagheld BB shares for years until selling at $20 earlier this year. 

Bought Citi shares coming out of the financial crisis thinking there was nowhere to go but up. I was right but it took nearly 12 years to actually go up any appreciable amount."
2021-04-26 00:51:43,stocks,"I'm currently bagholding on pretty every EV tech stock. Came into some money in January, put it into EV stocks, and then the SPAC correction came and wiped out a lot of it. Lesson learned - set stop losses and don't be emotional and try to ""believe"" stuff will come back."
2021-04-25 23:55:32,stocks,"My grandpa held $500,000 of JC Penny all the way until it got delisted a couple months ago after bankruptcy. Doesn’t always come back."
2021-04-26 17:54:44,stocks,"Who here remembers Enron (yeah - I'm that old).

This still haunts my Fidelity account: 

12/04/2001: 5,000 shares @ $0.66

05/02/2002: 5,000 shares @ $0.24

07/16/2004: 10,000 shares @ $0.09

Total loss: $5.357

And I was never able to write off the loss. Apparently Enron still exists in some mutant phantom zombie form that will forever haunt my brokerage statements."
2021-04-25 22:13:42,stocks,"I bought $CODX $10.80 saw crossing $20 but did not sell as it was suppose to reach $27 :) 
Now it is sitting at $8.95. I am so mad.
But it’s 1 year target is still $23 so hoping 1 day it will start moving up again."
2021-04-26 00:53:02,stocks,Well the stock doesn't know u bought it at a high price. If u think a stock can go from 23 to 38 in two years you should be buying the heck out of it if u are rationally investing and not speculation
2021-04-26 11:25:30,stocks,"I have like 45 shares of a stupid pump and dump stock I followed last June, never sold them bc I was stupid. I was hella new to the market, they stay in my portfolio just to remind myself never to be that dumb again. Bought at the literal top, maybe they'll pop in 20 years 😂"
2021-04-26 01:54:06,stocks,"I bought AMD at $10, $8, $5, and $16. Everything other than the $16 was a bag hold for years.

If you're convinced that the company is a 5-year play and executing as you expected then you can add more. If things have changed for the worse but you still like their prospects you can hold. If the changes mean you think they have bad prospects you should probably sell now rather than panic when and if it dips lower and sell then."
2021-04-26 00:05:12,stocks,I was up 20% with CD Projeckt Red. Now I am down 20%.
2021-04-26 00:38:54,stocks,"Bag holding BUD. I bought at $116, thought they would maintain sales or do better. It looks like I'm going to be bag holding for a while"
2021-04-26 00:53:40,stocks,1250 shares of HYLN @ 24.50.
2021-04-26 07:33:19,stocks,I have shares in Hyliion and Palantir. Do I even need to say anything?
2021-04-26 08:25:22,stocks,"Bought a load of APHA at like $16. It almost immediately dropped to $4 and I bagheld for about 2 years. Averaged down to $12. 

It mooned a few months ago to $25, and I exited at almost exactly 100% gains. Bagheld for 2 years and wound up doubling the cash."
2021-04-26 12:47:55,stocks,Let me tell you a story about how I put 80% of my entire portfolio (I didn’t know shit about investing at that point) into ACB thanks to Reddit hype.
2021-04-26 01:54:16,stocks,-10k on wire_card. Still holding at -99.8% as a reminder to never again hold 100% of a Swing trade through earnings
2021-04-25 23:25:31,stocks,$ACB end of story
2021-04-25 22:54:51,stocks,"I had bags on FL and SIX. They cut the dividend and then COVID. FL is gone and I made $1k but SIX won’t go away. I still roll out cc’s and I’m above breakeven. But I still want it to go away and free up capital. 

The dividend was great years ago."
2021-04-25 23:42:19,stocks,"I bought £CINE at 60p, sold at 30p, now is 95p"
2021-04-26 00:35:01,stocks,Bought M at $36 when it had crashed from $70 in 2016 then averaged down all the way to $20 then got even at $26 and it went to $40 after I sold in 2018 but glad it was gone......worst 2 year hold ever. Never buying mall retail again.....
2021-04-26 00:36:56,stocks,[deleted]
2021-04-26 02:01:18,stocks,"Got caught up in the hype of NKLA when it first came IPO'd. It had been an absolute shit show since after about 3 weeks and a high of $93. I did my best to down cost average when it took a big ""dip""... but it just kept going down after that hindenberg report.  I'm sitting at $35/ share.   It's been sitting around $10 now for a couple weeks..."
2021-04-26 03:15:18,stocks,VIAC at 48 fml
2021-04-26 03:24:36,stocks,"Bought an oil and gas ETF (ZEO) in 2015. It had dropped a ton and I b
Thought I was buying the dip and oil was guaranteed to go back above 100$. Been bagholding ever since.

I was sitting at -90% about a year ago. ""Only"" down 36% right now. Feeling like an idiot for not doubling or tripping down when oil was in the negatives."
2021-04-26 05:38:50,stocks,"ATOS is dragging me down like fuck.  I normally cut losses at like 10-20% but this time i actually decided to try bagholding just to see what happened, as some of the stocks i've cut losses on then had huge rallies.

well, it's been 2 months and i'm still currently getting reamed."
2021-04-26 06:01:29,stocks,"Haha just in 2021 I have too many to count already. Some I'm sticking with long-term, others I cut and moved on. My strategy has always been to hold if I genuinely believe in the company long-term, but if I'm holding just due to some emotional ""it's not a loss unless I sell"" bs then I just accept my f\*ck up and cut it and move on. Otherwise imho the opportunity cost is too great - you could be investing that money elsewhere and actually making decent returns.

So anyways, my mistakes of 2021 so far:

**BB** **(cut) -** I admit it, I got caught up in the reddit hype and bought in at $15+. At the time I was justifying it to myself by getting confirmation bias from all the reddit DDs saying they had a huge number of patents, were going to be leading the way in self-driving software etc. But obviously since then it's cratered.

I cashed out at a 40% loss as whilst I don't think this stock will drop much further, equally it doesn't seem like it's going anywhere anytime soon. It's a legacy tech company that is making no money, has a lot of patents but patents are worthless if you can't monetise them, and mediocre leadership (CEO himself was selling stock as the price peaked). So really I think my cash could be invested better elsewhere.

**COIN (holding)** \- bought in at $390 hoping it would spike, of course it didn't. However I bought in more at $300 and am holding long-term, on the basis that at a $100bn valuation this was probably over-valued, but now it's barely worth $50bn which doesn't seem crazy compared to companies like SNOW and even PLTR (more on the latter below). Of course it's very much dependent on the crypto market so is definitely a speculative investment, but I don't think 40-50% gains from here over a few months is unrealistic. I mean their Q1 21 profits were *insane.*

**PLTR (holding) -** bought in at $35, partly because of reddit hype but also because it is a *fantastic* company - Peter Thiel and Alex Karp are veritable genuises, and they really have a huge moat - there is no-one out there who can offer comparable tech currently. Also for all the IT guys on here saying big F500 companies can build their own equivalent software, I would say - have you ever worked for a big corporation? IT always gets the minimum amount possible spent on it (seen as a cost center) and plus data is usually dispersed across numerous legacy databases etc, and nobody has the willingness/skillset to fix it.

Having said that, I acknowledge this is still speculative because of one thing - *valuation.* I love the company, but even I have to admit they are still expensive at $40bn. If the stock price doubled that would make them an $80bn company, which even for an elite data science/machine learning outfit is a pretty pricey valuation (especially given they're not making much in revenue/profits currently).

***AMC (cut)*** \- again bought into the hype, took a big hit but decided to cut and move on. Ok cinemas are reopening, but AMC now has a similar stock price to pre-covid which isn't really justifiable, plus I dont have much faith in the management (CEO paying himself huge bonuses  during the pandemic etc). FYI, for people looking for a better cinema play would check out *Cineworld* (I don't currently hold a position but might do shortly) - listed in the UK but they own cinemas all around the world, particularly in the US. Have a lot of debt so speculative, but their price is still well below pre-covid levels at least.

**TSLA (holding) -** think everyone knows Tesla by now, so no analysis needed here. Bought at the Feb peak but the market crashed, holding long-term though as even though the company is expensive at these levels think they have huge future potential.

**NIO (holding) -** same as above."
2021-04-26 07:32:04,stocks,JD and Tencent currently at a loss
2021-04-26 07:37:49,stocks,"Hyliion. Enough said lol.
I started buying in the 20’s then added 1/4 of my original share count at around 15, 10, and 8.50. Brought my average down pretty low and I’m happy with it now for a long term hold. This worked because the price was dropping despite only good news from the company in recent months. Valuation was impacted by interest rates and bearish outlook on both SPACs and EV startups, all macro-risks that will fluctuate throughout my holding period. 
I was hurtin’ when I kept seeing it drop lower and lower and lower but now I am glad I had patience. We’ll see how this ages."
2021-04-26 11:17:41,stocks,"I bought Tencent (HKEx) at it's peak (475HKD) back in early 2018. Subsequently, news about the Chinese govt clamping down on gaming etc. brought the stock down to 260HKD at it's lowest at Oct 2018 and it traded sideways or down most of 2019. Then we had the Mar 2020 crash, but today Tencent is at 628HKD (was 750 in Feb) even after more recent clampdowns in China.

If you believe in the company, just hold or DCA."
2021-04-26 17:47:30,stocks,"Great timing that this just hit in my inbox. 

Bought 1000 shares of MMDEF in January at$3.21/share. 

Wrote the following in my spreadsheet where I track purchases/sales:

""Why? Because it's fun to be crazy once in a while. Also, stock has applied for full NASDAQ listing "" \[for those unfamiliar, this is a small Canadian company developing therapeutic uses for LSD.\]

Dropped to low 2's in early April. Bought another 500 shares at $2.48 about two weeks ago.

Last week they got their NASDAQ listing. Stock instantly shot up 80+%. Up about another 30% today. Sold all my shares at $4.62/share for about 56% gain.

Sometimes crazy pays off!

Needless to say - this is not investment advice."
2021-04-25 20:47:09,stocks,Stop-loss at -8% and never look back.
2021-04-26 00:43:19,stocks,[deleted]
2021-04-26 05:24:32,stocks,Lmfaooo i bought GME puts at $40 on its run up to $400
2021-04-25 23:15:58,stocks,"Are you seeing value in DNMR? Care to share DD?

Mine was bag holding a couple SPACs when the market turns. Blind luck has it that I concluded the party is over for SPAC and limit my loss to 20%."
2021-04-26 02:31:14,stocks,ARLP used to be $20
2021-04-26 03:58:13,stocks,"I bought a small portion of Bayer-Stock, the pharmaceutical and agrochemical giant a while back. They had lost about 2/3 of they market cap after the Monsanto-disaster. I thought, there is no way they will not come back from this eventually.  So far they didn’t. In the last year alone their stock Price lost over  10 percent again. Luckily it’s a small positon, but  I am still down more than 15%"
2021-04-26 04:43:00,stocks,"If you want some numbers/anonymous stories, here are some of the biggest ones I've found so far [https://www.markovchained.com/bagholding](https://www.markovchained.com/bagholding)"
2021-04-26 06:01:38,stocks,"Bought APHA in 2017 for ~$12.65CAD held through the early 2018 frenzy up to $24+, but I was so green I didn't know what to do. There was a short attack that brought the price down to at least the $4's. I sold most of my other weedstocks and averaged down to ~$8.50. I held for quite a while, only selling in January/February at ~$16.50 for GameStop.

Another weedstock I owned, Canntrust, I bought over $10CAD and watched it get delisted"
