Timestamp,Subreddit,Post/Comment
7/1/2021 12:15,stocks,Yeah but TQQQ is triple leveraged QQQ. It doesn't take a 2008 style event to lose all your money or a lot of it just 1 bad day.
7/1/2021 14:10,stocks,"Unless you buy ETF  that heavily shorts the S&P500, DOW and  R2T"
7/1/2021 0:41,stocks,"I don’t see target not continuing to grow over the next 10-15 years.. I mean if the market dips. This is cash I won’t need, could hold for 20-30 if need be."
7/1/2021 17:19,stocks,Do you take xrp? 😀
7/1/2021 11:29,stocks,"Worker. Started at the bottom, moved up to a lead worker."
7/1/2021 11:54,stocks,So the answer is no.. figured so
7/1/2021 14:06,stocks,HOORRAAAYYY!!!! MY MAN GOING THE DISTANCE AND MAKING THE TOSS!!!!
7/1/2021 10:47,stocks,500k
7/1/2021 11:36,stocks,"Lead worker sounds a lot like ""manager"" so yeah there's your explanation"
7/1/2021 15:15,stocks,UPVOTE-  “you’re on a roll”
7/1/2021 12:05,stocks,"That would be nice but highly impossible. 

Though whenever I say something like this my fate proves me wrong, so I hope it proves me wrong this time too on this highly impossible part :)"
7/1/2021 16:07,stocks,So your belief (based on what?) is that the bottommost rung of employees are somehow treated poorly.  got it.
7/1/2021 0:00,stocks,Most Overlooked Stock in the Market I have been looking around for stocks that have massive potential and upside with little downside and comparing them to other companies within their industry. I want to hear what you all got. I completely screwed up this week just day trading highly volatile stocks that I ignored my plays that I wanted to go long on. I was watching Pop Culture Group today and made over 100 percent gains but ignored what I was looking to go long on for options which were Editas and Newegg.
6/30/2021 22:33,stocks,aerotyne international
6/30/2021 23:38,stocks,GAYMF (Galway metals)
7/1/2021 12:36,stocks,"NAK. They are sitting on a mine in Alaska with a fuck ton of gold and copper below it. It doesn't look good for getting approved anytime soon...but at .50 a share it is a good penny stock gamble. There is a lot of drama with the EPA and they went on an aggressive smear campaign against NAK and the Pebble Project. 
With the push for electric cars they are going to need more metals, I imagine at some point when the world is facing a precious metal shortage it will finally get approved. It would also be a great meme stock to buy up and force a squeeze.
Not financial advice, DD, or even coherent information. I am in for 1000 shares and growing."
6/30/2021 23:27,stocks,">I have been looking around for stocks that have massive potential and upside with little downside 

This is going to sound ridiculous (on the overlooked part)... but AMZN.  It's still trading at prices you could've had in August of '20.  

This price after ridiculously great earnings reports & their continuous reinvestments into future ventures is kind of mind boggling.  

Personally, I've recently sold a bit of my AAPL holdings (which Buffett himself called the 'perfect company') to increase my AMZN holdings.  I believe in the latter-half performance/redemption that much."
6/30/2021 22:33,stocks,"Hmpt
Ldi
Nls
Smed
EZGO
Your welcome"
6/30/2021 22:46,stocks,"Any of the private equity firms ex. Apollo, KKR, blackstone etc"
7/1/2021 0:30,stocks,$INMD
7/1/2021 2:16,stocks,BP
7/1/2021 0:11,stocks,MMNFF because it’s so inexpensive that you aren’t risking a lot. The upside potential is around 4000%
6/30/2021 22:42,stocks,FORD
7/1/2021 1:29,stocks,"UWMC straight up. Solid financials, solid dividends, shit ton of cash on hand, but no volume so it sits at a cool $8+"
7/1/2021 3:02,stocks,G-M-E
6/30/2021 23:08,stocks,"Fireside chat with CEO: https://www.npd.com/wps/portal/npd/us/news/videos/a-fireside-chat-with-mark-tritton-president-and-ceo-of-bed-bath-and-beyond/  
  
Activist investors are turning this around with new C-Suite: https://www.sec.gov/Archives/edgar/data/886158/000092189519001180/ex1dfan14a09050028\_04262019.pdf  
  
New leadership CEO and President Mark Tritton (previously Chief Merchandising Officer at Target).  
  
Its well below its ATH.  
  
Has a p/s of 0.3. (mkt cap only \~3 billion, revenue \~9 billion)  
  
Closed many unprofitable locations, and remodeled other locations while foot traffic was low.  
  
Got rid of many unprofitable brands.  
  
Is focusing on and has begun to release their own vertically integrated brands which in turn will increase margin. They have released 5, with 3 more this year I believe. July is a storage brand which is great for back to school and all of this new home ownership.  
  
Over 2.5% insider ownership (CFO just bought 500k USD of shares in April at \~25 dollars a share to add to his 300,00 shares).  
  
Over 98.5% institutional ownership (Yes those add up to more than 100%).  
  
\~20% Short interest with 100 million share float.  
  
They are currently doing buybacks for the rest of the year.  
  
They had a dividend but removed it due to covid.

They had their earnings today and closed up 11%

Stock is $BBBY"
7/1/2021 1:20,stocks,"$TELL

LNG play"
7/1/2021 2:54,stocks,Hrb
7/1/2021 3:07,stocks,Wabisticks!!!
7/1/2021 3:33,stocks,Kgc is a gold miner trading really low atm
7/1/2021 8:05,stocks,"Haemonetics. It has 75% of the plasma market, the market is growing. Covid was not good for them, but that will not last long.  they recently lost a big client (accounted for 12% of revenue) and fell 60%: big over-reaction I believe, and great investment opportunity."
7/1/2021 8:40,stocks,Exro Technologies
7/1/2021 10:49,stocks,"Not overlooked, but GE"
7/1/2021 12:00,stocks,Police training stocks
7/1/2021 12:12,stocks,"CAT since it's 8+% lately since if the infrastructure bill ever passes, it should really help the stock."
7/1/2021 19:22,stocks,"Niocorp Investments : The only US based mining company about to mine 3 minerals listed on the US Critical Minerals list. 

Construction is expected to start sometime before the end of the year.

NIOBF, NB.TO"
6/30/2021 23:19,stocks,I think they make radar detectors
6/30/2021 22:43,stocks,areotyne ya
7/1/2021 0:30,stocks,What a ticker
7/1/2021 7:34,stocks,"It's trading at 70x free cash flow so the growth will need to be insane to justify that, and its up about 20% since September last year, its definitely not overlooked."
6/30/2021 22:41,stocks,why?
6/30/2021 22:40,stocks,Had 4 out of 5 of these on my previous watchlists. I definitely like some of these with price point currently especially NLS
7/1/2021 2:16,stocks,Even after the run ups? And paying so much for real estate lately?
7/1/2021 16:16,stocks,Based on what? Hopes and dreams?
7/1/2021 12:24,stocks,Is this really overlooked? F has had an insane year. I'm definitely bullish though.
7/1/2021 16:12,stocks,"How dare you to mention the nr1 negativ beta stock!

You can only mention nr2 lowest beta stock: Walmart!"
6/30/2021 23:43,stocks,The best secretary too
7/1/2021 2:59,stocks,Hahahaha
6/30/2021 22:42,stocks,"Most of them make money and are ridiculously cheap
Ezgo reported earnings today have a look at that growth"
7/1/2021 16:19,stocks,Assets and revenue. They have a lot of debt they’re attempting to pay down. If they can pull it off then that’s the upside
7/1/2021 16:14,stocks,"Lol
Gotta keep the media happy right?"
6/30/2021 22:48,stocks,"NLS compared to Peleton for me. However, Peleton market cap is like 70x the size of NLS with only 4-5 times financials."
6/30/2021 22:46,stocks,"I am genuinely interested, I don't know these tickers. I'm not a fan of buying a stock after a 12% day but I have no problem taking a small position on one of these."
6/30/2021 22:49,stocks,Correct..I have actually done a posts on these 2 and why pton should buy nls
6/30/2021 22:48,stocks,"Hmpt and ldi are in the mortgage sector
Have been down hard since rkt missed and they are short targets...today mortgage news crushed them

Smed deals with medical waste profitable

Nls is the owner of Bowflex..they have knocked the last 4 quarters out of the park...

I have a trade team about 50 of us we have been trading these all, especially ezgo wow!"
6/30/2021 22:56,stocks,Agreed. With Peleton’s cash on hand and the NLS trading half under the industry average with great fundamentals would only make sense. They make a great comparable product that has a niche market for less serious cyclists. Peleton buys them out then puts Peleton brand sticker on it increase price by $200 per unit.
6/30/2021 22:56,stocks,Yes
7/1/2021 0:00,stocks,Besides TSMC which other companies are supplying or part of the supply chain for all the chips for cars? Been hearing a lot about companies like Ford slowing down production due to chip supplies.  So I'm wondering if it would be a good investment to purchase companies that are either part of the supply chain or the main chip makers once supplies are are back in full?
6/30/2021 21:43,stocks,ASML
6/30/2021 21:45,stocks,Umc
6/30/2021 22:49,stocks,UMC.
6/30/2021 21:44,stocks,So so so so many
7/1/2021 1:37,stocks,"Check out indi semiconductors.  Their board has Ford execs, GM execs and Skyworks old chairmen (company that sells apple their chips)

They power apple car play and supposedly have over $2B in back orders.

More speculative, but has incredible upside.

I’m in nearly 1000 shares.

 [investor presentation](https://s27.q4cdn.com/910956235/files/doc_presentations/2021/06/Overview-Summer-2021-Final.pdf)"
7/1/2021 13:16,stocks,himax
7/1/2021 15:50,stocks,"Xilinx and Intel both sell FPGAs and CPLDs that are very popular with car makers. Xilinx is in the process of being merged into AMD, and at some point XLNX stock will turn into AMD stock. Every time something good is in the news about that merger AMD goes up a few dollars.

You’ll hear a lot of different opinions about INTC, mostly not great, do your own research (although I personally like it if the semiconductor stimulus happens soon); FPGAs are a very small portion of Intels business so they aren’t the most relevant to the final stock price."
6/30/2021 21:18,stocks,AMAT. Applied Materials Inc….solid company. Bought 100 shares about a year ago. Up 130+% since
7/1/2021 0:01,stocks,"Magna (MGA) is my unsung hero for the auto industry. EV powered or not, car companies are  still going to build a car and Magna supplies the exteriors, interiors, seating, roof systems, body, and so much more."
6/30/2021 21:50,stocks,Look into axti. Very under followed and under appreciated. Supplies wafers to many companies including apple. It also owns mines which produce minerals used to make wafers and it has planned to spin that asset off later this year.
6/30/2021 23:07,stocks,BWA and MGA aren't a direct chip play but they are essential to car manufacturers and appear to be on sale due to the slow down.
7/1/2021 4:03,stocks,"I have a modest position in Infineon (listed in Germany). I also like Micron, but this is for the broader industry rather than automobiles. Don't see these two names mentioned in the sub often."
7/1/2021 4:57,stocks,"Adding to the already named equipment manufacturers, I'd mention Infineon, STMicroelectronics and NXP Semiconductors."
7/1/2021 9:45,stocks,Lam Research (LRCX) & ASML make the machines that make the chips.
7/1/2021 11:20,stocks,Umc is solid.
7/1/2021 14:33,stocks,"Micron (MU) make memory storage used in everything. They just killed earnings today yet got dumped for stupid reasons (CEO was an idiot on media), so now is a great time to buy the dip. Solid projections btw"
6/30/2021 22:26,stocks,"Shit, i regret not getting in when i had this shortlisted 2wks ago"
6/30/2021 21:45,stocks,">ASML

this one sounds interesting, thank you."
6/30/2021 23:08,stocks,">UMC

thanks this one is very interesting. what do you think of ON?"
6/30/2021 21:24,stocks,"Yes agree, I just got a few shares this morning.  What do you think of these? MU, LSCC, MRVL, or QCOM"
7/1/2021 10:41,stocks,">LRCX & ASML

Performance these two companies seems to be very similar.  However, ASML looks like its more focus, more moat?  I like both though."
7/1/2021 13:17,stocks,"it has really some nice drops that always recover, just sit around long enough and you can make some good money."
6/30/2021 23:07,stocks,"first time I heard of this company, shows how much I know!  Apparently its so dominant its a small monopoly in some ways.  I think this is good one to get into.  Where did you see 2 weeks ago?"
7/1/2021 1:21,stocks,"Now might be the time to get in, it's been hitting resistance at $700 and been kinda trading sideways around there. I've been watching it for a couple months now too and it's just been going up and up but it finally dipped and I bought in a week or two ago."
6/30/2021 21:57,stocks,Really dig into that one. Their EUV is an amazing advancement and one that no one else has.
7/1/2021 0:30,stocks,Bought in big last year at 11 for ON when I found out they were making chips for medical equipment. Sold half a while ago and am so glad I kept the other half because they’ve  done nothing but stay consistent and bounce off the 35 wall. Definitely a stock you’ll regret not holding long term. Just my thoughts.
6/30/2021 21:29,stocks,Love MU. Owned it when it was in the 40s and sold in the 60s. Regretted selling it ever since. Wanted to buy it again but I have trouble paying 80.00 for something I bought for 40.00 once… mental block lol
6/30/2021 23:49,stocks,"I was literally researching the same thing as you. I looked up MU and TSM on Yahoo finance and its got a “people also watch” list which has AMD, QCOM, NVDA and ASML listed. 

Had a look at Screeners in Yahoo finance as well. Theyre at the top if you filter for Technology > semi conductors"
7/1/2021 9:55,stocks,thanks jumping in on this now
7/1/2021 13:41,stocks,"options for july just dropped tremendously cause of today, might pick up some calls on this dip it looks like this stock is relatively volatile and some calls definitely have the potential to make some money"
7/1/2021 9:55,stocks,thank you.  I'm gonna go a bit in on ASML
7/1/2021 0:00,stocks,"75500 into ETF (Canada) Hi, 

I have 75500 to invest into a TFSA.  I was thinking of putting it all into VFV.TO.  This is long term.  Would you suggest I put it all into this ETF or should I spread it around in a few.  Also is there a point in scaling in or just all in buy?"
6/30/2021 21:44,stocks,"There is no mathematical reasoning for scaling in.

I still do it, to protect my sanity if I'm using a huge position. It really shouldn't matter tho"
6/30/2021 22:16,stocks,"The ETF spreads it around for you. Unless you want to specialize.

Although people will tell you it is statistically better on average to put it in all at once this is not correct. An individual is subject to unfavorable market fluctuations shortly after they buy. If you have a 10 year time frame take about 20% of the time to average in, hold and 20% of the time to average out. That would be 2 years averaging in, hold, the last 2 years to average out. It's like insurance, it might cost you a little in missed returns but it might save you a lot. If the market happens to crash then throw it all in.

r/CanadianInvestor"
7/1/2021 0:11,stocks,I would buy cp rail they will always be needed and they pay a dividend
6/30/2021 21:40,stocks,"If you do want to go the ETF route it may be worthwhile adding one with more mid/small cap exposure as well as international or be lazy and go total stock market (VTI). There’s lots of good tips on the ETF board. 

If you decide VFV.TO is your preference I would scale in. 16 of the last 20 days were green

(Edited for typo on ETF)"
6/30/2021 21:19,stocks,"If it were me, I would make sure I could sell call contracts, purchase 100% of a single stock, and sell call contracts that expire weekly or bi-weekly and take $ month by month. 
Stock goes over strike price, you profit tax free plus premium. 
Stock doesn’t rise, you take premium. 

I’d personally probably buy apple or IBM 

You get taken out you profit. All tax free"
6/30/2021 22:11,stocks,"Na don’t put it all into one ETF. Diversity, buy some Apple, Microsoft, google, etc. Literally can’t go wrong. Also I wouldn’t just toss it all in, I would wait for a dip and start taking positions. Start with half and then buy more if it dips even lower. But if really long term like 5 years plus u could just toss it all in as it won’t matter."
6/30/2021 22:04,stocks,"Reducing variance on your total portfolio is a mathematical reason for scaling in, at a cost of reducing your expected return. It's a question of personal risk preferences."
6/30/2021 21:21,stocks,You only profit off strike price if the buyer chooses not to exercise though
6/30/2021 22:13,stocks,"Ok let me run an example and you tell me if i'm right.  I have never wrote call options before.  So I can buy around 550 apple shares with $75500.  lets say I write contracts worth 500 shares.  That's 5 contracts. Say the contracts are worth 2.02 with Jul 9th expiry. I would get $725 for the contract.  If the price stays below share price + option price per share, the contracts become useless and i keep the shares and the contract fee.  If it jumps up say $10, my shares are taken away at what I paid for them and i keep the money for the contracts $725.

2 downsides: if the stock goes up a lot i miss out on the profit.  

If it crashes I'm stuck with the bags.

Correct? So a gain of about 1%"
6/30/2021 22:13,stocks,Don't buy an ETF of the S and P 500 to just buy individual stocks of those companies instead? Can't believe the garbage advice people put on here lmao
6/30/2021 21:47,stocks,"The money is in the options.  You want an ETF, there are a million financial advisors who will “get” you your 4% a year."
6/30/2021 22:23,stocks,"No. But close. 
You choose the strike price. 
You can get 500+ shares
 $148 OTM calls are .45
.45x 100= $45 
5 contracts = $225 premium.  Deposited into your account.  

If shares hit $148, you get paid $148 per share.  An $11 per share increase in 10 days going with July 9 expiry.  $5,100 in 10 days. Now you can do same thing except take that your starting with 80,000

If price goes to $158, you get $148 and the gambler gets the stock at a great price. 

Pick a strike price you would be happy with, and a stock you would be happy keeping long term 

TFSA is all tax free

Do this for a few months, $$600 per month for 24 months.  Adds up. Plus you still have the stock, which hopefully is growing.  

Sorry typing on cell phone so may be scattered"
6/30/2021 23:01,stocks,Yea man telling people to buy the best companies in the world is garbage advice. U realize buying individual stocks gives you more exposure than the ETF would.
6/30/2021 22:32,stocks,"Thanks for taking the time to explain (this stuff should be thought in high school)

So let me try again with an example:

I buy apple today at 136.92.  So i can buy 551 shares.

Looking at the options, I choose a monthly at $143 strike price.  For easier math I can write 5 contracts.  The contracts sell for $750.

I get to keep the $750 whatever happens correct? and if the price sky rockets and the call gets exercised i would still make (143 - 136.92) per share? + $750?"
7/1/2021 0:00,stocks,"Why I believe that Builders FirstSource Inc. ($BLDR) is undervalued Hello there everyone. This is my first analysis on a company, so I would appreciate criticism more than anything else. With that said, let us get down to business:

# Overview

""Builders FirstSource is the largest U.S supplier of building products, prefabricated components, and value-added services to the professional market segment for new residential construction and repair and remodelling. We provide customers with an integrated homebuilding solution, offering manufacturing, supply, delivery and installation of a full range of structural and related building products. There are 550 locations across 40 states."" ( [Builders FirstSource | Building Supplies & Materials (bldr.com)](https://www.bldr.com/) )

Market Cap = $8.83B

Sector =  Producer Manufacturing

Net Sales (9/30) = $12.8B

Their most recent press release (06/29)  on the acquisition of  WTS Paradigm, LLC shows that the company is still interested in expanding and improving on their business model.  ([https://investors.bldr.com/node/15296/pdf](https://investors.bldr.com/node/15296/pdf))

&#x200B;

# Fundamentals

The last time the stock did not meet earnings expectations was on the 4th of August in 2016, but since then all the company has been exceeding expectations.

The stock has a P/E of 12.52 ( [BLDR Builders FirstSource, Inc. Stock Quote - finviz.com](https://finviz.com/quote.ashx?t=BLDR&ty=c&p=d&b=1) ). However, the average P/E ratio of the  building materials sector is 28.19 and this is expected to increase by 15.28% in the upcoming five years ( [Price Earnings Ratios (nyu.edu)](http://pages.stern.nyu.edu/~adamodar/New_Home_Page/datafile/pedata.html) ). This would signal that the stock is undervalued according to the sector's average... which is also expected to grow.

The current profitability levels for the company are sitting at: +6.35 for the present operating margin and +25.11 for the gross margin.  It has an EPS of 3.40.

The net margin for Builders FirstSource Inc. stands at +3.66. The total capital return value is set at 19.88, while invested capital returns managed to touch 11.81. Equity return is now at value 23.70, with 9.00 for asset returns.

Based on Builders FirstSource Inc. (BLDR), the company’s capital structure generated 165.26 points at debt to equity in total, while total debt to capital is 62.30. Total debt to assets is 45.65, with long-term debt to equity ratio resting at 157.54. Finally, the long-term debt to capital ratio is 59.39.

&#x200B;

# Technicals

[https://www.tradingview.com/x/0q5DNdQB/](https://www.tradingview.com/x/0q5DNdQB/)

* The stock is sitting 2.55% above the 200 SMA. The last time that contact was made with the 200 SMA was in July 2020.
* The RSI is at 41 and the Laguerre RSI is sitting at 10.
* The price is sitting near the 1.61 Fib retracement level that is acting as support. T
* The stock is labelled as a strong buy by analysts too. Following the recent drop, this would be one of the fairer moments recently to accumulate shares.
* It has a 65-day average volume of 3.02M

&#x200B;

# One Year Price Targets

\~ $66.23 ( [BLDR | Builders FirstSource Inc. Analyst Estimates | MarketWatch](https://www.marketwatch.com/investing/stock/bldr/analystestimates?mod=mw_quote_tab) )

\~ $65.70 ([https://gov.capital/stock/bldr-stock/](https://gov.capital/stock/bldr-stock/))

\~ $65.00 ( [Builders FirstSource, Inc. (BLDR) Stock Price, News, Quote & History - Yahoo Finance](https://finance.yahoo.com/quote/BLDR?p=BLDR&.tsrc=fin-srch) )

\~ $64.50  ( [https://www.etoro.com/markets/bldr/research](https://www.etoro.com/markets/bldr/research))

\~ $53.40 ( [https://walletinvestor.com/stock-forecast/bldr-stock-prediction](https://walletinvestor.com/stock-forecast/bldr-stock-prediction))

\*\* This is an average upside of 64% off the current price of $42.66 in the upcoming 12 months

&#x200B;

# Risks

The company is witnessing inflation related to raw materials. During January and February 2021, commodity costs grew to its all-time high. The company is encountering supply-related challenges with respect to some of the products including OSB, plywood, lumber and particleboard, thereby leading to the price hike.

Although the demand for single-family residential housing remained very high, the company faced troubles meeting those demands due to labour and material-availability constraints.

The company witnessed volatility in the lumber market throughout 2020. Being a nationwide supplier of building material, the company is very susceptible to fluctuations in market prices for such commodities.

&#x200B;

\*\*My current position is $116 shares at $41.95 and I plan on holding them for the next 3 years."
7/1/2021 0:45,stocks,Interesting. Will add to the watchlist
6/30/2021 21:33,stocks,They almost doubled their shares in the past year. And with that… I’m out.
6/30/2021 20:31,stocks,"Good first analysis...I've followed bldr for many many years... occasionally I do trade it...

However I don't see a big near term catalyst...

This is a long term play for you?"
6/30/2021 20:31,stocks,I do see that at the end...3 years...well anything could happen and they are solid
6/30/2021 22:28,stocks,These guys are making (and have made) some big acquisition and merger moves though
7/1/2021 1:39,stocks,Try finding a stock that hasn't doubled at least once since last year.
7/1/2021 0:00,stocks,"Question: If we get super high inflation/hyperinflation… Question: If we get super high inflation/hyperinflation… won’t stocks just adjust prices to match that new currency level eventually? Ie if we have a $100 stock and we have money devaluation of 50%, won’t that stock go to $200 because in efficient markets that company will just adjust its prices to collect more money for its products or services? I understand there will be a lag time in this happening but won’t that generally be the final result? Anyone know?"
