Timestamp,Subreddit,Post/Comment
2021-04-30 07:09:37,stocks,"In my useless opinion, I think it bounces off 3550-3570 early, and could fall as far as 3390 again

But it's range is much tighter than it has been since early July 

Should be a new channel forming and I will add to my position if it dips today"
2021-04-30 09:18:06,stocks,Whole portfolio is red 😂
2021-04-30 09:42:59,stocks,It’s continued to slide. I would wait till it stabilizes or just slowly start DCA in
2021-04-30 10:40:06,stocks,Ooooof
2021-04-30 15:04:11,stocks,"if you have the money, you could hedge your bets and buy a little now and a little on monday."
2021-04-30 15:55:47,stocks,"Doesn't matter, buying in +-2% isnt going to change a whole lot and it trains you to think you can time the market which will in the long run give you  bad habit and cost you gains."
2021-04-30 08:57:34,stocks,Can you explain just a little more? Not being snarky.
2021-04-30 10:06:15,stocks,How is that good? That's worse off than any of the major indices
2021-04-30 10:13:51,stocks,ARKK is an ETF and it's a fat pile of turd right now
2021-04-30 10:32:28,stocks,"Don't buy something right away just because you have cash, find something you really believe in"
2021-04-30 10:26:19,stocks,ETF until you have a good plan.
2021-04-30 15:22:27,stocks,"no you wouldn't, just buy the S&P sometime during the coming correction and you'll outperform cash"
2021-04-30 08:29:40,stocks,When it actually crashes 😂
2021-04-30 08:20:06,stocks,WWW shape recovery
2021-04-30 09:18:58,stocks,When the undertaker gets the folding chair
2021-04-30 08:55:01,stocks,">this

as in the s&p just going straight up without a correction? I think it has already reached that point. Every indicator has been screaming overbrought for weeks and put buyers are losing it all."
2021-04-30 16:26:30,stocks,This bear market needs to end.
2021-04-30 10:57:53,stocks,$PSTH?!
2021-04-30 11:35:54,stocks,I don’t recommend it.  They basically admitted that they don’t really have any idea how to further grow the company.
2021-04-30 11:32:58,stocks,"2k worth of PINS

Every analyst remains bullish, long term. They even seem a little confused at the size of the sell-off. Everyone seems to agree the platform is undermonetized and so, despite slowing user growth, should continue to increase profit."
2021-04-30 12:15:12,stocks,$500 worth of PINS at 66.71.  Cmon baby rise up!
2021-04-30 12:24:07,stocks,Buy PINS
2021-04-30 11:35:11,stocks,"Twitter isn’t a ‘dip’, it’s just a company shifting to a lower and more accurate price.  PINS is better, though still pretty risky."
2021-04-30 13:20:06,stocks,Do you prefer a roll of toilet paper to go over the top or underneath?
2021-04-30 14:36:52,stocks,AMD
2021-04-30 14:50:51,stocks,"If I had to choose, AMD"
2021-04-30 14:53:47,stocks,NVDA
2021-04-30 14:41:57,stocks,Hoping there is a earnings run up and im dumping this shit stock at my cost basis. Even if they smash earnings this market is unpredicatable.
2021-04-30 14:57:22,stocks,Down 13% here. Good thing is on a day like this there are much redder things on my account.
2021-04-30 16:02:29,stocks,BABA
2021-04-30 16:01:25,stocks,Goog and fb
2021-04-30 16:17:35,stocks,PayPal has earnings next week on the 5th. Definitely gonna use those to evaluate my position on it right now. I think I am still a bit too exposed to tech and PYPL has been getting it particularly bad on a day the NASDAQ gets punked.
2021-04-30 17:08:36,stocks,LIGMA looking good
2021-04-30 16:16:24,stocks,"Definitely not a shitty week in terms of earnings results, they were all great numbers. What's crazy is the fact that these companies managed to fall despite great reports. I don't see it holding through next week."
2021-04-30 19:19:24,stocks,I know I sound like an idiot... but I thought once mergers were announced they were more or less done. I guess you live you learn
2021-04-30 19:59:03,stocks,Same with Apple
2021-04-30 07:04:24,stocks,cause green helped pm helped so much yesterday
2021-04-30 16:15:58,stocks,"Just like yesterday..

I don't like these sort of days. How is the stock market any fun this way? What a lame rollercoaster."
2021-04-30 07:00:45,stocks,"Logic...you see that's where you're going wrong.

“Markets can remain irrational longer than you can remain solvent.” ― John Maynard Keynes"
2021-04-30 12:24:27,stocks,Since day 1
2021-04-30 15:28:21,stocks,Just curious... when did you start investing?  Was it this year?  It's definitely been a wild ride for people who got into the market for the first time any time this year.
2021-04-30 15:30:01,stocks,Same
2021-04-30 08:22:45,stocks,"Tough call imo

I personally do not think all of these companies are going to make it, so you have to decide what you think

TSM will come back no doubt

NIO is a crapshoot"
2021-04-30 10:33:01,stocks,"Double their stock. So yes, dilution."
2021-04-30 10:12:45,stocks,[deleted]
2021-04-30 10:37:45,stocks,"Stagnant user growth.  They will continue making money for a while, but there’s not anything to support future growth being likely."
2021-04-30 10:55:12,stocks,I haven't checked twitter since the orange blob was kicked off
2021-04-30 10:34:12,stocks,No future
2021-04-30 10:54:38,stocks,Still listed as pending for me.
2021-04-30 12:58:17,stocks,It might dip it might not. Still overvalued by a lot
2021-04-30 13:42:53,stocks,Airlines doing good!
2021-04-30 13:34:37,stocks,BRO has had a good week.
2021-04-30 13:37:44,stocks,Shipping is doing is well. Safe Bulkers is up 16% right now
2021-04-30 13:50:06,stocks,COF for me. Consistent as rain in the sunshine state.
2021-04-30 14:37:39,stocks,"every fuckin stock so far has pretty much given up its earnings gains like it never happened.

great earnings are not getting rewarded

Look at fuckin AMD sinking from $89 to $81 on a fuckin 33% increased guidance."
2021-04-30 15:13:09,stocks,I've enjoyed using the Yahoo Finance app. Pretty much has everything I'd want.
2021-04-30 15:20:17,stocks,AMZN
2021-04-30 15:27:10,stocks,Not going there until the market share bleeding stops
2021-04-30 15:28:15,stocks,July $65 options are dirt cheap. An easy way to dip your toe without committing much
2021-04-30 17:04:46,stocks,Its going to go down more
2021-04-30 14:02:17,stocks,"Apple: earnings per share up 35% in Q1 -> down 2% in the last week.

Gamestop: “Apes going to da moon any day now!” -> up 18% in the last week.

Fuck, maybe they are right.  Who the hell knows these days."
2021-04-30 14:05:09,stocks,You're doing it wrong. If you see quality stocks down then you should buy some.
2021-04-30 13:21:29,stocks,The market has been crashing / correcting for 3 months. Energy and some tech down +50% in that time hope you dodged it
2021-04-30 13:48:52,stocks,I should have known it was going to sell off again
2021-04-30 17:18:39,stocks,"I'm honestly shocked at people who buy a company at 30 PE, double it's historic average and then whinge it doesn't go even higher. Earnings were flat 2020 vs 2019 yet the stock price doubled. A massive amount of growth has now been priced in, so it will have to perform brilliantly for an extended time period to keep moving up."
2021-04-30 08:53:42,stocks,"Nah - end of week, and end of most big tech earnings. Just profit taking."
2021-04-30 08:36:55,stocks,[deleted]
2021-04-30 09:23:46,stocks,Pulling out their money before the massive new capital gains taxes.
2021-04-30 08:04:44,stocks,"I would buy them if they were on US exchanges. Great earnings to their name, evidently they're an established company in the industry. I just invest in them through ICLN."
2021-04-30 09:48:20,stocks,Double digit moves are a daily occurrence for penny stocks.
2021-04-30 08:41:13,stocks,r/pennystocks
2021-04-30 08:41:56,stocks,"Same with Boeing the next day multiple countries banned their 777 model - BA went up for days. It's not an answer to your question, I'm just saying who the fuck knows what's going on any more."
2021-04-30 09:47:45,stocks,TGT is a very strong company. If you're more confident in it than ABNB go for it.
2021-04-30 09:51:12,stocks,If you are talking 1 or 2 shares why not just invest in spy/vti.
2021-04-30 10:27:27,stocks,I was just thinking about selling my TGT shares to buy more ABNB and JETS
2021-04-30 10:29:27,stocks,"Personally prefer TGT over ABNB. I feel like the chance of additional regulations (both domestic and international) can really hamper the company's growth. Also, from a personal standpoint, I think it's really shitty that people are driving up cities' rent prices by listing private properties on these sites. VRBO is also another big player in this space, so I wouldn't say Airbnb has a monopoly (as some would claim)."
2021-04-30 09:52:24,stocks,Make sure you're keeping track of regulation. There have been stories lately about the feds wanting to potentially ban flavorings (e.g. menthol) and reduce nicotine levels.
2021-04-30 10:09:39,stocks,"Same thing with BA. I thought about buying it around 100 then it soared to 125 and I was like nah, too high

Of course it doubled since then..."
2021-04-30 10:30:33,stocks,DKNG
2021-04-30 10:40:54,stocks,Yes. In Details
2021-04-30 11:06:31,stocks,"I sold a stock for 40% profit. It went up after I sold.

Bought stocks with said sale. they went down"
2021-04-30 11:31:35,stocks,"Nice, what stocks are you in?"
2021-04-30 13:10:11,stocks,"I think you've already missed a lot of the run up unfortunately. The time to buy was back in October.

Chevron for $72 is one of the best stock buys I've ever made."
2021-04-30 13:37:44,stocks,Avoid oil companies and invest directly in oil futures via ETFs. This summer is going to be wild
2021-04-30 13:36:35,stocks,Buy equal portions of GUSH and DRIP.
2021-04-30 15:22:11,stocks,I like FANG
2021-04-30 13:06:22,stocks,"Because fuck ETSY, visit my subreddit /r/ETSYsucks we need more members"
2021-04-30 13:48:50,stocks,A quick glance at their respective betas on Yahoo finance says yes. 0.72 vs 1.
2021-04-30 13:52:16,stocks,"I have some shares and I am kicking myself. I bought the hype, but their demo day was sooo bad. Then their ceo compensation was shared. I’m kicking myself. I might take my loss and move on. 

You should go look at their demo day and ask yourself if that is a cutting edge product or some bullshit from radio shack 40 years ago."
2021-04-30 13:58:50,stocks,I have wondered the before too but I think it's just a scam by law firms. How could stock owners sue for losing money?
2021-04-30 15:03:31,stocks,"As long as the years were appropriately selected when you contributed, you should be fine.

You didn't mistakenly contribute to 2020 earlier in the year did you? If so, that would have obviously put you over the 6k limit for 2020."
2021-04-30 14:59:53,stocks,Ur fine
2021-04-30 07:30:24,stocks,Nice day to buy.
2021-04-30 07:32:36,stocks,Spread them buttcheeks
2021-04-30 08:57:45,stocks,LUBE up 10% pre market
2021-04-30 10:50:24,stocks,My small caps in my portfolio are getting fucked the past month. Down like 15% on a couple.
2021-04-30 10:42:30,stocks,"SPY is down half a percent bro, relax."
2021-04-30 08:29:27,stocks,"Fine dividend and growth. Enormous P/E for a coffee shop of that size, and lots of debt. Probably fine in the long run."
2021-04-30 08:50:26,stocks,"> Thoughts on Starbucks?

Their coffee tastes like chalk."
2021-04-30 09:43:16,stocks,"That's the risk of having everything in one stock, also apple is long term anyway, so you just have to go through the pain"
2021-04-30 09:45:07,stocks,"Why though?  That's an investment that's going to make you a lot of money down the line.  What would you do with your profits?  Buy something nice for yourself?  Reinvest?  Where?  Where would you reinvest that's significantly better than Apple?

One option would have been sell to cover your principle but with Apple I don't even think that's a good strategy."
2021-04-30 12:29:54,stocks,"I think it was over-exagurated. The Nikkei 225 closed down 0.88%, which is what I assume they're referring to."
2021-04-30 14:14:20,stocks,YIKES index mooning
2021-04-30 07:37:32,stocks,I’ve been buying the dip for the last 2 months... I hope it will pay off!
2021-04-30 11:56:18,stocks,"If you're down 6% compared to a flat market, your portfolio is not nearly as diversified as you think it is."
2021-04-30 13:00:51,stocks,6% in one day?? What do you hold?
2021-04-30 15:30:40,stocks,VTI’s still up almost 6% this month.
2021-04-30 15:29:18,stocks,market rebound right on cue lmao
2021-04-30 08:13:52,stocks,"I was really disappointed with my ARK ETF's, so I dumped them a while back and got IYR and IVOV, both of which have done quite well for me."
2021-04-30 08:11:17,stocks,Also means if there is another NASDAQ correction they have a lot of downside.
2021-04-30 17:20:42,stocks,How does you portfolio looks like if you don't mind sharing. I am down a few percentage points this week and am working to change my portfolio.
2021-04-30 18:13:22,stocks,I can't even believe that Robinhood would do something shady to screw over their users.  Simply unheard of.
2021-04-30 10:34:55,stocks,"I don’t have Amazon, Apple or MSFT because most of my money is in my 401k which is all VOO so I already have guzzilion $ of all those companies. Just want to diversify a bit."
2021-04-30 11:58:35,stocks,I feel personally attacked.
2021-04-30 10:31:57,stocks,I don't own it because I don't like the company. So there's that.
2021-04-30 10:29:21,stocks,Not many people like this entry point.
2021-04-30 12:56:28,stocks,"gonna be a theme this year.

take your profits when you can, and don't hold through earnings if you're up.

I left $700/contract on the table for an AMD call after earnings.

i didn't cash out of AAPL at 139.

i lost on TWTR, ENPH, PINS etc etc all went to shit after earnings."
2021-04-30 13:48:45,stocks,"lol bruh chill, Google is up 15% up for the month and 2% up for the week, it's just a regular red day"
2021-04-30 06:23:02,stocks,"Sometimes the whole thing seems coordinated. All the stocks I follow were buying up until the bell yesterday and then immediately after close everything turns red. What mechanism would cause this? If these post market sellers intended on selling before today then why not just sell before the close?

If billions of sell orders are placed after market then the pullback can be fabricated to generate buying opportunities. I have no hard evidence I just feel manipulated."
2021-04-30 12:41:11,stocks,"Tesla up 4% while the S&P is down 0.65%, it's incredible."
2021-04-30 12:21:24,stocks,Volatility
2021-04-30 12:24:11,stocks,It also went down yesterday for no reason.
2021-04-30 14:00:34,stocks,it_0vers01d_hard_yesterday
2021-04-30 16:13:31,stocks,"uh, April was the best month for the Nasdaq since December, so it wasn't a slog for any of the major averages, I think it's more problematic that overall the Nasdaq looked fantastic this month (even with a disappointing finish) and more speculative stuff ""still"" was not able to do anything.

Nasdaq/.IXIC: +5.4%

ARKK: +0.68%

That is...ummm, a problem and major warning shot for more speculative investments given what the story was from February 12th to early March. The two Nasdaq indices traded to the highest they've ever traded in this month and ARKK is not even close to where it was the last time .IXIC was around 14k or above it."
2021-04-30 16:26:00,stocks,"... April was not on a slog, it was record days man."
2021-04-30 08:01:28,stocks,ATER is up 3.38%?
2021-04-30 08:30:29,stocks,"If its all you have to invest then that's a good strategy, but if you already have the money sitting there, don't drip feed it. It's better to put it all in the market in one go."
2021-04-30 08:42:06,stocks,https://www.investopedia.com/terms/d/dollarcostaveraging.asp
2021-04-30 08:56:14,stocks,Putting regular amounts of money into stocks is a popular strategy. It helps even out risks because theoretically your buying an equal amount while the market is doing well and the market is doing not so well
2021-04-30 09:27:10,stocks,"If you're doing it as a habit and discipline of always having every cent you can be invested as quickly as possible, then great.  

If you are more of a trader though, and have the discipline to set aside savings to create ""large sums"" (your words) that can be deployed when the price is right, that will be a more rewarding strategy.  

Contrary to the biggest myth in stock markets (that *you* can't time the market yet everyone else can) there are fairly obvious times when certain stocks are up or when they're down.  Using your lump sum to buy a high quality stock that just happens to be beaten down one day will fare much better than following the widely misunderstood DCA strategy."
2021-04-30 08:36:43,stocks,"who's your broker?

Darktrace has already launched under the ticker DARK"
2021-04-30 10:10:01,stocks,"Lol read read read, listen listen listen, to everyone, even people you don’t agree with 

Then just buy VOO and QQQ and use some play money to buy stocks you like."
2021-04-30 10:47:08,stocks,"I'm not too sure of what its actual results were, but given the story of what happened from mid-February to early March in the market, it needed to completely and utterly blow out its quarterly results to garner interest.

Yep, a beat wasn't enough here, it needed to be a total blowout."
2021-04-30 11:37:30,stocks,I think all solar stocks are hurting right now. Supply chain/material cost issues
2021-04-30 11:22:04,stocks,"SCHD and VTI. cam NEVER go wrong with them.

SCHY is new and international schd basically. Ita cheap rn"
2021-04-30 11:19:36,stocks,VTI
2021-04-30 14:17:31,stocks,Costing up or costing down doesn’t really matter.  Is the current price a good price today?  Do you think its going to go up?  Buy some.  Doesn’t matter if you bought at an even lower price before - if it goes up more you will profit on both the original investment and the added money.
2021-04-30 14:22:10,stocks,"On 12th may inflation CPI data is released. Will likely be high. Markets could slide in the run up to this release. Wait until then to buy. If markets not tanking at open on 12th may, will be a good buy in time."
2021-04-30 15:16:45,stocks,SMH
2021-04-30 14:25:36,stocks,SPY
2021-04-30 15:02:27,stocks,Yes
2021-04-30 15:45:58,stocks,"The only thing I can think of is tax loss harvesting. Bought some VTI, some lost value, so you sell those and buy SPY."
2021-04-30 15:51:09,stocks,A crescendo?
2021-04-30 16:09:05,stocks,"Well.. if this week taught us anything, wait until a day or two after and then buy a lot."
2021-04-30 11:52:07,stocks,Why Spotify? I understand it has dipped a bunch but actually turning a profit with artist pressures is going to be difficult
2021-04-30 13:54:46,stocks,"Everything is overpriced and at artificial prices. 

Also red days are mandatory."
2021-04-30 15:54:31,stocks,I have 55 mostly small and mid-cap.  Half are red and Half green so up only 1%
2021-04-30 14:24:59,stocks,Lol you’re getting destroyed? Down .16% here
2021-04-30 07:38:47,stocks,"VW is a second biggest automaker with a loyal customer base and premium brands, such as, Audi, VW, Porsche and others. It will not be left behind by the switch from ICE to EV. Sold under 300K EVs in 2021 (ca. 50% of the TSLA), planning to double in 2021 and reach 2million by 2025. It is already leading the legacy automakers in the move to EV. Stock is up over 60% in the past 3 months alone. 

\- Plans to have over 70 EV models by 2030 - much wider choice than any automaker would offer

\- Partnering with QS on solid state battery that could be a game changer  

\- Looking to operare over 18K battery stations in Europe and plans to have similar model in China

Like all automakers VW has it's challenges - namely in VW's case - Euro exchange rate, China competition and the lingering emissions scandal. Having said that it is better placed than most auto makers with their growth potential 

Deutsche Bank in their March note think VW would be worth 400Euro per share (currently at 217Euro) if it were to be valued on a price to sales multiple like TSLA or NIO and that's without taking into account the premium subsidiaries of Audi and Porsche."
2021-04-30 07:04:01,stocks,"VW, GM and Tesla all seem like the big players in the future EV market"
2021-04-30 07:28:37,stocks,"I’m sitting on 100 shares, I wish I never bought it"
2021-04-30 10:24:25,stocks,Gonna throw out a wild and crazy guess that they said something concerning in their call/report
2021-04-30 11:56:50,stocks,What did you buy?  The market is well-above Feb high?
2021-04-30 08:12:52,stocks,AAPL?
2021-04-30 08:02:39,stocks,EU is broke as hell and they are suing anyone and everyone to try to get some cash flow
2021-04-30 07:09:07,stocks,"I have been considering getting a seeking alpha subscription but it does seem hard to justify. The news is available for free if you're willing to search around each day and anything available to retail traders is most likely behind, plus their contributors have a bias (as do we all) which mean that they're similar to the good posts on here which give you an idea to research more rather than any direct guidance. However, the information is all together and I like the number of articles posted as it lets me read a lot of differing views on a stock to compare to my own thoughts.

I am struggling to see if it is good value though and would be interested to know why you were looking at it."
2021-04-30 13:54:35,stocks,I think oil is a really solid play over the next 12 months.
2021-04-30 14:49:15,stocks,How did you gain so much yesterday?
2021-04-30 11:14:21,stocks,Stop selling and hold
2021-04-30 11:18:36,stocks,I know the feeling. It's all learning. I bought shares of BTX at like 5 dollars and sold when it dipped a bit a few weeks ago. It's been running now lol.
2021-04-30 11:43:34,stocks,">Randomly guessing and following trends didn't immediately show a profit

Shocker"
2021-04-30 11:47:25,stocks,Interesting take given that basically everything is red except for VIX
2021-04-30 13:53:32,stocks,That equates to they are doing so good it seems like they cant possibly do better so ill dump a company that is doing amazing. Seems nonsensical to me.
2021-04-30 09:17:28,stocks,"> Notice how before earnings calls big companies will hype up their business by throwing some good news out there, then their stock goes way up for a few days just before it tanks. This can't be a coincidence. 

That's not true.  And it would be illegal to make material announcements during the quiet period.  

You're possibly confusing what bystanders and analysts speculate ahead of earnings season.  That's not the companies themselves doing that.

> Mofos are trying to find people willing to buy their huge loads of stock (whoever those people are). It would be a perfect time to unload.

Again, that's false.  Except in rare and transparent circumstances, the shares you buy don't come from the company itself.  You buy them from other shareholders.  When you buy stock of company XYZ, you're almost never getting it from them.

In the highly rare event they are selling stock, it's highly publicized and done by outside brokers.  You would absolutely know it if you ever obtained stock directly from a company."
2021-04-30 08:01:51,stocks,"It's definitely not the semiconductor shortage to blame. If I had to make a guess, I'd say big money is anxious to see inflation data today. If inflation numbers are good, and we still fall, I'd say it's a simple pullback from the ATH we reached yesterday, probably pushed on by the poor performance of the Nikkei 225 last night. All speculation though, I've no clue what's driving the market, but these are the best educated guesses I can make"
2021-04-30 09:26:43,stocks,"Lmao, do you have any idea how much money is being printed."
2021-04-30 09:54:02,stocks,"[nio says chip shortage will slow deliveries](https://www.cnbc.com/2021/04/30/chinese-electric-automaker-nio-says-chip-shortage-will-slow-car-deliveries.html)

There was an article saying Ford and VM are having the same problem."
2021-04-30 08:15:50,stocks,"I actually think internet advertising is bound to get more regulated. Longterm I would rank them equally, short term Google."
2021-04-30 08:32:48,stocks,"Google have their hand in everything, but not massively, their bread and butter is still ad revenue. So plenty of room to expand in one of the industries they're already in. For example Waymo could explode if they get it right. 

I also think it will get to a point where big tech will be split up."
2021-04-30 09:46:05,stocks,"How have you done with your predictions so far?  I remember you didn't do so good for days 1-4, lol."
2021-04-30 09:41:02,stocks,They didn't split the stock. It will correct downwards. Last quarter was also record breaking jaw-dropping - and stock went from 3500 to 2950 in a month...
2021-04-30 13:42:56,stocks,Weak play psfe can go below 10 doesn't have the traditional spac protection anymore
2021-04-30 13:46:34,stocks,Rumoured yesterday. Amazon had earnings call yesterday after close. No split. So debunked.
2021-04-30 09:43:06,stocks,No
2021-04-30 09:42:18,stocks,Who knows anymore.
2021-04-30 09:48:34,stocks,"Sure, if the overall market corrects

More likely it bleeds for a week"
2021-04-30 16:21:03,stocks,">	This is a put your money in good companies and watch it grow play.

I think people are just disillusioned watching good companies like Apple and Amazon blow expectations out of the water and immediately close the rest of the week red while a joke coin about a dog pops off."
2021-04-30 16:18:13,stocks,"Hey, thanks for thinking your strategy is the only valid one! Love to be condescended to by some rando!

Besides being incredibly stupid advice for anybody under the age of 40, you are wasting SO MUCH time. Just throw money at a safe etf and enjoy your life. I promise, they’re better at this than you are"
