Timestamp,Subreddit,Post/Comment
2021-06-06 23:55:23,stocks,"With all states (including California BTW) doing away with net metering there is no possible financial case for solar panels.  I think it is more likely that California will roll back their solar panel mandate then more states adding it...  It has been a total disaster.

Solar panels are a dying industry and the only traction it ever had was with the possibility of net metering and now that is over, there is no case to be made for home top solar panels.  

It is only a matter of time before the entire industry faces system wide bankruptcy.

But I encourage the folks down voting me to buy all the stock they can.  Everything is discounted right now.  (I wonder why that is?)"
2021-06-06 23:53:24,stocks,"I hope they figure it out, though.
[https://solarmagazine.com/solar-panels/transparent-solar-panels/](https://solarmagazine.com/solar-panels/transparent-solar-panels/)"
2021-06-07 08:27:04,stocks,"Yeah as someone mentioned before we don't really have the tech for this yet, thought there was but I was mistaken, they aren't transparent yet. I was fully aware that such tech wouldn't be as efficient but it wouldn't matter if you've got an entire skyscraper of solar cell windows."
2021-06-07 17:21:08,stocks,Yeah I’ve used Market Rebellion services over the years and their UOA is impressive plus they drop bombs like this when it was like $1.50 or they had us buy Voyager stock Ticker VGYFW at .62 in October and it’s like $19 now. These guys are super smart and worth every penny. Made soooo much money off then over the years. Their Equity Oracle service is nice too.
2021-06-07 01:10:24,stocks,DCA down? I know nothing about the stock but 54 looks pretty far out
2021-06-07 16:47:16,stocks,"I would guess lithium ion batteries will be in use for a while, even after a more efficient storage method is designed.

Longboarding-is-life suggested a video which mentions this. Technological lock-in.

My investment strategy is to look for technology which has a future and invest in companies which produce the raw materials needed for them, as opposed to the tech companies themselves."
2021-06-07 15:09:45,stocks,"Planned obsolescence is nothing new, but that's mostly on the consumer side. people buy a $50 coffee maker that will break from 3 coffees a day over 5 years. 

In a Dunkin Donuts, their coffee machines cost a thousand, and handle hundreds if not thousands of coffees a day.

On the other hand, if a power company is paying to replace batteries every 3-5 years, I'd assume any business would look for an alternative if there was one available.

[This video](https://youtu.be/-PL32ea0MqM) goes through the issues of using lithium ion batteries and proposes that liquid metal batteries are a better option. Now nobody knows which mix of energy storage technologies will become commonplace, but lithium ion seem like  a temporary solution at best."
2021-06-07 01:43:52,stocks,"Let's be real here, analyst PTs are 99% bullshit."
2021-06-06 23:51:45,stocks,"That’s insane.  When we’re saying efficiency here, does that mean how well it actually does what it’s supposed to?"
2021-06-07 01:18:40,stocks,100 miles is 160.93 km
2021-06-06 21:58:10,stocks,SolarCity was created by a relative or close friend of elon (can't remember which) and then Elon bought it out while grossly overpaying. The entire transaction was highly criticized for being sketchy.
2021-06-06 23:37:38,stocks,So I’m assuming you believe the government won’t stick to their promise?
2021-06-06 23:59:02,stocks,"Ok without net metering does solar powered energy stop powering up house utilities? It does, so what's the exact problem? Roi being bad/long?"
2021-06-07 16:19:08,stocks,"Outstanding counterpoint, I really appreciate that.

I'm not up to speed on battery chemistry, something to look into.

I'll keep an eye on Professor Sadoway's findings for sure, thanks man"
2021-06-07 00:10:33,stocks,It turns 21% of solar energy into usable electricity. This is remarkably high for a standard PV cell.
2021-06-07 03:42:48,stocks,Good bot
2021-06-06 23:10:32,stocks,Tesla's Power Wall Solar/home back up Power Batteries use Tela batteries and may be the best in the business. Tesla's solar roof are conventional looking roofing tiles that produce solar energy. Both are considered by some to be as game changing as Tesla's cars.
2021-06-07 11:41:27,stocks,"They will, most likely, but it’s already priced in quite a bit, isn’t it? The high potential for return OP is looking for has already passed. Like the bozo bragging about his 1000% gain. Ya. That’s not going to happen again."
2021-06-07 00:03:32,stocks,There has never been a ROI case for solar power.  With the end of net metering the financial case for solar power just gets worse.
2021-06-07 00:12:20,stocks,Ok got it.
2021-06-07 11:42:40,stocks,Oh okay I see what you’re saying.
2021-06-07 01:45:51,stocks,Hmm so you have no idea what you are talking about then.
2021-06-07 07:21:40,stocks,"yup...  No confirmation bias on your part at all...

[https://www.detroitnews.com/story/business/2021/05/24/solar-power-costs-surge-after-decade-decline/5243384001/](https://www.detroitnews.com/story/business/2021/05/24/solar-power-costs-surge-after-decade-decline/5243384001/)

[https://www.solarreviews.com/blog/big-changes-for-california-net-metering](https://www.solarreviews.com/blog/big-changes-for-california-net-metering)

https://www.dailyrepublic.com/projects/home-seller/solar-panel-leases-a-growing-problem-for-home-sellers/"
2021-06-07 00:00:00,stocks,"through my job instead of a pension plan they give RRSP to sunlife first time I've looked and have questions I'm looking through I have about 10 thousand in investments, Everything is mainly in bundles though them with some room to personalize. if I go with a high risk bundle are these type of company's very good at what they do? should I do my own research and try to personalize my own portfolio ? I'm pretty new to all of this so any help is welcomed"
2021-06-07 10:47:08,stocks,"My employer also had their RRSP's with sunlife. At the time i knew nothing about investing and the salesman cant help you with your selection. He will show you the most popular funds and thats about it.

Bench mark the funds to the S&P and the NSDQ for comparative returns, remember the 1y returns will be crazy high because of the covid rally.

Look at the funds holdings and the sector it is focused on. Note the weighting for the top 10 holdings and you will figure out where most of the returns are going to come from.

next evaluate the companies themselves. Are they companies that you would invest in personally?

lastly look at the expense ratio. keep in mind that will come off your account in fees every year regardless of what the market does.

now you could go with growth orientated funds or more towards money market funds, the key benefit here is the employer match. That might be the only reason i personally would sign up."
2021-06-06 21:07:34,stocks,Usually they are pre set. But it varies. You should be able login and look through them. But yea upgrading the risk will most likely be the right move for long term
2021-06-07 00:00:00,stocks,"AMC Stock Holders - Pitch for AMC Subscription Service - Cable and Streaming - Your Thoughts. As we the investors and are now owning 80% of the shares, I wanted to toss an idea out to the group.   


I think that the Big Ten Network or HBO, serves as a great example of how AMC could create a market that requires cables services that gives people a theater experience at home and could really bring a great experience to streaming services. So here is my idea. I am a game dev, so I would like people closer to this industry to take hold of the idea, and drill into how good or bad the idea is and take control of it and see if a pitch could be taken up for review. We could form a team to present and bring it up in a share holders meeting.  (Be actual adults who hold shares, be apart of the process to fix the company)  


So here is the service.   


What do you watch on the service?   
I think we follow the same setup standard TV channels follow with a pattern style of movies at exactly known hours. So people are never surprised about what movies will be on and what time.   


M-F you know exactly what genre of movies come on around what time. TBD what those are by research. During the morning it could be cartoons and then as the mid-day pushes in more old time classics and then I feel every night at 9pm having the prime-time movie.   


Before each prime-time movie you have exactly what you have at a movie theater. Previews of what is coming out at the movies and on our channel on release dates.   
I also did like at Almo draft house they had themes of previews or movie skits before the movie based on the movie that was going to be watched. So for example before It they showed a bunch of really scary clown, old movie clips and cartoons and it was really cool to have this before the show. Could do this before Prime-time, to really give it the attention it deserves.   


Weekend Prime-time moves get more focus and but release movies, the ones that get released the same day as movies in the theaters, get a big half hour of just really pump'd up time before the movie just like in the theaters. With previews and these little skits.   


This is a paid service with cable providers and online streaming services. There is an App, their could be a few channels, AMC Western, AMC Prime and AMC Sci-Fi etc . The idea is to make it a premier channel like HBO.   


Anyway, just an idea, wanted to float it and I am sure someone else has thought about it. But wanted to spin it and see if someone inside that industry could take a hold of the idea and see why this legally or functionally would or wouldnt work. If it could not how could we actually help the company bring more money in? Lets help find solutions, not just sit on the stocks.   


Thanks in advance for any thoughts. Just wanted to give some help if I was able."
2021-06-06 20:59:15,stocks,"Could AMC beat the 600-pound gorillas (Disney+, Hulu, Netflix) in the streaming wars? The same chance I have of beating Kobe Bryant in basketball. How much do you want to bet on me winning?"
2021-06-06 22:20:20,stocks,"> As we the investors and are now owning 80% of the shares

But who did you buy them from? The company executives are betraying you.

https://wallmine.com/nyse/amc/insider-trading"
2021-06-06 20:30:54,stocks,The amc by me is a dine in. I never used that service.. But I think all amcs should be a restaurant and movie together. Dinner and movie. Why not. Maybe join together with Applebee's or something for better food etc.
2021-06-06 23:29:55,stocks,"To be fair, you vs. Kobe today, I’m putting my money on you making more baskets."
2021-06-07 11:53:02,stocks,"Uh, you had me till you said better food and Applebee’s in the same sentence."
2021-06-06 21:01:14,stocks,The way you make more is by stop being a holder of AMC stock. Let others play the greater fool's game.
2021-06-07 11:59:18,stocks,"Hey, I’ll give you credit for trying to brainstorm on ways to improve them long term.  Just their debt load is so massive right now, I don’t see how they are going to get out of it.  Remember they were having lots of issues before COVID.  I’m honestly surprised theaters have done as well as they have over the last 10 years with the price of tickets and the insane amounts of other entertainment options."
2021-06-07 11:51:19,stocks,"Yep, there will be a market of people who will want the movie theater experience, but I think it’s a lot smaller than it currently is."
2021-06-06 23:47:40,stocks,Damn...I completely forgot.
2021-06-07 12:45:15,stocks,Or something like that. Chilis whatever
2021-06-07 00:00:00,stocks,"He Who Sleeps Not Random Market Thoughts 6-6-21 Hello Everybody! \[Echo- Hello Doctor Nick!\]

&#x200B;

It’s me, HewhoSleepsNot, here with another fantastic product for you and I have a question for you all at the end of the post from The infamous TeB!

&#x200B;

So, disclaimer, this is not financial advice, we are not financial advisors, and we are certainly not YOUR financial advisors. This is a labor of love and a thought experiment. I am hoping that you all will push me further in my analysis so that I become better over time!  These are just our personal thoughts and views based upon news shared out in the world. 

&#x200B;

This information is not groundbreaking but more us gathering from various sources some interesting stories, news, and tickers to share with the community! I will note where I found the material from when I can remember or when my notes include it but some are just from memory and came from places like Twitter, emails, reddit, etc.

&#x200B;

Now lets get into it, shall we?

&#x200B;

Some upcoming events this week to keep an eye on: Earnings from **COUP, MRVL, MTN** on Monday, followed by **CPB, GME, RH** Wednesday, and **ADBE, CHWY, PLUG**, on Thursday.

&#x200B;

Also happening are key reports on core inflation, consumer sentiment/expectations, job turnover rate, and G7! Will proposals to tax multinational persons/corporations make any big changes in the market? Long term- I do not believe it will have any significant effect on valuations of these companies.

&#x200B;

Player 3,297 has entered the EV game.  **Rivian** is working with advisors to set up their IPO and have reportedly selected their underwriters.  This will be very interesting to me. I have a close friend who is working for them and they have been giving him great opportunities which gives me a lot of optimism because he is 1 of 2 people I have met over the last 3 decades that I would trust to work for me, regardless of the industry, just because of what a solid and smart person he is.

&#x200B;

Conservative Investing News, who I have spamming me constantly, is shilling Kraft Heinz **KHC** as the number 1 income stock of 2021. They cite the dividend of 5% at current valuations and the stock decline of 50% since 2017. I’ve been holding **KHC** since pre-merger so I have seen this decline and not sure I agree with them that this stock is ready for a major comeback. May be a decent dividend play but then again so is **AT&T**.

&#x200B;

&#x200B;

So it’s been a wild week of meme stock pops and dips.  I will admit I am still holding some **GME** but prematurely sold my **AMC**. Thought double was good enough but this week proved me wrong considering could have done 7x. Oh well, if you look at my massive loss from last year I have learned to make my peace with taking profits, even if they aren’t as maximized as they could be.

&#x200B;

I just wasn’t as convinced for the **AMC** thesis as I am for the **GME**. I like to look at them both and think about them as if there is no MOASS in the wings and when I look at them like that **GME** is a good value buy for me even at the current market cap.  It’s got a great digital transition team lead by RC and others that are the top of their game.  The amount of publicity they have received is also beyond what anyone could have paid for and they have capitalized on it wonderfully.

&#x200B;

I did enjoy **AMC** CEO showing us his naked shorts, and have been selling cash covered puts on **AMC** in the 15-20 strike range earning 30-60+% APY when projected out for a year.  He is doing a great job of harnessing the movement and keeping shareholders interested and engaged.  Will see if he continues to roll out things like the AMC Investor Connect, but if he does I think the shareholders will reward him.

&#x200B;

My cash covered puts and stock secured calls I have been doing for about two months have been doing well.  I stick with what I know and only sell puts on stocks at prices I wouldn’t mind being long in, and then I sell calls to continue generating current income on the blocks.  Averaging about 30% interest last I checked a few weeks ago.

&#x200B;

**TSLA** jumped 4.6% on news that it was looking to expand to India. Don’t know if that alone is good enough news to justify a pop like this alone, especially with rivals coming from every direction.

&#x200B;

**American Airlines** dropped 2.4% when it released a lack luster 2Q revenue forecast this week.

&#x200B;

**TGT** continues to attract attention of hedge funds and investors with an impressive target of 211$ from Credit Suisse and a total of 78 hedge funds holding.  It has a 1.23% dividend as well so huzzah.  Wish I had held more of the shares I bought in the mid to high 60s a few years back! 

&#x200B;

**OPEN** came on my radar and bought \~200$ of each.  Found it in a stock gum shoe article deducing it as the likely teased stock from MF’s new real estate trailblazer big bucks subscription. Seems like a very interesting real estate disrupter. The market is ripe for disruption as buying/selling a house is far too cumbersome given all the technical tools at humanities fingertips.  This company makes cash offers on houses, do necessary renovations, and resell them. Instant gratification is the Achilles heel of modern Americans so this type of business that scratches that itch I think will go far. Just a matter of what companies take the space first and service the customer the best.

&#x200B;

Long **Disney** until the IP laws change in this country. The amount of IP they own, from Marvel to Star Wars is just insane.  And they are continuing to churn new content in these hot spaces.  The Star Wars Disney+ offerings have proved popular, and Loki is right around the corner!  Consensus 1 yr target avg from Yahoo Finance is $207 which presents decent upside from current levels.  Wish they would bring the dividend back but they are sufficiently pushing growth initiatives that I won’t complain too much at this time.

&#x200B;

Let’s end with the question, what do you guys think of **Upstart**, a fin tech company? Are they sufficiently unique to distinguish themselves in the crowded market and get ahead of the primary players? Seems like loans are ripe for disruption given the archaic roots of the industry players, but will **Upstart** be a lead disruptor, or will it fall behind?

&#x200B;

Thanks for reading."
2021-06-07 00:00:00,stocks,"$BIDU Cash reserves This thread is just a quick question about Baidus cash reserves being so high, with a company like apple having $70 billion and then baidu having $162 billion just seems mind boggling. Does anyone know their plan with the cash and $80 billion dept?"
2021-06-06 23:30:42,stocks,"Why maybe? That is the case. Their current cash on hand is US$26.395 billion as per the latest quarterly report. That equates to roughly RMB $162 billion. The yahoo finance (web) data im looking at literally states ""currency in CNY"". Chinese yuan = ren min bi

Edit: yahoo finance (web). The app doesnt state it's in RMB."
2021-06-06 21:05:54,stocks,Hating the Chinese government and communism isnt being racist. Why is your comment even upvoted lol
2021-06-06 23:59:50,stocks,Ah ok thanks for help.
2021-06-06 21:53:12,stocks,Cause apparently anything and everything is racist these days.
2021-06-06 21:56:27,stocks,Yea pretty much on reddit at least.
2021-06-07 00:00:00,stocks,"Clarification Regarding 401a/403b & IRA Account Contribution Limits My work provides a 401a/403b retirement account for me, which I believe has a max annual contribution amount of 19.5k (have not gotten close to maxing out). I also have a Roth IRA account that I’ve been maxing out (6k) for the last several years during my full time employment.

Are these two contribution limits completely separate from each other? I’m reading things that say something along the lines of “You can have as many retirement accounts as you wish but the combined contribution limit of 6k remains”. Do I assume the 401a/403b is exempt from that? Also from reading it sounds like when I switch employers I would likely be rolling over my 401a/403b into a 401k, and am wondering if the contribution limits I have now would mirror that once rolled over into the 401k while still investing in my roth.

Thanks,"
2021-06-07 00:00:00,stocks,"AMZN or GOOGL buy one share What would people’s preferences be?

AMZN has been trading sideways a bit, whilst GOOGL is pushing toward ATH. This stock would be to hold for long and would join the following portfolio;

AAPL
MSFT
AMD
ALLY
PEP
DIS
TGT
F
V
VWRP

It’s also worth asking would anyone sell those already owned to make way for AMZN or GOOGL? For example sell off two holdings for one of those others?"
2021-06-07 06:56:34,stocks,Amzn
2021-06-06 20:48:05,stocks,QQQ?
2021-06-07 06:36:45,stocks,"You should really own both.  I would actually own all four of the big tech companies, GOOG, AMZN, AAPL and MSFT.

But out of the four like GOOG best.  So between Google and Amazon I would definitely say Google."
2021-06-07 01:34:08,stocks,"I wouldn't sell any of your positions. I'm bullish on amzn and google. Slightly more bullish on amzn, but I've been buying both"
2021-06-07 03:14:34,stocks,Pushing toward ath? GOOG hit ath on Friday.
2021-06-07 03:34:42,stocks,Just buy a tech ETF
2021-06-07 12:45:38,stocks,Amzn
2021-06-07 13:08:54,stocks,Google
2021-06-07 14:27:15,stocks,"AMZN because it will be the ""go to' for everything within 10 years."
2021-06-07 04:16:17,stocks,Google
2021-06-07 08:28:10,stocks,Definitely GOOG
2021-06-07 05:52:38,stocks,I agree with this. I got 7 back when it was 220 just got a bunch more. Literally can't go wrong on it. It has no real competition imo and is only expanding into more things that will go well such as Xbox and azure
2021-06-07 01:54:12,stocks,Could do!
2021-06-07 12:32:11,stocks,Do you have one you recommend
2021-06-07 14:04:49,stocks,QQQ
2021-06-07 14:35:39,stocks,VGT or FTEC
2021-06-07 03:49:03,stocks,why not just dca in then if it doest go under 200 load up.
2021-06-07 05:35:54,stocks,"This is absolutely awful advice. No, the best time to buy a stock isn’t always a year ago. Stocks do in fact go down sometimes and sometimes they’re overpriced. It’s obviously completely possible that 6 months from now Google will be down $200 from its price now.

I personally am not buying or holding *any* stocks long term right now. I will continue to wait for a market correction. I am confident that stock prices will one day be lower than they are right now. In fact I think it’s practically a certainty."
2021-06-07 08:36:14,stocks,"Many people can only buy one or two of these stocks, they are not like any other $10 stocks."
2021-06-06 20:13:18,stocks,"If you want a broker you could go with interactive brokers, they offer fractional shares. By the way I would choose GOOGLE"
2021-06-07 07:15:39,stocks,"I think you can get Stake where you are, they offer fractional shares."
2021-06-07 00:31:38,stocks,Trading212?
2021-06-07 05:57:39,stocks,"Except it's basically the advice warren Buffett and every other must read finance book offers. Time in the market is always better than timing. It's either some random reddit dudes opinion or the best financial advisors of all time. I wonder who is right.

 I tired to time it when I first started last year. Now it's base line is far higher than the previous. If I had went back in time i would have put in money right away, would have made so much more."
2021-06-07 13:55:29,stocks,"GOOGL is a good buy.  Have fun always waiting for market corrections all your life.  You can't time the market.  Even John Bogle said that.

When the market is higher 6 months from now it'll be  your loss. The Fed is not going to let a correction of any significance happen for quite some time
  The market is manipulated."
2021-06-07 09:27:07,stocks,"you can buy fractional shares though, dont more brokers offer that option than not now? at least most the popular ones do now"
2021-06-06 20:14:04,stocks,I believe it’s VUSA
2021-06-07 01:51:48,stocks,There’s a major wait for them to open slots for new customers since January?
2021-06-07 06:32:07,stocks,"No it absolutely isn’t his advice or any other reputable person’s advice. Warren Buffett considers Benjamin Graham’s *Intelligent Investor* to be the most influential book he ever read, and that book absolutely shits on everything you and the above commenter are saying. If I had to distill that book down to one sentence it would be something along the lines of “the price matters.” 

Your sample size of one year of the market is utterly useless. Also, if you could go back in time even one week you could become a billionaire. It’s a useless thought experiment since you already know what happened. What happened in the past does not tell you what’s going to happen in the future.

Nassim Taleb uses the analogy of a turkey to explain why your thinking is so fundamentally flawed. A turkey is fed every day for years and then one day, a few days before thanksgiving, it gets slaughtered. Like you, that turkey’s confidence in the trend increased every day for years, and his confidence was at its highest the day it was slaughtered. Don’t be a turkey.

I’d highly recommend reading Nassim Taleb’s books before you invest another dollar of your money."
2021-06-07 01:52:59,stocks,"It is VUSA, but at that point surely best to sell off all the individual stocks and Boglehead the portfolio using VWRP and VUSA to overload US."
2021-06-07 06:11:28,stocks,"Try Etoro for the UK, they offer fractional and they’re pretty good. It’s what I’m using until trading212 clears up."
2021-06-07 01:57:09,stocks,"Oh, I didn't know, sorry. I wonder why they'd do that?"
