Timestamp,Subreddit,Post/Comment
2021-04-25 19:50:46,stocks,"I used to mess around with volatile tech stocks.  I ran the up and down cycle a lot with Zoom Telephonics in the 2000s.  It would go $2 to $8 and back, all the time.  So, I bought in once, and it dropped to like $0.50.  So I held.  Eventually they stopped reporting mandatory financial info and the SEC delisted them.  Lost $8,000 or so.

Currently a GME baggie for -$6000."
2021-04-25 19:59:58,stocks,"Fuck, Luckin Coffee, I bought at ~$38 cut losses for $2.77 after the news came out of falsifying number. Lost about $3K, still pisses me off to think of it."
2021-04-25 19:34:12,stocks,Don't know the company but RSI says you're right bout the oversold part.
2021-04-25 19:44:34,stocks,"I bought into PLTR when it was 22.50. It hit 45 but I caught it at a 90% gain & I wanted 100. I do all my trades manually so I missed out on the gain. Figured it would reach it again soon.. & it steadily went right back down to where I bought it. I mean I don’t really consider it a loss because I truly believe in them long term. But I really wish I would’ve sold & got back in at a good price. Lesson fuckin learned here, believe me"
2021-04-25 19:44:17,stocks,Depending on RSI is another way to end up bag holding
2021-04-25 19:50:38,stocks,Ahh yes I also run manually. I agree you’re good with PLTR long term.
2021-04-25 19:42:39,stocks,"Those mutual funds have high expense ratios, FBALX has 25% bonds, which is high for your age. I'd just switch out everything for VT, maybe keep <10% of your portfolio for stocks you find interesting. Check out [the three fund portfolio](https://www.bogleheads.org/wiki/Three-fund_portfolio) and r/bogleheads"
2021-04-25 19:35:34,stocks,"Congrats on being so forward-looking. This is really a great start. My advice would be to the extent possible, optimize your tax efficient spaces first. 

I assume you’re getting the full match by contributing 11% of salary pre-tax. I’d look to fund a Roth IRA before looking to contribute more to the 401k. 

Investments in those accounts are ideally going to continue to be in broad market index funds, covering both US and ex-US markets. 

Only if you took full advantage of the Roth would I look to contribute to a taxable account. I’m a big proponent of keeping things simple and maintaining the ETFs you’re buying in other accounts. This makes it easier to consider a total portfolio (all accounts) approach when allocating investments and asset classes. 

Otherwise, I always recommend to scratch the speculation itch if you have it but allocate a reasonable percentage to buying individual stocks and more speculative assets. 

I’d say overall, the savings rate is more crucial right now than hitting the biggest home runs in the market. Steadily save, any raises you’d bank and continue to save, and just keep the good work up."
2021-04-25 19:24:37,stocks,"Depending on your salary you could look into funding/maxing out an Roth IRA after you have maxed your 401k monthly payments out. Also could look into setting up auto payments with Betterment or another roboadvisor and just let them do the work. 

If I could go back 20 years to your age that is what I would do. Just get things to a set it and forget it status. 401k, IRA, extra robo / monthly ETF deposits. 

Check out Fidelity’s Basket Trading, I think it is like creating your own “etf” in the sense you select X stocks/funds and can just buy spread across. Not sure as I still need to look into it for myself."
2021-04-25 19:37:26,stocks,"You have a ROTH IRA I hope. Above and beyond anything else, you should have whatever isn't going into the 401k go into a ROTH. Google it for more details...

As a young person who so far has done a very good job getting started, I would just say put money into SPY & QQQ. Once you have some time watching how those ETFs react to different market actions, you can start adding individual stocks. 

During that time, watch the individual stocks in the DJIA. Its only 30 stocks and they are very big and well known. You will have a very good base of knowledge watching those. A few months after that, put the NASDAQ 100 into your watch list. That's about another 98 stocks for you to keep track of.

After that, you can determine if you want growth, dividends, some combination, or if you want to invest in some speculative stocks.

If you really want to get hands on, learn how to trade options. You can lose your ass if you don't know what you're doing with options, but you sound kinda smart so I bet you would be fine. You can make a lot of money with options, and most brokerages will allow option trading in IRAs."
2021-04-25 19:08:11,stocks,"Hey there I’m 26 and I personally like VBR, VOO, VWO, and VXF, I also have some money in the ARK etfs but some people like them and some don’t, i only own one single stock and that’s COST, I’m definitely more aggressive though. It seems like you’re doing alright though, the only recommendation I have is to try and eventually push that 11% into your 401k to 15% I personally believe that’s the ideal amount. FYI this isn’t financial, I am not a professional"
2021-04-25 19:14:06,stocks,"I was gonna say the same thing the other guy commented. If you have a well-paying job and you’re building up your savings quickly, you might want to think about putting more than $50 a paycheck in."
2021-04-25 19:18:16,stocks,[deleted]
2021-04-25 19:55:07,stocks,"My employer matches 100% up to 6% of what I put in, so about half of what I put in is matched. Do you think it would be worth it to lower my contribution into my 401(k) and put that amount into a Roth IRA? 

The penny stock is the only solo stock I plan on continuing to buy going forward just for personal interest in the company and the belief I have in them. Other than that I think I’d be content with the long term savings route"
2021-04-25 19:39:52,stocks,"Although my income is high compared to my expenses, it is unfortunately not maxing out an IRA high :( 

I will definitely look into the roboadvisor and the Basket Trading. Aside from the one penny stock I mentioned, I would love to not have much to do with my investments, so that’s definitely an appealing route. Thank you!!"
2021-04-25 19:24:39,stocks,[deleted]
2021-04-25 19:11:49,stocks,"I’ll definitely do some looking into those. Now that I have my cash savings to a point I feel comfortable with, I was planning on upping my 401(k) contribution, so I’m glad to have someone else’s input on that idea. Thank you for your reply!"
2021-04-25 19:35:59,stocks,"Thank you, but it was really my parents who gave me a running start in the world of financial security; they share a similar sentiment as you and I’m very fortunate to have them. 

As far as my solo stocks go: AMC and SBUX were kind of “why not?”s and they’re low percent of my portfolio. The penny stock mentioned happens to be a psychedelic medicine company I was first exposed to in my undergrad; I believe in the company and I believe their research has amazing implications for the future of mental health... I believe this is one I will continue buying into well into the future. 

As far as the sector funds, I bought those pretty early on when I was unsure what I was really doing (still don’t really know, but I’m getting there). They all have pretty decent % returns (9-14%), so I’m planning on holding, but unsure of buying more. 

You bring up a compelling point with SPY. I was unsure about going all in on one fund for diversification reasons, but, and this just occurred to me, that is already a VERY diversified fund"
2021-04-25 18:40:38,stocks,"Welcome to r/stocks!

For stock recommendations please see our portfolio sticky, sort by hot, it's the first sticky, or see [past portfolio stickies here.](https://www.reddit.com/r/stocks/search?q=author%3Aautomoderator+%22Rate+My+Portfolio%22+-+r%2FStocks+Quarterly+Thread&restrict_sr=on&include_over_18=on&sort=new&t=all)

For beginner advice, brokerage info, book recommendations, even advanced topics and more, please read our [Wiki here.](https://www.reddit.com/r/stocks/wiki/index)

If you're wondering **why a stock moved** a certain way, check out [Finviz](https://finviz.com/quote.ashx?t=spy) which aggregates the most news for almost every stock, but also see [Reuters](https://www.reuters.com/), and even [Yahoo Finance](https://finance.yahoo.com/).

Also include *some* [due diligence](https://www.investopedia.com/terms/d/duediligence.asp) to this post or it may be removed if it's low effort.

*I am a bot, and this action was performed automatically. Please [contact the moderators of this subreddit](/message/compose/?to=/r/stocks) if you have any questions or concerns.*"
2021-04-25 18:45:57,stocks,"Someone told me long ago to invest in things people use everyday, and even moreso when things get bad. Kimberly Clark, Johnson & Johnson, Hormel, etc."
2021-04-25 19:09:05,stocks,"I’d argue that inflation doesn’t really hurt the stock market and you shouldn’t change your strategy because of it. Inflation causes people to get out of the bond market, since the money in a 10 year bond won’t be worth as much if inflation is high. Because of this, inflation affects the bond market more than the stock market. 

Inflation is a reason that people get INTO investing. If your money loses 2% in value every year by sitting in a bank account (inflation), you’re gonna want to invest so that your money maintains or exceeds its value over time. Inflation could be seen as more of an incentive to get into the stock market, not less.

I think growth stocks could move anyway since people don’t understand that their stocks should be fine. Not many young investors know/understand this, so (if your worried about that happening) it might be good to get out of young people investments like growth stocks and get into old people investments like Mcdonalds or Coca-Cola if you don’t want THEIR ignorance to hurt YOUR portfolio. 

As for the capital gains tax, that will affect all areas of investing and i don’t think there’d be a sure way to completely avoid it. I suppose less risky stocks (like the ones you mentioned) would minimize the losses though. The big question to ask yourself is “do i think the capital gains tax is actually going to be increased? Should i decrease my risk?”

And the answer to those questions are for you to decide, not some random person you’ve never met on the internet. 

Good luck"
2021-04-25 19:16:54,stocks,SPY puts
2021-04-25 18:43:24,stocks,F*** Walmart. Costco all the way.
2021-04-25 19:41:30,stocks,Consumer staples ETF are safe IMO.  People will always shop at grocery stores and need toothpaste and such
2021-04-25 19:13:00,stocks,"Bank stocks like JPM. And any company that can pass the costs onto the consumer such as PEP, PG, and SAM."
2021-04-25 18:43:18,stocks,Gee Em Ee with it’s -30 beta 😂
2021-04-25 19:48:29,stocks,"CPB has been great as a counter stock. It pops when there are talks about recession. 

MMM has had a nice long run of growth & dividend payments. 

MSFT pays a dividend now. 

Someone else mentioned JPM and I agree. It might be a little expensive as it has gone from like $90 - $150 over the course of past 6 months."
2021-04-25 19:11:57,stocks,Wouldn’t trust Costco too much. It did drop to 309 a month ago from 388. That’s a huge drop for a company that’s been kinda too heavy stock wise.
2021-04-25 19:12:47,stocks,"It will rebound but just from a moral perspective I respect Costco and I hope Walmart burns. Garage products, low wages, non existent help in their stores."
2021-04-25 19:22:25,stocks,"Walmart is still growing and stealing market share from Costco. In Colorado Springs, I counted almost 4 Walmart’s vs 2 Costco’s. Walmart was busier for sure but Costco wasn’t as busy compared to California. Different states have different buyers/value propositions. 

Costco is big, but Walmart has the numbers game"
2021-04-25 19:24:57,stocks,I’d rather Costco’s everywhere than Walmart’s everywhere. At least I know people are earning a decent living at Costco
2021-04-25 19:45:20,stocks, I don’t own but MITC
2021-04-25 18:24:48,stocks,"What's your projection on the companies' consumers buying lab grown meat? Tyson is known for its chicken, its not whether Tyson can switch from ag to lab, but whether their customers can."
2021-04-25 18:40:50,stocks,It’ll be Forced on us sooner or later anyways
2021-04-25 18:35:54,stocks,yuck
2021-04-25 19:55:52,stocks,Gross!!!🤢🤮🤮🤮
2021-04-25 18:23:09,stocks,"I’d never eat that sh*t and I can’t see it going anywhere but, what do I know? It might be a good investment."
2021-04-25 18:42:15,stocks,"I’m not certain of anything, but willing to take some risk to gain exposure. If there’s no laws requiring to label it, and the quality is indistinguishable consumers might not even know."
2021-04-25 19:58:33,stocks,I'd rather eat lab grown meat than feces and cyst laden meat.
2021-04-25 19:25:59,stocks,"I only really eat meat and can tell you that food is trending in the opposite direction of lab grown, 20 years from now I think most places will be like Whole Foods"
2021-04-25 17:42:57,stocks,I studied astrology instead of TA and I can confirm November 22 seems to be the date based on my most recent observation of the stars
2021-04-25 17:45:04,stocks,"Not May 10, but more like May 24. I just thought about that just now, based on nothing."
2021-04-25 17:43:21,stocks,Tanko de Mayo
2021-04-25 17:51:14,stocks,">I feel like it’s common knowledge that there will be a crash within the foreseeable future

Lol what? It’s not common knowledge at all. And for those that think it is, they’re playing right into the hands of the institutions that want to scare retail into selling their shares to them for dirt cheap.

They’ve been pulling off these scare tactics successfully for about 50 quarters in a row now."
2021-04-25 17:45:19,stocks,"I predict that the market will do what it is gonna do, exactly when it does it. Tell me I'm wrong, go on"
2021-04-25 17:51:11,stocks,If it’s known there’ll be a crash. Then it’ll probably be tomorrow.
2021-04-25 18:36:37,stocks,"Will there be a crash? Definitely. Is it possible that we will go ten years, have a crash and look back and point to the V-shaped correction of 2020 as the “previous crash”? Possibly. Nobody actually knows, and right now the problem is that there’s more capital than there are companies “worth” investing in."
2021-04-25 18:37:29,stocks,well if you know when itll happen and short right on time youll be rich! congratz buddy
2021-04-25 18:42:30,stocks,That next CPI data release is May 12. I dont agree with a crash like OP saying. But wouldn't be surprised if that data shows higher inflation stocks dip.
2021-04-25 17:58:07,stocks,!remindme May 10
2021-04-25 19:37:22,stocks,"ok I rolled the dice three times and played cards. Crash is May 4th, at 9:13.56 am EST. Ensure you and your family is off that day and watching the live broker. Keep cash under the sofa you are sitting on. P.S I'm not a financial advisor I'm a roll the dice typa guy"
2021-04-25 17:48:25,stocks,"i'm a virgo, could you tell me about the next big tech crash?"
2021-04-25 19:37:12,stocks,Hey that’s my birthday
2021-04-25 18:46:46,stocks,"As a Canadian, May 24 is a holiday for us. Sorry for the inconvenience but  the crash can't happen that day, as we will be too busy drinking 24 beer.  Can we delay it for a few weeks, maybe December?"
2021-04-25 18:39:10,stocks,"I actually heard it would start around 1:45 PM Central on May 17th and we'd hit the bottom late morning-ish on May 20th (not sure of the exact time just yet, but I'll circle back when I hear)."
2021-04-25 17:58:58,stocks,"I will be messaging you in 14 days on [**2021-05-10 00:00:00 UTC**](http://www.wolframalpha.com/input/?i=2021-05-10%2000:00:00%20UTC%20To%20Local%20Time) to remind you of [**this link**](https://www.reddit.com/r/stocks/comments/myid45/possible_crash_may_1012/gvv3wtn/?context=3)

[**CLICK THIS LINK**](https://www.reddit.com/message/compose/?to=RemindMeBot&subject=Reminder&message=%5Bhttps%3A%2F%2Fwww.reddit.com%2Fr%2Fstocks%2Fcomments%2Fmyid45%2Fpossible_crash_may_1012%2Fgvv3wtn%2F%5D%0A%0ARemindMe%21%202021-05-10%2000%3A00%3A00%20UTC) to send a PM to also be reminded and to reduce spam.

^(Parent commenter can ) [^(delete this message to hide from others.)](https://www.reddit.com/message/compose/?to=RemindMeBot&subject=Delete%20Comment&message=Delete%21%20myid45)

*****

|[^(Info)](https://www.reddit.com/r/RemindMeBot/comments/e1bko7/remindmebot_info_v21/)|[^(Custom)](https://www.reddit.com/message/compose/?to=RemindMeBot&subject=Reminder&message=%5BLink%20or%20message%20inside%20square%20brackets%5D%0A%0ARemindMe%21%20Time%20period%20here)|[^(Your Reminders)](https://www.reddit.com/message/compose/?to=RemindMeBot&subject=List%20Of%20Reminders&message=MyReminders%21)|[^(Feedback)](https://www.reddit.com/message/compose/?to=Watchful1&subject=RemindMeBot%20Feedback)|
|-|-|-|-|"
2021-04-25 18:27:31,stocks,Next time Mercury and Mars retrograde simultaneously
2021-04-25 17:42:59,stocks,I sell covered calls against my whole portfolio at strike prices that I would be comfortable selling my shares at. I own most individual stocks and etfs tho. No index funds
2021-04-25 18:42:31,stocks,Check out XYLD. It basically is an ETF index that owns SP500 and sells covered calls against it. Pays out a monthly dividend from the premiums received. That’s a decent backtest of the strategy. Obvious downside is that your upside is capped when you do this so the best months you might not get the full gain of an unhedged position.
2021-04-25 17:58:03,stocks,"I did that with VYM in my Roth one month ago. Sold 2 at strike of 102 for 5/21 and another 2 at 103 strike same day expiration. Delta was at .3 both trades(made a few days apart). Took~$400 in premiums.

Looking like I'll be getting mine exercised at this point!! I'll have to sell a cash covered put to get them back! Lord knows if I'll be able to!"
2021-04-25 18:44:15,stocks,"You're never actually at risk of losing your shares, unless you want to lose them. 

You sell OTM CCs at $1, the underlying goes up and the CCs are worth $1.50 now. Your choices are 1) let the option get exercised or 2) buy to close the CC and add an option leg for sell to open CC at the next week or month at the next higher strike price. This way you can keep rolling your CCs forward. 

I do this constantly and it's a great way to keep extracting time value on a CC even long after the underlying blows past the strike price on your first CC."
2021-04-25 17:50:56,stocks,That’s basically my dream to sell OTM CCs on SPY one day in my Roth so I don’t have to worry about taxes either
2021-04-25 17:37:08,stocks,Too much risk for not enough bread
2021-04-25 18:21:10,stocks,I honestly can’t see what’s wrong with it. Even selling way ofm for like 5 cent premiums is better than just owning
2021-04-25 18:41:33,stocks,Yes
2021-04-25 18:06:01,stocks,"Yep. I don’t try to play the guessing game or where it might be and go just above that to get maximum premium.

I own 100 shares of PLTR - I sell monthlies at a price that would give me 25% gain. If it jumps up and sells - cool. If it doesn’t - oh well. I’ll take my premium and buy more."
2021-04-25 18:07:09,stocks,"I do the same, unless I think something is about to explode. I just rarely see people suggest it for index funds."
2021-04-25 18:14:13,stocks,"One warning about this strategy: don't use it on anything that might collapse after hours. Many brokerages won't let you hold naked calls, and you can't sell options with the market closed. So, if there is some news that causes shares to plummet when the market is closed, you might not be able to sell your shares until the next day because of the covered call."
2021-04-25 19:02:17,stocks,"Interesting. My specific strategy is to sell CCs on unsustainable peaks, so I might not necessarily do it every time my CCs expire. I'll take a look a XYLD's strategy to see what deltas and expirations they use, and when they sell."
2021-04-25 18:49:22,stocks,"For example... UMC just blew past my $10 strike price. Everyone is bullish on this, so I rolled my CC from May to July. I get another $200 in my pocket and if it keeps going up then I'll do it again next month.

https://imgur.com/a/c9Ap7VF"
2021-04-25 18:39:01,stocks,Check out XYLD. ETF that basically does that for you.
2021-04-25 18:11:31,stocks,"For a small position, it's probably a waste of time, but once you have a large enough position, you can choose a small delta that can make an non-negligible absolute amount of cash each month. It's certainly not a method for getting rich, but for a position you plan on accumulating forever, it eventually becomes a nice way to pay for monthly expenses."
2021-04-25 18:14:39,stocks,Yes I have 400 shares of pltr and have been making decent premiums. I don’t really mind watching it trade sideways because I’m still making money haha
2021-04-25 18:55:02,stocks,Just wondering... what strike did you play during the month of April? I also own 100 shares at 22.34 and have been trying to play weeklies but IV has been mediocre and I can’t seem to find a comfortable strike with reasonable premium.
2021-04-25 19:49:50,stocks,The high iv helps too.
2021-04-25 19:16:21,stocks,"I think they are pretty much always covered, so even the call selling is programmatic. Makes sense since correctly predicting a peak to be unsustainable is just another way of timing the market."
2021-04-25 19:27:05,stocks,Oh thanks didn’t know about that
2021-04-25 18:47:50,stocks,18 years. Just put it in spy and forget
2021-04-25 17:36:30,stocks,VTI
2021-04-25 19:20:42,stocks,Vti
2021-04-25 18:29:55,stocks,"Any massive ETF. Then close the program for 18 years. VOO, VT, VTI."
2021-04-25 19:01:14,stocks,"$YUM (Taco Bell) will become a fine dining establishment in the future. Its true! I seen it in a movie.

Since that didn't happen yet I can only assume it will within the next 18 years."
2021-04-25 18:20:10,stocks,What about an MSCI World ETF? It’s hard to know which companies exactly will perform well and still be around in 18 years.
2021-04-25 19:40:57,stocks,Vt
2021-04-25 19:39:39,stocks,"To answer your question:

1. LVMH
2. American Express
3. Canadian National Railway
4. AstraZeneca
5. Microsoft

To give you the best possible advice: a total stock market fund, probably with Vanguard."
2021-04-25 17:49:15,stocks, google apple Tesla alibaba Amazon
2021-04-25 18:48:03,stocks,"If it’s real life I’d say etf like voo. 18 years is a long time a lot can change.

But for the sake of the exercise goog msft aapl dis Amzn (assuming no major government regulation)"
2021-04-25 18:14:52,stocks,"$CLF, $GOOG, $FB, $ABBV, $MU"
2021-04-25 17:34:25,stocks,"Well, I don't really have Five but here's one that I believe in

\- Canadian National Railway - I can go into many reason's why I believe this a great company, it's one the only companies that still transport Essentials and Goods across Canada and America.

Do your own research, I don't recommend you just go off my pick, but many reasons why this company is a great pick! Let me know what you think.

Sorry I don't have 5 But hope this still helped"
2021-04-25 17:53:43,stocks,"1. AAPL
2. AMZN
3. DIS
4. MSFT

I can’t think of a 5th one at the moment."
2021-04-25 17:30:49,stocks,"VNQ, HYG, BRK.B."
2021-04-25 18:22:10,stocks,"Shop, Brk.b, any bank, wmt, amzn"
2021-04-25 18:15:23,stocks,"nvda, msft, amzn, sq, no number 5!"
2021-04-25 18:01:01,stocks,"Idk about the other 4 but def $plby for one. This is def going to be a 3 figure stock and we’re still cheap, relatively."
2021-04-25 19:00:55,stocks,"Open up a stock screener and screen for companies with strong ROA, ROE, Gross Profit Margin, Operating Margin, Net Profit Margin, year-over-year revenue growth, year-over-year earnings growth, P/E < 40, low debt/equity, low long-term debt/equity, strong current ratio, and strong quick ratio.

Then do your due diligence on them until you identify 5 good stocks that you feel confident in. With that set of criteria you should have a solid head start before even looking at a stock."
2021-04-25 19:04:28,stocks,"/thread 

There’s no way to predict 18 years of market movement, and I find it hard to imagine the top performers of the last 18 years would do similarly again. 

That would put, eg, Apple at a $930 trillion market cap. 

For reference the entire global stock market had a market cap of $95 trillion last year

If you wanna pick single stocks, expect to rebalance over time"
2021-04-25 19:04:31,stocks,Would want to keep an eye on CLF. I've got positions in it but I'm waiting for a supercycle as opposed to holding for 18 years. Don't want to end up a bag holder.
