Timestamp,Subreddit,Post/Comment
2021-06-24 18:58:06,stocks,"Lol nothing to do with earnings smash. It's going up because I sold all my Nike shares right before earnings, that's all."
2021-06-24 19:29:38,stocks,very expensive stock. Very strong brand but you can’t justify their valuation
2021-06-24 18:38:00,stocks,Love my Nike stock
2021-06-24 18:53:11,stocks,What a monster of a quarter Nike had. And y’all were panicking a couple months ago because a gymnast decided to leave Nike.
2021-06-24 18:50:26,stocks,"Give them stimmy checks and what do they spend it on?  Overpriced sneakers.

No... no, you do not need a special pair of athletic shoes for that new Peloton."
2021-06-24 19:45:23,stocks,I rather buy lulu next nike in the making with a premium in margins 👍
2021-06-24 19:00:20,stocks,Thank you for your sacrifice. Did you buy FedEx before earnings? Is that why the stock is dropping?
2021-06-24 19:00:55,stocks,This is why I never pull out
2021-06-24 19:15:13,stocks,"Earnings is always a coin toss. I believe Nike also beat earnings last quarter, but it went down afterward."
2021-06-24 19:54:20,stocks,Yea I don’t really understand their valuation even when you factor in their brand name but that’s just me.
2021-06-24 19:34:06,stocks,Tuff to justify many stocks valuations in this current market
2021-06-24 19:02:28,stocks,Haha I remember that... everyone goes to Nike to buy women’s gymnastics clothes 😂😂😂
2021-06-24 19:29:54,stocks,Racist who are they
2021-06-24 19:07:47,stocks,"Did not buy the stock, bought calls instead."
2021-06-24 19:18:25,stocks,Not true they missed revenue by 6 percent last earnings
2021-06-24 19:40:19,stocks,but Nike isn’t even a growth stock but trades like one
2021-06-24 19:40:23,stocks,I don't know why your laughing.  The company does alot of shitty things.
2021-06-24 19:24:13,stocks,"Yeah, revenue missed estimates last quarter, but the earnings beat."
2021-06-24 19:53:40,stocks,I agree.... got your eye on anything in the next few weeks?
2021-06-24 19:51:07,stocks,Who cares so do most company’s.... I’m trying to make money
2021-06-24 19:52:53,stocks,"Everyone here is buddy, it is what it is.  But there is no point in laughing at others who chose not to invest based on moral beliefs."
2021-06-24 19:54:29,stocks,What are your moral belief company’s?
2021-06-24 19:53:55,stocks,🤦‍♂️😂😂😂
2021-06-24 19:55:55,stocks,Non I don't invest based on morals but don't laugh at thoughs who do.  Or laugh at abuse scandals.
2021-06-24 19:54:17,stocks,Good old teenage edge lol
2021-06-24 19:57:44,stocks,No one brought up morals until your comment
2021-06-24 18:42:51,stocks,What’s everyone‘a consensus after the Earnings call? I was ehh about it tbh.
2021-06-24 19:47:38,stocks,"Eh, semi chub. Expected more from the call."
2021-06-24 19:02:23,stocks,It seems to me fairly boilerplate. They’re restructuring. Losing money but stopping the bleeding and looking to pivot into their core areas like cyber security. I’m optimistic for the future but think the actual value might take a while to build
2021-06-24 19:37:36,stocks,"My concerns at this point are that the management team has been saying the same exact thing for the last 3 quarters, and continues to kick the can down the road on the earnings calls. 

I'm also concerned that IVY is not going to be as immediately high-grossing and widespread as the investors have been led to believe. This, above all else, will be a major detriment to any short-to-medium-term price action."
2021-06-24 19:46:08,stocks,"They have been selling off assets to pay down debt and put capital towards priorities. They seem to be focusing and moving in the right direction. 


I agree that I’m not expecting short term or maybe even medium term price action. I think this is a fairly risky play offering a ground floor access to a company looking to reinvent and grow. But it is an attractive space and I think they can execute a nice turnaround"
2021-06-24 17:37:07,stocks,I made my wife open an investment account a couple months ago with money she had sitting in saving. She picked TGT and AMZN. And she’s happy! So I’m happy. I personally have no AMZN stock but I think you are right. The only concern I have with them is about regulations breaking them up in the future but I’m pretty sure Amzn will buy the politicians and will come out ahead. I wish it wasn’t the case but I see that as the only obstacle to more growth from them.
2021-06-24 19:23:23,stocks,[deleted]
2021-06-24 19:56:08,stocks,Lol
2021-06-24 19:37:46,stocks,They mean the largest market cap.
2021-06-24 19:41:35,stocks,What are you talking about?
2021-06-24 19:57:39,stocks,"I know that. If Amazons earnings are 3x lower relative to their market cap compared to Apple‘s, it‘s hard to say they are undervalued"
2021-06-24 19:56:04,stocks,[deleted]
2021-06-24 19:51:53,stocks,"Yes, ABCL is going up 43.25% on Wednesday am, next week.  Tomorrow is an excellent time to buy but better to buy tonight."
2021-06-24 19:32:48,stocks,"Make sure you're looking into share dilution. CCL is trading at half it's pre-covid price, but there are twice as many shares outstanding, so it's really trading a the same value despite the price being half as much. I think there's some room to run once they start getting boats in the water, but not as much as it looks like.

u/bp___ is also very much correct about being late to the party on most of these plays. You'd have to find something that isn't an obvious reopening play to get big value at this point. For example, road traffic is going back up, are tire companies depressed or did they float up with everyone else when the market recovered from the crash?"
2021-06-24 19:45:45,stocks,"I played CNK starting in November. Entered at about 15. Exited about 22. Pre-Covid it was around 32, but with so much dilution it seems unlikely that it will return to those levels even by year end. Also cruise lines. There are some opportunities right now, like today 6/25/21. I am targeting 37 for my NCLH (entry at ~27) not sure where CCL will go, but most likely 33 as a max. Again it is about dilution and additional debt. CCL could go higher if they reinstate their dividend, but that doesn’t seem likely this year."
2021-06-24 18:47:02,stocks,I think you're too late. All these recovery plays have been priced in.
2021-06-24 18:51:38,stocks,"I disagree.  The exact point of the post was to find markets where its not too late.   sure its too late to make a play now in bio-research, big tech, but there are markets right now still heavily affected by the pandemic.  Tourism, Retail, etc.  TY for your effort though..."
2021-06-24 19:26:58,stocks,"The summary is so good . I will
Never miss it"
2021-06-24 19:16:17,stocks,"Thanks, as always."
2021-06-24 18:58:14,stocks,Thank you and hope your day is going good for you.
2021-06-24 19:17:34,stocks,Thank you for another daily recap. Some great calls by you lately 👍
2021-06-24 19:29:45,stocks,"Thank you, really appreciate you saying that, glad you found the recaps useful"
2021-06-24 19:30:32,stocks,"Same to you my friend, have an awesome day"
2021-06-24 19:30:18,stocks,My pleasure!! Thank you glad you have found the recap useful
2021-06-24 19:58:31,stocks,These are awesome. So appreciate what you guys have to say.
2021-06-24 17:10:24,stocks,"I think all of them will pullback within the next couple of weeks, doesn’t mean you should sell them because I could be wrong. NET and CRWD are two of my favorites for the next decade. The growth of the sectors and the companies (especially crowdstrike) is unreal."
2021-06-24 19:25:17,stocks,"since motley fool recommended NET today, that was my signal to start unloading 50% of my holdings. I'll keep the rest for now."
2021-06-24 19:14:51,stocks,I actually just sold some NET today to realize some profits. I love the company (and the stock) but it is trading at an absolute insane valuation. Moving my profits into QQQ and VOO and holding my remaining shares for a long long time
2021-06-24 18:42:06,stocks,Net is over extended. Sell now and buy back after 30 days to avoid wash sale
2021-06-24 19:43:05,stocks,Crowd is out of this world are they such a good company or what is happening there haha sadly i missed the boat 🚣‍♀️
2021-06-24 19:18:41,stocks,"Yeah, I sold some as well. Probably have about 1/4 of my original position in case it pops to $110, but feel the same about the valuation"
2021-06-24 19:12:47,stocks,"A wash sale only applies to a stock you sell at a loss. OP is taking profits, so the rule doesn't apply here."
2021-06-24 18:48:13,stocks,"Really great company but is a bit high atm, sold a third of my holding."
2021-06-24 19:56:42,stocks,I bought the dip to 175 a couple months back and I'm super happy with it so far. What I like is that the company is proving to not only be the best in class end point security company but is willing to expand through acquisitions into new areas.
2021-06-24 16:41:25,stocks,"Welcome to r/stocks!

For beginner advice, brokerage info, book recommendations, even advanced topics and more, please read our [Wiki here.](https://www.reddit.com/r/stocks/wiki/index)

If you're wondering **why a stock moved** a certain way, check out [Finviz](https://finviz.com/quote.ashx?t=spy) which aggregates the most news for almost every stock, but also see [Reuters](https://www.reuters.com/), and even [Yahoo Finance](https://finance.yahoo.com/).

Please direct all simple questions towards the stickied Daily Discussion and Quarterly Rate My Portfolio threads (sort by Hot, they're at the top).

Also include *some* [due diligence](https://www.investopedia.com/terms/d/duediligence.asp) to this post or it may be removed if it's low effort.

*I am a bot, and this action was performed automatically. Please [contact the moderators of this subreddit](/message/compose/?to=/r/stocks) if you have any questions or concerns.*"
2021-06-24 16:48:32,stocks,"When done via an exchange, the buying and selling of options is pretty much identical to the buying and selling of stock. You may buy one stock for $1, but no one will care if you try to sell it for $100 unless the market has moved to point where it believes $100 is a price worth paying for it. In a very basic way, trading options works the same way."
2021-06-24 17:09:55,stocks,"Yeah and that's how most people make money. They buy calls hoping the value of the call goes up so they can sell it themselves. 

Calls have higher risk reward so you can get rich or go broke very fast."
2021-06-24 17:32:54,stocks,r/options
2021-06-24 19:49:23,stocks,"Yeah, no. Not possible unless someone is actually willing to pay that much."
2021-06-24 17:15:36,stocks,"Thanks. So say I was flipping those options through an online broker, when I went to sell them would there be a box I can fill in to set how much per share I want to sell the options? Price completely in my control?"
2021-06-24 17:16:48,stocks,You can set your own sell price but that doesn't mean someone will actually pay it
2021-06-24 17:19:49,stocks,Thanks!
2021-06-24 16:15:22,stocks,"People here don't care to listen to facts. They either sold all their stock in March 2020 and are sitting on the sidelines or they sold a portion of their money and have watched things continue to rise. 



People forgot not only was the Nasdaq much more expensive in 2000, interest rates were also *much* higher and most of those tech companies then made no money and barely any revenues."
2021-06-24 16:07:14,stocks,"theres really no point in arguing this. those who are bearish will look at the reasons to be bearish. same with those who are bulls.

no one knows what will happen in the future"
2021-06-24 16:26:22,stocks,"It's expensive but not exuberant. It's incredible that 2000 Tech Bubble happened given the Japan bubble 11 years earlier. Given that almost all growth and returns come from tech in the modern world, it's almost the only game in town"
2021-06-24 19:25:36,stocks,[deleted]
2021-06-24 16:12:22,stocks,"Yes, this is called ""Confirmation Bias"", looking for researches or news that confirms your idea, and discard different point of views."
2021-06-24 19:40:51,stocks,Man it’s almost like QQQ and SPY are entirely different indexes or something.
2021-06-24 17:31:18,stocks,"What about selling 1/2 of MU, and buying that with AMZN? That's probably what I would do."
2021-06-24 19:42:19,stocks,I would keep MU if I were u
2021-06-24 16:04:04,stocks,"OMG no... MU currently has one of the best F P/E and PEG's in its sector, not to mention practically zero debt.

Even just looking at technicals, it is currently right above its 200 SMA @$74. Top of range is like $95 and it'll probably be at least somewhere north of $90 by end of Jul.

Disclosure: I currently hold LEAPs for MU"
2021-06-24 15:52:46,stocks,"Damn, I would've sold a LOOOONG time ago if my cost basis was $20 for MU, lol."
2021-06-24 15:55:01,stocks,Hell yea I would do that.
2021-06-24 16:35:47,stocks,"MO 
And in the news:

Is a Merger in the Cards for ViacomCBS (VIAC)?"
2021-06-24 16:01:57,stocks,I inherited it haha. It’s been a year+ now so i dont have to pay short term tax for it so that’s why i asked
2021-06-24 15:34:50,stocks,"A reminder to everyone, please focus on how this is going to affect a specific stock or the stock market in general.

If your comment is pushing political agendas, memes, insults, trolling, etc then your comment is going to get removed and/or get you banned.

If you *have* to discuss just the politics, then post this topic to r/PoliticalDiscussion without linking back to r/stocks, thanks!

*I am a bot, and this action was performed automatically. Please [contact the moderators of this subreddit](/message/compose/?to=/r/stocks) if you have any questions or concerns.*"
2021-06-24 17:28:23,stocks,This will help CAT Caterpillar.
2021-06-24 19:59:32,stocks,Damn… I was really hoping this bill would be my chance for icln to break even so I could get the hell out of this shit hole. 🤣
2021-06-24 17:20:41,stocks,"Buy on the rumor, sell on the news?"
2021-06-24 19:28:59,stocks,"The deal is not finalized. This bipartisan bill will pass in the Senate with Republican support - and then the Democrats will use the process of reconciliation to pass additional spending measures on TOP of the bill, which are likely to include additional dollars for EV infrastructure. 

The bipartisan agreement along with the additional reconciliation will then make its way to the House where it will be passed. 

Important to note - if the additional spending in the reconciliation is not passed, Speaker Pelosi said today that the House will **not** hold a vote on the bipartisan bill as a standalone."
2021-06-24 19:19:48,stocks,"They're already talking about passing a second bill using reconciliation to add in a lot of the stuff missing from this package like EV infrastructure, and paying for it by raising the corporate tax rate/higher taxes on the wealthy."
2021-06-24 19:34:41,stocks,CLF 🦾
2021-06-24 15:36:02,stocks,"Well I for one, thought all the $ was going to go to infrastructure. I’m just shocked. Appalled."
2021-06-24 16:53:18,stocks,I'm looking at this and see $49b on public transportation. I have to believe a lot of that will go towards EV.
2021-06-24 15:44:35,stocks,Think they missed the usual 20% to fraud and waste like every other bill.
2021-06-24 19:10:38,stocks,"imo, they can't go big on EV's until the powergrids are increased. Or there will be near constant blackouts.🤔"
2021-06-24 15:54:04,stocks,how did i just get ratiod on a post that is just  data analysis
2021-06-24 19:53:59,stocks,"Would PFAS and related water treatment be covered under environmental, water infrastructure, or something else?"
2021-06-24 19:40:42,stocks,*inflation has entered the chat*
2021-06-24 19:40:30,stocks,What about hydrogen stocks like PLUG? Do you guys think this bill can affect Hydrogen?
2021-06-24 15:38:35,stocks,WTF is “resilience”?
2021-06-24 18:15:27,stocks,"Oh look, we are getting ripped off again."
2021-06-24 16:53:56,stocks,"Credit where credit is due. That is way less shitty than I thought it would be 

I was anticipating a bill with 80% of the funding going to childcare, equity initiatives, and other useless BS"
2021-06-24 15:57:59,stocks,"I'm so shocked a politician didn't follow through on their promises.

/s"
2021-06-24 17:32:25,stocks,"I read an article that said Biden said ""Human infrastructure"" was non negotiable for him but I don't see anything in this budget that would classify as ""Human infrastructure"".  
Can anyone help me understand this discrepancy?"
2021-06-24 19:54:02,stocks,"Let’s chalk it up as round 2 when fusion is available, then we can really overhaul everything"
2021-06-24 19:35:40,stocks,Trying to find smaller caps that it'll help in the sector also.
2021-06-24 18:42:32,stocks,"I don’t think so, because there is a second bill and there is still some details at play. Plus we don’t know how much this will increase shortages that boost raw material prices (good for stocks like NUE, X, MLM, VMC, FCX)"
2021-06-24 19:59:27,stocks,Add community solar and you’ll have developers pay for the upgrade infrastructure. It’s quite simple really
2021-06-24 15:39:52,stocks,"the original deal biden had was $400B towards EV, these are the updated ratios"
2021-06-24 17:01:57,stocks,"not sure, because technically i consolated EV infrastucture which was broken into two catagories, EBuses 7.5B and charging stations 7.5B"
2021-06-24 16:44:19,stocks,20%? Make that 60%
2021-06-24 19:36:22,stocks,"Plus 30 minutes to recharge, imagine getting ""gas"" in the morning when 20 people are waiting. 😂"
2021-06-24 15:47:07,stocks,"[This](https://www.nj.gov/dep/floodresilience/rbd-hudsonriver.htm) is an example.

Infrastructure resilience should mean money to projects to protect against future floods and other natural disasters."
2021-06-24 15:41:08,stocks,"my guess is either spending on protecting coast lines and earthquake proofing buildings, or just rebuilding worn down buildings in inner cities."
2021-06-24 15:43:39,stocks,Probably meant repairs or updating.
2021-06-24 17:10:28,stocks,It still will. Count on it.
2021-06-24 17:34:29,stocks,"Not from America, so coming at this from a different perspective and wanting to get your view - why to you think childcare is BS? It’s a pretty popular social program where I’m from"
2021-06-24 18:53:10,stocks,Childcare is useless? Of all the horrendous useless tax dollars our government wastes you choose childcare?
2021-06-24 17:06:06,stocks,"Oh thats still happening, its just shifted to its own second path bill"
2021-06-24 17:19:22,stocks,"How are initiatives that benefit areas of society that our current market undervalues useless?  I think investing into our society into areas that helps allow people to enter the workforce, escape poverty and close the racial wealth gap, would create a better long term functioning economy that doesn't leave millions behind.  The biggest thing I think this bill misses is serious climate related investments, which the longer we ignore the exponentially larger expenses we'll have to deal with down the road."
2021-06-24 17:25:55,stocks,Now it’s only 42% bs.
2021-06-24 15:59:43,stocks,I mean its kinda hard when republicans wont let him fulfil them all the way.
2021-06-24 19:23:41,stocks,"Dems are already talking about passing another package that will have a lot of the stuff that's missing such as the ""human infrastructure"" component.

>Hours after U.S. President Joe Biden declared “we have a deal” to renew the nation’s infrastructure, the Senate’s top Republican lashed out at plans to follow the $1.2 trillion bipartisan bill with another measure addressing what Democrats call “human infrastructure.”

https://reut.rs/3h4HDHD"
2021-06-24 19:47:09,stocks,"TTC. In 2019 they acquired Charles Machine Works, which makes underground construction equipment. Should see a nice tailwind from both infrastructure and future 5G development."
2021-06-24 19:51:07,stocks,Right but i think the plan is for the dems to pass a second bill via budget reconciliation that covers EV and climate spending
2021-06-24 15:42:25,stocks,"What, exactly, would the Federal government spend the “EV” money on?"
2021-06-24 17:26:37,stocks,Sorry I was not aware of that. How are they going  spend so much in money on public transportation and railways without touching on EV? (Hypothetical question)
2021-06-24 19:19:20,stocks,"Oh good, cuz I actually want that to happen."
2021-06-24 19:51:18,stocks,"I read that as being more about an *infrastructure* bill being porked-up with money earmarked for childcare.

Though the other respondents aren't completely off-base either."
2021-06-24 19:01:44,stocks,"We Americans have a rich tradition of voting against our own best interests and don't have time for this ""thinking"" concept you're referring to"
2021-06-24 19:27:29,stocks,[removed]
2021-06-24 17:19:57,stocks,I doubt that will get through. I can't see them getting enough votes if this bill is where they landed on after over a month of negotiations
2021-06-24 19:01:17,stocks,Thats not infrastructure tho. So it should not be in an infrastructure bill. If biden wants those things he can propose a different bill for that.
2021-06-24 17:05:48,stocks,Oh yes. My mistake. Only truthful politicians are on one side. A politician who is elected by appealing to the masses couldn't possibly ever lie.
2021-06-24 15:52:10,stocks,"500,000 ev charging stations and upgrading goverment veichles (and busses) to ev"
2021-06-24 19:15:57,stocks,"Helping city and county transition from diesel to electric fleet, upgrade facility. Power infrastructure have to also be upgraded to meet new electric demand."
2021-06-24 15:48:33,stocks,"Just like the Obama stimulus bill, this will benefit the unions, which is better than purely benefiting Wall Street. But This will not help average joe at all. The guy working at Wendy’s or hone depot or the independent contractor will not see any of it"
2021-06-24 18:44:08,stocks,"Good question, that’s why I’m waiting for more details"
2021-06-24 19:04:36,stocks,Probably rebuilding bridges and roads. Most all the bridges in the U.S. have been deemed slightly or horrifically decayed and inadequate.
2021-06-24 18:45:05,stocks,They can reconcile the bill
2021-06-24 19:10:51,stocks,"That's not how government works though, you only get a chance to pass so many bills, so you wrap everything up into a larger bill. Every major spending bill is like this. If there was a way to rapidly pass bills for every little part of the economy that needs assistance then maybe this could happen."
2021-06-24 19:18:38,stocks,"In addition to what was said below, considering the current senate majority leader has made it known his objective is to stop any democratic progress they need to combine multiple aspects of things they want to achieve in every bill possible. Our presidents are lucky to pass 1 maybe 2 major bills.

Edit - I'd love for someone to explain why their downvoting this.  What have I said that's untrue?  Mcconnell has repeatedly vowed to slow and stop bills proposed by democrats and regarding major legislation passed by presidents trump had the tax cuts and stimulus, Obama had Obama-care.  The rest was mostly gridlock."
2021-06-24 17:09:00,stocks,"Its true though, the majority party always faces contention from the minority party that tries to block their process. Happened to obama trump and biden. Plus it is logical, why would one party want the other to be successful, its against their interest."
2021-06-24 16:21:04,stocks,Actually much of the EV money was to get power to the charging stations. Quick charging requires much higher voltage (800 volts +)than what is typically near commercial properties.
2021-06-24 17:23:07,stocks,Infrastructure we do not have the power production to support unfortunately.
2021-06-24 19:18:51,stocks,This will like fit in better in agency budgets and make this bill more palatable to fiscal conservatives
2021-06-24 15:56:35,stocks,Interesting. When Ford started pumping out Model T’s did the federal government build all the gas stations? I don’t know the answer.
2021-06-24 17:08:19,stocks,"I don't agree

Davis-Beacon wages will be applied on non Union infastructure work.  Resulting in higher wages for those parties and for unions.  The result is more likely to create some wage inflation that would assist in driving Wendy's workers hourly to 15 etc as the labor market contracts from lack of supply at the bottom of the economic ladder

Will it be significant, I don't think so, will it apply pressure... Certainly"
2021-06-24 19:45:12,stocks,"That may be true, but then dont be mad if republicans do the same shit next time around. Not saying you get mad, its just a more general statement. Someone needs to break the cycle of hyper-partisan politics so it might as well be biden."
2021-06-24 17:12:46,stocks,[deleted]
2021-06-24 17:19:43,stocks,"I also read and was told that much of the power lines in the U.S. are old school non- insulated cables(or possibly just weaker), and that they would have to be upgraded before they could support the transfer of power required for that many charging stations. I could be totally off, or relaying it incorrectly, but this is what I got lol."
2021-06-24 15:58:31,stocks,I know they helped build the roads for them to travel on and eventually subsidized gas stations
2021-06-24 17:21:56,stocks,Well u can’t put electricity in a truck from a refinery so
2021-06-24 17:26:33,stocks,I think you missed the part where he said the same thing happened to trump
2021-06-24 18:39:21,stocks,"Yup, that’s why I own copper"
2021-06-24 17:31:56,stocks,[deleted]
2021-06-24 19:20:08,stocks,"Yeah, but non-underground cables are almost exclusively built with Aluminum though"
