Timestamp,Subreddit,Post/Comment
2021-05-22 13:45:34,stocks,I know ?!?!? Someone please tell me why?!?!
2021-05-22 13:44:33,stocks,"I’ve had both for over 10 years. JNJ has performed much better over the long haul.  MRK does pay a better dividend.  MRK has consistently been regarded as a well run company with solid management, strong pipeline, and they haven’t had any serious missteps.  Just keep wondering when it’s going to shine?  Idk....probably right after I finally give up waiting, lol..."
2021-05-22 17:16:32,stocks,I totally agree with you. I was too greedy and am now down a few thousand dollars
2021-05-22 05:28:59,stocks,"That also surprises me. Last I checked yesterday, it was still in the 12's. Just looked again. Wow. We'll see if she holds above 13."
2021-05-22 17:14:47,stocks,I bought it at 58
2021-05-22 11:58:50,stocks,Well at least she got some closure
2021-05-22 15:34:11,stocks,"+70% in 9 months since IPO.

Yeah that really bad ..."
2021-05-22 12:52:40,stocks,"Definitely agree with being skeptical about China getting involved. At the same time, semis are everywhere now and I don't see the demand ever going lower for smaller, more powerful chips at high capacity. I invested because they are one of the giants, how could you go wrong with the discount prices this year and enormous growth potential? I didn't even bother looking at TA when I bought. Discounted monopoly on the supply? I'll bite.

Maybe I get burned, maybe it shoots way up. 🤷‍♂️

Either way I made my bet. If it goes south I'll just have to retire a few years later than I anticipated."
2021-05-22 16:49:36,stocks,Perfect example as to why to wait for awhile after a IPO or DIrect offering look at $COIN it open at 380 went 429 then  took a huge shit fast and now sitting at 225. Its a crap load of ppl holding some expensive bags.
2021-05-22 16:08:10,stocks,Luckily dodged that bullet
2021-05-22 09:53:18,stocks,Some of us holding options 🥲
2021-05-22 02:51:46,stocks,"I just make music and chill at bars idk how you guys can sacrifice fun for stock investing but all the best to you, hope you make some good moolah."
2021-05-22 11:54:54,stocks,Damn the original GME...
2021-05-22 16:52:25,stocks,"No, I meant 90. Any discounted free cash flow that tries to look at their actual value and is not complete speculation puts it between 80 and 110. Just because people buy it at 250 doesn’t make it intrinsically worth that."
2021-05-22 15:54:09,stocks,Man i hope it fluctuates back up to $260. I really dont want to swallow a realized loss right now. Id swallow 12k if i sold right now. Im holding for now though.
2021-05-22 06:22:54,stocks,"They always were a Communication Security Company, you bought their phone because of Sec and there own Network."
2021-05-22 02:26:59,stocks,World leader?
2021-05-22 13:25:59,stocks,He saw some memes
2021-05-22 14:26:29,stocks,He is bonkers on Cathy woods
2021-05-22 12:23:38,stocks,"Lol their 5 year model assumes tsla will be the most profitable insurance company in the world, running a fleet of robot taxis inside of 4 years. It's absurd on its face."
2021-05-22 19:09:28,stocks,"I agree. I'm down a few hundred but I really don't care. Federalization is inevitable, and then it will be our time. Smart people are buying now after the pump in January/February."
2021-05-22 04:06:20,stocks,"I only bought one share, and thank god! The stock has done nothing but tumble since then."
2021-05-22 14:25:22,stocks,Next breakout for Tesla is when it releases a million mile battery
2021-05-22 15:20:00,stocks,"Actually although i'm working on the Merck DD, I already did JNJ yesterday. I am really suprised with their continued growth and widely spread sources of income! What do you think of them at the current price?"
2021-05-22 14:12:34,stocks,Your glass has the garden hose going on full into it
2021-05-22 17:59:44,stocks,"Not everyone bought at IPO, and their Forward P/E is under 20 right now. They just reported a triple beat (Beat revenue, EPS, and forward guidance) and the stock went down, hence disappointing, but hopeful..."
2021-05-22 13:08:36,stocks,"Indeed, either way is a gamble really. I've been on the fence on both but have yet to buy in....I just don't trust the CCP.... so I've got my shares in the semi market elsewhere"
2021-05-22 11:31:36,stocks,I'd be a lot less thrilled with options vs. shares.
2021-05-22 04:41:03,stocks,"The fuck is the point of a comment like this?  ""I'm gonna go to a forum based around a certain thing, say I dont understand how anyone could like that thing, and offer a condescending good luck."" If you are cruising this subreddit without any interest in trading or investing, it is you who is wasting your time."
2021-05-22 09:03:13,stocks,I think investing is pretty fun.
2021-05-22 02:52:44,stocks,"Downdraft, IPO, analytics, forensics, margins. All these disgusting words. :)"
2021-05-22 11:14:36,stocks,"Yep, backed up by gartner, university health network in Canada, NSA and a bunch more, there's been almost weekly catalysts for blackberry on new partnerships, new products and partners for sometime now.

But you won't find it here because holding BB is supposedly bag holding."
2021-05-22 12:28:52,stocks,The important part is that it's not impossible ;)
2021-05-22 16:14:37,stocks,"Always a long term buy.  I can’t predict what will happen in the short term but have never regretted getting in.  There have always been questions about the price, but in the end, it’s been a long term excellent performer.  No reason to think that will change....IMO......"
2021-05-22 13:14:54,stocks,Yeah I'm getting cucked
2021-05-22 08:40:45,stocks,Wah
2021-05-22 09:35:25,stocks,"Same. It's a big hobby of mine, I spent hours a day on it because it's fun as hell"
2021-05-22 09:25:04,stocks,"I think you’re doing Reddit wrong, you know you can find subs that you might have more of an opportunity to have meaningful contributions to?"
2021-05-22 10:10:41,stocks,"I like finding delusional people on the internet. What do you do for work? I imagine you’re unemployed. Are you married? Are disabled mentally in any way? Older or younger?

I’m so curious."
2021-05-22 17:13:05,stocks,That's why they have declining revenue even with they're balls deep in their turn around plan.
2021-05-22 12:31:37,stocks,"Lol, it is impossible for this to happen."
2021-05-22 13:49:47,stocks,That's dope I'm glad it's fun for you guys. I'm kinda surprised so many people got upset at me saying the stock market isn't fun for me lol. Was just looking for a discussion on the spiritual side of investing.
2021-05-22 13:47:12,stocks,"Ah fasho, im happy to oblige u. I'm 21, own a semi successful landscaping business, around 10k in savings, made around 1k off the stock market so far but it doesnt fit my life goals to spend years getting good at trading. Realized that after browsing this sub for a couple months. I'm deaf in both ears but since I got a cochlear implant when i was one I've heard it's very hard to tell from my speech. 

I was drunk last night and believe it or not I was commending y'all on your discipline to stare at a computer screen all day and do math."
2021-05-22 17:39:23,stocks,"That's the thing though, it's essentially a bet on whether these new partnerships generate revenue or not, if you don't believe so then you don't invest in it. Simple as that."
2021-05-22 13:29:42,stocks,Care to explain why you think that?
2021-05-22 19:49:32,stocks,I figured you were drunk. You sure wrote like you were. People here seem pretty uptight.
2021-05-22 14:23:17,stocks,Care to explain why you think it's a possibility? Null hypothesis is pretty obvious here.
2021-05-22 14:42:14,stocks,"What ever I tell you will be from Arks website. 

Read that."
2021-05-22 15:17:07,stocks,"Trying to gain some bear perspective other than ""she got lucky""."
2021-05-22 15:27:21,stocks,"Take your own advice and read ark big ideas, then draw your own conclusions. The entire paper is nothing but wild speculation."
2021-05-22 15:42:20,stocks,"Wright’s Law Has Modeled The Decline In Battery Costs Successfully

Why should the trend break? When ev's become cheaper than gas it's gonna be a party!"
2021-05-22 15:51:40,stocks,Do you want to explain how that intersects with the best insurance margins in the universe and the likelihood of robot taxi technology in the next 4 years?
2021-05-22 15:53:50,stocks,Yes please
2021-05-22 16:04:35,stocks,"Oops. I thought you were gonna explain something.


Well insurance will go down as roads become safer. 

The neural networks improve every day. Just gotta be patient. 

It's seriously impressive to see a Tesla drive it's self. Have you been in one while it's doing that?"
2021-05-22 00:00:00,stocks,"I Need a Little Guidance I’ve been lurking on r/stocks for a long time. Haven’t contributed because, well, because I have nothing to contribute. I’m pretty new at investing. 
Here is my question. 

I have a Roth IRA through Vanguard. I chose the Target Retirement 2050 fund. I am able to max this out every year. I wanted to start investing more and opened an account with Merrill. My  plan, so far, is:

60% ETF’s 
Within that 60%, 50% is growth and 50% is speculative.

40% Individual Stocks
Within that 40%, 50% growth and 50% speculative. 

Question 1.) Is this a good plan? I have a tendency to overthink and over complicate things. 

Question 2.) For my growth ETF positions, I already have some shares of VTI. Is this position redundant since my Roth IRA is Vanguard Target Retirement 2045(which I max out.) From what I can read, the 2045 target retirements holdings are 50% VTI. If it is redundant, would anyone happen to have a recommendation for growth ETF that would offer different exposure. 

Thank you in advance. This community is a great resource."
2021-05-21 21:27:53,stocks,Sure there is nothing wrong with your plan. But why do Growth and Spec. In both ETF and Individual?  I would add some Value / dividend stocks.
2021-05-21 21:29:45,stocks,"I think your way ahead of most people, looks like you've thought everything through. You can always adjust your % toward or away from risk when you want but no need to change anything imo"
2021-05-21 22:02:26,stocks,"$VWUSX look at this one, I invest in this one regularly. Please do ur dd and good luck"
2021-05-21 22:05:52,stocks,"I’m 19, also have a roth and individual brokerage account with vanguard

-max out roth

-I like to do 60% etfs (about 70% of that in VTI and 30% in qqq), 30% stocks and 10% speculative

Do what you want with this info. I like my set up"
2021-05-21 21:32:25,stocks,I like the strategy. Aggressive is good. No need to be afraid unless you need money in the near future. Consider ARK ETFs if you haven’t already
2021-05-21 22:48:11,stocks,"If you want something growth like, ICLN is always a good recommendation following their rebalancing. If you want a foot in the clean energy game, that's probably your safest bet, alongside TAN. Maybe consider a 50/50 - 70/30 split in ICLNs favour if you do buy a bit of both, but that's just how I would split it."
2021-05-22 10:02:42,stocks,"IMO you're way overthinking it.  You already have a target retirement fund that you're maxing out every year.  That's your diversified backup.  

If you like doing research and want to work at learning to invest, put the rest in stocks.  If not, just put it in VTI.  Fuddling with asset allocations is a complete waste of time and effort.  It's like cutting supermarket coupons to save five cents on milk.   You're better off learning something fundamental about companies or markets or economies.  

I'm 100% stocks for over 15 years and have done well.  I don't bother with canned methodologies like ""growth"" or ""value"" or ""dividend"" investing or sector allocations or bonds or any of that crap.  Just buy stocks in strong companies when there is a good price opportunity and sell the same way.   

I've read many Buffet books.  They were great in terms of learning about how to read financial statements.  But in the end his complicated valuation strategies don't provide much return on the effort.  Over the last 20 yrs no one cared about AMZNs ROE or whatever, they bought the stock because it was screaming upwards, and it was screaming upwards bcz AMZN was growing revenue stupidly fast.  For AAPL and GOOG the same, with profit also important for them.  

Good luck!"
2021-05-22 17:46:44,stocks,GOOGL MSFT AAPL AMZN PYPL NVDA
2021-05-21 21:34:23,stocks,Honest answer...ignorance. I don’t have a whole lot of knowledge on value and dividend stocks. Looks like it’s back to the search bar. Haha.
2021-05-22 07:33:41,stocks,"If I went heavy in VWUSX, would that make it redundant to invest individually in Amazon, Google, Alphabet, etc?"
2021-05-21 21:37:03,stocks,My thought was that the Roth IRA is my “safety net.” I could afford to be a little risky as long as I contribute to that.
2021-05-22 17:48:06,stocks,No to ARKK!  Stick with AMZN AAPL MSFT PYPL NVDA GOOGL
2021-05-22 06:31:58,stocks,"How exactly do you value ICLN to make you say it’s always a good investment?

Most of the holdings went from lofty to extreme valuations, and have come down to somewhere between the 2 by now, but still, I wouldn’t tell someone to put their entire allocation towards growth into 1 thematic ETF ( or 2 with the same profile )."
2021-05-22 17:50:19,stocks,50% of my portfolio is AAPL MSFT GOOGL AMZN etc.  Will I be ok 5 years from now?
2021-05-21 21:50:57,stocks,"Some stocks will do better with low interest rates, like growth and spec.  If rates go up others like Val/div and consumer will do better.  Also inflation has diff effects on each group.  By diversifying you will / can average out in most markets.  Big down turns will effect everyone but some more than others"
2021-05-22 10:00:43,stocks,"do u hv the time to track and maintain positions doing individual stock on daily basis ?
what r the returns u expect on your investment ?
to ur question, No since results risk/reward at the end of the day will be different

Above is as per my opinion, u still need to do ur own research, its ur own hard earned money"
2021-05-21 21:54:23,stocks,"That makes sense. Thanks for the insight. In terms of percentage of total portfolio, what would you suggest...or am I over complicating? Haha."
2021-05-21 21:59:24,stocks,That’s up to you.  Look at risk/reward. How much risk are u willing to take for a certain amount of possible reward.  Then based on that set your %.
2021-05-22 00:00:00,stocks,"Anyone familiar with Nvidia’s takeover of British chip designer Arm? I am considering putting some money into NVDA and read a little about the deal. From what I gather, it seems like it makes a lot of business sense but politics might get in the way?

Curious if anyone has done significant research on the topic."
2021-05-21 23:06:46,stocks,It has a chance of being blocked because ARM’s other customers happen to be some of NVDA’s biggest rivals. Would not be surprised to see it blocked.
2021-05-21 23:08:21,stocks,ARM is partnered with DARPA.  Guess thats why the gov is intervening on the acquisition.
2021-05-21 21:39:40,stocks,They announced today that they will do a 4 to 1 split in July. Buy now get 3 free.
2021-05-22 00:03:48,stocks,"There are basically 4 parts to the semiconductor industry. Architecture (ARM, Intel), design (NVIDIA, AMD, Apple, Intel, etc…), manufacturing (TSMC, Samsung), parts supply (AMAT and many others).

As you can see, there are two main bottlenecks in manufacturing and architecture. NVIDIA is acquiring a very strategic part of the semiconductor supply chain that can be used powerfully. I am long NVIDIA because of this.

There is actually another bottleneck in the supply chain which is the Dutch company ASML that supplies highly advanced manufacturing equipment.

There is a chance that the acquisition is blocked. USA and Europe are both trying to get a better grip on the semiconductor supply chain. Europe's main levers are ARM and ASML. ARM being acquired by the American NVIDIA could be an issue for them. However, ARM is currently owned by the Japanese company Softbank, so this might be an overblown fear."
2021-05-22 02:28:54,stocks,"UK gov will most likely block this deal to prevent monopoly, another merger to look out for is AMD and Xilinx. That will most likely get approved and will be a huge boost for AMD for exposure in much more industries."
2021-05-22 05:39:19,stocks,It won’t go thru until 1st quarter 2022 if it’s not blocked.
2021-05-21 21:24:04,stocks,"TSM is a hidden gem, I’ve been hodling for about year now. They lead the world in chip manufacturing."
2021-05-21 21:17:21,stocks,"Nvidia will acquire arm, it is known."
2021-05-22 03:04:48,stocks,Is this why they announced the stock split? More cash?
2021-05-22 04:09:12,stocks,Didn’t it get blocked?
2021-05-22 05:10:39,stocks,It got blocked by the gov already due to national security.
2021-05-22 05:11:53,stocks,"Lots of regulatory hurdles.. the UK Government isn't keen on it and the there are a TON of issues to work out in China between the regulatory concerns AND the fact that that subsidiary has gone somewhat rogue.

&#x200B;

Lots of regulatory hurdles.. the UK Government isn't keen on it and there are a TON of issues to work out in China between the regulatory concerns AND the fact that that subsidiary has gone somewhat rogue."
2021-05-22 06:43:49,stocks,"I don't know if there's much research that one can do, but I've been following reasonably closely since it was announced. Pretty much everything that has been announced since the initial plans has basically been what analysts predicted would happen at the time, the Chinese government remains the biggest hurdle and the most likely reason that the deal would fall through. 

The single human who probably has the best pulse on the situation and most info about it is Masayoshi Son and he implied a high level of confidence at the last earnings report. He's also overseen deals that involves Chinese regulatory authorities before (a lot). Also a tidbit that you could read a lot into or see as meaningless: the executive from ARM left Softbank's board and someone from the law firm that's advising the sale joined it."
2021-05-22 01:10:37,stocks,"TSMC is the bottle neck for growth for NVDA, not sure what everyone is excited about...  Samsung is a couple of years behind TSMC.  TSMC won't have any new fabs for at least 2 more years..."
2021-05-22 16:47:34,stocks,That's not the only reason it could be blocked. The UK could decide that it's a matter of national interest to block the deal.
2021-05-21 21:45:17,stocks,"I know you are probably joking, but for those that do not know... This is not how it works haha"
2021-05-22 04:56:33,stocks,"Should note, AMD also does architecture. the 64 bit version of x86 is from AMD. Without it we wouldnt have had 64 bit PCs in its current form(intel was betting on IA64 for 64 bit)"
2021-05-22 04:03:25,stocks,"Please forgive me for the ignorant question I am about to ask but, what is the difference between architecture and design regarding chips?"
2021-05-22 05:34:28,stocks,There is nothing hidden about TSM.
2021-05-22 08:52:28,stocks,How is TSM a hidden anything? Everyone knows about TSM. They’re the market leader.
2021-05-21 21:35:37,stocks,No one makes better silicone than them
2021-05-22 01:18:37,stocks,Add ASML and ASX to that mix and you’ll dominate the silicon world
2021-05-21 21:43:05,stocks,"Source? While I won't pretend I did extensive research, I spent an hour looking and couldn't find any articles or news reports saying it would happen."
2021-05-22 08:53:07,stocks,Already got blocked. That’s no secret either.
2021-05-22 16:34:35,stocks,"Not blocked. They are investigating it. And their reasoning is idiotic seeing as it was already sold to a Japanese ""bank""."
2021-05-21 21:47:04,stocks,I’m going to buy on the dip... I think this stock will go down 75 percent by June 20th
2021-05-22 05:38:15,stocks,"Not joking announced today, have have purchased before the vote day in June. Look into it."
2021-05-22 04:36:42,stocks,"Architecture in this context refers to a fixed set of protocols and framework to start building your chip off of. Think of it as if your chip was designed on x86 architecture, technically it'll be able to work on any mother board that is able to accept that version of x86 chip. A common language in a way Ensures that the chip can operate with any hardware that is designed for the same architecture.

Design here refers to the customizations you do on top of the common framework to make your chip faster, more power efficient or do more things above and beyond what a common x86 framework chip can do."
2021-05-22 16:49:59,stocks,They're literally one of the biggest public companies on the NYSE/NDAQ.
2021-05-22 00:05:00,stocks,"Excuse me, but Brazilian women would like a word."
2021-05-22 04:41:04,stocks,"Check seeking alpha for some content on this topic. I would not invest in NVDA at the moment not until it is clear whether the deal with ARM will go through. Also, inflation fears might reck tech market until mid autumn and since NVDA trades at PE 84 it can drop in price very easy."
2021-05-21 23:35:04,stocks,"*NVDA shoots up to $2,400 on June 18th*


*Mr. Market laughs*"
2021-05-22 00:07:35,stocks,"Down 75%? 

Whats your reasoning"
2021-05-22 05:58:52,stocks,Lol. Please tell me you dont think you get free shares
2021-05-22 04:37:57,stocks,Thank you.
2021-05-22 16:50:45,stocks,What i’m saying
2021-05-21 23:47:26,stocks,I have puts for $150
2021-05-22 00:19:34,stocks,It'll split
2021-05-22 11:56:36,stocks,Oh he does. It's pretty funny
2021-05-22 16:29:53,stocks,"Noob question, why does a company split shares? Seems it just artificially lowers the share price, but to what end?"
2021-05-22 06:14:29,stocks,"No, nothing is free."
2021-05-22 06:26:38,stocks,that's not how options work. the contracts will split too
2021-05-22 15:04:15,stocks,"hahaha, those $150 puts will turn into $37.5 puts post-split"
2021-05-22 00:20:37,stocks,Oh was that guy being sarcastic? Didn’t pick that up
2021-05-22 04:37:28,stocks,Now you understand why people will panic sell and create a beautiful opportunity to buy!
2021-05-22 05:59:43,stocks,"A split splits the value, since it's a 1:4 it will be a 75% loss per share but you gain 3 extra shares, so nothing is lost obviously."
2021-05-22 05:39:27,stocks,Was not being sarcastic. Little research goes a long way in making money.
2021-05-22 00:00:00,stocks,"Do you use discounted cash flow for evaluation? If you do, where do you get the forecasted values from? I’m looking to expand my tool belt in how I evaluate a stock. DCF seems like a reasonable method for companies that are deeper into their life and aren’t expecting as much growth. The problem I am having is finding forecasting values. Granted, the numbers are just that, forecasts, but something with some actual science behind it would be helpful. Thank you."
2021-05-21 21:08:25,stocks,"Forecasting is not a science, it is more of an art. Companies have been paying me to do financial forecasting for a long time.  The key is to look at the underlying assumptions and see if they make sense. Does each number in the forecast have an underlying assumption that makes sense? And then, look at ranges, worst case, best case etc."
2021-05-21 22:52:41,stocks,"If you are doing a DCF for a company with 10 plus years of financials available wouldn’t you simply look at the past and more recent growth rates of revenue and net income? 

I am only somewhat familiar with the DCF method but isnt the goal to establish a margin of safety? Therefore using conservative growth rates reflected in the past performance would allow you to come up with a rational expectation of future earnings?"
2021-05-22 01:21:40,stocks,There is no scientific formula.
2021-05-22 01:35:36,stocks,Bloomberg
2021-05-21 21:51:07,stocks,Simplywallstreet does this for you. It’s a good place to look for a start. Their values can be wildly but that’s why it’s a dark art not a science.
2021-05-22 03:41:00,stocks,"You’re looking for Edgar. It has all public companies 10-k’s and such so you can build your models. 

https://www.sec.gov/edgar.shtml"
2021-05-22 04:30:00,stocks,"Often the first place to start is revenues which for many is price x quantity. You want to ground those forecasts with data from their management team and from their competition. This is where greater economic forecasts also come in.

Some costs you just tie back as % of revenue. Some you forecast individually. 

Usually after all is done you try to add some sensitivity analysis by tweaking your revenue assumptions and cost assumptions by +/- 10% 20% or whatever. 

It’s an art because in each step you introduce your own input and thoughts as to what seems to make sense. And because it’s a forecast, there’s no way to know beforehand if you made the right choice. You can try to back test your model with historical data but that’s not a guarantee."
2021-05-21 21:10:13,stocks,"Where would I be able to find this sort of thing? Even if I learn the basics, I don’t think I’d be able to apply it well enough to trust it. The equation breakdown is something I can do, but the forecasting I would need a lot of time and practice to even understand."
