Timestamp,Subreddit,Post/Comment
2021-04-26 19:40:18,stocks,"65 shares all bought in the mid-$80s range here, let’s gooooooo!

I fancy them for a long-term hold but exciting anyway!"
2021-04-26 19:43:44,stocks,"They'll beat earnings, stock will tank"
2021-04-26 19:33:02,stocks,"When I bought in at $87 months ago, I thought I got a bargain.  I really hope they have good news."
2021-04-26 19:43:27,stocks,Expecting low 70s by next week but will buy the dip!
2021-04-26 19:49:03,stocks,"With all the chip shortages, I think this will be the case. Even with great earnings."
2021-04-26 19:33:04,stocks,"Okay, so the option strike price stays the same but is now for TLRY. The way this works is you get .8381  of you APHA shares as TLRY shares after the merger. So when purchasing options, each option you purchase is for 100 shares of the stock. In this scenario, once the merger happens instead of 100 shares per option, you will now have 83 shares per option (I can't remember if the converted number was different for options, but it's about 83 shares.) So you will then have the option to sell or execute your 83 share options."
2021-04-26 19:36:25,stocks,"Extra side note: $13 put on TLRY after merger may not have been very wise. Honestly either way this pans out I would say the option will expire worthless. They are at $17 pre-merger. I doubt a catalyst is going to make them drop ~23% in a month, but I guess we will see. My advice, if you see an opportunity before expiration to break even, take it."
2021-04-26 18:18:22,stocks,So now both Uber and Lyft out of the autonomous robotaxi network? I guess it wasn’t so easy to maintain and grow after all.
2021-04-26 19:03:10,stocks,They’ve got to focus on profitability right now. Wouldn’t surprise me to see them get back into autonomous in the future.
2021-04-26 18:55:25,stocks,"It never made sense to me that these guys thought they could just walk in and try to rush a product to market. 

Google has been at this for over a decade. If I'm placing bets on someone being first to market, and doing it right, it'd be on Google."
2021-04-26 19:07:04,stocks,"Yeah man Elon is gonna win this war.
Wish I owned TSLA lol"
2021-04-26 19:11:19,stocks,What advantage will they have over other players who stayed in the space all along?
2021-04-26 19:01:13,stocks,"Well, google’s waymo is secluded to only Phoenix Arizona no? Or have they expanded?"
2021-04-26 19:29:25,stocks,"Google’s Waymo has agreements w/Lyft anyway. Yeah that’s not as profitable as owning a self driving technology, but they still stand to gain from Google’s tech if they hit full automation first."
2021-04-26 19:09:18,stocks,good news it’s dippin
2021-04-26 19:30:55,stocks,"That's the same place uber lost their accreditation from hitting and killing that woman. Developing a fsd car is more than a two year project, which is how uber and the like were treating it."
2021-04-26 17:58:33,stocks,"You lose time by holding. If another investment would make a higher return over the same time period, I would sell at a loss to invest in the higher potential return."
2021-04-26 17:56:04,stocks,"I’m not sure what you’re asking specifically if it’s “can I just sell and rebuy when it’s lower so I can make more than if I were to just hold” then the answer would be: how do you know how far it will go down? What if you sell and it was at the bottom and now it’s starting to go up?

If you’re asking why you should sell, then there are a ton of reasons that can make someone sell. If there is a better opportunity else where or if something materially changed in a company are just some reasons. 

Before you sell, ask yourself this: “why did I buy this stock in the first place? What changed my thinking process compared to now?”"
2021-04-26 18:07:52,stocks,Commissions are a down side.
2021-04-26 18:41:50,stocks,"you did well selling, I was in the same spot few weeks earlier, kept the stock and it only went down, I found myself down 43% while my stop loss was initially set to -1% ( a stop that I removed hoping it will bounce back ) I will never ever disrespect my strategy and as wonderfullingeniunity said earlier : remember why you bought the stock. good luck trading"
2021-04-26 17:55:37,stocks,No downside. If it turns rebuy.
2021-04-26 18:00:22,stocks,No downside unless you rebuy within 30 days.
2021-04-26 17:54:17,stocks,You lock in your loss...duh.
2021-04-26 18:23:02,stocks,I always consider this a correction. No harm done.
2021-04-26 17:53:00,stocks,The downside is this question
2021-04-26 18:00:45,stocks,That's what made me start thinking about selling. Thanks!
2021-04-26 18:01:34,stocks,"Thanks. This is good advice, especially the part about reminding myself why I purchased in the first place."
2021-04-26 18:01:43,stocks,Thanks.
2021-04-26 18:02:59,stocks,"I think that this 'lock in your loss' is the reason that I was considering not selling. But, if it goes back up, I'll have the chance to recover my losses. So, I'm ok w selling. Thanks for helping me think this through."
2021-04-26 17:38:37,stocks,There are some pretty fat target price raises here.
2021-04-26 18:15:00,stocks,"I love your posts but do you ever list downgrades? Cleveland-Cliffs had a downgrade today that’s been all over CNBC and that would be good information to list. Again, I appreciate your posts, try to read them every night."
2021-04-26 19:27:35,stocks,Never understood why firms even bother with raising their price target by $1 or $2.
2021-04-26 18:38:42,stocks,Nice green day today but let’s see how this momentum plays out.
2021-04-26 18:12:11,stocks,"At this rate no one actually knows wtf is going on with this stock. It baffles me everyday. 

I’m just enjoying the ride and there’s no way Would want to miss out"
2021-04-26 17:17:18,stocks,Wonderful news. Happy to hear some real news on GME.
2021-04-26 17:24:01,stocks,How does this help a squeeze? I would have thought it would do the opposite and mitigate it from happening by releasing more free float?
2021-04-26 19:16:49,stocks,"Sending everyone loads of love, the greatest HODL 🚀🚀🚀🚀🚀🚀🚀🚀"
2021-04-26 18:28:03,stocks,I shorted gme a few weeks ago. A company raising money you figured would decrease the price right? Why are we up 30% on the day then? I'm about to get margin called with the 300% margin requirement. Man I can't believe this stock.
2021-04-26 19:06:04,stocks,I feel bad for anyone that doesn’t have a ticket on this rocket. Oh well can’t cure stupid I guess..
2021-04-26 18:03:57,stocks,[deleted]
2021-04-26 19:20:17,stocks,Are you insinuating that there hasn’t already been a short squeeze?.....
2021-04-26 18:15:37,stocks,"Not gonna lie, I'm completely stumped how gme is trading at 190"
2021-04-26 19:53:33,stocks,Another squeeze is not gonna happen.
2021-04-26 19:06:12,stocks,"More stock, price goes up?    It would be the opposite, unless you assume someone is pumping to dump."
2021-04-26 18:42:08,stocks,Why is this good?  Looks to me like RH just sold the shorts 3.5 million shares.  But I'm supposed to hodl?
2021-04-26 18:00:49,stocks,!remindme 12 hours
2021-04-26 19:25:01,stocks,Finally another toilet flushes.
2021-04-26 19:05:02,stocks,instructions still unclear. going to buy more again i guess?
2021-04-26 18:53:46,stocks,i would not want to miss out on this ride
2021-04-26 19:41:51,stocks,"Same, I had probably around 13 shares way back in mid January, right before all the hyping all over the news media, when it was still in the mid 2-digits range. Sold out to recover costs after that crash, but held onto a couple shares, knowing it was the house money anyway, the ride's sometimes too fun to get off lol."
2021-04-26 19:58:21,stocks,"I played calls on this and made a lot of money....but the rollercoaster is too much for me, I will be missing out on this jump but best of luck to you and everyone else holding."
2021-04-26 19:06:31,stocks,Obvious stock manipulation.
2021-04-26 17:27:41,stocks,"You would be correct, however 3.5 million shares is a drop in the bucket compared to the total shares and estimated short interest on the stock. The reason the price is going haywire after hours now is because there is no longer a threat of share dilution and the fact that the offering was done at MARKET value of $157 speaks volumes as well. There is only positive outlook moving forward for GME at this point."
2021-04-26 19:09:24,stocks,Because it's complete. They are selling no mores shares. Now that it's been actioned the speculation is removed
2021-04-26 18:58:20,stocks,"They started selling these shares since Early April by their last filling i think ? So by slowly selling them on the market whith all these micro fluctuations all month long, they were able to add those 3.5M shares with minimal impact on the (possible) squeeze, or the price."
2021-04-26 18:12:37,stocks,"It's good for the squeeze imo because GME is debt free by end of month. This money may not have been used directly toward the debt but money that enabled them to go debt free without risk. Completely speculative, going debt free allows them to I dunno pay out a crypto dividend like overstock.com did and force a short squeeze."
2021-04-26 17:26:38,stocks,You are 100% correct.
2021-04-26 17:46:53,stocks,“Bad” for the squeeze but good for the company. At this point GME will not make big strides unless the company improves its business roadmap. So think of it as the “long” game to get the ball rolling again
2021-04-26 17:29:27,stocks,Prepare for downvotes from the cult
2021-04-26 17:46:49,stocks,"I hate to tell you this, but the short squeeze happened in January. What you saw recently was a Gamma squeeze, and is only possible due to how tightly held the float is."
2021-04-26 19:19:35,stocks,"Sorry m8 but I gotta say that was, in fact, not the move"
2021-04-26 19:26:25,stocks,"Not sure if serious, cause that would be the dumbest move ever (at least for this month)"
2021-04-26 19:13:53,stocks,What was the price you sold at? I thought it peaked at $190 the morning after the announcement.
2021-04-26 19:01:35,stocks,LOL
2021-04-26 18:38:59,stocks,guh
2021-04-26 18:30:40,stocks,Lol
2021-04-26 18:59:39,stocks,Stop disrespecting meme stocks
2021-04-26 18:43:37,stocks,No fkn way any retail was Ballsy enough to short gme. Holy f rip to ur port soon my brother
2021-04-26 19:32:39,stocks,Hopefully you and everyone else
2021-04-26 19:48:45,stocks,rekt
2021-04-26 18:41:32,stocks,"Im sorry for your loss. Im all in invested in GME myself at the moment. 
Unless you read and know how much market manipulation is going on and how much GME is an anomaly you will never understand. 
But i hope your next trades do better for you."
2021-04-26 19:36:49,stocks,RIP
2021-04-26 19:04:02,stocks,[removed]
2021-04-26 19:00:40,stocks,It wasn't the subreddit that did all of that although it has done some amazing things like the Gorilla foundation.
2021-04-26 18:47:08,stocks,Squeeze or not.. This has been cool to see. I'm in for either because I believe in Cohen and I've got time.
2021-04-26 19:25:40,stocks,"No way the shorts have covered, the squeeze is still coming imo"
2021-04-26 19:06:35,stocks,care to elaborate on how you derived that the squeeze is over? asking for a friend.
2021-04-26 18:38:00,stocks,This is the truth.  The shorts got out when Robinhood restricted buying shares during the first squeeze.  The potential for an ‘infinity’ squeeze is absolutely gone.
2021-04-26 19:37:29,stocks,"That wasn't a short squeeze... that was barely a squeeze, they've doubled down since then and only made it worse for them."
2021-04-26 19:36:53,stocks,"The stock has been injected very slowly all month long, nobody saw it and yet everybody was waiting / fearing 3.5M shares being injected at once, which would have tanked the price, or added some fuckery to the stock. 

Now, it has all been injected, and the price was barely affected if at all, so with that in consideration... Price go up, because there's less threat to expect tanking the price."
2021-04-26 19:09:42,stocks,"The original prevailing theory for many years was that GameStop was a doomed company with its relatively unchanged antiquated business strategy in an ever-growing ecommerce world. 

The shorts bet big that this company would eventually go bankrupt and cease to exist.

Well within the span of less than a year, someone with extensive experience in building a highly successful online retail business has quickly amassed an impressive amount of control over the company determined to steer it in a completely new direction.

And now, the half a billion raised through this sale of 3.5M shares builds a war chest and establishes a lifeline for the team to build on that vision. 

If the company is truly turned around. Revenue growth becomes a thing again. It's not only going to be mainly retail on the long side. 
Institutional investors will start piling in in droves. 

Shorts aren't going to be able to suppress buying pressure once more and more large whales enter the game against their positions."
2021-04-26 19:04:03,stocks,What? Did you iron press the last wrinkle in your brain?
2021-04-26 18:01:26,stocks,"I will be messaging you in 12 hours on [**2021-04-27 10:00:49 UTC**](http://www.wolframalpha.com/input/?i=2021-04-27%2010:00:49%20UTC%20To%20Local%20Time) to remind you of [**this link**](https://www.reddit.com/r/stocks/comments/mz87ma/gamestop_completes_atthemarket_equity_offering/gvzchxu/?context=3)

[**CLICK THIS LINK**](https://www.reddit.com/message/compose/?to=RemindMeBot&subject=Reminder&message=%5Bhttps%3A%2F%2Fwww.reddit.com%2Fr%2Fstocks%2Fcomments%2Fmz87ma%2Fgamestop_completes_atthemarket_equity_offering%2Fgvzchxu%2F%5D%0A%0ARemindMe%21%202021-04-27%2010%3A00%3A49%20UTC) to send a PM to also be reminded and to reduce spam.

^(Parent commenter can ) [^(delete this message to hide from others.)](https://www.reddit.com/message/compose/?to=RemindMeBot&subject=Delete%20Comment&message=Delete%21%20mz87ma)

*****

|[^(Info)](https://www.reddit.com/r/RemindMeBot/comments/e1bko7/remindmebot_info_v21/)|[^(Custom)](https://www.reddit.com/message/compose/?to=RemindMeBot&subject=Reminder&message=%5BLink%20or%20message%20inside%20square%20brackets%5D%0A%0ARemindMe%21%20Time%20period%20here)|[^(Your Reminders)](https://www.reddit.com/message/compose/?to=RemindMeBot&subject=List%20Of%20Reminders&message=MyReminders%21)|[^(Feedback)](https://www.reddit.com/message/compose/?to=Watchful1&subject=RemindMeBot%20Feedback)|
|-|-|-|-|"
2021-04-26 19:47:15,stocks,Hold?  Buy?  Too many choices!
2021-04-26 17:48:16,stocks,It removes uncertainty and gives Gamestop liquidity to try to transform itself.
2021-04-26 17:36:07,stocks,"This is the most logical explanation for the after hours spike, but I thought the short interest was down below 25%. Unless this synthetic shares theory is credible."
2021-04-26 17:32:09,stocks,I’m reading the complete opposite on WSB:)
2021-04-26 17:56:01,stocks,"It seems like there are two facets of GME holders:

1. People who believe in the future of the company
2. People who want to sell their shares for $1MM a piece

It's been pretty interesting to watch the pendulum swing back and forth between the two.  Right now, it seems like group #1 is definitely the majority right now.  The group that thinks they're going to retire billionaires after selling their 4 shares have gone straight down the conspiracy path.

Whether any of this still justifies the current share price, I don't know."
2021-04-26 18:54:59,stocks,It literally is. Take a doomsday cult and replace their doomsday prediction with the short squeeze prediction and you can't tell the difference.
2021-04-26 17:59:48,stocks,Who told you this?
2021-04-26 19:33:35,stocks,care to expand upon on how they specifically exited their positions? explain the market mechanism in ape terms pls.
2021-04-26 18:41:24,stocks,[deleted]
2021-04-26 19:42:35,stocks,"Sure,  it's not a pump and dump.   LOL.

After hours action is all organic."
2021-04-26 18:33:54,stocks,To try and transform themselves? Try? TRY? They already have! 😅
2021-04-26 18:06:08,stocks,"The thing about GME is it sounds like a conspiracy, it feels like a conspiracy, but when you look at the live trading data, it’s clear that millions of individual buy orders are being routed through dark pools, then shorted on the NYSE in batches with identical volume (one day a block of 37 shares is traded back and forth ten thousand times, another day it’s a block of 12 shares, etc.) Every trading day, someone borrows 300,000-500,000 GME shares, as well as millions of ETF shares with GME in them. 
 
There are two theories: one, that the whole GameStop squeeze thing is bullshit and a conspiracy, and the other, that it’s true and this has never happened before. 
 
The first one seems to make more sense, just because the other one seems like it’s ridiculous. But when you look under the hood? If there aren’t an absolute ton of synthetics being shorted every day because the short hedge funds never closed out in January, then how else does the math possibly add up? 
 
That’s what makes it so bizarre and unique. It’s worth taking a look."
2021-04-26 17:40:27,stocks,"No one can tell you what the true short interest is on the stock, but I do believe there are synthetic shares and that the SI is still high. There is good DD on r/GME and r/Superstonk which I personally don't find to be completely ridiculous that explain reasons why the SI is still high. 

The current speculation to put it simply is that retail owns more than the float of ~26 mil."
2021-04-26 19:24:38,stocks,"I honestly believe it's way higher than that.
I'm never thought myself a conspiracy theorist but I'm putting my money on this one..."
2021-04-26 17:48:23,stocks,"The way I see it if you believe a squeeze is imminent it would do the opposite if they were selling those shares during a squeeze giving shorts available shares to exit their positions. 

If an even more epic squeeze than what we saw happened and the price is 4206.9 and gme decided to sell shares right at that moment. They would slow the rise and possibly reverse it because suddenly they are releasing 3.5 million shares to shorters trying to get out because the only people buying at that point would be shorters attempting to exit. 

GME sold at the market without telling anyone when and where they were selling the shares. So while they were selling shares around an average of 157 dollars. GMEs price was flat or increased.  There is no longer any shares for shorters to count on and there is a ton of upward buying pressure because they ate up the 3.5 million shares without a huge impact on the price of the stock. 

Of course this is some back of the napkin type thinking on how you could interpret the news and why the price may be increasing right now."
2021-04-26 19:33:48,stocks,"WSB is irrelevant nowadays. Mods are bought, shills run the show, and they don't even allow GME talk anymore. Not sure how you're seeing anything about it on WSB 🤣"
2021-04-26 18:39:38,stocks,"Some of us are both. I was a doubter at $15,,,, and 40.... I finally was like.... wtmf is going in here.
I gave a chance I was wrong and decided I was. I dipped my toe in the Friday it ran to $60 and it’s changed my life in so many ways, more than just money...

I admitted I was wrong at first and thank god I did. I believe in the SS. And I also believe even without this is a minimum $60B company, and 100B is realistic naturally before 2023... the squeeze, IMO, is 100% legit tho too. I’ll be a part of both"
2021-04-26 19:14:17,stocks,"> Whether any of this still justifies the current share price, I don't know.

I don't see anything that justifies the current price beyond speculation. I believe the company will do well, and expect it to be fairly valued at the current price eventually, but buying now just feels like locking up cash that could otherwise be making gains based on speculation that is somewhere between solid evidence and wild conspiracy"
2021-04-26 18:06:36,stocks,Yeah all the idiots that are still spamming “100k is not a meme” or whatever are the ones who have 10 shares or less lol. The ones with big skin in the game are not expecting 10k or 100k
2021-04-26 19:08:21,stocks,"It's not a cult, it's a scam.   Using reddit for pump and dumps.  You have to wonder why mods and admins abide it on the front page so much, and the awards etc..  a bit conspicuous.   They are so greedy they ruin a 100s year old good thing.."
2021-04-26 18:03:28,stocks,"Look. The first one was clearly a squeeze, and you could see covering. Based on the price and volume action.

Now, that last one was a pretty amazing Gamma squeeze lead by large hedge fund investors, but there was no forced buying beyond the option delta hedging. 

And now, it has largely turned into a way to extract call premiums from retail investors expecting a squeeze higher."
2021-04-26 19:35:42,stocks,"When Melvin capital was underwater, they got bailed out by Citadel, and on top of that, Robinhood Restricted Buying Shares that week in January.  They did this to allow the shorts to cover.

Jesus Christ there’s a whole Wikipedia.

https://en.m.wikipedia.org/wiki/GameStop_short_squeeze

If it didn’t happen, go argue with Wikipedia and every news outlet and all the facts in existence."
2021-04-26 18:46:20,stocks,It would have gone 1000+ that’s a fact and that’s why they had to stop it.  Robinhood couldn’t afford to pay us 😭🤣
2021-04-26 19:48:05,stocks,"How could there be such a high quantity of shares owned by retail if there wasn't some fuckery ? 
Also, why is it a pump & dump ?"
2021-04-26 18:56:23,stocks,"Not really, going online isn’t that easy and requires significant investments which the offering helps alot and with Ryan’s expertises it means only one thing. GME TO MOON🚀"
2021-04-26 19:13:21,stocks,I can’t believe people are still trying to tout the ETF theory. Have you looked at how much GME any of those ETFs hold?? Nobody should take anyone seriously who claims that HFs are shorting GME through ETFs. It means you haven’t done any of your own research.
2021-04-26 18:51:00,stocks,">It’s worth taking a look.

I am willing to take a look but I have high standards. Do you have a source of data that 1) has a proven track record in the stock market 2) isn't anonymous and 3) has something to lose if they're wrong (for example, SI Partners who provides short interest data and would literally go out of business if people lost faith in the data they're selling)?"
2021-04-26 18:31:14,stocks,"It really is like sifting through radioactive shit to find actual diamonds in those subs. The diamonds however, are diamonds."
2021-04-26 19:00:52,stocks,This^ r/superstonk is the primary source IMO after mod issues in r/GME from a single mod
2021-04-26 19:00:31,stocks,"My question is now this one : 
Since they added 3.5M shares to the outstanding shares of the company, and recently their 14A told us what the float could be as of lately, does this 26M float figure include the 3.5M shares or not ?"
2021-04-26 18:42:06,stocks,"This is my belief. Gme got what they needed, and they also are giving thanks to us by letting us get all the squeeze money. Extra smart when you consider we’re also their customer/demo target.. and we’ll be loyal for life. RC is a god damn genius"
2021-04-26 19:35:21,stocks,"Pretty much spot on. While the hedgies were trading back and forth with each other GameStop was slowly releasing shares that were probably largely bought by retail. Genius level move, imo."
2021-04-26 18:53:20,stocks,"You sound like a religious nut talking about how they were skeptical but then they gave their life to Jesus and it solved all their problems.

Edit: exactly the same, right down to the downvotes that this would get on a religious sub"
2021-04-26 18:36:59,stocks,Umm xxxx hodler here and you’re incorrect
2021-04-26 19:27:08,stocks,"I’ve got xxx and have no plan to sell. If it moons great, if it trades flat great, and if it goes down I’ll buy more. I like the stock."
2021-04-26 18:13:42,stocks,We all expect 10 Million
2021-04-26 19:16:01,stocks,I mean I would agree with the caveat that most cults are also scams.
2021-04-26 19:01:52,stocks,Let me guess there was no fuckery in that “squeeze” either? Like say 6-7 places blocked buying? I forgot that didn’t happen. In the rules of supply and demand what happens if 1/2 the demand is say turned off?
2021-04-26 19:38:17,stocks,So when Citadel bailed them out what happened to those short positions? Can you explain specifically the exact mechanism that they used to exit the positions?
2021-04-26 19:46:54,stocks,"What do you think about this possibility then ? 
https://www.reddit.com/r/Superstonk/comments/mz5yav/msm_counter_why_the_shorts_couldnt_have_covered/

BTW, wikipedia articles are made by people, they are as trustworty as marketwatch saying the stock was tanking when it barely moving... 

>every news outlet and all the facts in existence
Yeah it's know that news outlet are reporting the whole story about gamestop, and not playing the narrative that either suits them, or bring them the most money... 
Wether you believe in the squeeze Theory, saying ""believe the media, they are saying the truth !"" is the worst thing you could use as an argument my man."
2021-04-26 19:50:24,stocks,"If you have any experience with pump and dumps, the charts scream it at you.      I bought GME at $42 and sold at $283.     Hope you get in early and out early too."
2021-04-26 19:37:49,stocks,They were already online. They are just adding more options and faster deliveries
2021-04-26 19:36:15,stocks,where is the info to prove otherwise? your claim is as meaningless as his right now.
