Timestamp,Subreddit,Post/Comment
2021-05-22 16:34:08,stocks,Debt to Equity?
2021-05-22 17:04:37,stocks,what are your thought on THOR Industries?
2021-05-22 19:50:24,stocks,"I don't know if this info is good or bad, but about 3 weeks ago Cramer recommed it as a re-opening stock."
2021-05-22 17:09:03,stocks,"Looks interesting, but I believe CWH is trading at better value relative to its earnings, as most of THOR's earnings seem to be priced in. I also feel like CWH has a head start in their dividend potential."
2021-05-22 17:20:08,stocks,Think im leaning towards THOR but Dang that market cap is cheap on CWH
2021-05-22 17:22:42,stocks,"THOR seems like a great hold for anyone who got in early, but it's still reasonably valued atm."
2021-05-22 17:24:33,stocks,CHW earnings history is a little choppy so maybe its not so cheap atm
2021-05-22 17:28:04,stocks,"That is another noteworthy con, but I have no reason to suspect they'll slow down. They're still a relatively young stock, and the past few Quarters have been good."
2021-05-22 19:18:10,stocks,"I'd say the premise is wrong.

When one holds their capital in cash or cash equivalents, they are exposed to the risks of currency value swings. The currency *is* the value store, so the holder is exposed to all the risks associated with currencies.

When that cash is used to purchase ETF shares, that currency is no longer the store of value; the ETF shares are. The stored value then fluctuates with the value of the shares, not with the value of the currency with which those shares were purchased."
2021-05-22 16:30:35,stocks,"Countries that survived the pandemic nearly unscathed are likely to have undervalued economies as a result of adapting their economies to a 2 year market cycle that is priced in to 1st world stock exchanges but not necessarily developing ones. 

&#x200B;

EX: Vietnam, Taiwan, Bhutan, Laos etc."
2021-05-22 16:21:23,stocks,"And the video in question: [https://www.youtube.com/watch?v=LwTHLtuToSY](https://www.youtube.com/watch?v=LwTHLtuToSY)

(Could not add to original post due to board rules)"
2021-05-22 16:27:49,stocks,That'd be the impact of currency on international ETF performance. Wisdom Tree has a line of international ETFs designed to reduce or eliminate that effect. I checked that long time ago. You can take a look at them and their prospectuses.
2021-05-22 15:49:59,stocks,"For ten years? Man complete honesty. No one can say with certainty, this is all best educated guess. But those are usually the ideal choices for what you’re trying to do here."
2021-05-22 18:10:48,stocks,I’m betting tech gets me to retirement early. I put most of my roth contributions towards vanguards VGT
2021-05-22 15:59:43,stocks,"some of the best performing stocks of the past 20 years are not IT/tech stocks. Monster Energy and Tractor Supply have beaten most of the hot tech stocks. 

those are not terrible choices, but IMO they're mostly over-valued and trendy. I'd prefer more of the portfolio in broad funds/indexes covering more of the market rather than being so heavily concentrated. what goes up tends to come down. going forward, boring stocks like insurance or utilities could easily beat the hot stocks of 2020. 

I have some tech funds, but they're a minority of the overall portfolio."
2021-05-22 17:50:11,stocks,Yeah I hope so cause this looks like a lot like my portfolio 😆
2021-05-22 19:15:56,stocks,A number of your holding are very overvalued right now and a number are somewhat undervalued; are you planning to ignore these holdings for 10 years or actively rebalance based on shifting valuations among them?
2021-05-22 17:49:42,stocks,Yes you'll be fine. Tech is going to (continue to) dominate the world.
2021-05-22 16:02:37,stocks,"Your portfolio consists of some very high quality companies. You’ll likely do well in the long run, even if tech goes out of favor from time to time"
2021-05-22 16:04:03,stocks,For the relative near future you’re okay. I have kind of the same portfolio atm. Long term anything can change. Example apple in 90s was a struggling company… apple today is dominating.. the cycle could repeat but no one knows. That’s the same in everything sector.
2021-05-22 15:58:08,stocks,This is the wrong place to ask this question....the Apes in here cant even spell stonk !
2021-05-22 15:57:35,stocks,Can I give you an advice?
2021-05-22 16:06:33,stocks,"Why try to pick which stocks will do best?  Are you going to follow these stocks, vs the ones you don't pick every day intensely?

I'd go with a tech etf like qqq or something else"
2021-05-22 18:01:06,stocks,"Honestly I would be comfortable being 25% apple, 25% Amazon, 25% google, 25% Microsoft but I’m 40% apple, 30% Amazon, 30% google"
2021-05-22 16:14:17,stocks,Thanks.  I like living on the edge I guess. 😆
2021-05-22 16:12:36,stocks,Thanks.  I have HD UNH SHW HON UNP ODFL.  ODFL has returned 30% for many years.  I also have 10% total market.  I may increase it as I trim and stuff.  I don't like much more than 5% in each stock although MSFT and AAPL constitute about 20% right now.
2021-05-22 17:52:03,stocks,"I think we'll be ok.  Hey if those stocks are the same or less 5 years from now the whole market will be hurting so it won't matter!

 I have faith in the Fed!"
2021-05-22 17:53:19,stocks,I hope so.  I can't imagine all those companies going under 5 years from now.
2021-05-22 16:08:54,stocks,Thanks.
2021-05-22 16:09:54,stocks,Yeah as I accumulate I may trim and put more in sp500 or whatever.
2021-05-22 16:13:16,stocks,😆
2021-05-22 16:13:39,stocks,Yeah.
2021-05-22 16:08:23,stocks,I like picking my own.  I think fangs will do well.  That's why.  Thanks.
2021-05-22 16:14:26,stocks,"Well 65% of my portfolio is in an s&p 500 index fund, 25% in a blue chip growth fund, and the rest is invested in tech stocks that I think have potential to beat the s&p (apple, google, Amazon, nvida, and Netflix) and crypto. FYI I also have cash savings which is kind of significant."
2021-05-22 16:26:11,stocks,"It's more of a question and I'm thinking how to say it....

Have you ever considered that maybe, there will be time when all your stocks will be worthless and unavailable because something could happened? Like I don't mean apocalypse, but it's a good idea to be diversified into stocks, cash, bonds, crypto, valuable metals but also to invest some of your money and time into building your skills and buying tools that could be usefully if the system we are living in wouldn't work, so you would be self reliable, I don't want you to be a prepper, build bunkers or buy tanks, but reasonably prepare so if the grid would go down you wouldn't be hopeless (like people in snowstorm in Texas, or oil scarcity, major drought, big economic collapse, supervulcamo eruption, or just breakdown of current system, because it happens a lot of time in our history and it can happend again)"
2021-05-22 16:16:43,stocks,"Thanks.  If I add my savings I have maybe 28% cash.

I only have 10% FSKAX Total Market.  I've noticed that volatility can be in the few thousands for me from month to month, but I'm not at 6 figures yet.  1.5 years invested.  Starting late with money left to me by grandmother.  Wished I had started at 30 at least. Mid 40s.

Maybe eventually I should trim tech to 30 to 40% or so.  But I feel like once I trim MSFT AAPL GOOGL or whatever, they'll go higher! 😆"
2021-05-22 18:32:37,stocks,"...what are you talking about?

1. None of this has anything to do with investing in stocks

2. Even if you are developing survival skills, you don't need to not invest in stocks. You can go learn how to survive in the wild, shoot guns, Hunt, grow food, build shelters, etc. But why wouldn't you invest?"
2021-05-22 16:29:48,stocks,"Nope.  I'm gonna be dead someday.  Maybe a few years from now.  Not sure.  I don't think like that.  We're all in the same boat so if what you're describing were to happen is just deal with it.  If I became homeless or broke so be it!  If I died, well than that's the breaks.  We all die in the end.

The things you're describing don't worry me in the least.  Actually if it happened I'd say oh well about time I guess!"
2021-05-22 16:19:42,stocks,Yeah that’s about what I keep too.
2021-05-22 16:31:00,stocks,"If you are gonna be dead someday, why do you care about your stock portfolio 10 years ahead ?"
2021-05-22 16:25:34,stocks,"Yeah I like NVDA MSFT AAPL.  Even PYPL and SQ.  SQ is beaten down lately, but hanging in.  I'm negative slightly in SQ right now.

I like LRCX and ASML too.  They've done well in my ROTH since I added them months ago.

I stumbled across ODFL.  It's returned 30% yoy I think since 2010 or before.  It's a trucking company.  Then I added Sherwin Williams."
2021-05-22 16:35:24,stocks,"Because I enjoy life and hope for the best.  But I realize all of this is temporary.  If I make lots of money great!  If I die next week great!  It's gonna happen to you and me sooner or later.

If it happens next week I won't know about it cause I'll be dead.

But I still go about living my life and trying to make as much money as I can.  Maybe some day I can get a hot hooked to ride me to death when I'm 80."
2021-05-22 18:20:34,stocks,Lol don’t listen to that guy he sounds crazy
2021-05-22 16:15:54,stocks,"Sounds like your trying to drink from a fire hose, maybe just pick a few that you know best and get to know them inside out. Then you can broaden your scope.

In duck hunting what you are doing is called flock shooting. That guy leaves empty handed every time."
2021-05-22 19:54:43,stocks,Swing/day trading is a lot of work.
2021-05-22 15:34:42,stocks,"I started out as a day trade. Then a swing trader. And now I’m a buy and hold investor. I’ll say this. The more you trade, the more you’ll lose. Just buy good companies and hold and you’ll be more profitable"
2021-05-22 14:57:57,stocks,"I love the idea of VT and while I consider ETF fees as somewhat trivial, it is cheaper fee wise to buy the Vanguard ETFs that make achieve the same as VT: VTI, VEA and VWO. Owning these 3 instead of VT also allows you to tweak the balancing."
2021-05-22 15:06:06,stocks,"VXUS+VTI will get you there, pretty much.

Or just VT."
2021-05-22 14:43:36,stocks,"ACWI but it does not track small caps, and expense ratio is higher. The index is different too, but for a world index it may not matter much."
2021-05-22 15:28:36,stocks,"FSPSX is Fidelity's global ex-China fund

ACWV is a global low-volatility ETF."
2021-05-22 17:57:25,stocks,LCTD
2021-05-22 16:39:21,stocks,Or simply VTI and VXUS.
2021-05-22 15:09:21,stocks,Thank you!
2021-05-22 17:22:52,stocks,"If you hold VEA and VWO in the same ratio as they are represented in VXUS, the fees are lower than VXUS alone."
2021-05-22 18:09:12,stocks,"Sure. But we're talking about picking up pennies in front of the steamroller at that point. There's also a theoretical rebalancing bonus (which means you can break out VEA into Europe + Asia/pac), but the OP was inquiring about global funds, so simplicity is probably key here."
2021-05-22 19:01:10,stocks,"Another key to splitting to VEA and VWO is that it is better to be more heavily weighed to VWO than what VXUS is, as VXUS heavily weighted to developed while emerging is the better long-term bet."
2021-05-22 13:08:40,stocks,"Welcome to r/stocks!

For beginner advice, brokerage info, book recommendations, even advanced topics and more, please read our [Wiki here.](https://www.reddit.com/r/stocks/wiki/index)

If you're wondering **why a stock moved** a certain way, check out [Finviz](https://finviz.com/quote.ashx?t=spy) which aggregates the most news for almost every stock, but also see [Reuters](https://www.reuters.com/), and even [Yahoo Finance](https://finance.yahoo.com/).

Please direct all simple questions towards the stickied Daily Discussion and Quarterly Rate My Portfolio threads (sort by Hot, they're at the top).

Also include *some* [due diligence](https://www.investopedia.com/terms/d/duediligence.asp) to this post or it may be removed if it's low effort.

*I am a bot, and this action was performed automatically. Please [contact the moderators of this subreddit](/message/compose/?to=/r/stocks) if you have any questions or concerns.*"
2021-05-22 13:44:10,stocks,"This is why I tend to shy away from investing in Chinese companies. I like to be at ease and at least have a solid feelings that what I invest in will do well...because of the CCP I just don’t get that feeling with Chinese companies. In my opinion, baba is in a tough spot...they can grow as a company ...as long as they grow exactly how the CCP wants them to grow."
2021-05-22 13:12:09,stocks,"Good insights, may I ask you how did you get in contact with Chinese people to know that"
2021-05-22 16:15:48,stocks,"I avoid China as much as possible, because it's a communist dictatorship with extremely high levels of government and business corruption. 

Go watch The China Hustle."
2021-05-22 13:18:02,stocks,BOOOOO ccp
2021-05-22 15:33:57,stocks,I just don't trust the CCP. I would rather invest in crypt if I'm going to take bigger risks.
2021-05-22 16:20:16,stocks,"The biggest problem is not the Covid right now. Both sides need a comercial agreement as soon as possible. If there isn't, both sides will suffer the consequences. USA is fearing with the inflation (people have realized the inflation is real) and China can't survive without USA and EU (although they think they can ingenuitly)"
2021-05-22 16:59:25,stocks,"I think a lot of Western investors are used to thinking about companies in a certain way that don't translate to BABA's situation very well. They expect a free market where companies rise and fall based (mostly) on their merits. In that world BABA is severely undervalued and will inevitably go back up to ATHs. However in China the government is above all and anything that might threaten that control is targeted and eliminated with brutal efficiency. BABA was the nail that stuck out and got hammered down.

The government will never allow BABA to amass as much power in China as a company like Amazon has in the West. So where does that leave their future? I don't think anyone knows. But this could very well hang over their heads forever. They should recover somewhat but could very well stagnate for years with their growth potential severely limited. In the worst case they go too hard again and the CCP really screws with them. Basically a no-win situation."
2021-05-22 14:11:22,stocks,"Chinese economy could be the future but they F'd up .
Watch China Hustle for an introduction. 

But the reality is much darker .Uyghurs in concentration type camps + surveillance state to the max + no human rights to talk of. Hong Kong invasion and probably Taiwan next."
2021-05-22 13:19:31,stocks,"Did you talk to the slave laborers?

This was a joke/ friendly troll, why am I getting down voted…"
2021-05-22 16:11:41,stocks,"yep, same reason I don't invest in Facebook. Too much uncertainty around the way Congress will regulate them. 


Although I'm more bullish on some smaller chinese stocks as they won't be hit by anti-monopoly regulations."
2021-05-22 13:39:43,stocks,I use a language learning app and talk to many each day that way
2021-05-22 16:24:39,stocks,"I totally agree, and think Biden is in a tough position politically.  Republicans attacked him as being easy on China; His base want China to address Uygher issue and Pelosi wants boycott of Olympics.  I think he will stay far away from China for a while...but would think a new agreement would benefit both"
2021-05-22 15:15:19,stocks,"Definitely not a surveillance state to the level you talk about. I have friends and relatives in China and we regularly talk over WeChat, talked shit on the CCP as well. Openly talking shit about CCP in tv/news will get you fucked up, but talking shit privately is ok. You seriously think they have the ability to monitor every call/text sent?"
2021-05-22 14:18:14,stocks,"It's like any organization.  You can control it and make it super efficient but it will have limits due to the control.  

As for the other two issues...it's a bit more complex.

Uyghers were bombing and attacking chinese some years ago.  They wanted independence.  In a sense, like Tibet, it started a type of civil war.  CCP fought back in their way.

Taiwan will never be invaded, and if there is anything from the HK disaster it's that it's made Taiwanese come closer together against CCP."
2021-05-22 13:50:41,stocks,"Yes, they said they are working very hard in order to meet quota for the booming order volumes of western e-commerce 🤡🤡"
2021-05-22 15:40:08,stocks,The United States uses slave labour everyday through the prison system shut the fuck up with this xenophobic bullshit.
2021-05-22 16:28:48,stocks,"Yes, I have the same opinion. It is not gonna happen tomorrow but maybe in 2022 or 2023 we could see this agreement."
2021-05-22 15:17:57,stocks,"It's a question of time. Your friends aren't on a black list.
They have cameras everywhere and access to phone locations + face recognition etc"
2021-05-22 14:33:12,stocks,Frickin based
2021-05-22 16:06:38,stocks,Also xenophobic is made up BS .. this is stocks… not social justice warrior bull crap ..
2021-05-22 16:25:25,stocks,"> prison system

the difference is that anyone working in the US prison labor has been through due process system and has some legal protections, while China is a one-party communist dictatorship that slaughters people wholesale. 

there's absolutely no comparison."
2021-05-22 16:05:02,stocks,Bro I was joking. My reply to another comment below should make that obvious
2021-05-22 16:12:44,stocks,you're delusional
2021-05-22 16:17:16,stocks,Because when ever the word China is said someone has to spout off some conspiracy theory. I don't understand why China cannot be discussed like any other country.
2021-05-22 16:39:36,stocks,"Think you might want to look into mass incarceration, the war on drugs and policing of Black and Latino communities. Or you can stay in your ignorance bubble whatever. USA is #1 in the world for prison population 25% of the world's incarcerated are in America."
2021-05-22 16:19:29,stocks,Bc they’re doing things other countries aren’t doing
2021-05-22 00:00:00,stocks,"$SPCE Virgin Galactic Test Flight 5/22/2021 is currently successfully proceeding as planned! FINAL EDIT: VMS Eve has landed safely. Thanks to our pilots Kelly Latimer and Michael Masucci for flying the mothership today and their vital role in helping VSS Unity complete today’s spaceflight!

Twitter link for direct updates from Virgin Galactic team -> [https://twitter.com/virgingalactic](https://twitter.com/virgingalactic);

\-  Take off! VMS Eve and VSS Unity have taken to the skies above Spaceport America, New Mexico.

\- VMS Eve is taking VSS Unity to a release altitude of 44,000ft. The climb to release will take approximately 60 minutes.

\-  VMS Eve and VSS Unity are now at 30,000 ft, nearly half-way to release altitude.

\-  Approximately 10 minutes from release, VSS Unity switches to its own battery power for avionics and control systems, and performs electrical, feather system and flight control checks.

\-  VSS Unity is in its launch configuration and pilots are readying the rocket motor system. Awaiting clearance for release from Mission Control.

\-  Release, release, release! VSS Unity has successfully separated from VMS Eve.

\-  VSS Unity’s rocket motor has been ignited by our pilots CJ Sturckow and Dave Mackay.

\-  Rocket motor shutdown. Momentum will keep VSS Unity travelling upwards towards apogee.

\-  VSS Unity enters coast phase. Tail-booms raised into “feathered” re-entry position.

\-  VSS Unity, our two pilots and [NASA\_Technology](https://twitter.com/NASA_Technology) supported experiments are now in space.

\-  VSS Unity reaches apogee.

\-  VSS Unity is descending back to Earth.

\-  The feather has been lowered and VSS Unity is now gliding smoothly back to the runway at Spaceport America.

A successful test flight + landing!

EDIT: - Touch down, VSS Unity.

EDIT2: Their smoke trail looks the same as their stock will do in the next week (had to insert this joke, sorry).

EDIT3: For people who were panicking on twitter due to motor shutdown - it's per procedures, it's what the motor HAS and HAD to do, everything is perfect.

Congrats to fellow bagholders, this was a fun one to watch!"
2021-05-22 15:55:28,stocks,"You’re looking at a guy who bought 400 shares at $35 and sold at $15. 

🤡"
2021-05-22 13:12:38,stocks,Yes!!!! Great money making news 🚀💕📈
2021-05-22 11:48:32,stocks,Congrats to the Virgin Galactic team! Can't wait for Monday 🚀🚀🚀
2021-05-22 17:24:31,stocks,40@51 bag holding to teach myself a lesson 😅
2021-05-22 16:08:36,stocks,Love this companies goals but bought at IPO at $12 and averaged down till my average was $9 and was forced to sell at $32 because FOMO was too crazy. Glad to have been able to start back in at $16 but keep in mind how incredibly speculative this is. This is gonna take time so play the rips and dips. I took my profits and put into a Index Fund and I’m gonna keep building till I get a free trip on one of their ships.
2021-05-22 14:08:25,stocks,"Finally, I thought I was gonna be screwed when I bought 40 shares at $38..."
2021-05-22 12:52:17,stocks,SPCEtards unite
2021-05-22 13:18:48,stocks,"Congrats to Kelly Latimer, my former 418th FLTS colleague!"
2021-05-22 13:40:38,stocks,To the moon please. My only issue was I didn’t buy more!
2021-05-22 13:40:09,stocks,Only 10 more years until this is affordable for the masses!
2021-05-22 15:53:24,stocks,LETS FUCKING GOOOOOOO MY 4 SHARES ARE HAPPY
2021-05-22 18:51:45,stocks,Watch it go down by 5% on Monday.
2021-05-22 16:47:22,stocks,They have 1 plane and an expensive roller coaster for rich people.
2021-05-22 18:07:06,stocks,4@15.
2021-05-22 13:30:15,stocks,"Hoping my call goes brrrrrrrrrrrr…

But if not hoping my put goes BRRRRRRRRRRR!!!


Lol… I’m loving strangles these days… don’t care if it moves up or down… just want it to move.  So much less stress…

But seriously… I hope it soars to the moon for everyone… good luck!"
2021-05-22 15:14:01,stocks,I have virgin galactic stocks . The HF have been shorting this wonderful company heavily
2021-05-22 15:54:48,stocks,is Chamath that fucker already gone on this? why people still touching his stocks?
2021-05-22 18:10:27,stocks,"Bought at $25 sold at $58...
Not buying again because I don't want to put in jeopardy beautiful feelings I have for this stock."
2021-05-22 18:29:34,stocks,"Got 206 shares at $20.34, let’s ride this to andromeda"
2021-05-22 18:34:11,stocks,I owe 117 shares at $44 a share. But I also own three SPCE options that expire in June with 37 strike price. Hopefully this test flight actually gives it life and gets it back to the $50 range again
2021-05-22 18:04:56,stocks,Pump and dump alert. And I'm here to play.
2021-05-22 13:55:58,stocks,pls fly again (after today's successful flight)
2021-05-22 12:34:04,stocks,I knew it was oversold in the last few weeks and should have loaded up!
2021-05-22 15:08:29,stocks,Amazing news. One ticker that actually gets to the moon!
2021-05-22 13:09:08,stocks,Up 30% last 5 days
2021-05-22 15:56:48,stocks,At what price did Chamath dump the rest of his shares? Like $30?
2021-05-22 16:07:47,stocks,Shit should’ve bought more
2021-05-22 16:47:31,stocks,"Nice, my 7/16 $35c have a chance"
2021-05-22 17:02:17,stocks,Pleas fly again
2021-05-22 17:24:09,stocks,*-20%
2021-05-22 17:35:00,stocks,I have it on good authority from “Potato Wedge” that a $60 price target is realistic in the near term. Tater is never wrong.
2021-05-22 18:36:02,stocks,"Congrats to Virgin Crew for a successful flight!! 500 shares deep, taking the day off work Monday. Full send boys."
2021-05-22 19:19:17,stocks,Where the bought @≈$60 gang at?
2021-05-22 12:21:59,stocks,"Also, shorts are fucked https://www.ortex.com/stocks/47838/shorts"
2021-05-22 15:32:28,stocks,"Finally! So depressing sitting and watching it keep going down! Now, limit order time for first thing Monday AM!"
2021-05-22 16:16:24,stocks,Did the CEO get launched into space yet???
2021-05-22 17:20:42,stocks,so monday red?
2021-05-22 17:20:39,stocks,Dump it
2021-05-22 16:32:03,stocks,Should’ve bought puts.
2021-05-22 13:28:10,stocks,Cathie Wood is a moron
2021-05-22 15:51:03,stocks,"This is gonna dump hard on Monday.

Was only up this past week due to rumours."
2021-05-22 16:23:21,stocks,"Hm, might I just point out that ""Test flight is currently succesfully proceeding as planned"" is doubly redundant?
First redundancy: If it is ""proceeding"" it is still ongoing, so ""currently"" is redundant.
Second redundancy: If it is ""proceeding as planned"" then ""successfully"" is implied and also redundant.

Just some food for thought."
2021-05-22 15:32:23,stocks,"Holy shit, this is great.  Going to be a fun week."
2021-05-22 18:39:54,stocks,Glad didn’t sold my calls Yaay!!
2021-05-22 19:12:52,stocks,my weekly call $$$
2021-05-22 19:29:51,stocks,I hope someday I can sell my 200 shares and it will pay for my round trip
2021-05-22 19:48:50,stocks,How fast can they turn this around and launch another flight?  Can they fly 2x/week?
2021-05-22 18:42:32,stocks,Seems like this is what bumped up ARKX in the last few days.
2021-05-22 19:12:38,stocks,"bought at 23 at the start of the year. Sold at 45  
bought at 27 abt a month ago and endured some terrible losses but it was worth it"
2021-05-22 16:39:10,stocks,"Buy high, sell low!"
2021-05-22 17:08:52,stocks,You're making people feel better about themselves if it's any consolation.
2021-05-22 18:29:55,stocks,"I mean, I have an Incredibly horrible Avr. But never sell..."
2021-05-22 18:37:35,stocks,Lol watch it go past $35 this week.
