Timestamp,Subreddit,Post/Comment
2021-04-26 15:13:54,stocks,Stop fucking around with options kids
2021-04-26 11:23:29,stocks,We can’t see your account. Call your broker to confirm what you need to do to close the position.
2021-04-26 11:50:18,stocks,"Who is your broker? on fidelity you have a very handy ""buy to close"" button when you open up your options. It will prefill a ticket to close your option. 

You will have to pay whatever the current premium price is."
2021-04-26 11:44:15,stocks,For the same date?
2021-04-26 11:50:50,stocks,Webull. Okay I’ll try and figure them out thank you
2021-04-26 11:45:49,stocks,"You are saying that you “sell to open”? If you want to close that position you sold, you need to “buy to close”."
2021-04-26 18:59:44,stocks,"WeBull, the Chinese Robinhood"
2021-04-26 11:48:08,stocks,"I’m confused. I purchased a call option for June 18. I did this a while back. Today I was happy with my profit. And wanted to close my position but I sold the call option instead of closing it. 

So you’re saying I go back and buy to close a new position?"
2021-04-26 18:50:08,stocks,Please stop doing options.
2021-04-26 11:52:04,stocks,"A while back, did you “buy to open” the one that is June 18? If you want to close it, then “sell to close”"
2021-04-26 12:01:10,stocks,I did sell it and it has left the place where it shows my open positions. But Im concerned I didnt close the position. I’m concerned I sold the call option I had and now have unlimited loss
2021-04-26 12:08:50,stocks,"You sold the contract. That means someone else owns it. Why would you have unlimited loss?

You wouldn’t be able to have unlimited loss on a call anyway. You’d just lose the premium.
I think you are confused"
2021-04-26 12:12:19,stocks,"Right exactly. I was cool with risking the initial premium. I am a bit confused on what my sale did. I had two options. To sell and to close. I sold the option at a profit instead of closing. I just want to make sure I’m off the hook at this point. 

This was the first time I got into options.  I bought trying to be responsible with risk and what not"
2021-04-26 12:13:38,stocks,"Yeah you are good. Someone else owns that contract now. They could execute and buy the shares or turn around and sell it too. 

Did you make a good return?"
2021-04-26 12:14:59,stocks,Okay thank you. I appreciate it. $20 like 9% so yeah whatever. Small account trying to learn options so we’ll take it hahaha
2021-04-26 12:20:36,stocks,Do paper trade first. Don’t dip your toes on options until you are ready. Options can go $0.
2021-04-26 12:29:05,stocks,Yeah I think I’ll have to step back after this haha. I guess I’m not as ready as I thought. I’m glad selling the contract did not make me the writer of the option. Thank you so much
2021-04-26 00:00:00,stocks,"Cleveland Cliffs fianlly receives an upgrade to target $24 from B Riley  

# B. Riley Raises Cleveland-Cliffs' PT to $24 from $22, Notes 'Strong' Outlook, Deleveraging, Execution; Keeps Buy Rating

(MT Newswires) -- Cleveland-Cliffs ( CLF) has an average rating of outperform and price targets ranging from $18 to $24, according to analysts polled by Capital IQ.

Price: 18.03, Change: +0.05, Percent Change: +0.28

&#x200B;

With iron or and processed steel prices shooting up ( and sustainable, if the $2 Trillion Biden \_Blue wave Infra gets passed by both houses ) the price of CLF could easily rise to the $24 level IMHO.

Not to mention that the Arcelor Mittal union is ( in hindsight of course) a stroke of genius offering extra capacity ( if needed) by firing up those furnaces that were shut down as a result of the merger."
2021-04-26 11:23:51,stocks,CEO will be on Mad Money tonight.
2021-04-26 11:21:59,stocks,Can I ask why B Riley doesn't get more love here? They're up 300% since last year and they give a div.
2021-04-26 12:27:07,stocks,"Thanks for sharing...I stopped watching showman Cramer but I will tune in today.

Cramer: Bulls make money, bears make money, hogs get slaughtered !"
2021-04-26 12:25:00,stocks,Not sure.
2021-04-26 00:00:00,stocks,"VF Corp - underrated ticker Why hasn’t anyone spoken about V.F. Corp (ticker VFC) before? To me it seems like a hidden gem among mainstream stocks with insane PE valuations. 

But VFC is a huge company with over $30 billion revenue. It is a fashion/retail conglomerate that owns Vans, Timberland, Dickies, Northface, Eastpak, Jansport, and more recently Supreme among many more.

I became aware of this company after recent reports that Adidas is selling Reebok to VFC. If so, this would be a great acquisition slotting very well into VFC’s portfolio of outdoor/streetwear/workwear brands.

Interested for anyone’s thoughts."
2021-04-26 11:04:50,stocks,They pay a dividend too. It may not be a huge grower but its a good stock to own.
2021-04-26 11:01:11,stocks,What makes it a hidden gem? Do you think it’s currently undervalued? VF Corp been around forever and has a super straight forward business model - most people know what they do and how to value their business?
2021-04-26 12:24:10,stocks,"As far as I can tell there's a deal, but no news as to who actually bought Reebok. Are you seeing something else?

While I really like the North Face and Dickies, I'm not seeing where the growth is coming in those brands (certainly not Dickies, but store branded outdoor apparel from Target and Walmart don't help TNF either). Can you explain your reasoning there?

If they do get Reebok I like the idea, given the gross incompetence of Adidas in trying to take over Reebok's US market with all the subtlety of an arsonist in an acetylene planet, ""Hey guys, let's spend $4B for an entry to the U.S. and then pay to replace Reebok with our own apparel, only we'll have worse style and branding! Then we'll start making discount outlet shoes with their brand AND try to compete in Underarmor's market niche simultaneously, it'll be great!""

But I don't really get the benefit of Supreme and I need to understand the growth story you're seeing along with more definitive news on Reebok."
2021-04-26 15:03:57,stocks,"They run their business strictly by bean-counting.

I've never invested in VF solely because it has the reputation within the industry as the place good brands go to die.

I also hate hate hate their suburban mall/outlet Zumies/PacSun/Dicks focused channel strategy. Their d2c  build-out has been woeful.

They should buy the Coach brand from Tapestry. It would fit right into their portfolio."
2021-04-26 11:05:50,stocks,"Yes but their recent transition to understanding the wide range of consumers, delving into sportswear and streetwear brands (Supreme, Reebok) marking a change in their business strategy that focuses on iconic brands and essentially higher profits when you consider the resale price of Supreme white tees alone"
2021-04-26 12:36:21,stocks,"From several sources, the 2 main companies to make the acquisition of Reebok are VF Corp and Anta Sports. VF Corp are more in line with with the brand’s target market and retaining the individuality of brands - after all Adidas has not proved a successful model of managing Reebok. 

VF Corp has done collabs between Supreme and North Face in the past, to name one, meaning they can elevate Reebok in one collaboration project. Anta Sports are only big in China. VF Corp is big in China too - thanks to Dickies and NorthFace. 

Dickies is making a come back in retail fashion imo. Aside from the practicality it provides in work environments, Dickies - with the quality sourced industrial minimalist style - is becoming “cool” again. 

Cool means you can sell for insane prices because you become culturally relevant and mark a space in time when it was cool, making them commodities too. Take Supreme where white tees with a Supreme logo slapped on the front sell for the north of $3000. 

There’s good reason to be optimistic of VFC. It provides a good diversity strategy that taps into work/street wear, in a portfolio along with Nike (sportswear), and LVMH (high fashion)."
2021-04-26 11:11:45,stocks,I guess my question is what about their current valuation seems undervalued to you? Or you just like the direction of their business generally (which is totally fair too)
2021-04-26 11:21:38,stocks,"I believe DCF’s are undervaluing the growth of brands like Dickies, NorthFace, and possibly the Reebok acquisition which isn’t be factored. My personal qualitative analysis would say Dickies, NorthFace and Reebok are poised for huge growth in the next 5 years. Reebok can emerge out the ashes Adidas put them in - a brand that sponsored NBA throughout the 90s can’t go that easily into the night. Huge bull on Dickies too. And the general direction the company is going in with their relatively recent CEO. When it ticks all the boxes I can’t fault it"
2021-04-26 11:23:43,stocks,"Nice ok cool - the original post was a little vague but like this framework. You should post something about the work you did, I’m sure people would appreciate that! Thanks for sharing"
2021-04-26 00:00:00,stocks,"Weekly trucking outlook, news, and Q1 earnings YRC:

YRC just settled a lawsuit this week for overcharging DOD for frieght 

https://www.freightwaves.com/news/yrc-yellow-agrees-to-immaterial-2-1m-settlement-in-investor-suit-over-dod-overcharges-action

Heartland Express:

They're doing a current hiring push to add more drivers but missed earnings estimates. 

>Heartland Express (HTLD) came out with quarterly earnings of $0.17 per share, missing the Zacks Consensus Estimate of $0.18 per share. This compares to earnings of $0.16 per share a year ago.

>This quarterly report represents an earnings surprise of -5.56%. A quarter ago, it was expected that this trucking and logistics company would post earnings of $0.22 per share when it actually produced earnings of $0.22, delivering no surprise.

https://finance.yahoo.com/news/heartland-express-htld-q1-earnings-142502780.html

https://www.freightwaves.com/news/heartland-express-to-raise-driver-pay-again-slight-miss-in-q1

Old Dominion:

Had a strong Q1 growth. 

>Old Dominion Freight Line saw revenue and net income rise for the first quarter of 2021, the company reported April 22.

>The Thomasville, N.C.-based less-than-truckload carrier posted net income of $199.4 million, or $1.70 a diluted share, for the three months ending March 31. That represents a 49.7% increase from $133.2 million, $1.11, during Q1 2020. Total Q1 revenue increased by 14.1% to $1.13 billion from $987.4 million a year ago

>The results surpassed the expectations of Wall Street analysts, who were looking for EPS of $1.58 and Q1 revenue of $1.11 billion, according to Zacks Consensus Estimate.

https://www.ttnews.com/articles/old-dominion-freight-line-reports-strong-q1-growth

P.A.M. logistics:

>P.A.M. Transportation Services Inc. (PTSI) on Wednesday reported first-quarter net income of $11.9 million, after reporting a loss in the same period a year earlier.

>On a per-share basis, the Tontitown, Arkansas-based company said it had profit of $2.08.

>The trucking company posted revenue of $148.9 million in the period.

>P.A.M. Transportation shares have increased 22% since the beginning of the year. The stock has climbed 95% in the last 12 months.

https://apnews.com/article/earnings-transportation-business-4a8e6c2814f1938e0bb9900516817f45

J.B. Hunt:

The company is increasing the number of trailers and containers they have to help shippers. They also had a strong Q1. 

>J.B. Hunt Transport Services saw revenue and earnings increase due to strong segment growth during the first quarter of 2021, the company reported April 15.

>The Lowell, Ark.-based transportation and logistics company reported net earnings of $146.6 million, or $1.37 a diluted share, for the three months ending March 31.

>That compared to net earnings of $104.8 million, 98 cents, during the same time last year. The total revenue increased by 15% to $2.62 billion from $2.28 billion

https://www.supplychaindive.com/news/jb-hunt-trucking-trailers-containers-driver-shortage/598847/

https://www.ttnews.com/articles/jb-hunt-reports-q1-revenue-increased-26b"
2021-04-26 09:54:24,stocks,YRC holders are extremely pissed of right now. Im expecting a lot of short term paperhands to drive the price down so if you are bullish on this you can wait for that discount
2021-04-26 10:11:43,stocks,They haven't released their Q1 yet either so that will tell how well they're doing as well. Even though everyone else released this week or last.
2021-04-26 00:00:00,stocks,"Tesla comes under growing China pressure after customer complaint  The singling-out of Tesla in China, which accounts for 30% of the U.S.  firm's global sales and where it makes cars at its own factory in  Shanghai, comes amid ongoing U.S.-China tensions and as other foreign  firms have encountered backlash. 

&#x200B;

[https://news.yahoo.com/tesla-comes-under-growing-china-163458554.html](https://news.yahoo.com/tesla-comes-under-growing-china-163458554.html)"
2021-04-26 10:00:02,stocks,Interesting this news comes out the same day they have earnings.
2021-04-26 09:57:04,stocks,"so one person causes the backlash? idk, sounds more like a hit piece."
2021-04-26 10:08:40,stocks,"They released the data logs from the vehicle and the woman didn't step on the brakes enough and accident avoidance took over to stop the car. 

The woman also made a big stink at the auto show in public instead of getting legal representation. 

This is more about the CCP trying to save face for that woman and saying they will be there for the people even when she clearly is in the wrong. Tesla basically shamed her which is what I think they were apologizing for.

Chinese people like that woman are the new self-entitled rising middle class POS that travel abroad and make Chinese tourists look bad. I have no sympathy for her stupidity or method of getting attention on the issue. 

The way she aired her situation makes me think she's looking to get a free car replacement if she causes enough PR backlash."
2021-04-26 09:53:19,stocks,The amount of anti-Tesla news as China tries to grow its own electric vehicle market grows so quickly it's creating pressure on my brain.  Somebody please help lance this Communist propaganda and let the pus out!
2021-04-26 10:03:32,stocks,"Will be interesting to see if this effects  NIO, etc in a positive way. I own no shares of any of it personally waiting for it to settle more"
2021-04-26 10:24:45,stocks,"China is a propaganda machine.  that is how everything is done these days.  no real wars. Liberals and democrats support China as well,"
2021-04-26 13:22:26,stocks,"They’re trying to get Tesla to break one of the obligations for the Shanghai factory. If the CCP thinks that Tesla has broken any of Tesla’s obligations to the Chinese consumer, then they can basically kick Tesla out and give the factory to one of their competitors."
2021-04-26 09:51:03,stocks,TSLA holders are pissed of right now and got a lust for revenge on the stock market
2021-04-26 10:20:33,stocks,"Typical Communist propaganda, propped up by the supporters of the CCP. You see them here in this thread."
2021-04-26 10:03:34,stocks,There are conspiracy theories but I believe the cars they make in China has inferior quality to US made
2021-04-26 12:23:07,stocks,I wonder if her social score ended up improving
2021-04-26 11:31:13,stocks,"If a ""movement"" suddenly starts getting reported everywhere in the news in China you can be sure it's happening at the blessing of the CCP.

Let's be real, the Chinese government does not like Tesla. They see it as a foreign competitor to their homegrown EV industry that needs to be dealt with. They've done the same to plenty of other Western companies. We'll see if Tesla's story is more of an Apple or a Google."
2021-04-26 11:06:58,stocks,"Agree 100% with this assessment.

Tesla's other crime is being foreign owned and they make an easy target."
2021-04-26 18:35:05,stocks,"You can expect that China will try to protect its home-grown companies from competition after they manage to ""transfer"" enough technology. It's a declared strategic aim of China to become the world leader in EVs and other emerging technologies."
2021-04-26 09:56:48,stocks,Tesla do have a quality control issue
2021-04-26 11:55:08,stocks,"If you see a pattern of this - I.e. repeated criticism of Tesla based on shoddy accusations, without the gov steeping in to vindicate Tesla, then I would start to worry. Nio will for sure benefit from it at that point.

Letting false rumours and accusations fester without correction, is their roundabout way of supporting national car makers.

They dont suffer lies if it puts them or their country in a bad light, if they let these people continue to call out Tesla for user error, there is a longterm weakening of the brand at work. 

They can bolster CH brands while weakening public support and opinion of Tesla and they didnt have to lift a finger. Inaction on rumours and slander is just as powerful as action for them."
2021-04-26 18:38:06,stocks,"They might plan to make Nio, Li and Xpeng into a ""trio of national champions"". They generally pursue such trios in every industry (look at Cnooc, Sinopec and Petro China etc. )"
2021-04-26 11:04:08,stocks,"I'm not a liberal/D by any stretch of the imagination, but I would say its them who are most vocal about calling China out on the Uyghur situation. They absolutely do not support the current China gov."
2021-04-26 10:08:50,stocks,"No, momentum investors a year or two late to the party might be pissed. TSLA becoming one of the FAANG stocks (~~FAAMGT~~ FAMTAG stocks?) is an inevitability."
2021-04-26 10:25:35,stocks,especially in r/politics
2021-04-26 11:20:53,stocks,You want access to 1.3 billion people you bend the knee a bit.
2021-04-26 10:14:26,stocks,"My house is filled with items that were manufactured in China that fall apart and are no good a mere weeks after purchasing them. Quality control is not what that country is all about, and to hear them squawk about other people's quality control is a joke."
2021-04-26 11:59:48,stocks,"Yeah especially with them having a factory for building over there it will be interesting to see if any sort of sanction is put onto Tesla in the entire bout 

Next few weeks should be interesting to say the least. I think as Elon has Starlink IPO it will have some people take profits and there will be a correction as people reallocate towards that as well too"
2021-04-26 13:54:03,stocks,"Am a progressive. Can confirm, don't like China. I think the ""Dems are lapdogs for China"" is a dog whistle for the right. It isn't the right or left that have caused production to move to China. It's greed."
2021-04-26 18:39:59,stocks,"> It isn't the right or left that have caused production to move to China. It's greed.

Bingo !"
2021-04-26 00:00:00,stocks,"Calculating company value (VIAC/VIACA value) Hello. 
I was looking at VIACs value, and was wondering “what is the market cap?”

I see their income and net income.... but when I compare it to market cap (for ratios)... is it just VIAC? There is just as much market cap (more actually) in VIACA [voting shares]. 

There is a big difference in valuation if we figure it with both. This would apply to other stocks with different class shares [i assume]

Thank you for any help or resources!"
2021-04-26 14:52:39,stocks,"I was curious about this as well. I believe the market cap includes each series of shares. VIAC has 605 million shares (25.4B). VIACA only has 40 million shares ($1.8B). VIACP has 10 million shares ($700mm)

Marketwatch gives them a market cap of around $27B, which seems to include all 3 groups.

Disclaimer: I have lots of contracts and some shares."
2021-04-26 09:30:18,stocks,One family owns 80% of A shares.  So you can get it if you want to have a meaningless voting right.  Most institutions invest in C I believe.
2021-04-26 09:36:42,stocks,VIAC holders are extremely fucking pissed right now
2021-04-26 13:09:02,stocks,"Each VIAC and VIACA have their own outstanding shares ... so it is almost like the market cap is 56b instead of 26b for that revenue. 

Was hoping to get some wisdom here on how that works with stocks with multiple share types"
2021-04-26 09:54:59,stocks,"Okay... but do I need to basically add the market cap together to be able to get a value of the company? 

I almost feel like we do. Or do they split income down between the two?"
2021-04-26 17:49:20,stocks,This is correct; I went through the 10K and the vast majority of the market cap are VIAC class B shares
2021-04-26 18:22:45,stocks,"When I look at it on webull it looks like they both have 645m or something close. 
Where did you see the A and P shares along with the common? 
On WeBull it’s showing me 29.88b market cap on A, 712.9m on P, and 27.01b for common.
That’s a total of 57.6b

I like your calculations better, I’d like to know where it all comes from. Where to see those shares."
2021-04-26 10:12:58,stocks,"Check a sec filings. It should say the number of all outstanding shares. You can multiply shares x share price for it and see.    
Disclaimer: heavily invested around 42 average"
2021-04-26 18:23:44,stocks,"So I need to do some 10k reading? Just the most recent one will work?

I really appreciate all the helpful feed back I’ve been getting"
2021-04-26 00:00:00,stocks,"Fed to Taper Bond Buying in Fourth Quarter, Economists Say  The Federal Reserve is expected to begin trimming its $120 billion in monthly asset purchases before the end of the year as the U.S. economy recovers strongly from Covid-19, according to economists surveyed by Bloomberg. 

[https://www.bloomberg.com/news/articles/2021-04-26/fed-to-taper-bond-buying-in-fourth-quarter-economists-say?srnd=economics-vp](https://www.bloomberg.com/news/articles/2021-04-26/fed-to-taper-bond-buying-in-fourth-quarter-economists-say?srnd=economics-vp)"
2021-04-26 09:29:52,stocks,Its not the Fed themselves saying it so I wont believe it. Jerome Powell has been saying the same thing for 2 months now.
2021-04-26 09:33:59,stocks,"Even if they're gonna do it, I don't think the Fed will even mention it until the end of the third quarter."
2021-04-26 09:48:49,stocks,"Did they mention anything specifically in terms of bond purchases?

IIRC, only thing they did say was interest rates will be low for a while. I don’t think it would surprise anyone that they would start to bring bond purchases down before that."
2021-04-26 00:00:00,stocks,"Should I sell at a loss if it means I can rebuy at an even lower price? For example if I buy a stock for 100 dollars, and then it tanks down to 90. Should I sell it for 90 if I could get it for 80 as it goes down?

I understand that if it goes down to 90, but never goes lower — I could be out of my money. But in theory if I sold early during a dip and rebought it again later to lower my average — is that effective?

The math confuses me sometimes, lol..."
2021-04-26 07:57:22,stocks,"Welcome to r/stocks!

For stock recommendations please see our portfolio sticky, sort by hot, it's the first sticky, or see [past portfolio stickies here.](https://www.reddit.com/r/stocks/search?q=author%3Aautomoderator+%22Rate+My+Portfolio%22+-+r%2FStocks+Quarterly+Thread&restrict_sr=on&include_over_18=on&sort=new&t=all)

For beginner advice, brokerage info, book recommendations, even advanced topics and more, please read our [Wiki here.](https://www.reddit.com/r/stocks/wiki/index)

If you're wondering **why a stock moved** a certain way, check out [Finviz](https://finviz.com/quote.ashx?t=spy) which aggregates the most news for almost every stock, but also see [Reuters](https://www.reuters.com/), and even [Yahoo Finance](https://finance.yahoo.com/).

Also include *some* [due diligence](https://www.investopedia.com/terms/d/duediligence.asp) to this post or it may be removed if it's low effort.

*I am a bot, and this action was performed automatically. Please [contact the moderators of this subreddit](/message/compose/?to=/r/stocks) if you have any questions or concerns.*"
2021-04-26 07:59:15,stocks,"“Time in the market is better than timing the market”

Most people get burned trying to time the market.  If you’re confident in the stock, just keep buying in as it goes lower to reduce your avg buy in.

Edit - wow thanks for all the upvotes and awards, I don’t think Iv seen so many notifications on my Reddit before !"
2021-04-26 10:51:39,stocks,"I think the important thing to consider here is the volume you are trading. Also, you need to consider the 'Wash Rule', which I only recently learned about due to that article that hit earlier this year. 

Wash Rule Summary: Any losses you receive on a stock are added to your base price if you buy back into the stock within 30 days. 

Wash Example using 1 share for simplicity: If you have a basis of 100, sell for 90, you have a $10 loss. If you buy back in 29 days later at $80, that $10 loss is added to the $80 cost, meaning your new basis for the share is $90. 

Because this rule, you cannot count that $10 in 'Losses' against your taxes, as it is now part of your new basis for the shares you purchased. 

&#x200B;

Now, if you were to sell 1000 shares at 90, you would have $90k on hand, with a loss of $10k. If you use the $90k to buy 1200 shares ($75/share), you have increased your position by 20%. Your cost basis for the 1200 shares is $83.33 ($100k / 1200 shares). 

&#x200B;

So basically, it CAN be worth it (with large volumes), but may not be once you factor in taxes too. Re-purchasing the shares like this resets your 'Long' position into a 'Short' position, pretty sure anyway. 

If you are doing small volumes, don't waste your time and money unless you somehow anticipate it dropping immensely. As others have said, time in market is better than hoping to time the market."
