Timestamp,Subreddit,Post/Comment
2021-04-30 12:18:46,stocks,"I think you are completely wrong. Majority of business owners I know are in it for the money and the Lifestyle that comes with it. 
You can be very successful in business if you only want money..."
2021-04-30 12:36:49,stocks,This makes sense to me. The business is for the romantics.
2021-04-30 15:32:50,stocks,"I agree, I’m also interested in what this thread has to say. I would prefer to own a business for something to do. Do something you’re passionate about too. Obviously being successful but the goal for a company isn’t to make profit. You won’t make profit or an income for yourself for about 5 years."
2021-04-30 15:36:25,stocks," >They want to create something that they can control and develop, to pursue their passion and achieve their life's goal.

That could very well describe something that would have zeroes over 2 mil.  Not just capital investment, but operating costs before it becomes profitable as well."
2021-04-30 18:14:18,stocks,"That's a really interesting point, because I started a business with someone who put up like a quarter million. The business failed within a year & a half & they're currently buried in debt. I always wondered why if he had so much money to start it why they didn't stick with what they were doing."
2021-04-30 19:02:05,stocks,Absolutely.
2021-04-30 08:57:06,stocks,Jeff Bezos disagrees with the last statement
2021-04-30 07:57:06,stocks,"I'd invest the $2 million and then do tech start ups living on the investment returns.  Still ""work"", but it's stuff I enjoy.  And who knows, I could have the next $2 billion idea.  Even if I don't, I've grown a tech start up to a $20 million valuation before.  Should be even easier to do if I'm not working a day job at the same time."
2021-04-30 09:17:16,stocks,"As in you sell product, or you are essentially a salesman contractor for other businesses? Just out of curiosity."
2021-04-30 07:44:33,stocks,And the diversification
2021-04-30 06:11:02,stocks,"The true difference is trusted *repeatability*.

I own a business doing contract work. I can repeat this income month by month, I can scale it and I can decide myself how much money I make. This is *trusted* income.  I know people with four, five small companies who just manage them and aren't included in the day by day. Its not neck breaking and not a 60h week, if you have products and services that work.

The [MSCI World](https://www.msci.com/documents/10199/178e6643-6ae6-47b9-82be-e1fc565ededb) had spotty years. I have seen people living off 80k fixed income and just one year of bad stock weather and they had to sell one of their beloved old timers to afford to help out in the family.

Also; even if I would earn enough to live well, I would still work and make money. That is the best position to be in, because you can do things you love even if they are completely non paid or underpaid."
2021-04-30 06:27:01,stocks,"From a non-financial standpoint it is also far more boring, plus is everyone chose to invest rather than start a business - there would be no small businesses."
2021-04-30 08:34:56,stocks,"Gotta get those sweet, sweet ppp loans though... haha"
2021-04-30 04:07:12,stocks,Get this diamond hands bullshit out of here. Not once in 2021 have diamond hands been the best play. You sell at 15+ or sell over 300+ then you can get back in lower and do the same thing again. If you had just held you would miss out on 500%+ in unrealised gains on multiple occasions.  People also sell the news on any spac or ev play.
2021-04-30 09:38:30,stocks,"> Chefs/cooks can be difficult people to manage.

biggest understatement I've ever read lol"
2021-04-30 06:57:23,stocks,"Having said that, there are some businesses which will give higher revenue than 10%. But then you have to also manage those, a portfolio could literally take you a couple weeks a year to manage, allowing you to do other things.

I think what you will find in this sub is that we are all about working from home, in our spare time, rather than managing something which could dominate our spare time."
2021-04-30 09:53:10,stocks,"Agreed, though if I was running a food business I'd probably go with a food truck. Much lower overhead and you can operate when and where you want to."
2021-04-30 10:21:10,stocks,Scariest place in the world is a busy kitchen with an upset cook.
2021-04-30 06:54:22,stocks,"Exactly! I'd say it's always going to be better to have money like that because you can do anything you can do without money, OR you can do nothing at all. It also means you can start whatever business youd like and not have to worry about getting paid."
2021-04-30 08:13:07,stocks,"That last part is what people forget about having passive income. It doesn’t preclude you from having another job. Even if your passive income is fairly low- imagine a *very* conservative number like 2%- you could do anything you want. Be the worlds wealthiest school bus driver, work all of 90 minutes a day, etc."
2021-04-30 08:17:58,stocks,"For what it's worth, you should account for inflation too if you want to maintain your worth. 5% of $1.5 million is not the same today as in 10 or 20 years time."
2021-04-30 07:35:12,stocks,"I want to say thank you.

You’ve literally changed my life and have given me hope.

Financial security is one of the biggest stressors in my life and I’ve worked many soul crushing jobs working for incompetent, power trippy bosses. This has opened the doorway to life where I can actually live for me.

Edit: I guess my comment was somehow offensive to some lol dreams are dreams I guess."
2021-04-30 08:33:15,stocks,"I would buy some income producing property. It’s a business I know fairly well, so it wouldn’t be too hard to find a good deal."
2021-04-30 09:52:48,stocks,"But, it won’t work that way. 

If your portfolio makes $75k and your expenses are $75k then you are losing money every year. After 10 years of 3% compounded inflation, your portfolio is now worth $1.3M in today’s dollars and your income is under $50k in today’s dollars and you’re working as a Walmart greeter because it’s the only job you can get having a ten year gap in your resume."
2021-04-30 11:48:29,stocks,This was my exact thought reading this. Good answer
2021-04-30 11:54:56,stocks,"5% after inflation is 2%, This is how generational wealth dries up...

75k is going to be near poverty in 35 years."
2021-04-30 18:27:54,stocks,Yeah If I could make 75k a year passive income I would never work a day in my life ever again
2021-04-30 09:27:14,stocks,"75k is good.... right now. but what about 10 years? 20 years? 40?

probably not."
2021-04-30 09:51:47,stocks,Dividends are still taxed as income though. I'd rather just keep it in an index fund and sell off periodically. 10% vs what 25+ (depending on where you live)?
2021-04-30 10:45:25,stocks,I think the strategy of just selling 4% of your portfolio per year is also a sound one. I'm skeptical of dividend chasing because they can vary and that can lead you to ignore overall stock growth (like maybe it pays a high dividend but it's growth is questionable).
2021-04-30 12:12:14,stocks,"Good luck with 5%, particularly after tax these days. But yeah, even if it is more like 30-40k a year that is still nice in covering lots of costs"
2021-04-30 12:40:58,stocks,I’d put the 1/4 into a high growth etf like QQQ or a market etf like SPY. Just easier than “picking” a high growth stock.
2021-04-30 13:07:53,stocks,"This where all those people on the homebuilding shows come from.

Sally & John, receptionist + baseball card collector, budget: 2.4Mil"
2021-04-30 13:13:06,stocks,Any suggestions on some well paying dividend stocks?
2021-04-30 08:20:41,stocks,Dividends are value. Why would you have cap and style overlap if 75% is already dividend paying stocks?
2021-04-30 09:54:40,stocks,"Yea the jist (gist?) of this question is ""is it better to slave over a hot stove 7 days a week or do whatever I want for more money""?"
2021-04-30 13:39:10,stocks,"I think most people answering this question here don’t understand how businesses work.

Nobody would pay 2M for a restaurant that nets you 200k"
2021-04-30 13:14:01,stocks,How much profit comes from alcohol?
2021-04-30 13:15:29,stocks,"Oh also, how much of your menu is unique / made in house vs choices from Sysco or Food International?"
2021-04-30 08:15:33,stocks,Maybe get a small loan from your dad?
2021-04-30 08:13:42,stocks,It’s not that uncommon through long term investing. Talking 40+ years
2021-04-30 08:42:06,stocks,"Many professional careers pay enough to accumulate $2mm over the course of a few decades if you budget appropriately. 

It’s much easier when a married couple both has professional jobs. Two software engineers could accumulate $2mm in a decade if they can keep their spending low enough that they can put one person’s earnings entirely into investments each year."
2021-04-30 09:39:16,stocks,Sales
2021-04-30 09:57:08,stocks,Yoloing FDs
2021-04-30 12:39:31,stocks,"\^\^ This is what I would do haha. 

I'm a modest man, 140k a year and I'm freaking chilling"
2021-04-30 06:19:34,stocks,"I know people with a bunch of small companies (not more than 10 people working there) but high price services. One of them is invested in five or six sectors (housing, stocks, metals, old cars...) In the last 20 years he was broke more times I can remember. Its 80% because his investment tanked. Without his companies he wouldn't have made it. People think its easy to call up your bank and ask for a ""index fund with 10% guaranteed for 30 years"" and they just send you contracts to sign."
2021-04-30 03:54:32,stocks,The S&P has an annual historical return of 10%
2021-04-30 05:04:00,stocks,"I've sporadically had 2000% annual returns. Also had some 95% losses 😅

Over all I'm still green"
2021-04-30 10:49:33,stocks,"Yeah, if I had that much money I don't think I'd have as much appetite for the risk that stocks pose. I would probably put 10% of my portfolio into an investment account I can use for stock picking and the rest in an ETF or index fund that has a greater chance of consistent returns."
2021-04-30 11:03:19,stocks,"You gotta be investing in the right stuff. If you’re going to be investing lump sums of money like 2 million you’re better off doing ETF’s and index funds. These have an annual return of average 10%. Track VTI and VCN.TO, look at the annual performance for the past 15 years. You’ll see that for many years it was up 20%, some years only 5%, which is why the average is 10%. Dividend investing is good, but you’re better off investing in blue chip stocks, not dividend indexes.

Not to mention compound interest, at high levels of 2m, the snowball effect will leave him with far more as time goes on."
2021-04-30 17:11:49,stocks,Why did I have to scroll this far down to find someone call out OP on the unreal consistent 10% return...
2021-04-30 11:10:09,stocks,"Not sure why you said this. It's incredibly easy to make far more than 10 percent a year when playing options. I've only been trading since 2016 and done way better than that. 

But even if you weren't doing options, just swing trading stocks... can beat 10 percent so easy its a joke."
2021-04-30 14:39:08,stocks,"Shrewd and/or lucky investments over extended periods of time.

Lol jk yoloing on insane options plays is probably the quickest way xD"
2021-04-30 11:58:09,stocks,"So by principle, you mean if someone have $2 million but their principle is 900K over years of contributing, then if there is a bear market and their portfolio goes to 900K, that would be the principle amount right? Not good to touch if you don’t need to?"
2021-04-30 11:32:10,stocks,"When you talk about profit, is that the money you put into your pockets or is that strictly your company while you take a salary?"
2021-04-30 08:40:24,stocks,"as a restaurant owner, i think all of your points are spot on. but it's not as big of a negative as you think, bc it weeds out the competition so effectively. if you can put systems in place that even marginally address the issues you pointed out, you will be doing better than 99% of your competition."
2021-04-30 10:20:22,stocks,"Successful pizza shop owners are all like this. All restaurants that are successful, honestly. I can't think of one that I've worked in that didn't have an owner or partner of some kind that was seemingly present all day every day...and BUSY.  


Can't hate on that hustle, but it's definitely too much for me. Gave it a whirl with a little burger and comics shop. It was fun for a few years but it wasn't my heart - so it had to end before I started to get into the red."
2021-04-30 07:41:41,stocks,"most small businesses or startups don't cost $2M to start.

you could easily start a business for 200k, and invest $1.8M

also, running a portfolio is always going to seem easier than running a business in a huge bull market, wait till the market turns and instead of making $20k/day you're losing it every day for weeks on end."
2021-04-30 04:04:57,stocks,Rightly said🙌🏻🦧🦍🦍🦍
2021-04-30 09:20:13,stocks,QYLD pays a 10% dividend of you want to do it on easy mode.
2021-04-30 08:14:35,stocks,This. And in the UK with an ISA you don’t even have tax to worry about
2021-04-30 08:26:23,stocks,"That 10-15% ETF figure you quote is technically true in the long run, but it’s not reliable year to year. The market has its ups and downs and you need to be able to weather them. If you’re dipping into your principle for expenses when the market’s down, that loss will be multiplied when it rebounds. 

To make this safe, you need at least 1-2 years of cash set aside."
2021-04-30 09:28:07,stocks,Probably like...  1.
2021-04-30 09:24:30,stocks,Probs 1
2021-04-30 11:34:39,stocks,For stocks or owning a business?
2021-04-30 11:47:46,stocks,Then what is a more accurate return?
2021-04-30 12:06:33,stocks,">	but 10% returns is a lot for a portfolio

It’s not that outlandish. The average return is 7-9%."
2021-04-30 12:38:03,stocks,What were you making after you account for taxes? Also have to worry about self employment taxes right?
2021-04-30 11:48:03,stocks,"Assuming you're certain that you'll be living nearby to manage the property/properties, and that it isn't an area with a lot of empty unrentable places:

The rental property gives you a relatively steady stream of income. Yes, it has costs, and you need to set aside maintenance funds and be prepared for it to stand empty every now and then, and it takes some work. But that income is valuable during a bear market, as if it is residential property you would have to be unlucky for it to dry up completely. That income stops you having to touch the principal of your portfolio (as much) during extended downswings. 

Not for everyone, but seems like a valuable addition to a portfolio."
2021-04-30 10:04:36,stocks,"I'm not sure I would take $2 mil of stocks over $2 mil of property. Of course, it depends where the property is located, but rental income and land scarcity is a very good investment"
2021-04-30 11:28:57,stocks,"How much are you taking home? What is your revenue, gross profit, then total net income?"
2021-04-30 14:08:30,stocks,Very well said. Thank you
2021-04-30 06:12:07,stocks,"And you can diversify the “stock portfolio” business, where owning a business is like owning one stock."
2021-04-30 09:47:09,stocks,you need more partners?
2021-04-30 07:04:08,stocks,"I disagree, it's certainly possible for someone to answer. Easiest way is to subtract the financial calculation and focus on whether you want to live a fulfilled life and build something you can be proud of, or live off some interest while hammering drugs and alcohol into yourself as you sit around doing nothing because you are so bored from not *having* to do anything ever."
2021-04-30 11:35:56,stocks,What is your take home pay from those revenues?
2021-04-30 12:17:47,stocks,How about food business?
2021-04-30 12:18:14,stocks,How reliable are OTM options?
2021-04-30 12:34:37,stocks,How much does it cost to get started?
2021-04-30 12:36:09,stocks,Wow good for your fam! Was that 300k-400k their take home pay?
2021-04-30 14:09:31,stocks,What’s a good div etf that also has good CAGR?
2021-04-30 18:27:07,stocks,Idk how call options work? How would I get 300k annual?
2021-04-30 19:44:27,stocks,If you want a cash drain own a restaurant
2021-04-30 11:54:27,stocks,Relax
2021-04-30 08:29:57,stocks,What happens if they have a bad year? You still take out money?
2021-04-30 14:50:40,stocks,">Food truck or something commercial with food like a sauce or bread company, maaaaybe, but never a full restaurant.

$1 Grilled Cheese truck. Cash only. No change. No special orders. You hand over $20, you get 20 grilled cheeses."
2021-04-30 17:34:48,stocks,"Just wait until you try food delivery (DoorDash, Uber Eats, GrubHub)... then you will HATE restaurants AND people!"
2021-04-30 18:39:38,stocks,some of the best lessons are free!
2021-04-30 08:59:34,stocks,I worked at a restaurant for 10 years in the summers while I was in high school/college.  The boss was a good friend of my dad's and he always hired good people.  Even then he didn't trust us to run the day-to-day and was there 9:30am to 9:30pm 6 days a week.  It took a toll on him for sure.
2021-04-30 12:04:10,stocks,"And speaking from experience doing books for several restaurant owners, you'll make money when you're there and somehow magically lose money when you're not.  A couple of my clients feel like they have to be there almost every minute the restaurant is open.  That life sucks."
2021-04-30 09:53:19,stocks,"almost all restraunts are built on a house of cards imo.

What you get out of it is so often not worth it. I can see it being worth it for highly ambitious chefs and front of house managers, but yeh, fuck me do you need serious edge to make it in that industry."
2021-04-30 09:11:38,stocks,"My gf's best friend is opening a restaurant soon (was supposed to be last year but covid) and her husband is going to be the head chef.

I worry for her because the husband is an amazing cook (trained by some fancy shmancy french chef that's famous) but he goes through periods where he'll be super fucking dedicated for 6 months and then just be a complete lazy bum for a few months.

I don't know how they intend to survive his down periods"
2021-04-30 08:41:38,stocks,Yeah I second this. My husbands parents owned restaurants and it is NOT passive income and you have to keep a close watch on it because management and staff WILL steal from you. It’s not a matter of if it’s when. That being said it can be prettty lucrative when done well.
2021-04-30 13:49:19,stocks,"All this aside, a tightly ran restaurant is lucky to profit 10%.  Having one that does $2 million in revenue a year is a large order as well."
2021-04-30 14:15:02,stocks,Yes
2021-04-30 14:43:49,stocks,"> Good running restaurants need people who are willing to spend 12h a day there, if its the cook, the owner, or someone who is paid.

Looking at /r/kitchenconfidential, they don't even have to be well-run to require people who spend 12h days there for little pay and high stress."
2021-04-30 17:17:46,stocks,"I know 5 sisters that went in together to start a restaurant it is a success but at the end of the day it generates a lot of assets and not much cash flow, they pay themselves a good salary but they are there all the time.   


Even though they dont get more cashflow than just their salary, the business having consistent revenue allowed them to purchase the 4 store building they were in, and last week it allowed them to close on purchasing the 4 other store building next to them so its allowed them to purchase the entire strip mall now so they will be transitioning into more passive income streams from the business finances"
2021-04-30 09:31:01,stocks,"It took him 30 years, but he finally got his degree! Good for him :) only took me 9!"
2021-04-30 13:54:48,stocks,"You don’t own a restaurant, a restaurant owns you."
2021-04-30 08:59:30,stocks,">Most people I know would be astonished to have even 100k to start a restaurant, people pull ropes and make it happen with a lot less

Which I think is directly related to the failure rate in a lot of ways. Also related to why you don't see mcdonalds franchises fail in the same way, you have to have something like $1 mil liquid to be allowed to open one."
2021-04-30 08:29:13,stocks,Not to mention 10% returns is not as easy as set it and forget it investing with no risk. Going to take a lot of management to get that consistently enough to withdraw gains for living expenses each year.
2021-04-30 13:25:05,stocks,"> You have half drunk people who may or may not know what they are doing

You must know the contractor who made my existence a living hell for over a year."
2021-04-30 09:23:13,stocks,"Of course it’s regional, there are hot markets in the US and there’s slow ones. I’m in PNW and it’s boomin over here and been like that for years, as of now we have homes scheduled 2 years out. 
Shortage of housing and a lot of people moving out of Seattle caused insane demand. Most of the new construction homes we build are sold as the foundation is getting poured, they never even hit the market. And the crazy part is a bunch of these people don’t even get loans, they cash out on a 2mil+ home. Plus there is an overwhelming amount of custom homes up and down lake Washington, lake sammamish and surrounding areas. 
My friend who’s a builder in Florida, says market is slow and profits keep you afloat but will never make one rich. Sure there are high end builders in Florida and there’s very expensive homes but the number of people in the industry and the amount of work do not compare."
2021-04-30 12:15:23,stocks,"""half drunk'  is right.  I've worked with a couple of construction companies for over thirty years, and their two biggest problems are finding workers that will show up for work and finding people with a driver license because of DUIs.  They used to hire young ""helpers"" that were pretty useless except they could drive, but that is too expensive now here in Seattle with the massive minimum wage gains."
2021-04-30 10:32:27,stocks,"Sounds fun, but out of my budget."
2021-04-30 15:51:36,stocks,Lol the help. I bet you treat your server like a slave.
2021-04-30 15:47:17,stocks,"Your product expires if you don’t have the business. You have expectations for business but it’s always a mystery as to how busy you’ll get tonight. Your employees in every position from management to bussers steal from you. Your clientele is always looking for something free. You have to pay your cooks a competitive wage if you want them to be good at their job and continue to work for you. Whatever you don’t hire out you have to do yourself. You can’t make a host serve or a server cook. If a manager has to serve, bus, or cook then you have to manage. If you don’t want to manage you better make damn sure you pay somebody handsomely to be your general manager and then you have to make sure they actually care about their job. Passion is not guaranteed at any position in a restaurant. If your servers are not hospitable then it doesn’t matter how good your food is. If your busboys are not motivated to move fast then your guest count gets lower. If you go on a two hour wait and your kitchen crashes then you lose the people that were waiting to come in and your night basically ends there. I could go on if I felt like thinking harder.

A lot of these things get easier the longer the restaurant has been open or if it’s a chain. But a mom and pop that opened their first restaurant? These are huge hurdles."
2021-04-30 17:41:21,stocks,"Labor and COGS, R&M, occupancy, taxes, services and utilities. A restaurant making 20% profit after all that is doing exceedingly well. Most smaller restaurants will never see that for a number of reasons, one of which is that a lot of the people that get into the business have little or no actual restaurant experience."
2021-04-30 08:16:52,stocks,📷🤨📸😑
2021-04-30 13:22:05,stocks,"Both are technically work, one is just very low effort and involves starring at a computer and reading/learning. Think of it being like a pro poker player lol"
2021-04-30 19:59:56,stocks,"Can I just have 2 million at 0%?

Id retire now at 35"
2021-04-30 11:50:08,stocks,"Dividends aren’t just free money, they are a form of return, same as share value growth.

If you aren’t reinvesting your dividend then you are in theory pulling your asset, as stock price generally decreases equivalent to dividend payout.

It would be the same as selling shares of a non-dividend paying stock investment."
2021-04-30 10:43:03,stocks,You think the 15% capital gains tax is anything close to the taxes you pay owning a restaurant? Your kidding right...
2021-04-30 09:42:52,stocks,At a third of what most people are paying in payroll taxes...I'll take 10-15% capital gains any day of the week.
2021-04-30 11:13:52,stocks,"Oh no, not taxes that are way lower than the taxes I pay on my labor"
2021-04-30 08:38:41,stocks,Unrealized cap gains smirks
2021-04-30 10:39:27,stocks,You guys get gains?
2021-04-30 08:54:57,stocks,Laughs in tfsa
2021-04-30 13:35:16,stocks,"In the US, if you manage the withdrawals to remain in the 12 % bracket (~US $ 80,000, married, filing jointly), the tax rate on long term capital gains will be 0 %."
2021-04-30 11:46:25,stocks,No effect in this situation. Unless you are making a million a year in income and realizing long term cap gains in the same year it doesnt matter
2021-04-30 14:07:07,stocks,"Capital gains taxes' grin are welcoming you to a fun party once you retire and the first ~$80k/year (married;jointly) has a 0% tax rate, and that doesn't count the benefit of your tax deductions."
