Timestamp,Subreddit,Post/Comment
2021-06-23 20:33:20,stocks,"You HAVE to lose some money to be the most competent investor. Here's an example:

You own A but it's down $5 and will stay that way for 6 months

You see a trend in B and it's slated to go up $10 in the next 2 months

If you hold A you'll be losing $10. The correct move is to exit from A and move to B. So you have to accept the loss in your current position in order to get to a better one.

This is a simple example but it shows a couple of important maxims:

1. You have no power over the past or the future, only the present. Because you are making predictions, you are bound to be wrong a fair deal. In fact, it would be insane to expect to never make a wrong move, or catch bad luck, have the market fall underneath you, etc. All of these things should be naturally expected. If you stay in the game long enough you'll hit them all, and plenty.
2. What your money is doing RIGHT NOW should be judged against the other many things it could be doing RIGHT NOW. Not maybe 6 months from now while you wait for a loss to maybe rebound. 

So your job is to try to make the least amount of forced errors. Try to constantly get better at your predictions, knowing that without a crystal ball you are just a mortal like everyone else. And don't fall for emotions and stay in a losing position when your money could be doing something much better right now.

This is why you play in a landscape of reasonable investments. Because you are going to win some and lose some. But you can apply dedication, research and perseverance to beat the odds. So instead of winning 50% and losing 50% (random odds), maybe you win 60% and lose 40% thanks to your dedication. And that's enough to be successful long term, unless you are being stupid and YOLOing your way through life so that a couple bad moves tap you out.

This is why ""the house always wins"". Casino game odds are designed just a hair in favor of the house. If you played them steady and reasonable you couldn't lose much. They are betting on people going YOLO, making a couple bad moves in a row and gifting them their hard earned money. 

Remember that casino dynamic when you decide if you want to be a serious, organized, reasonable long term trader, or a YOLO type of creature.

Investing is not about trying to nail a couple of great moves in a row without taking any losses. Investing is about building a steady landscape for yourself, and beating the 50/50 odds just good enough to come out on top consistently and long term. Losing is part of the deal, as long as it happens less often than winning."
2021-06-23 21:19:07,stocks,"You have to recommend Mark Douglas ""Trading In The Zone"""
2021-06-23 22:02:15,stocks,">In the beginning I shared one of the most dangerous bias of a young trader – I came to make money, not to lose it. This is fundamentally wrong. I spoke with many folks about it and they all seemed to have this bias. In fact taking small losses does not equal to losing money. There’s no way you can become a profitable trader if you are not ready to be wrong anytime you make a bet.

of course, that doesn't necessarily mean that anytime a stock goes down that  someone was wrong. when a stock goes down, someone needs to objectively look and say ""why did i buy this to begin with, and do i still believe this stock will end up going where i expected it to in the long term"".

look at all the people who were buying XOM for $40-$45/share last year, then watched it crater to around $30/share. those who still believed and held on have shares that are over $60 now. same can be said for moderna. i remember all the ""i'm down so much, i bought at $80 and now it's tanking"" posts last summer. 

there's a big difference between acknowledging that the analysis that lead someone to purchase a stock may have been flawed and selling for a loss versus simply seeing red and panicking, pulling the money out as a kneejerk reaction.

the most important question someone can ask themselves when they see red is ""has something changed from my initial analysis of the company"". i've definitely sold stuff where  the answer to that question was yes (for example when dave and busters was on the verge of bankruptcy, and that risk was WAY higher  than when i purchased, and the executives were putting out insane  ideas like some stupid radio station as a way to right the ship). ended up selling at break even, so fortunately not a loss, but easily could have been (and would have been if i waited a little longer to sell)"
2021-06-23 23:44:06,stocks,"Love the post! I just started trading a few months ago.
My cousin has been investing for 30 years and I was telling him some of my moves. He told me everyone is a genuis in a bull market. 
So whenever I think I'm doing good I always honor my stop loss and exit."
2021-06-24 04:17:02,stocks,"Most people on reddit just don't fundamentally understand risk and timescales.  They think that they should be able to easily trade and secure big gains in a short time and that leads to them being in a far riskier basket than what they really have the stomach for.

There's a reason why the most common advice is just to set up a regular contribution to a total market fund and check back in 30 years.  Stock picking is difficult and requires expertise far beyond what 98% of people here have."
2021-06-23 22:41:55,stocks,"A random walk down wall street is all i read and didn't even finished. The only thing not to get emotional is to buy and sell whenever you want, even at a loss, try as much as you can with very small increments you can lose.

Then long term trends are easily seen, so just throw at whatever you want to invest, that's it, just don't listen to anyone, there are always better investment around the corner, and more people invest better than you do, so why compare. I tend to choose the not so much people talk to, and I always have themes for long term. Then short term, I make estimates, loss or gain."
2021-06-24 06:20:20,stocks,Market Wizards and Unknown Market Wizards should be in that book list
2021-06-24 07:33:56,stocks,But this is good for someone willing to play long term. And that is fine. What I don’t understand is why a long term investor is giving advice someone who wants to get rich soon. Two different types of person/investors!
2021-06-23 22:18:17,stocks,If they’re still holding they’re probably up pretty good right now.
2021-06-24 19:48:02,stocks,When you are struggling to either down vote or upvote.
2021-06-24 01:57:43,stocks,don’t use options? why not sell CC’s deep otm and collect premium?
2021-06-24 07:33:24,stocks,But this is good for someone willing to play long term. And that is fine. What I don’t understand is why a long term investor is giving advice someone who wants to get rich soon. Two different types of person/investors!
2021-06-23 23:16:48,stocks,"I've seen lots of investors talk about their risk ratio, and they'll say that a certain play was a 4 to 1 or 3 to 1. For example, on a 4 to 1, the investor may have said that if he's right on this move, then it's a 12 percent gainer. If he's wrong, it's a 3 percent loss. 4 to 1 risk reward ratio.

It sounds great, but I honestly wonder how many times they subconsciously inflate the upside, just to ""allow"" themselves to get into the play? I think it's probably a lot more common than one would think."
2021-06-24 13:41:29,stocks,Blind leading the blind
2021-06-24 08:47:22,stocks,Cmon it was just a joke!
2021-06-24 07:56:15,stocks,😂😂😂
2021-06-23 21:01:45,stocks,"You got 1,000 in dividends? How my friend?"
2021-06-24 04:57:50,stocks,"Check out aitx, first penny I've felt comfortable holding long term"
2021-06-24 08:34:29,stocks,"I do this with SPY.  But I only do it while it’s at ATH, so there is very little risk of assignment.  If it’s in a correction phase, it could surge at anytime and the option can become ITM."
2021-06-24 00:24:55,stocks,"For the good ones, there’s next to no inflation. This is because they simply trade the chart. Let’s use $TSLA after today’s rally as an example:

- On technicals alone, it looks like $TSLA broke out of an intraday bull pennant at close. This happened after basing all day after the early market run up
- Bull pennant break is typically the distance of the flag pole from the breakout point 

So if you are playing the breakout:

- Entry: $656 (Today’s close)
- Stop loss: $647 (Pennant low. Likely signals a breakdown is underway)
- Target: $685 (length of the pole)

Upside: 4.4%
Downside: -1.4%
Ratio: ~3:1

Now those numbers aren’t much, but $TSLA options trade with a significant premium. I’d also anticipate we’d make this move by the end of the week given the breakout. If I really felt good about this move, I could opt for weekly options vs. stock, adhering to my levels to minimize my loss.

Personally, I trade options based only on the chart, but my durations are ~4 months out. I have general rules that I follow around profit taking and cutting losses, but I’m flexible if I have high conviction about a play."
2021-06-23 21:53:55,stocks,"> You got 1,000 in dividends? How my friend?

if someone has a dividend focused portfolio, it's not that hard to do. it really just comes down to portfolio size.

with like 50-60k spread  among high yield  stocks (MO, IRM, T, QYLD, etc.)  someone can easily get $1k every 3 months or so."
2021-06-23 21:08:32,stocks,"No, 2000 in dividends, from NYMT (every 3 months though). I have several REITs: Realty Income, New York Mortgage Trust, etc."
2021-06-23 23:43:34,stocks,"SCHD

VIG"
2021-06-24 08:31:59,stocks,"Yoloing into spacs last year was how I turned 150k into $900,000 after taxes.  My reasoning for doing this was because they don’t drop below $10 until after merge. And I buy them as close as I can to $10."
2021-06-24 00:00:00,stocks,Buying and selling an IPO Hey everyone I have a question. I got notified of an upcoming IPO and wanted to buy in.  My question is. What is the wait period after purchasing an IPO do I have to wait if any before I can sell my shares after the company's official 1st day on the market.
2021-06-24 00:01:40,stocks,"Someone really down voted me for that comment lol I'm just trying to learn.

I'm guessing you've been doing this for a while? Any books or learning points you could throw my way would be much appreciated."
2021-06-24 10:36:07,stocks,"Keep doing what you're doing. Ask questions, read articles, etc. There are so many resources available nowadays, there's no one single best source."
2021-06-24 10:44:48,stocks,"Well, I appreciate everything homie."
2021-06-24 00:00:00,stocks,"Paypal turning Venmo into Paypal [https://www.marketwatch.com/story/paypal-steps-up-efforts-to-make-money-off-venmo-with-new-fee-changes-11624476046](https://www.marketwatch.com/story/paypal-steps-up-efforts-to-make-money-off-venmo-with-new-fee-changes-11624476046)

$PYPL

>PayPal Holdings Inc.’s Venmo is making several changes to its platform, with plans to increase the fees for instant deposits that users make to their bank accounts and add an option that lets people designate that they’re paying another user for the purchase of goods and services.  
>  
>The moves come as PayPal [**PYPL,** **+0.48%**](https://www.marketwatch.com/investing/stock/PYPL?mod=MW_story_quote) [looks to turn Venmo into a bigger revenue engine](https://www.marketwatch.com/story/heres-how-paypal-hopes-to-turn-venmo-into-the-next-paypal-2020-07-31) while still trying to maintain the service’s appeal among the many younger users who rely on it to send money to their friends.  
>  
>Venmo plans to add a function that will let senders identify whether they’re making Venmo payments to cover the purchase of goods and services, according to a notice that began rolling out to Venmo customers this week. The change will allow users to gain purchase-protection benefits on eligible payments, though the sellers of these goods and services will start being charged 1.9% of the transaction amount, plus 10 cents, to receive money this way.  
>  
>It’s free for people to send or receive money through Venmo, which got its start as a way for friends and family to exchange money with one another. But Venmo is also used for business purposes, as folks like hairstylists, artists, and other sole proprietors opt to accept customer payments through the service. Venmo has been looking to capitalize on this kind of commercial activity while preserving the ability for friends to freely pay one another.

Seems like a smart (yet a bit dirty) move from them. Going to increase their growth profits even harder."
2021-06-24 01:01:00,stocks,Yea just instant transfer. They’re upping the fees
2021-06-24 00:30:31,stocks,Ya I use Venmo to send money to my friend with stupid emojis and use PayPal to pay for dominos
2021-06-24 00:00:00,stocks,"AT&T, is it still worth it? The post is in the title. I have held AT&T for a long time enjoying a decent dividend and relatively good growth, however, I'm not so sure that it's worth holding on to. Selling off WarnerMedia sounded good at first, but I missed the part initially where they're planning to slash the dividend. Which was kind of the point of my buying in in the first place. 

I was thinking of selling off my position and puting it into something different. VZ, AMD, MSFT or something else.

Anyone else starting to think ATT isn't all that fantastic anymore? (If it ever really was. Im really starting to second guess myself)"
2021-06-23 21:50:28,stocks,I sold them because they completely lost the meaning of me holding them. I bought them when they were trading around $27.00 and $28.00 during August and September. I saw how much they dropped during the pandemic and never recovered plus they paid that nice dividend. I also like what separated them from Verizon was their streaming platform and movies which I saw huge growth potential in. After the deal they are now cutting the dividend and separated their streaming and TV network into one which I hated. For me they are no different from Verizon at this point.
2021-06-23 22:48:25,stocks,SELL.  NOW.
2021-06-24 00:28:13,stocks,Na not worth it. The stock literally doesn’t move. Without looking it’s probably still at 28 dollars. It’s been there for like a year. Could make more money elsewhere so why not
2021-06-24 15:27:42,stocks,"T has been dead money since 2000. However this change they are proposing is fairly radical, they are attempting to pay down debt and give the company more financial flexibility. T went from a predictable path of paying 7% bond proxy to... something else? Doesn't appear to be a growth stock, they are no longer dividend oriented, so what are they?"
2021-06-24 00:57:47,stocks,"I believe it will go up once everyone who is only in it for the dividends sells. Very telling that many people are getting out because of the dividend cut, but yet the stock has not exactly tanked. Most, if not all, articles I have read have the combined post merger valuation around $29 to $40 as a conservative estimate. 

There are good reasons why the post merger companies will see better value. With less better balance sheet due to reduced debt and dividend, as well as and a focus on their core business. T's multiple should increase. The NewCo's valuation may also command a higher multiple more inline with other streaming companies.

I am buying based on:

* Currently price then $29, the minimum estimate of the combined post merger stocks.
* Should be 4 more 7% dividends before the merger.
* Good chance at a $40 post merger valuation for the combined stocks. Personally, I think it will be higher, especially after we remove the final dividend holders that sell off post merger.
* I think T will try to reassert itself as a dividend aristocrat after it cuts the dividend.
* Growth is single digits for T, but I believe they will be in a good position moving forwards.
* The NewCo has tremendous growth potential.

Frankly, I am tempted to buy DISCA as well, but am going to stick with T for now since I will be getting a large chunk of the NewCo anyway.

I hope it stays low for a while though, I plan on buying up T every month until the merger."
2021-06-24 00:57:46,stocks,You call it excellent divisend. Not decent.
2021-06-24 00:00:00,stocks,"US antitrust reform of big Tech; are the bills essentially removing the competitive abilities of each tech company? Do you think these proposed changes will heavily impact profits? For example, Amazon prime is arguably one of the most competitive advantages that maintains customer retention. YouTube advertising on Google would dissapear, would YouTube still reach such a big audience? (and therefore advertising revenue lowers etc)
Will some big tech be less harmed by these changes?"
2021-06-23 21:37:34,stocks,We love McDonalds and cigarettes too
2021-06-24 00:00:00,stocks,"Here is a Market Recap for today Wednesday, June 23, 2021 **PsychoMarket Recap - Wednesday, June 23, 2021** 

Stocks rose again today, as inflationary concerns continue to abate, with the Nasdaq (QQQ) powering to a new fresh intraday high driven by the continued rallies in mega-cap tech stocks like Apple (AAPL), Microsoft (MSFT) and Amazon (AMZN) The S&P 500 (SPY) continues to hover 2-3 points below its record high while the Dow Jones (DIA) continues to recover after suffering its worst performance since October 2020 last week. 

In a meeting with the House Select Subcommittee on the Coronavirus Crisis, Federal Reserve Chair Jerome Powell once again reiterated that interest rates will not be raised on inflation fears alone and sees current pressures as transitory. Powell said, “We will not raise interest rates preemptively because we fear the possible onset of inflation. We will wait for evidence of actual inflation or other imbalances.” He went on to further say recent price increases “don’t speak to a broadly tight economy that would require higher interest rates” but come from factors “directly affected by the reopening”. Powell then went on to further reiterate the Central Bank is keeping a close eye on a “broad set of labor market statistics” before any adjustment to the current policy is considered. He said “We will not just look at the headline numbers for unemployment. We will look at all kinds of measures…. That is the most important thing we can do to ensure the benefits of the recovery are more fully shared”. 

As expected, response by lawmakers to Powell’s testimony, no surprise, split squarely down partisan lines, with Democrats focusing on labor market imbalances and unemployment and Republicans focusing on concerns surrounding inflation. I do not place much, if any, weight on what was said by lawmakers, just interested in what Powell had to say. 

Looking ahead, market participants are gearing up for Q2 earnings, with analysts expecting a repeat of Q1 record setting season, with earnings expected to continue being super-charged by stronger than expected demand by savings-laden consumers as the US economy is finally open to begin broadly reopening thanks to effective distribution of the vaccine.  So far, analysts are looking for S&P 500 earnings to grow by 61.9% year-on-year in aggregate, according to FactSet data – an estimate UBS's Head of Equity Derivatives Research Stuart Kaiser said may still be ""need to be revised higher."" 

Moreover, tomorrow Thursday  the Fed is set to release the results of its “stress test” on the US largest banks, an annual test meant to test the financial health of lenders that was instituted following the 2009 financial crisis. The tests are designed to see how banks would fare during a hypothetical extreme economic downturn (not unlike what banks experienced last year). This stress test is extremely important because last year, during the height of the pandemic, the Fed imposed restrictions on banks on capital distributions like dividends and buybacks in order to ensure banks would have enough capital to weather the storm. Thanks to those measures, plus low interest rates and government stimulus that held off loan losses, analysts expect banks to perform well on Thursday, which would lead the Fed to lift remaining capital distribution curbs, opening the floodgates for banks to increase dividends and reinstitute stock buy back programs. If these restrictions are fully lifted, the six largest banks in the US - Bank of America (BAC), Citigroup, Goldman Sachs (GS), JP Morgan (JPM), Morgan Stanley (MS) and Wells Fargo (WFC) - are expected to increase payouts by $66 billion to $130 billion over the next four quarters. This is huge.

On Friday, Later this week, investors will receive the latest update on core personal consumption expenditures (PCE), which serves as the Fed's preferred gauge of inflation. The report due for release on Friday is expected to register a 3.4% year-on-year increase for May, marking the fastest jump since 1992, albeit while still reflecting ""base effects"" as prices rebound after last year's pandemic-induced collapse in prices across the board

**Highlights**

* Southwest Airlines (LUV) CEO Gary Kelly announced he would be stepping down and transitioning to becoming Executive Chairman of the Board. 
* New home sales fell unexpectedly for the second straight Month in May, according to the Commerce Department. This shows a slow down in market activity after the frenzy experienced in the beginning of this year. New home sales were down 5.9% in May over April, compared to a rise of 0.2% that was expected. 
* Amazon (AMZN) prime day was very strong despite supply chain challenges. Analyst are expecting Prime Day sales of $9.5 - $12 billion. AMZN stock currently hovers a few percentage points from its record high.
* Microsoft (MSFT) became the second company, after Apple (AAPL) to reach the $2 trillion market cap milestone. Saudi Aramco, the largest oil producer in the world, briefly had a $2t market cap a while ago but has since lost it. 
* France is suing Apple over allegedly abusive contractual terms imposed on developers and startups that seek to sell their apps on the tech giant's App Store, a spokesperson for the finance ministry's consumer fraud watchdog told Reuters
* **\*\*Please note that current stock price was written premarket and does not reflect intraday changes\*\***
* Carvana (CVNA) target raised by Jefferies Financial from $375 to $400 at Buy. Stock currently around $313
* FedEx (FDX) target raised by Barclays from $360 to $375 at Overweight. Stock currently around $298
* McDonald's (MCD) target raised by Wells Fargo from $262 to $268 at Overweight. Stock currently around $234
* Olin (OLN) target raised by Royal Bank of Canada from $63 to $65 at Outperform. Stock currently around $46
* Microsoft (MSFT) target raised by Wedbush from $310 to $325 at Outperform. Stock currently around $265
* Peloton (PTON) target raised by Telsey Advisory Group from $120 to $135 at Outperform. Stock currently around $117

“""An investment in knowledge pays the best interest.” — Benjamin Franklin"
2021-06-23 20:37:22,stocks,"Thanks again and hope your day has been good one, cheers.👍"
2021-06-23 20:20:10,stocks,"I see Twilio, Roku and Docu taking a small dip. They rose too fast too quickly in the last week, let alone the last month (25%-40%) increase. Pretty big for short time frame. Look for a small pull back a few percent in the next week."
2021-06-23 21:28:06,stocks,"This should have happened in April if not March lol... speculation insisted on doubting Powell's plan that he reiterated over and over and over, and here we are, the ""market"" finally admits it was wrong and we're in another bull year.

Summer of tech and growth."
2021-06-23 23:07:22,stocks,"No, AMC."
2021-06-23 23:55:36,stocks,Wrong Wkhs
2021-06-24 00:00:00,stocks,"AMMO, Inc. Awarded U.S. Department of Defense Contract for the Development and Manufacture of Ballistically Matched Multi-Purpose Rounds Ammo, INC recently acquired Gunbroker, the largest online gun auction site. They now are breaking ground on a new factory in Northern US and now earned a US government contract for sniper ammo.  


Yahoo Finance: [https://finance.yahoo.com/quote/POWW?p=POWW](https://finance.yahoo.com/quote/POWW?p=POWW)  


[https://finance.yahoo.com/news/ammo-inc-awarded-u-department-123000016.html](https://finance.yahoo.com/news/ammo-inc-awarded-u-department-123000016.html)  


I'm extremely bullish on this company with the demand (Also in VSTO and SWBI). I'd like to hear opinions from those that are bearish on this company heading into the next 2 year time-frame.   


AMMO is set to report earnings this Tuesday and have already confirmed their 400% increase in revenue guidance compared to the same quarter last year.  


**Comparison for Fiscal Year End 2021 vs. Fiscal Year End 2020**

[https://finance.yahoo.com/news/ammo-inc-sets-fiscal-2021-123000598.html](https://finance.yahoo.com/news/ammo-inc-sets-fiscal-2021-123000598.html)

* Revenue guidance for the fiscal year 2021 of $62 million – a 319% increase in comparison to the $14.8 million for fiscal year end 2020.

Stock is up over 300% so for in a year.  


Thoughts?"
2021-06-23 20:38:36,stocks,"Bearish argument would be the valuation.
Trading around 10 times price to sales.  They also have poor gross margins <10%.
They could see further margin compression from metal prices.
Maybe some issues with shortages in materials. (Powder etc)
That said they have absolutely sick revenue growth, analysts have 190 mil in 2022.
Tough to put a price target on, definitely high risk high reward."
2021-06-23 22:31:16,stocks,I predict it will hit ~$14-$18 per share by end of the summer.
