Timestamp,Subreddit,Post/Comment
2021-06-07 05:42:51,stocks,"What I realized since last year with the “covid crash”, manipulation is a pivotal role in how the market flows."
2021-06-07 08:10:53,stocks,Gollum’s grandmother should retire soon
2021-06-07 09:54:31,stocks,Interest rates have been in the shitter worldwide for years. It's an indication of underinvestment. Competition for capital would absolutely be a good thing.
2021-06-07 00:57:33,stocks,Printing started with Yellen!!
2021-06-07 00:30:16,stocks,Abolish the federal reserve
2021-06-07 07:51:08,stocks,“Our first freshet secretary with a vagina knows what she’s talking about.” - Jen Psaki
2021-06-07 01:26:31,stocks,"Puppet. If you zoom in, you can see the hand up her ass making her ugly mouth move."
2021-06-06 23:54:53,stocks,"Current politics and what not just make me want to be off somewhere with a little land and nothing to worry about. 

Anyhow, I think this whole “International tax” stuff is nothing more than an attempt to stave off the failure of the global system as it continues to die (system worked, but it’s at the end of its life). More taxes will eventually lead to lack of ability of the people and that will eventually lead to uprisings across the board. What I’m most curious about is when a corporate entity just says screw it and go ATLAS (COD: AW) on the world"
2021-06-07 05:45:42,stocks,It would be. Tapering will be the real “challenge”
2021-06-07 06:15:31,stocks,"Am I crazy or was this mostly reported as ""higher inflation might be positive"", not ""higher interest rate environment might be positive""?"
2021-06-07 06:28:32,stocks,"Again? [https://www.cnbc.com/2021/05/04/treasury-secretary-yellen-says-rates-may-have-to-rise-somewhat-to-keep-economy-from-overheating.html](https://www.cnbc.com/2021/05/04/treasury-secretary-yellen-says-rates-may-have-to-rise-somewhat-to-keep-economy-from-overheating.html)

After that, the FED repeatedly said it will not change policy right now:

[https://www.cnbc.com/2021/05/25/feds-daly-says-the-economy-is-strong-but-its-way-too-early-to-tighten-policy.html](https://www.cnbc.com/2021/05/25/feds-daly-says-the-economy-is-strong-but-its-way-too-early-to-tighten-policy.html)

[https://www.cnbc.com/2021/06/04/jobs-data-improves-but-not-enough-to-get-fed-talking-about-tapering.html](https://www.cnbc.com/2021/06/04/jobs-data-improves-but-not-enough-to-get-fed-talking-about-tapering.html)

Bottom line: No one (should) care."
2021-06-07 09:48:55,stocks,"Welp, there goes the housing bubble"
2021-06-07 12:47:50,stocks,What do you expect? She's the former FED chair. All she's doing is backstopping Powell when he's forced to raise rates later this year. Inflation is not temporary.
2021-06-07 13:41:45,stocks,"they are trying to use words since their ammo is low.  

  
Once they raise and markets seize up they will have to cut"
2021-06-07 17:32:14,stocks,r/picotrades
2021-06-07 17:44:19,stocks,She lies so much.
2021-06-07 19:31:37,stocks,"This is a proactive statement. It's likely not intended to lead directly into higher interest rates. Rather it's a warning for the markets to start pricing it in.

Now that she's started the conversation, the fed will start gradually signaling its intent to raise rates. By the time the rate hike comes it won't be a surprise and won't result in much market movement.

At least that's my assumption of the intent. She wants to avoid a ""taper tantrum"" by easing us into it."
2021-06-07 01:22:50,stocks,#SELL
2021-06-07 08:44:43,stocks,"I’ll allow it.  Any excuse is good enough to liquidate the entire market for another week ESPECIALLY when the GME shareholder meeting is this Wednesday (6/9) and they might then announce the number of votes..

Hint: it exceeds the float of 70M"
2021-06-07 04:02:18,stocks,"There may not be a huge waterfall due to the likelihood of the 40% capital gains tax passing. I believe the tax is being put into the budget reconciliation, and the present proposal makes the tax retroactive.

Idk for sure because I haven't been following the issue closely at all, but if this tax is likely to pass, I think it will prevent a sell off from the market makers."
2021-06-07 02:44:24,stocks,It’s probably a good idea so I can buy the dip too.
2021-06-07 01:37:56,stocks,Yea after she BTFD
2021-06-07 03:08:24,stocks,Lol. I wonder if there's infighting at the Fed about what to do. Looks like the seams are showing sometimes.
2021-06-07 08:38:15,stocks,Every market needs a good FUD dip once in a while.
2021-06-07 11:58:53,stocks,"Sadly true, and the market reacts worse to confusion and mixed messages than one time bad news, so she is really hurting us."
2021-06-07 12:27:49,stocks,Hahaha I love that this is the top comment. We all know it's true.
2021-06-07 03:29:39,stocks,Market doesn't care. Elon musk could tweet that he is waving the wand to lower the interest rates and markets would go up even though Elon musk isn't even in the government. The market has been irrational lately
2021-06-07 01:38:32,stocks,"Biden be like, hold my sleeping pills"
2021-06-07 19:06:39,stocks,"I’m sure the former fed chair and now secretary of treasury isn’t just speaking totally out of her ass.

Maybe slightly out of her ass, but not totally."
2021-06-07 00:37:46,stocks,Yellen is so annoying LOL
2021-06-07 01:27:16,stocks,She likes to comment on things outside her jurisdiction
2021-06-07 03:11:04,stocks,Agreed. But futures don't always mean much.
2021-06-07 04:28:31,stocks,"
London slightly up 0.2% in first 90 minutes so no jitters here."
2021-06-07 05:33:29,stocks,I’m down $57 premarket with this tectonic news and I’m probably just gonna kms
2021-06-07 01:02:49,stocks,"I agree with you that it is a pretty tame comment. And I don't pretend that I know what it will or won't do, but I also thought that her last comment about - possibly, maybe, perhaps-in-the-future-slight-rising-of-rates - was also pretty tame, and all the institutional investors had their panties in a bunch.   


Just wanted to give a heads up to people if it happens again."
2021-06-07 08:18:23,stocks,"Nothing benign about that. Central bank comments are always extremly toned down and have a lot of sub text. The reason being that every comment can freak people out or create hype. That is why analysts dissect everything that central bank heads say to shreds.

Another factor is that inflation expectations drive actual inflation. In fact, current inflation expectation is a variable in calculating future expectations."
2021-06-07 02:18:52,stocks,You think Reddit is up in arms? Wait until you see the market.
2021-06-07 09:26:52,stocks,"""Oh noes! Something normal and common might happen!"""
2021-06-07 03:24:55,stocks,"Memorial Day week is almost always a heavy trade week that goes green. 

Last week, people got excited because job numbers were bad which means stimulus/QE/interest rate support won't be curbed. 

Personally, I think we're seeing short term plays. Lots of money rotating in and out of certain stocks."
2021-06-07 00:10:15,stocks,Spy is over 20% big tech and they should react to the 15% tax news. Spy looking red at open for sure
2021-06-07 00:55:51,stocks,SQQQ for the win
2021-06-07 02:45:28,stocks,ARKK puts
2021-06-07 03:11:29,stocks,Been holding them for a while now.
2021-06-07 03:40:32,stocks,Buy calls on the dip tomorrow and profit when SPY rebounds after she walks back her comment
2021-06-07 07:45:42,stocks,Careful. I think we see ATH on spy this week.
2021-06-07 01:33:17,stocks,"Yes. She says a lot but nobody ever said she was naive. ""Don't worry, I already said it was a good idea to adjust interest rates before I even knew about this, remember?"". Not trying to push anything political and/or anti-Yellen, this is just within the scope of what you expect out of the position. 

We all know that the bill for inflation is *eventually* going to come due. The trick is that nobody knows exactly when. So they try to get out in front of it."
2021-06-07 03:20:42,stocks,"I agree. They know the market had to come down. They just want to bring it down gently. 

Never an easy task."
2021-06-07 04:51:32,stocks,does anybody know if Yellen is single?
2021-06-07 12:01:21,stocks,"Just bought TQQQ for the first time this morning on the small 0.5% dip.  I really don't like leveraged funds or QQQ, but I'm sure this is an overreaction, and I'll be happy with my small gains."
2021-06-07 01:25:26,stocks,Then raise them and let's be fucking done with it. Rip the band-aid off. We can't have near-zero interest rates forever.
2021-06-07 01:07:57,stocks,That was the tariff war with China.
2021-06-07 10:05:32,stocks,The market crashed at the end of 2018 because Little Donny threw a tantrum and shut down the government.
2021-06-07 03:36:42,stocks,"Don't forget ""that's not inflation"" ""it's transitory inflation"" Basically doesn't exist. We're all good."
2021-06-07 03:35:49,stocks,"Yeah. It's hard to predict panic.

We look back on earlier crashes and say it was this or that which was the cause. But the exact date, time and catalyst? You just can't pin point that. 

People panic when they panic."
2021-06-07 07:18:32,stocks,Yellen has zero control over rates. She’s likely just covering her own ass for when this house of cards inevitably crumbles bc she knows rates aren’t going up soon enough. No way Biden let’s Powell crash the markets just first year in office.
2021-06-07 03:25:32,stocks,He does until he doesn't.
2021-06-07 03:34:26,stocks,"I really don't think that's going to sustain. 

Buyers just aren't showing up.

It can only trade sideways for so long. If buyers don't show up, sellers will."
2021-06-07 07:17:02,stocks,Lol the way this market is anymore wouldn’t be surprised to see big green today. The obvious plays never work out
2021-06-07 01:49:09,stocks,This comment right here is why I don’t use Reddit for any smart stock advice lmao “make everyone rich”
2021-06-07 00:29:16,stocks,"Vast majority of Americans aren't significantly invested in the market. So pumping the market cannot ""make everyone rich."" What would help the average American is higher wages, though, but that's not going to play well with the market because investors would rather companies cut costs & increase profit margins, so there is actually a conflict of interest between the market & the average American."
2021-06-07 09:25:02,stocks,Never seen such blatant disregard for economics and reality in a single comment. Bravo.
2021-06-07 03:31:07,stocks,"I paid 43% in taxes last year. I don't make a million.

The issue isn't personal taxes, it's the businesses.

The market has been pumped and people have gotten rich. That was 2020.

Tech/growth goes up 30% in the next six months? 

Not going to happen."
2021-06-07 03:27:51,stocks,No. Now is the time to hedge.
2021-06-07 03:38:28,stocks,Don't forget the off the charts M2 and staggering deficit that has only been this high since WWII.
2021-06-07 02:45:33,stocks,You're allowed to say fuck on the internet.
2021-06-07 01:28:16,stocks,No
2021-06-07 05:27:29,stocks,"Dip???? Wtf….

Almost the entire US market is trash except commodities and maybe the bet on GME."
2021-06-07 03:37:43,stocks,WAKE UP JANET!  Your car is drifting into Jerome’s lane again!  Mind the lines.
2021-06-07 13:22:45,stocks,"The people not currently chairs of the fed are usually hawks, but when they actually are the decision makers, they turn into doves.

Nobody wants to make the hard call and be blamed for fallout when they are running the ship."
2021-06-07 04:00:44,stocks,"""lately"""
2021-06-07 10:01:34,stocks,Welcome to the brave new world.
2021-06-07 01:45:52,stocks,"They must be feeding him with Adderall daily, tbh trump also definitely abused Addy. Is there any US president who doesn't abuse stimulants"
2021-06-07 02:22:20,stocks,[removed]
2021-06-07 01:32:14,stocks,"That’s her problem, she doesn’t think she has a jurisdiction"
2021-06-07 04:18:00,stocks,"Ah, so she's a Redditor. Got it."
2021-06-07 08:32:27,stocks,Are you ok? Please get help if you’re really considering harming yourself.
2021-06-07 01:19:45,stocks,"Your post is good.. the headline and Reddit comments are more annoying. There's no hint in her comments for stagflation or a hawkish fed, yet there's a knee jerk reaction thinking that."
2021-06-07 09:32:30,stocks,"If you look at the 62 year chart of The Fed's interest rate, you'll see the rates have been quite low for a long time. It's not a unheard of thing that they are raised 1/4 of a percent at these lows. It means the economy's doing well enough to provoke inflation fears. 

https://www.macrotrends.net/2015/fed-funds-rate-historical-chart"
2021-06-07 09:32:16,stocks,"What's not benign? This what central banks globally have been saying for a decade+.

Spurring the economy on and if that leads to normalized interest and inflation rates that's a good thing. Always has been."
2021-06-07 00:12:12,stocks,"Inflation numbers come out on the 10th as well, correct? I’d assume those would drastically affect the market."
2021-06-07 04:14:10,stocks,"The 15% tax thing is completely irrelevant. The lowest tax rate of all the countries that have agreed to this is 15%. So instead of ""Industrialized nations have agreed to implement a 15% minimum global tax rate"" you could also say that ""poorer countries should also implement higher rates like us so they can lose their competitive advantage"". Countries with lower rates won't agree to the 15%. This is all talk. Nothing of substance will come out of this."
2021-06-07 03:11:51,stocks,"I see you, SQQQ fam. :)"
2021-06-07 08:42:49,stocks,long dated ARKK puts seem a pretty good strategy anyway tbh
2021-06-07 03:31:03,stocks,2024
2021-06-07 12:49:39,stocks,"Yeah, I was expecting a bigger tech dip today too, so kind of encouraging that tech might have stabilized, but not taking anything for granted...."
2021-06-07 03:22:42,stocks,"The sheer quantity of money out there is staggering. 

And because interest rates are so low and people got government money, the cash isn't being lent out. Banks just sit on it.

The M2 is off the charts but money velocity is bottoming out. 

So all those dollars are sitting in banks, not circulating in the economy doing work."
2021-06-07 01:31:08,stocks,"yeah, I doubt the Biden administration wants shit to hit the fan less than one year in lol"
2021-06-07 03:45:45,stocks,Our monetary policy is the financial version of a stimulant addict who keeps popping adderall to stay up instead of just going to sleep. When we eventually do crash we'll crash hard to recover from all the monetary adderall that is cheap debt just as stimulant addicts crash hard after a binge.
2021-06-07 05:14:55,stocks,"The thing is, if they did that, stock market correction would be the least of the worries. There are ton of companies and individuals over leveraged themselves on low rate. You'd be looking at a straight up recession, if not financial crisis, across the country if they raise it too quickly."
2021-06-07 04:53:02,stocks,Why not?
2021-06-07 01:21:39,stocks,Trade war + Interest Rate fears + Worries of a slowing economy all played a role in causing the crash in late 2018.
2021-06-07 01:20:39,stocks,It was mainly rates but tariff war didnt help
2021-06-07 10:12:10,stocks,"It was the government shutdown.

The tariff war and rate-hawking were ongoing before and after that slide.

Chucklenuts weakened the economy then took away a swathe of its inputs."
2021-06-07 08:47:31,stocks,**commodity prices go brr*
2021-06-07 06:44:53,stocks,"its mega corps that hide in tax havens. the biggest scam of the past 15 years is the whole “tax the rich” scheme, which could’ve been so much more effective as a “tax the mega corporation making billions”"
2021-06-07 01:09:08,stocks,"Agreed, except that most people working are still invested through 401k since the pensions were turned into stock market ""investments"" by Reagan (this isn't meant to be a partisan comment, just a fact). Not to mention how non-transparent many 401k plans are. I work at the university, and I'm literally allowed to see my balance once a year in April; no holdings information, nothing. The fund has been ""working to become more transparent"" for the past five years, but I suppose letting people log into their retirement accounts is too difficult to achieve in 2021... (I hope I don't need to add the obvious -s)"
2021-06-07 01:12:25,stocks,"There is conflict between the average American and the cost of everything.

The average American or any citizen anywhere enjoys cost cutting when it’s reflected in the price of goods and services.  It’s a perpetual cycle.

Sure the minimum wage can be 50%-100% higher, but expect to pay more for everything.

Food and produce is a big example of this.  I don’t think anyone ever complains about cheap food costs.  Like how the fuck do they get bananas across the planet, 100s or 1000s of miles, into stores for like 50 cents per lb?

Most can work 1-2 hours for $20, and look at the shit you can buy with $20.  

Lower costs and the engine of capitalism is why the average life today is soooo much more enjoyable then 100+ years ago."
2021-06-07 02:14:07,stocks,"That ""the vast majority of Americans"" don't hold stock directly is their own fault.  

But it's wrong to say those Americans have no stake in the market.  The US stock market attracts trillions of dollars of investment money from all over the world, which indirectly employees everything from first responders in NYC to programmers, brokers, analysts  account managers and data managers in Seattle, SF, Austin, Boston and probably even Boise; the janitors who clean up after them; the agricultural workers who pick the fruit they eat; the resort workers who maintain their vacation spots and the sex workers who cater to their ""needs"".  

The market is a powerful force for everyone's benefit."
2021-06-07 04:02:14,stocks,">I paid 43% in taxes last year.

Effective?? Not that i dont believe you, but because im curious...how? . Mind sharing the numbers?"
2021-06-07 03:36:57,stocks,"Ahahaha.

Am I allowed too?

Are you the internet ""fuck officer""?"
2021-06-07 04:13:20,stocks,But I don’t like to swear in front of you kid!
2021-06-07 01:52:44,stocks,Ok glad you enjoy bailing out banks.
2021-06-07 03:47:07,stocks,"Why not?

Central banks always end up being used to inflate away deficits and artificially pump credit bubbles. It's just some whack ass market manipulation on the grandest scale because nobody ever wants to be the guy that says we actually have to pay up.

It's an immoral way to tax and bad way to get capital and credit where it actually should be."
2021-06-07 08:26:20,stocks,"Exactly! Also, Tesla is one of the ONLY fairly valued companies!"
2021-06-07 05:34:45,stocks,Facts
2021-06-07 06:06:41,stocks,This. She just can't stop reliving the good old days.
2021-06-07 04:33:17,stocks,"Yeah, I noticed ""forever"" was misspelled too."
2021-06-07 05:20:49,stocks,Good one :)
2021-06-07 05:39:33,stocks,"Yeah, I mean have you just *seen* all the tweets he sends out at 3 AM? /s"
2021-06-07 02:35:12,stocks,"Why the downvotes? Hitler invented meth and was off his chops massively. I'm sure if a pleb like me can get my hands on Aderrall then the us president can and would

Edit: Hitler did not invent meth but he was a user"
2021-06-07 07:12:58,stocks,"I've never heard her speak, but when I see photos of her I get strong Kathy Geiss from 30 Rock vibes."
2021-06-07 05:32:45,stocks,She looks like a bird to me. That's her spirit animal.
2021-06-07 01:41:29,stocks,Yeah I solely listen the Pow
2021-06-07 08:35:33,stocks,I’m up $17.59 now 😎 looks like I can live to see another day
2021-06-07 12:20:58,stocks,"I think you mean “provoke inflation”. We’ve had 4 of episodes inflation fears since 2008, but each time it has gone nowhere. Economy looks like shit from where I’m sitting, so TLT calls it is."
2021-06-07 09:48:07,stocks,"What she says is benign stand a lone. In the context of where CB policy is at the moment it is not.

J-Pow tirelessly states that the Fed does not even think about tapering. Now the ex Fed head and Treasury secretary starts talking about the benefits of higher interest rates. This ambiguity could spook some market participants."
2021-06-07 00:30:45,stocks,And they will probably be slightly worse than expected. We may be looking at a bit of pain in June.
2021-06-07 03:16:20,stocks,"They may, they may not.

Basically, it comes down to if inflation is ""transitory"" or not.

Actually, it comes down to whether people believe them when they say that.

The whole, ""everything is fine, nothing to see here"" even  though the M2, defecit to GDP, stock market's P/E, stock markets price vs. GDP are all off the charts isn't aging well.

Jobs aren't bouncing back like they should. People are overestimating the reopenings effects (were not all going to buy a new car, take five vacations and have 1200 haircuts).

And there's a good case for massive deflation too. Which is just as bad as inflation for equities."
2021-06-07 07:55:17,stocks,"America doesn't give a fuck if Apple tries to shift its tax obligation to a small country after they pass a law to tax Apple on sales made in the US as if they were incorporated here properly regardless of their ""IP"" scams. 

All of these ""tax laws will do nothing"" always forget the second part of the tax law change. It was more than just a 15% floor, it was a recalculation of tax obligation based on location-of-sale instead of where the intellectual property was being billed.

EDIT: I haven't reviewed the G7 proposals personally in depth but the coverage includes statements like: 

>Agreed on Saturday, finance ministers from G7 economies pledged to enforce a minimum global corporation tax rate of at least 15%, reports Reuters. At the same time, measures will be put in place to make sure that taxes are appropriately paid in the countries where the firms operate."
2021-06-07 10:02:29,stocks,"Poorer countries have an in-built advantage in lower labor rates. The governments of those countries shouldn't also be forced to compete on tax rates to get the jobs, thereby making being a poorer nation a locked-in condition."
2021-06-07 08:46:27,stocks,"imo there are two options. Higher rates would reduce inflation and reduce money supply, etc. Fairly standard


Negative rates where the FED just burn the money coming in (or pay it back to the Treasury as dividends maybe) would reduce money supply as well while possibly causing the big bang in terms of consumption and investment that they're hoping for as lockdown eases."
2021-06-07 03:32:26,stocks,Infra bills
2021-06-07 18:05:06,stocks,Shows how bad Biden is that we don't know where to put our money in.  I just gave up and bought IVOL and VTIP.
2021-06-07 02:03:48,stocks,"Nobody in office wants that, that's why they just keep kicking the can down the road. Who wants to be labeled as the person who crashed the economy."
2021-06-07 07:50:06,stocks,"It's better for them that it happens now instead of risking it happen unexpectedly during the next election season. 

At least the administration can try to get ahead of it, or at least downplay the effects."
2021-06-07 09:36:53,stocks,"Yes, the economy Paul Volcker had when he ratcheted rates up to 20% is very different from our present situation. The government’s cost to service the debt would be astronomical, even at rates which would still be historically low. Then you have to factor in other parts of the economy like you mentioned and it’s clear this would be a very major depression at the least."
2021-06-07 02:05:13,stocks,"The reason pensions were eliminated pretty much everywhere is that gov entities and companies were promising \*far\* more than the could reasonably deliver.

Who holds your retirement account?  TIAA CREF?  :)  That's what you get in education: massive bureaucracy in relentless pursuit of more days off."
2021-06-07 02:44:32,stocks,Wages don't make up 100% of the cost of products so a 50% raise in wages would not result in a 50% raise in the cost of everything unless companies are being extra greedy fucks and jacking up prices to match wage increases while increasing their profit margins and blaming it on wages going up.
2021-06-07 02:06:24,stocks,"Bananas are loss leaders for grocery stores. Sure prices will go up if the minimum wage does, but that doesn't mean a 50% increase in wages will cause a 50% increase in total cost. 40% of Americans cannot even afford a $400 emergency, the wealth disparity is unsustainable. The American Dream is more alive in Norway, where people have better socio-economic mobility than the US."
2021-06-07 03:36:59,stocks,"What about the people working for 7.25 an hour that’s 58 dollars a day before taxes, that’s like 40 dollars a day, that means you make around 800 dollars a month, what in the world can you get for 800 a month. You can’t rent an apartment, you can’t afford a car. But yea atleast you can get a lb of bananas for 50 cents. Your absolutely right everything’s fine. Thank god for bananas am I right. Next time I see someone working there life away for absolutely nothing I’ll be sure to tell him about the bananas. You work 40 hours a week moping floors and cleaning up after people well that sucks, but quit complaining bananas are only 50 cents. You can buy 1600 lbs of bananas for your monthly salary what else do you want"
2021-06-07 08:43:42,stocks,"bro, a good portion of the united states is so poor that even suggesting this is a joke."
2021-06-07 06:38:20,stocks,I think I could see myself as the officer of fucks. Whether it's giving fucks or authorizing them.
2021-06-07 06:37:43,stocks,I'm 30.
2021-06-07 08:50:56,stocks,Btw: Tesla Puts are actually smart if you want to invest in GME without taking too much risk. If GME goes down you maybe lose 10-20%.
