Timestamp,Subreddit,Post/Comment
7/1/2021 19:20,stocks,"Welcome to r/stocks!

For beginner advice, brokerage info, book recommendations, even advanced topics and more, please read our [Wiki here.](https://www.reddit.com/r/stocks/wiki/index)

If you're wondering **why a stock moved** a certain way, check out [Finviz](https://finviz.com/quote.ashx?t=spy) which aggregates the most news for almost every stock, but also see [Reuters](https://www.reuters.com/), and even [Yahoo Finance](https://finance.yahoo.com/).

Please direct all simple questions towards the stickied Daily Discussion and Quarterly Rate My Portfolio threads (sort by Hot, they're at the top).

Also include *some* [due diligence](https://www.investopedia.com/terms/d/duediligence.asp) to this post or it may be removed if it's low effort.

*I am a bot, and this action was performed automatically. Please [contact the moderators of this subreddit](/message/compose/?to=/r/stocks) if you have any questions or concerns.*"
7/1/2021 19:33,stocks,"Don't touch it, even with a ten foot pole."
7/1/2021 19:52,stocks,In the wise words of my old roommate. If you buy that stock you're f*****g that chicken I'm just watching the feathers fly.
7/1/2021 19:41,stocks,"It's worth the investment. If we can pull them away from the clutches of Citadel, thats a win for everyone. The only problem is RH's PR is pretty badly damaged. They're going to forever be known as the GameStop killer. If they take action to repairing that damage, I can see people forgetting about it and using the app again."
7/1/2021 19:47,stocks,You think them getting more money is what will convince them to be ethical?!
7/1/2021 19:50,stocks,Maybe. Maybe not. Businesses do business things. Going public will at least help keep a light on their practices.
7/1/2021 19:28,stocks,Perfect post. D NUT BUY! I am impressed with the brazen bag passing by JAB.
7/1/2021 19:54,stocks,"Okay but if KK offers every shareholder a free donut and announces an offering the day after, I’m in."
7/1/2021 19:33,stocks,"Wouldn't be surprised to see it  goes to 100$, wicked irrational market."
7/1/2021 19:40,stocks,"My grandpa was an early investor in them and made out nice, probably around 20-25 years ago. I read up on them not too long ago because I was curious why they weren’t public anymore, and it was basically because they tried to expand too quickly and it ruined the company arch. By selling their donuts in grocery stores it became less of a novelty and it’s kind of just a good brand with not too much upside now. Had no clue they had an IPO til just now lol, but yeah don’t buy with any high hopes."
7/1/2021 19:45,stocks,I remember these Jokes and scandals.. $10 would be too high in my estimates.. I am waiting for Petsmart and Panera to go public again
7/1/2021 19:26,stocks,But but donuts…
7/1/2021 19:21,stocks,Read my mind. $10 to generous. A garbage company of deep fried bread frauds. Chart blows my mind...
7/1/2021 19:19,stocks,"I don’t know, every time I pass by Krispy Kreme the line goes around the parking lot."
7/1/2021 19:42,stocks,"They need to come out with some new products and expand their menu. Adding food coloring and calling it a seasonal donut is not a new product.

Breakfast sandwiches, sausage & cheese kolache... jesus how about even a basic classic baked cinnamon roll (not their cinnamon donut).

Sticking to ""the classics"" only works when your product doesn't accelerate diabetes in your clients."
7/1/2021 19:40,stocks,I never understood the hype behind Krispy Kreme
7/1/2021 19:39,stocks,I’d rather buy $DEEZ
7/1/2021 19:48,stocks,Unfortunately i was waiting Capital to list it on UK market cause it was easy 17 to 22 price range money.. and later just wait for the opening for short... i know the donut doesn’t worth even $5 but hey we are here to make money... unfortunately Capital screw up again... they listed Chinese truck ipo but not donuts 😀
7/1/2021 19:50,stocks,Not to mention all the people that are still working from home not buying donuts heading into the office.
7/1/2021 19:32,stocks,Just waiting for their morning veggie and CBD donut to rope in all the malnourished millennials and zoomers.  Maybe they can even make it transgender to drive all the cops away.
7/1/2021 19:58,stocks,"I saw the topic and was like, wasn't Krispy Kreme public at one time.."
7/1/2021 19:33,stocks,Their donuts are trash.
7/1/2021 19:25,stocks,How come I can't buy puts on them? Anyone have issues with this?
7/1/2021 19:59,stocks,It’s not a legit investment it’s a meme stock..I bought in today for fun and I am selling at my target
7/1/2021 19:53,stocks,"Or, you wait until they IPO, let the stock tank if that's what you think is going to happen and then you purchase the discounted shares because the reason a legacy company would IPO is because they want to raise capital - why do they want to raise capital? Maybe they have, you know, some kind of business plan that they need some cash for. Maybe the plan will prove to be genius. That's stocks."
7/1/2021 19:44,stocks,"$dnut as ticker

They know what they're doing. I wanna short but no entry point feels safe."
7/1/2021 19:23,stocks,Sales/customers DOES NOT equal value/profitability…that’s a juvenile investors mistake
7/1/2021 19:38,stocks,"Mine has like 2 or 3 cars parked in front, but is never real busy."
7/1/2021 19:52,stocks,I’m allergic to $NUTZ
7/1/2021 19:59,stocks,"Oh, you have a lot to learn new guy"
7/1/2021 19:43,stocks,Ig not available for a week
7/1/2021 19:47,stocks,$DNUT? More like $DONT amiright??
7/1/2021 19:40,stocks,But it helps… if you have plenty of demand for your product you can lower your margins and still be profitable while killing the competition
7/1/2021 19:50,stocks,You can only lower margins if you have them in the first place.
7/1/2021 19:41,stocks,"That only works if you’re a prudent and fiscally responsible businessman, you could have all the sales in the world and still be broke if you can’t manage your finances. Same as you could have barely any sales but post record profits if your spending is under control."
7/1/2021 19:49,stocks,Sales are more important than cost control. With good sales you can always get financing and figure out how to control cost later. Just look at how Amazon rose to the top after loosing money for 20 years
7/1/2021 19:58,stocks,"Only if its going to become cheaper at scale.

How do donuts become anymore cheaper?"
7/1/2021 18:20,stocks,"It's a single trade of 174 volume that settled at 58.63.

The last trades before that are all 60.91 at over 10k total volume."
7/1/2021 18:00,stocks,Step 1: Reconsider.
7/1/2021 17:43,stocks,Try this question in r/DayTrading
7/1/2021 17:55,stocks,"Learning to read pre-market moves and volume increases is probably one of the more important things about day trading to learn. The thing about your post is that you said “daily swings of $1-$3.” $1-$3 can be a 20% move for one stock and .5% for another. And you said “swing” obviously knowing it goes both ways. Reliably earning X amount daily in trading is impossibly difficult. To successfully day trade you have to be extremely patient, extremely selective, extremely strict on your bankroll, and extremely ungreedy. Once you master that, you’ll win more than you lose. Before even attempting to day trade I would recommend taking months and years to work on swing trading. If you really want some passive income and have a decent bankroll - selling covered calls is a great start (you really only stand to lose possible gains and realized gain taxes)."
7/1/2021 17:55,stocks,"The larger your account is, the easier it will be to make a profit. If you have $1,000, you’d need 20% gains every day. $10,000? You’d need 2% gains every day. Also yes try the r/DayTrading mentioned below.

Edit: these figures are based on the $200 a day target."
7/1/2021 19:15,stocks,"Unless your connected, or have great awareness/ability to track the markets your gonna lose"
7/1/2021 19:08,stocks,Step 2: Don't.
7/1/2021 17:51,stocks,thanks!
7/1/2021 17:24,stocks,Don't look at it
7/1/2021 17:25,stocks,"It comes with time, you get used to red days.  If your money is in quality companies and ETFs...it will grow.  Just not every day, unfortunately."
7/1/2021 17:45,stocks,"Most people are telling you to ignore short-term volatility, and I think they’re generally right. 

However, if you’re concerned about your losses so far you may want to reassess your investing strategy. Do you have a process for screening stocks and diving deep into the ones you’re interested in? Do you have a fair grasp on a company’s financial statements and can identify trends in their revenue, profit, free cash flow, shares outstanding,  etc.? Do you have a qualitative sense on the future plans of the company and how they’re executing that over the next few years? 

These are the kind of questions to ask and the subject matter you should be researching before investing in a stock. I’m not saying you have or haven’t done these things, but short term losses early in your investing career can be an opportunity to grow and learn more about the stock market. 

As you continue to develop and fine tune your process over time, I think you’ll grow more confident in your portfolio and be willing to endure the short term rumblings of the market."
7/1/2021 17:28,stocks,"You sound young and even if you’re not, you have many cycles ahead of you. Over the long haul, stocks will outperform all other asset classes more than likely. Trying to time the market is very tough. Try picking back to back exactas at the track. Pick good solid stuff and ride it out. Don’t get to euphoric when it’s high or despondent when it’s low."
7/1/2021 18:04,stocks,IMHO the secret to profit in the stock market is the iron stomach.
7/1/2021 17:46,stocks,Zoom out.. don't look. Think it will come back up eventually! I hope..or else we have bigger problems.
7/1/2021 18:42,stocks,"gets easier with time. after what i went thru past 5 yrs in investing, mild sell offs here and there dont bother me one bit. 

huge sell off end of 2018, then another one in 2019, then the covid crash in 2020, and we just had another monster tech sell off last month due to that ""inflation scare""

losers are those that sell low and buy back the same damn thing much higher just few months after."
7/1/2021 18:47,stocks,"Invest in stocks or better still funds, walk away, leave it and check in 6 months later.

Dont buy shit meme stocks, buy good companies you know of and believe in."
7/1/2021 17:39,stocks,Buy on the red days
7/1/2021 17:45,stocks,"Focus on other things in your life, and just keep adding to your positions. If after a couple years, it's not looking good then make it whatever changes you need."
7/1/2021 17:48,stocks,"I started trading back in December and I haven’t sold one stock since I purchased them. I think it’s two main reasons - you only invest in companies you believe and that has good potential and you only invest money you are willing to lose. 

Even if you get only get a profit of $100 be happy. Don’t get greedy too quickly. If you can sell 10 stocks for a $100 profit each you have $1000. That is a small sum to begin with but just stick to it and slowly the more money you make, the more you invest and the more your profits grow."
7/1/2021 18:03,stocks,"You need to distant yourself from your invested money. Cannot be looking at it like it’s your pocket money. Unless it is your pocket money.. then Don’t invest it. 
( I don’t know if pocket money is the right term here,  or English native. You probably get my point anyway)."
7/1/2021 17:45,stocks,"I asked the same thing a few weeks ago and people here were super nice giving their advice. And to be honest I’ve been down on most of my positions for some time, but this week I’m already green on total gains on most of them.

My best take out - don’t check your portfolio at all. If you want to understand how the market is doing in general - check main indexes - Dow, Nasdaq and sp500 at the opening and after market is closed, so you can understand the general perspective without the need to check your own portfolio. Come back in 1-1.5 months to Check your account and you will be pleasantly surprised:))"
7/1/2021 18:04,stocks,Go outside
7/1/2021 18:07,stocks,Pull out on the chart.
7/1/2021 18:08,stocks,I just learned not to look at my stocks . It’s better for my mental health :)
7/1/2021 18:08,stocks,"If you're investing long term, you can't look at it every day. Invest the same ant each month so you average cost. Reinvest dividends. 
It takes years to build a great portfolio."
7/1/2021 18:16,stocks,When you have been investing for a while you eventually disassociate from your day to day portfolio performance. If you can’t stomach a red day here or there you are over-leveraged.
7/1/2021 18:20,stocks,Just think of red days as opportunities to buy more
7/1/2021 18:29,stocks,"I'll tell you right now, unless you are thinking about adding more to your portfolio or are involved with daytrading, constantly looking at how the market is doing specifically with your own stocks is unhealthy. You don't want to be reactionary. Your due diligence should have been done before you purchased any stocks you currently own. You should use another app to check stock info rather than the app you use to purchase stocks with."
7/1/2021 18:50,stocks,"I’m emotionless in general so, that helps."
7/1/2021 18:56,stocks,I get red days when the market goes up and huge gains when it goes down. Bought nearly everything at bottom don’t really understand it
7/1/2021 19:18,stocks,The consensus is earnings are going to rise significantly over the next year. Coupled with no rate hikes and low treasury rates; staying long is the move at the moment. Sure you will have setbacks but that’s just another chance to buy
7/1/2021 19:30,stocks,How diversified is your portfolio?  Down days usually hurt less if your holdings are diversified.
7/1/2021 19:48,stocks,Buy more cuz you’re getting a discount. Hold until your profit margin comes up and win. I’m not a financial advisor
7/1/2021 17:30,stocks,"Look at the S&P 500 chart over 1 month, 1 year, 5 years, all time. Always since it’s inception steady growth up. Even the “crashes” due to pandemic and financial crisis are just a tiny blip. When your stocks are down bleeding in the gutter, scroll out. 

If you can’t then don’t look"
7/1/2021 17:31,stocks,"“Unless you can watch your stock holding decline by 50% without becoming panic- stricken, you should not be in the stock market.” -Warren Buffet"
7/1/2021 17:49,stocks,do you expect everyday to be a green day?
7/1/2021 17:56,stocks,"This is a long haul. 
If you're worried about losing that money, maybe you're not at a financial position to consider investing.
Put it in a savings account if you want to feel ""comfortable""."
7/1/2021 18:42,stocks,"If you can't stomach the down days, you are either wrong about your risk tolerance or you didn't properly understand the risk involved when you entered your position. Do your homework about what you hold. 

""Down"" is always a possible direction. You have to decide before you enter how far down is possible, how far you're willing to tolerate, and how long you're willing to wait before it comes back up. 

More homework is to know more about the direction of the company. For my major YOLO plays, I'm not at all concerned about a day's red movement. As long as no news materially impacts the direction or performance of the company, then deep red days are buying opportunities. 

* One of my positions was red by $over $8K a few weeks ago. I kept following them and didn't see any valid reason why it was down, so I kept buying. I don't expect its significant movement to begin for another couple months, and it should take more than a year. (It's back up to almost even now.) 
* Another of my positions doesn't allow for that. It's a play I'm in because I expect earnings at the end of the month, combined with the outlook for the rest of the year, to move the stock upward by mid- to late-August. If this ever reaches any more than 5 or 7 percent below where I've bought, then I can only assume I missed something or the market has fundamentally changed its valuation of the company and it's time to get out. 

In both of these cases, red days with no news don't bother me in the least, because I have a firm understanding of my timeline and my tolerance for fluctuation in the meantime."
7/1/2021 17:31,stocks,Only invest with money you don’t necessarily need.
7/1/2021 17:32,stocks,Buy the dip
7/1/2021 17:25,stocks,If u cant handle volatility dont look
7/1/2021 17:32,stocks,Vomit a few times and the anxiety eventually goes away you get harder as a person
7/1/2021 17:30,stocks,Sell your whole portfolio and buy a hooker
7/1/2021 17:25,stocks,sell at a loss
7/1/2021 17:54,stocks,"No, but I don’t expect to take hard losses in such a short period on decently stable investments"
7/1/2021 17:45,stocks,Don’t you technically rent a hooker? Or you a pimp?
7/1/2021 18:26,stocks,and what positions are we talking about?
7/1/2021 18:39,stocks,"Technically, I'd say you contract a hooker."
7/1/2021 17:42,stocks,"Welcome to r/stocks!

For stock recommendations please see our portfolio sticky, sort by hot, it's the first sticky, or see [past portfolio stickies here.](https://www.reddit.com/r/stocks/search?q=author%3Aautomoderator+%22Rate+My+Portfolio%22+-+r%2FStocks+Quarterly+Thread&restrict_sr=on&include_over_18=on&sort=new&t=all)

For beginner advice, brokerage info, book recommendations, even advanced topics and more, please read our [Wiki here.](https://www.reddit.com/r/stocks/wiki/index)

If you're wondering **why a stock moved** a certain way, check out [Finviz](https://finviz.com/quote.ashx?t=spy) which aggregates the most news for almost every stock, but also see [Reuters](https://www.reuters.com/), and even [Yahoo Finance](https://finance.yahoo.com/).

Also include *some* [due diligence](https://www.investopedia.com/terms/d/duediligence.asp) to this post or it may be removed if it's low effort.

*I am a bot, and this action was performed automatically. Please [contact the moderators of this subreddit](/message/compose/?to=/r/stocks) if you have any questions or concerns.*"
7/1/2021 18:32,stocks,"Honestly not promoting fidelity, but only bc I use them I can say they have a recommendation rating of those firms tracking how accurate they are.  So they give you the firm's recommendation and then a grade on how accurate they've been plus a report on the equity if it's available that's supposedly an objective data driven document.  Certainly not perfect or infallible but decent for sure."
7/1/2021 17:37,stocks,">It's easy for dishonest firms to buy a position and later go on news shows, like CNBC and Cramer, to tell people they should be buying the stock, too.

I avoid IPOs like the plague. if it's a good company, it'll still be a good investment in a year. if it's a bad company, that'll be exposed in a year. 

as for analysts, to quote from *Big Money Thinks Small* (2017), by Joel Tillinghast (manager of FLPSX at Fidelity)

>By shutting out refuting evidence, we become vulnerable to overoptimism that our chosen stocks will flourish. Wall Street encourages this tendency because anyone can buy a stock, while only owners can sell. Buy recom- mendations far outnumber sells. For estimates of a company’s earnings more than a year out and long-term growth rates, reality chronically falls short. **Declining earnings are rarely forecast but often occur.** This does not apply to predictions of the next two quarters, which, if anything, are slightly low. **Companies and analysts tacitly collude to create quarterly “upside surprises.”** (p. 21)"
7/1/2021 19:40,stocks,"Or the opposite, low pt while they have a short position."
7/1/2021 19:54,stocks,"Don't trust anyone, not even yourself.




Honestly, no one is out to make you rich, no one. The only way you'll ever get an investment tip is of someone already bought and hopes to push the price up. Investment analysts, journals, stock pickers, influencers, redditors...none of them are ever working *for you*."
7/1/2021 18:12,stocks,"For price targets, try to find the DCF models analysts use to get their price target. See if their numbers (discount rate, multiples, growth projections, etc.) are sensible and match up with how you view the company."
7/1/2021 18:59,stocks,Isn't this the purpose of analyst ratings? They typically only cover what their firm owns
7/1/2021 17:46,stocks,"The clip was regarding IPO's, but I think people should think critically about analyst recommendations on any type of investment. Price targets and outlooks are usually very valuable and confidential for investment firms, so you should be asking yourself why they're giving this information out for free."
7/1/2021 18:48,stocks,"Remember, Sears ""could never go out of business."" ETFs protect against that.

 If you want to do the research and maintenance that a portfolio of specific holdings would require, go for it. There's nothing wrong with that. When you're invested in an ETF even if the biggest holding takes a shit, that only represents about 4-5% of the position, so you're safe, unless the whole market shits the bed."
7/1/2021 17:19,stocks,Just buy the etf and let someone else do the work figuring out the top 10.
7/1/2021 19:23,stocks,"It’s harder than it was a year ago to beat the S&P, but the opportunity is always out there. It all depends how tuned in are you. Are you watching most markets majority of the day or are you busy at work. Point being if you don’t have the time to do research everyday buy an index fund, or buy the high growth companies you believe in."
7/1/2021 18:04,stocks,"I agree with your premise, OP. 

Buffet recommends picking roughly 7 companies that are phenomenal businesses, giving you the best probability of outperforming the market. Microsoft, Apple, Google, Amazon, and Facebook fit this description.

It’s just a matter of having the proper industry knowledge so you know where the industry is going and if these companies will have a relevant, growing position in society moving forward. 

If you know what you’re doing you don’t need to diversify. Diversification is protection against ignorance which is why it’s recommended most people index invest since they won’t put the work in."
7/1/2021 17:49,stocks,"Let’s say MSFT ends up in the middle of aggressive antitrust enforcement, a viable thing that could happen soon. What do you think will happen to the stock? If China decided that it didn’t like apples manufacturing facilities, not a whole lot better.

Not saying these things will happen but if you concentrate in the biggest market caps and something bad happens, you’ll take a huge bath. Whereas if you have a good deal of these but also diversify more then one crisis hurts less.

Also this portfolio will outperform ETFs in the short run now because tech stocks seem valued very high even compared to a lot of other stocks now. That could change at some point."
7/1/2021 17:09,stocks,"Go look at the top ten companies 10, 20, 30 years ago and see where they’re at today. In order to outperform the index, you’re suggesting that these companies will continue to outperform over the long term. MSFT, AAPL, FB, GOOGL, V market caps are already at mega levels and it’s a big assumption that they will continue to get bigger. While I do think they will continue to grow in the short/mid-term, I’d be cautious on just owning the top ten."
7/1/2021 17:12,stocks,"Convenience. Rebalancing a diversified portfolio is a monumental pain in the ass.

Also, smoothing. You limit upside potential but also downside."
7/1/2021 17:26,stocks,"well i mean you get a good like 20-25% weighting of FAANGs just buying SPY/equivalent, you get a lot of exposure to tech already.

> but these companies are at low risk of failure to begin with

historically speaking you are wrong. many of the too big to fail companies in the past decades... well, failed. 

perhaps the landscape has changed and the current big tech will remain but thats a bit of a gamble. tech has had an absolutely nutty decade but will it continue?

buying spy/qqq/whole market is easy, reliable, has a strong history of long term performance."
7/1/2021 19:42,stocks,Almost. - add to that a filter for companies that have a higher than average growth projections and the answer is yes.
7/1/2021 19:32,stocks,"I mean if you can pick them... 
Main reason I'm not ALL in on spy is that I think there are overvalued companies, and don't want to own them. For example, I dont like that nvidia would make up like 1% of spy.
But if ur just gonna close ur eyes and pick faang then come back 10 years later itd prolly be better to index, giants can always fall"
7/1/2021 18:57,stocks,"to quote from a podcast interview with Rob Arnott: 

>At the very top of the list, we did a paper called ""Top Dogs"" that looked at the largest market capitalization stocks in each sector, in each country, and the worldwide top dog, which today is Microsoft. What we found is that the top dog in any sector--and this is a global phenomenon; we tested it in eight developed economies around the world--the number-one stock in each sector on average underperforms by 5% per year compounded over the next 10 years relative to its own sector.

https://www.morningstar.com/articles/943058/rob-arnott-dont-sleep-on-value-investing-especially-emerging-markets-value"
