Timestamp,Subreddit,Post/Comment
2021-05-04 00:00:00,stocks,the most disappointing stocks $AAPL $COIN $TAN were told to be the most promising stocks and have cost me so much. I’m down about 1k from all of them. Should i cut my losses and sell what i have left or try and hold for the long term?
2021-05-04 09:54:58,stocks,Are you 12?
2021-05-04 09:49:18,stocks,Aapl is only up 12% 6Months and 70s% 1 year. So disappointing man. Why does it not keep going up forever like it did in 2020? /s
2021-05-04 10:01:57,stocks,"> and have cost me so much   

 - COIN: +11% YoY    
 - AAPL: +77.75% YoY    
 - TAN: +167.46% YoY   

Those are all wildly successful companies. You're losing your shit over some sideways movement after ATH for three~ months."
2021-05-04 09:52:12,stocks,You have no business being in stocks if this is how you feel.
2021-05-04 09:46:18,stocks,It’s a down day today on a lot of stocks. You’re already down 1k what’s a little more? Wait for a better day if you have to take losses
2021-05-04 09:50:51,stocks,Apple is undoubtedly a long term hold. Not sure about coin but I would sell TAN. TAN along with QCLN+PBW will take 6 months to over a year to get back where they were before the slight correction.
2021-05-04 09:59:53,stocks,$AAPL = the most disappointing stock even tho it consistently outperforms the S&P. okay got it.
2021-05-04 09:53:11,stocks,Did you buy into apple at ath?
2021-05-04 09:56:04,stocks,It is not a loss until you sell.
2021-05-04 09:59:34,stocks,Mosts watchlists are a bloody mess this morning. Don’t be discouraged. We in this man. Welcome to the market.
2021-05-04 09:59:47,stocks,Same i'm already down $1k
2021-05-04 10:00:07,stocks,"It's not just them.......everything I've purchased in the last 3 months has steadily gone down.  It seems to drop like 5%, 3%, 2% slowly walks down hurts quite a bit then slow walks up for a bit to kind of make you think okay maybe we're going back and then drops even further.  Then does it all over again.  It's just been a slowly depleting hole in my portfolio in several sectors (oil/energy, reopening trades, tech and growth, cyclical, even defensive stocks).  The market as a whole is going up but I can't seem to find a single stock that is actually making gains it seems."
2021-05-04 10:00:34,stocks,"Hold the Apple. Not sure about the other two, but Apple? C'mon now."
2021-05-04 10:02:38,stocks,asking during a red day... 😅
2021-05-04 10:04:51,stocks,You happened to buy during the all time high's of the entire US market.  We may be entering the start of a bear market.  If you were not planning on holding you need to re think your strategies before you decide to buy.
2021-05-04 10:28:31,stocks,People like you really tempt me to unfollow r/stocks
2021-05-04 10:16:24,stocks,This is the worst piece of advice I keep seeing posted on Reddit.
2021-05-04 10:41:46,stocks,In a bear market you sell everything and buy puts on Doordash
2021-05-04 10:24:30,stocks,The advice is from people who started trading in January because of Gamestop. Same with the HODL bullshit
2021-05-04 00:00:00,stocks,"DD: $ASO - Lawyers, Guns, and Money If you have not heard the song *Lawyers, Guns, and Money* by Warren Zevon then you're not missing much, but it does loosely tie into my analysis of **Academy Sports + Outdoors**.

**Intro:** There's a chance you haven't heard of Academy Sports if you're not from the Southern United States- and that's ok. The business is simple, Academy Sports operates as a sporting goods and outdoor recreational products retailer, similarly to Dick's Sporting Goods, Bass Pro Shops, Cabela's, and Sportsman's Warehouse. In terms of business model, there's not much more to it than that, except for 1 key difference compared to Dick's and some other competitors; **Academy Sports sells guns and ammunition**. I'll be using some comparisons to these company's in the analysis below. 

**Notes:**

1. The reason I'm putting this write-up together today is because of recent action on behalf of the major shareholders. I will go more into detail on that below.
2. ASO was intially publicly offered at the beginning of October 2020. I typically stay away from IPOs in general, but took a look at the company and decided to do a deeper dive. 

**Metrics:** 

1. **ROIC**, as of today, is 12.48%. This has improved year over year since 2019(the company was private before this so financial statements only go back so far) and doubled from 2020 to 2021. While Sportsman's Warehouse has had double digit ROIC over the last few years as well, it's more sporadic and up or down with some negative returns mixed in quarterly as well. Dick's is the steadier of the 2 comparisons maintaining that ~10% ROIC over the last few years(GuruFocus).
2. **D/E ratio** is currently at about .71. The good news, however, is that because ASO exists largely in the Southern United States, they did not bleed as much during the Lockdown Era. Depending upon the state, stores were kept open and selling while competitors had to close their doors and take on more leverage to survive. This is reflected further in ASO's financial statements showing that virtually all of their existing debt is long term. Their current cash position outweighs their short term debt substantially. (Side note, their cash position has been *at least doubling* every year for the last 3 years.)
3. **P/E & PEG** ratios are 8.91 and .21, respectively. The PEG ratio is based on Finviz's EPS Next 5 years expectations, but since I'm a fan of extrapolating out a shorter amount of time from the most recent data as possible, a safer PEG ratio to assume is 8.91/11.05(Next year's EPS growth expectations), which would be .80 instead. Again, this is the *low end* EPS growth expectations for ASO. Admittedly, the previous year was a great boon for outdoor and sporting goods retailers, so instead, if you'd like to take a larger sample size of the last 5 years EPS growth it would be 8.91/32.7, or .27 PEG ratio. For a quick comparison, Dick's expected EPS for next year is an 8% growth and with a P/E of 15.77, that yields a PEG ratio of 1.9. But I didn't need to calculate that to tell you that Dick's is largely done expanding and growing. 
4. **Cash flow from Operations** has skyrocketed over the last few years, but it's important to note an anomaly. A large change in payables occurred from 2020 to 2021 which significantly impacted ASO's change in working capital. If removing it from the equation, to help get a better understanding of their cash flow operations, they still nearly *tripled* cash flow from continuing operations. Net income from continuing operations over the last few years has grown at an incredible rate too. (Yahoo Finance). Gross profit in general has followed a similar escalation path.
5. **The outside influence** of the guns & ammunition industry, while not a strict mathematical metric, should also be considered. Academy Sports, described by one of my Texas-born friends, is ""an institution."" Currently there is an on-going ammo shortage that's affecting the industry that is expected to grow at a rate of at least 6% a year through the next 5 years(Mordor Intelligence). The sports gun market is growing and many competitors simply do not offer to fill that market niche. 

**So what's the catch?**
Well, I talked about the Guns... I talked about the Money... What about the Lawyers? Academy Sports is largely owned by private equity firm Kohlberg Kravis Roberts or KKR & Co. Inc. for short. As of this morning, they own roughly 65% of Academy Sports, making them the majority decision makers for the company. I want to be clear, **this is both good and bad**. Such a large position of ownership controlling the decisions for ASO will almost always benefit KKR moreso than other shareholders. On the other hand, KKR invested in ASO in 2011 and have helped establish the company as a quickly growing and successful retailer. The two are intertwined in a way that is mutually beneficial to each other, but not as much for shareholders. **Fortunately, this will change over time**.

Academy Sports + Outdoors announced after market on May 3rd that KKR will be issuing an additional 14 million shares of stock. For context, that accounts for roughly 1/3 of the current share float so this will dilute the shares fairly significantly. The upside to this is two-fold: 

1.  Starting today, shares should start trading a discounted, enticing price.
2. ASO also agreed to buyback as much as $100 million shares worth of the offering, thus reducing the dilution and adding to shareholder wealth. 

**Subjective analysis:** I like ASO and I like its prospects. It has the growth potential that Dick's no longer has, their management team has helped been guided by KKR to profitability, and it fills a market niche that some other competitors do not fill. It's important to note that the unraveling of KKR's shares will continue to happen over time, which will simultaneously frustrate shareholders but also spread ownership to a more reasonable degree across the Institutional spectrum. Their new focus on ecommerce has helped strengthen their bottom line and it's already started to pay dividends *without* considerable store growth. In a recent report, management had stated that 2021 won't be a time of store openings due to the inability to properly scout locations(although it was stated that 2022 should see 8-10 new openings). This is the slow growth mentality that I'm all for. This will likely be a multi-year hold for me, but it could just be the next big thing in Outdoor Sports & Recreation."
2021-05-04 10:17:42,stocks,"It IPO’d like 7 months ago at $13/share and it’s currently trading over $30/sh

If the big argument is that they sell guns/ammo, why not just invest in guns/ammo manufacturers?

Personally, It seems like gun/ammo runs are just cyclical and the current one has been “running” for a quite a while."
2021-05-04 10:25:28,stocks,I’ve liked them mildly for a while but haven’t bit the bullet so to speak. Definitely keeping an eye on it
2021-05-04 00:00:00,stocks,"Question about P/E ratio Hey there! I’m new to the stock world and I was just learning about P/E ratio. I was having trouble understanding why it’s fair to compare P/E ratios across companies. 
I’m almost positive it is unfair to compare EPS across companies as different companies will have different numbers of shares, and while one company may have more earnings, they may have many more outstanding shares so it is unfair to compare the two with EPS.
Now when we calculate P/E ratio, we do stock price / EPS. My question is why is it now fair to use the EPS when we add the stock price in to the equation to compare the two companies.
Hope this makes sense!"
2021-05-04 09:30:11,stocks,"Welcome to r/stocks!

For beginner advice, brokerage info, book recommendations, even advanced topics and more, please read our [Wiki here.](https://www.reddit.com/r/stocks/wiki/index)

If you're wondering **why a stock moved** a certain way, check out [Finviz](https://finviz.com/quote.ashx?t=spy) which aggregates the most news for almost every stock, but also see [Reuters](https://www.reuters.com/), and even [Yahoo Finance](https://finance.yahoo.com/).

Please direct all simple questions towards the stickied Daily Discussion and Quarterly Rate My Portfolio threads (sort by Hot, they're at the top).

Also include *some* [due diligence](https://www.investopedia.com/terms/d/duediligence.asp) to this post or it may be removed if it's low effort.

*I am a bot, and this action was performed automatically. Please [contact the moderators of this subreddit](/message/compose/?to=/r/stocks) if you have any questions or concerns.*"
2021-05-04 09:36:10,stocks,Because now you’re looking at what the value of earnings is PER share vs what you’re paying for each share. So buying a $10 EPS company isn’t better than buying a $2 EPS company if the share price for the first company is $200 and the share price for the second company is $3 ... You’re getting $2 of earnings for $3 vs getting $10 of earnings for $200 - so by looking at EPS in the context of price per share it gives you a better understanding of what you’re getting for what you’re paying. It’s still not a standalone metric though and you should always do more research as to why a companies P/E is different than another - there’s a lot you can’t tell by just looking at ratios
2021-05-04 10:15:52,stocks,"When comparing pe ratio, u also generally want to do it within the same industry.

Ie u don't compare apples pe to say costco."
2021-05-04 00:00:00,stocks,"Why should we even bother investing in growth/tech at this moment in time? Let's assume the fed is right and we don't raise interest rates until ~2023, it's my understanding that raising rates is going to send growth/tech stocks down because money isn't as cheap as it used to be. Under that assumption, shouldn't that mean it would be smarter to sit these next few years out until they end up raising rates and then open long positions? I recently purchased 10 LEAPs on various growth/tech companies and plan to exercise them in the future. Would it have been smarter to just wait for the rate hikes later on or how much of that is already being priced in the market today? I plan to be these positions 5-10+ years so I'm just curious."
2021-05-04 09:43:03,stocks,"Buy low. If you can't buy something low, buy something else."
2021-05-04 09:33:14,stocks,"And why do you think once the growth/tech tumble after two years, they'll be lower than where they are today? I am not saying it can't happen. But what's your conviction behind it?"
2021-05-04 09:43:41,stocks,"Because tech is the future. Last year we experienced a huge leap in use of techonology and we aren’t going back to pre-pandemic times when it comes to tech. Don’t be bothered about the short term movement, since tech will overcome in the long run."
2021-05-04 09:27:41,stocks,Time in market > timing the market
2021-05-04 10:12:58,stocks,"If the market correction that everyone is expecting happens tech stocks may go down, but unless we have another crash even with the corrections tech growth stocks will probably still beat the traditional value stocks.  If you are risk averse it would be wise to start rotating your investments to the traditional stocks and investments (Government securities etc).  The VIX is pretty low right so the corrections will likely lead to tech stocks becoming even more volatile.  Just note that in the long term you probably will lose out if you decide to adjust your portfolio like this."
2021-05-04 09:44:46,stocks,"I was convinced that S&P was way overvalued when it got $2,000 mark. You can never guess the top or bottom. I stopped trying. And I worked in finance amd have fancy degrees. Look at Buffet - he way misread last year.  And he is supposed to know things."
2021-05-04 10:07:45,stocks,brillant idea! sit out the next 2-3 years for growth/tech stocks and put your money into doggy stuff..much better I think!
2021-05-04 10:13:12,stocks,"Yes, if you think they have downside in the next 2-3 years, but upside long term, then LEAPs (assuming calls here) would be the opposite of what you'd want to hold. They would just expire and you'd get no benefit in the long term."
2021-05-04 10:23:09,stocks,"I think warren buffet said some shit like, he’d rather buy a great company at an okay price than buy an okay company at a great price. And this is the guy that has the biggest hardon for value investing in all of the Milky Way. So I dunno. This isn’t financial advice for anyone. Just personally for me, those words have resonated and I’ve looked for excellent companies and prioritized that over excellent prices. Of course if you can find both that’s great, but it’s hard for me to find an excellent company at an excellent price today lol"
2021-05-04 09:38:19,stocks,I don't have conviction on it that's why I was asking. Ig what I'm wondering is if the levels we are seeing today would seem undervalued even after the fed raises rates to normal levels?
2021-05-04 09:57:09,stocks,"Bingo.  Go ahead and look 2-3 years back when someone else posted this exact same thing...

&#x200B;

MSFT was $98 and people were questioning if it would ever break $100.

AMD was around $10 and people said Intel would crush it."
2021-05-04 09:28:54,stocks,"Yes, you are correct."
2021-05-04 00:00:00,stocks,"Can options contracts trigger a wash sale? Hello,I recently reading about the wash sale adjustment and was wondering if it also applies to the below options scenario:

Suppose I have 100 shares of XYZ and do the following:

1. I first sell a call option with September expiration against these shares.  I place the order in May, with the aim of selling them at $10. Let's assume the $10 strike price would generate a loss
2. Next, I buy 100 shares at $10 in May.
3. Then in September at expiration, I am forced to sell my initial 100 shares due to the price of XYZ going above $10.

Since I placed the option contract in May, would that trigger the30 day  wash sale rule?"
2021-05-04 00:00:00,stocks,"Check out AGR  Take a look at AVANGRID, ticker AGR. It’s a well performing utility stock with a nice dividend (3.5%) and they just reported amazing earnings.  They topped the street by over 50% by reporting $1.14/share when the street expected $0.74/share.  This kind of upside is normally unheard of for a utility. There is most likely not going to be a big pop today, but more a steady increase in the coming weeks.

Edit: The link didn’t work so I removed it."
2021-05-04 08:09:57,stocks,It hasn't gone up at all in the last 4 years. Seems like a miserable stock to have in your portfolio
2021-05-04 08:17:40,stocks,"Why, because the only reason to have a positions is stonks?

A reliable 3.5% dividend seems pretty good to have in an income portfolio.  there are more reason to own a stock than hoping for the price to rise."
2021-05-04 08:19:00,stocks,isnt WMT better then? It also has a high dividend but the share price is steadily increasing too
2021-05-04 08:27:13,stocks,"Depends on the investor I suppose.  AGR seems pretty solid to me, I don't hold any but it looks at a glance to be a solid fairly risk-free income generator.  There is a segment of investors that thinks stocks like this are attractive is all I am saying.  I too, look for price appreciation even in my income stocks but TBH, that is not always a major driver in what I add to my portfolio."
2021-05-04 00:00:00,stocks,"Corsair Gaming (CRSR) reports record first quarter 2021, crushes sales and earnings estimates Source: [https://finance.yahoo.com/news/corsair-gaming-reports-record-first-110000957.html](https://finance.yahoo.com/news/corsair-gaming-reports-record-first-110000957.html)

**First Quarter 2021 Highlights**

* Net  revenue was $529.4 million, an **increase of 71.6% year-over-year**. Gamer  and creator peripherals segment net revenue was $175.9 million, an  **increase of 131.9% year-over-year**. Gaming components and systems segment  net revenue was $353.5 million, an increase of 51.9% year-over-year.
* Gross  profit was $160.3 million, an **increase of 103.9% year-over-year**, with  gross margin of 30.3%, an improvement of 480 basis points  year-over-year. Gamer and creator peripherals segment gross profit was  $68.9 million, an **increase of 211.1% year-over-year**. Gaming components  and systems segment gross profit was $91.5 million, an increase of 61.9%  year-over-year.
* Operating income was $67.3 million, an **increase of 404.5% year-over-year**.
* Adjusted operating income was $80.4 million, an **increase of 221.4% year-over-year**.
* Net  income was $46.7 million, or **$0.47 per diluted share**, compared to net  income of $1.2 million in the same period last year, or $0.01 per  diluted share.
* Adjusted net income was $58.2 million, or  **$0.58 per diluted share**, an **increase of 420.4% year-over-year** compared  to adjusted net income of $11.2 million in the same period last year, or  $0.13 per diluted share.
* Adjusted EBITDA was $80.4  million, an **increase of 196.6% year-over-year**, with adjusted EBITDA  margin of 15.2%, an improvement of 640 basis points year-over-year.
* As  of March 31, 2021, we had cash and restricted cash of $125.6 million,  $48.1 million capacity under our revolving credit facility and total  long-term debt of $294.3 million.
* Cash flows from operations **was $27.8 million, which increased from $2.0 million** in the same period last year.

&#x200B;

**The Company is updating guidance for the full-year 2021:**

• Raising net revenue to be in the range of $1.9 billion to $2.1 billion from $1.8 billion to $1.95 billion.

• Raising adjusted operating income to be in the range of $235 million to $255 million from $205 million to $220 million.

• Raising adjusted EBITDA to be in the range of $245 million to $265 million from $215 million to $230 million."
2021-05-04 08:44:47,stocks,So this means the stock will dive this dive.
2021-05-04 08:08:23,stocks,Proving they are not a pandemic play. Long corsair
2021-05-04 07:51:14,stocks,"Operating income increased over 400% year-over-year, thats insane!"
2021-05-04 08:26:57,stocks,Feel like i'll be picked up soon with my 37 dollar average.
2021-05-04 08:05:26,stocks,Yesssss🙌🙌🙌
2021-05-04 09:49:34,stocks,Can someone tell me why the stock price is falling? Were these expectations really already priced in to the current price?
2021-05-04 08:18:28,stocks,"Buy any weakness today in the share price, the run up into next earnings will be glorious."
2021-05-04 09:34:18,stocks,Down 0.20%. Such a CRSR thing.
2021-05-04 07:56:02,stocks,Damn. Only wish I invested more.
2021-05-04 07:57:17,stocks,Hope my 800 at 42 will no longer be this heavy bags lol
2021-05-04 08:01:53,stocks,Glad I went for that earnings play. Nice stuff.
2021-05-04 08:12:40,stocks,Got it around 18/share. Long Corsair :)
2021-05-04 08:34:40,stocks,I got in early since I’m a consumer of a lot of their stuff. The number of new products and partnerships they’ve started since November is amazing. Bullish af
2021-05-04 08:50:15,stocks,If they didn’t do that secondary offering at $35 we’d be at new ATH on these results.
2021-05-04 08:54:01,stocks,"I also like the following two points, see also the [SEC filing](https://sec.report/Document/0001564590-21-022983/):

new products (though i cannot comment on that other than it sounds good)

>“We are thrilled with our first quarter financial performance and  strategic progress. End demand remained strong for our products and our  new products such as the K65 mini RGB keyboard and Elgato’s new  accessories debuted well. We introduced 29 new products in the first  quarter and we expect this blistering pace of new product introduction  to continue throughout the year with several brand new products still to  come. Supplies of key components remain tight but we have been able to  support our plans and will continue to work on this issue for the rest  of the year. As a result of our stronger-than-expected first quarter  performance and our current views for the rest of the year, we raised  our 2021 annual guidance,” stated Andy Paul, Chief Executive Officer of  Corsair.

reducing debt by 28 million despite the increase in all financial metrics.

>“We were able to convert our strong financial performance in the first  quarter into an opportunity to further strengthen our balance sheet. We  reduced debt by an additional $28 million with outstanding principal now  at $299 million and net debt at $177.3 million. We did this while  growing quickly and leaving sufficient resources to help us grow  further. We continue to evaluate growth opportunities while still  expecting to further reduce our existing debt in 2021,” said Michael G.  Potter, Chief Financial Officer of Corsair."
2021-05-04 09:58:43,stocks,WHY THE FUCK IS IT TANKING DESPITE GOOD Q1 RESULTS? Always seems good news makes the stock go down.
2021-05-04 08:21:05,stocks,72% YoY revenue growth is ridiculously good!
2021-05-04 08:21:09,stocks,"Long Corsair, averaging $33.15"
2021-05-04 08:51:41,stocks,"As someone who bought it at $42 and has averaged down quite a lot during the steep drop, it's nice to see some good news. 

Hopefully this marks a turning point and we can see this stock finally climb to up the $40s where it belongs."
2021-05-04 09:14:00,stocks,"1) P/S is < 2

2) Company is growing double digits

3) Gaming and streaming (elgato) is going to be growing as an industry like crazy this decade.

\---

This is insanely cheap. Stop focusing on yoy comps. last year was a once in a 100 year event"
2021-05-04 09:55:44,stocks,Down 5% on this news!
2021-05-04 09:58:04,stocks,Record earnings report and only down 5% today -- now that's a stock!
2021-05-04 08:30:28,stocks,"My most anticipated earnings report in a long time (due to it being my largest investment obviously) and it absolutely delivered.

Some important notes however, revenue is down compared to 2020 Q4 (not the holiday season), while profits and margins are up from Q4. 

Supply-chain is still an ongoing issue, but they claim to have handled it fine. Considering that Paul said in Q4 that stock was being sold out, the fact they maintained their sales in Q1 shows that they have managed to keep the supply coming.

Question for others, can someone explain to me their cash-flow from operations? Only 27M in Q1 (68M in Q4), is it just a common fluctuation in inventories, or something else benign or should I dig deeper into this?"
2021-05-04 08:42:01,stocks,They’re ridiculously undervalued and just suffering from low volume
2021-05-04 08:53:20,stocks,"Since I have held the stock since the last call and it went down then despite good news, I fully expect it to go down again this morning."
