Timestamp,Subreddit,Post/Comment
2021-06-24 09:10:23,stocks,"If 1 out of 3 holdings explode like Apple or Amazon or tsla, the fund makes up for the other 2 failed companies. That's the thing with big growth, it's difficult to know which companies will actually make it in hindsight so you just buy sell which buys all growth."
2021-06-24 06:28:54,stocks,😂😂 he's not 15.. 🤦🏿‍♂️
2021-06-24 17:12:54,stocks,"I feel like every new company, especially in fintech and other tech sectors, they are overvalued early on. You’re betting on the growth of the company growing into that valuation. I’m bullish on the company being one of the few one stop shops for everything finance. I think SOFI will easily make this valuation look cheap in a few years."
2021-06-24 11:54:09,stocks,18yo with RH accounts?
2021-06-24 13:43:11,stocks,Blocked.
2021-06-24 17:18:38,stocks,Thanks!
2021-06-24 16:58:49,stocks,"Yeah, so I’m pretty new. What happen to me was I set a market sell in after hours and it didn’t trigger because the bottom fell out on open."
2021-06-24 11:14:33,stocks,"There shouldn't be an ""OR"" either. If a retail investor wants to drop $3500 they can and if it's too expensive, they can buy something else. This isn't exactly BRK.A"
2021-06-24 09:29:36,stocks,I'm saying you aren't going to get a serious discussion from him because he's a troll and that's all he does here.
2021-06-24 09:31:43,stocks,"Many industries still not open.  Many large businesses are still largely remote and either staying that way permanently in a hybrid fashion or they're not going back until September.  This will continue to negatively impact many small businesses who serve those businesses.  Everyone from cleaning operations, to independent contractors, to food service and coffee shops.

Look at the cruise industry - they're weeks/months from paid passenger capacity operations.  The political posturing over testing/vaccination requirements does not help them recover.  Their insurance policies skyrocket when they cannot require vaccination for all onboard and those costs will be passed onto the customer.  People want to get away, but at what price do even the cruise happy look elsewhere?

We have a long way to go to ""reopen"" and then even longer to recover."
2021-06-24 14:54:45,stocks,Cool
2021-06-24 07:30:33,stocks,"Nope, I’m 14"
2021-06-24 13:31:44,stocks,Rectal hemorrhoid accounts
2021-06-24 12:08:07,stocks,RobinHood
2021-06-24 19:25:22,stocks,"Stupid and prob not worth the effort but in April-May 2020 in my IRA I traded $1,000,000 worth of Google 7-10 shares at a time netting $20-$40 per trade. Netted extra $2,000 at the end of the month doing that on $10,000 or so base. Don’t recommend. I got out my XLF and already had Google so I bought more and still have it."
2021-06-24 11:07:06,stocks,"aaaah ...

Cheers!"
2021-06-24 12:02:47,stocks,Makes sense. Appreciate the thoughtful response.
2021-06-24 08:28:25,stocks,What made you look into stocks?
2021-06-24 08:29:52,stocks,"An overall interest in investing, i thought it sounded interesting to invest, and many people said it was a good idea"
2021-06-24 09:19:01,stocks,Future you will be extremely happy if you put any amount of money towards VT on a regular schedule. I started in college and I wish I started earlier.
2021-06-24 00:00:00,stocks,"Visa to buy Swedish fintech Tink for $2.2 billion Visa Inc said on Thursday it had agreed a 1.8 billion euro ($2.2 billion) takeover of European open banking platform Tink, months after it ditched a planned acquisition of the startup's U.S. rival Plaid.

Founded in 2012, Sweden-based Tink enables banks and other financial firms to access consumer financial data more easily. It is used by more than 3,400 banks and other institutions, as well as over 250 million customers across Europe.

Visa was forced to terminate a planned $5.3 billion deal with U.S. data-sharing platform Plaid in January, following a U.S. government lawsuit aimed at blocking the deal on antitrust grounds.

Visa said the Tink deal was subject to regulatory approvals.

European Union rules on open banking, also adopted by Britain before it left the bloc, require banks to allow access to customer data by registered third party providers to boost competition.

The rollout of the rules has provided fertile ground for fintechs, such as Tink, which provide technology to help third parties and banks to access customer data.

Visa would retain Tink's brand and management team, and its headquarters would stay in Stockholm, the company said.

The Tink takeover included cash and retention incentives, Visa said, adding the deal would have no impact on its previously announced stock buyback or dividend policy. 

Link: [https://finance.yahoo.com/news/1-visa-buy-swedish-fintech-075400458.html](https://finance.yahoo.com/news/1-visa-buy-swedish-fintech-075400458.html)"
2021-06-24 08:10:25,stocks," VISA is that boring company but will continue to print profits for investors. Their profit margin is 97% or something.

It's all a fight against square and PayPal now"
2021-06-24 05:15:06,stocks,Are they going to change the name?
2021-06-24 12:18:07,stocks,It's about 70% not 97
2021-06-24 05:17:42,stocks,I don't tink so
2021-06-24 10:28:45,stocks,"Why? All swedes are fluent in English and tink is harmless enough, a play on think perhaps. Klarna for comparison to ""to clear (up)"""
2021-06-24 05:30:19,stocks,"Have an upvote, you beat me to this one"
2021-06-24 00:00:00,stocks,"AMD - A Diamond in the Rough I’m struggling to see how such a solid technology company can be trading at less than 9x Price/Sales. 

I mean, even apart from Lisa Su’s objective awesomeness as an Executive, consistently strong Revenue Growth and Earnings beats, this damn company is promising. Quarter after quarter it’s eating away at Intel’s market share, product users are continually impressed, and massive players like Tesla and Google are confident enough to back it. Even AMD wants to buy back it’s own shares at this price.

And what? Waiting for the XLNX deal has removed the entire speculative aspect of the stock market? A chip shortage, in part, due to an increase in CONSUMER DEMAND during the pandemic? Am I missing something here?

I know some investors may be able to make a reasonable bear case, given some unlikely circumstances, but do you honestly think this valuation is unwarranted (let alone significantly low in this market environment)?

I’m not a financial advisor lol"
2021-06-24 10:26:38,stocks,It's up like 13% in the last few months and 3% today lol. You guys never post these threads when it was at the low for the year.
2021-06-24 03:03:03,stocks,I just saw a similar thread about TSM and the answer there was that they spend all their profits on R&D. I assume the same may be true for AMD. They are at the top and probably spending a ton to stay that way.
2021-06-24 10:31:37,stocks,Everybody knows AMD is a great company lol
2021-06-24 04:03:40,stocks,"Not that I wouldn't buy it, but it was a pretty exciting company at the start of 2019 before it went up 4x."
2021-06-24 10:26:22,stocks,"Semiconductors are THE industrial cyclical of the 21st century, owing to their massive costs and capex requirements.  

They will rise and fall with the macro-economy.  

Consumer technology/communications/e-commerce/media and entertainment are much more resistant to macroeconomic cyclicality."
2021-06-24 03:21:37,stocks,"If the merger happens, each Xilinx share will be converted to 1.7234 shares of AMD stock. Currently the ratio is 1.56. As the merger gets more likely, the price of Xilinx will rise more. This is one of the reasons AMD share price is not able to rise up."
2021-06-24 10:08:08,stocks,I've seen lots of AMD posts the last week or so across all the investing subreddits. AMD's story has not changed in the last 3-6 months. No one is waiting for XLNX approval - it is expected to go through. The resulting merger has already been priced in (33B current XLNX valuation vs 35B purchase price).
2021-06-24 09:32:39,stocks,Load up on AMD there are few better value propositions in the market rn
2021-06-24 09:56:05,stocks,Buy long term calls because AMD likes to take its time
2021-06-24 10:26:07,stocks,"If you think that’s a good multiple then buy now, it’s still at a great price. 10@ 76 :)"
2021-06-24 11:17:05,stocks,"It will go back to $100, it is catching up with the market."
2021-06-24 02:23:23,stocks,"True, and I own $AMD. The price may plateau if crypto mining takes a hit. Same with NVidia."
2021-06-24 02:28:32,stocks,"PE ratio is only 35. Lots of reason for it to go up but when there is uncertainty in a stock, people doesnt want to jump in just yet and that uncertainty is the merger.

Remember that AMD stocks will be diluted with Xilinx stocks. So if the merger doesnt happen, AMD will go up a lot and Xilinx share will drop because it went up a lot due to AMD merger news. If the merger does AMD will go up but just a slight amount.

Also, the stock has gone up a lot since last year. Maybe it needs 1 or 2 more earnings proving that AMD is the future and Intel is something of the past for it to reach $90-100."
2021-06-24 05:36:48,stocks,"Be patient. AMD is in a consolidation phase. Which, is totally normal considering it's last run before consolidating was about 600%. The chart is really bullish. Not only is the stock in a consolidation period, the 50 day is about to cross the 200 day. Check out the chart. This setup has played out before. Both these big runs have happened under Sues watch. 


[AMD CHART](https://www.tradingview.com/x/rnSahBDO)"
2021-06-24 10:14:11,stocks,I’m in on long calls for June 22 at $115 and $150.  I’m confidently betting that these will expire ITM.
2021-06-24 11:48:45,stocks,"The bear cases:

- 9x price to sales is very high for a hardware company

- chip shortage and the fact that AMD outsources its manufacturing to TSM (who also manufactures iPhones) gives intel two years to catch up with its own foundries

- crypto mining will take a hit as ETH moves towards proof-of-stake instead of mining

- technology is cyclical and demand for AMD GPUs will wane as people return to work and don’t game as much after the pandemic"
2021-06-24 05:30:55,stocks,No matter how well it performs the people who bought it in 2017 will always win against the people who buy it now
2021-06-24 09:26:15,stocks,"Lots of uncertainty. The Xilinx deal, they can't seem to get TSM to manufacture enough chips, and Intel's products coming in the second half of 2021. 

I think once investors get clarity on those or more good earnings that could move the price up."
2021-06-24 10:33:36,stocks,I was thinking about this as well... They have AMD GPUs in the new model S Plaid and they're revenue for the whole of 2020 has been great but still its stock is held back while NVIDIA stock  is above $750... must be something we are missing here.
2021-06-24 17:18:13,stocks,"Until the deal completes, the Xlinx acquisition will keep the price depressed. The fact that AMD's price hasn't fallen below $80 is, in my opinion, very bullish. I'm looking to buy some calls after the current rally settles down."
2021-06-24 08:19:42,stocks,"1. Worldwide chip shortage leaves them disadvantaged in comparison to Intel, who makes their chips in-house
2. They take on debt like a mothertrucker, and have wildly inconsistent Revenue/Earnings over the last 10 years

They’ve had a great run over 3 years, but compared to their historical performance, it’s unlikely that this growth will be sustainable"
2021-06-24 12:06:06,stocks,"They were 1.86 not too long ago. There are plenty of valid arguments that they are overvalued. The market can stay irrational longer than you can stay solvent though. Just because this new generation of investors has absolutely no clue and most them will eventually lose their ass, doesn't me you know when it's going to happen. If AMD is your best idea you should just buy VTI or some other similar index and stop pretending your bets are investments."
2021-06-24 08:18:03,stocks,[deleted]
2021-06-24 10:48:18,stocks,"The chip shortage will hold revenues to whatever is available to sell.  As the chip shortage eases (some people are saying could be years), I think current sentiment that AMD has a better product than Intel right will let their stock price take off with the pent up demand.  At least that is what I told myself when I bought some.  Disclosures:  I own AMD stock.  I am poor to mediocre at DD.  This is not financial advice."
2021-06-24 12:00:12,stocks,"They do spend a lot R&D relative to the company's size. 2020 they spent around 2 billion. However, I wouldn't attribute the amount they spend to their success. Instead I would look to the engineers and managers. I think they have recruited very good talent. In comparison Intel spent around 13.5 billion on R&D in 2020. Intel has been losing talent and I think that's why even though they spend multiples more, they have struggled. Do note that the R&D budget is spread among different projects for each company."
2021-06-24 15:24:05,stocks,Exactly! Thanks for the reminder
2021-06-24 09:20:07,stocks,"At the start of 2019 intc's chips outperformed amd. It was seen as a budget slower chip. Now it's considered the faster and better chip company.

Stock price reflects that sentiment (based on fact)"
2021-06-24 12:50:17,stocks,So there's like 10% upside there? In a relatively short timeframe?
2021-06-24 04:37:25,stocks,"The benefit of AMD compared to Nvidia is that they also make processors. AMD dominate the processor space right now.

Faster, cheaper, cooler, higher-yielding chips have resulted in many high-level super computing contracts going the way of AMD over Intel, as well as the general consensus among gamers and content creators that AMD Ryzen is better than Intel Core for gaming (for about 85% ish of games).

AMD fortunately don't take as much of a hit as Nvidia will if crypto crumbles. It'll be a hit, though."
2021-06-24 03:07:48,stocks,I feel like this is a weird X-factor for AMD/NVDA. It's hard to tell what the future holds if mining gets hammered down. Sales following a crypto crash or something might be revealing.
2021-06-24 03:24:02,stocks,If crypto fails then people will finally be able to buy GPU's.
2021-06-24 09:31:05,stocks,"Not too worried about crypto. If you’ve been paying attention to the market, top coins have fallen upwards of 60% from ATH’s. We’re technically in the middle of the crash right now. 

The only stocks that will really take a hit are Coinbase, MicroStrategy, and to an extent, Tesla."
2021-06-24 03:50:11,stocks,"not the same at all for NVDA

two different beasts"
2021-06-24 02:58:47,stocks,"Just gonna say: Remove the tax $1.21 billion tax break in the TTM and the PE is closer to 100.

Edit: Yeah, downvote me because you're long on an overvalued company that you didn't realize was overvalued because you can't read an income statement. You'd rather just believe in a misleading valuation if it makes you feel justified."
2021-06-24 03:19:37,stocks,"> Remember that AMD stocks will be diluted with Xilinx stocks. So if the merger doesn't happen, AMD will go up a lot and Xilinx share will drop because it went up a lot due to AMD merger news. If the merger does AMD will go up but just a slight amount.


If the merger happens, each Xilinx share will be converted to 1.7234 shares of AMD stock. Currently the ratio is 1.56. As the merger gets more likely, the price of Xilinx will rise more. This is one of the reasons AMD share price is not able to rise up."
2021-06-24 10:04:59,stocks,"The 50 to 200 cross is at least a month away. In April there was a ""death cross"" where the 50 dropped below 200."
2021-06-24 10:48:45,stocks,$150 is a tad delusional.
2021-06-24 11:55:58,stocks,That gaming take is ice cold. Esports will only grow and gaming will only get bigger
2021-06-24 08:01:47,stocks,This is perhaps the dumbest comment I've read on this sub.
2021-06-24 09:28:47,stocks,"AMD has a negligible amount of debt right now and has nothing to indicate that they'd need to take on more anytime soon. Dilution is a separate matter, but is also being addressed in part by their buyback announcement."
2021-06-24 10:05:36,stocks,"AMD uses TSMC for fabs, they don't develop the node themselves."
2021-06-24 11:51:16,stocks,"With better performing chips AMD has also raised their price. In terms of business practices on pricing, AMD hasn't changed at all for decades. They continuously price their products relative to Intel's based on performance. So having a better product doesnt change this. Furthermore, having a better product does not make a company more profitable. This is one of the biggest logical fallacies I keep seeing in AMD discussions. You can have an inferior product line and still be more profitable than your competitors because you are more efficient, better marketing, etc, etc. The main reason to be bullish on AMD is their steady pace in gaining market share. Also, hopefully FSR will become mainstream and improved on because they desperately need some form of competition against DLSS once shortages level off in the next few years. There is no reason to buy a Radeon when its priced on par with Nvidia in terms of raw performance when Nvidia's cards have superior RTX and a fully functional way of upscaling. Not to mention all the other extras such as noise cancelling, etc. Its similar to comparing two Honda civics for the same price but one is fully loaded and the other is a base model. If market goes back to normal, those base models will be hard to sell without reducing their prices."
2021-06-24 10:51:36,stocks,"Yup this. I was watching the stock at $10 and it had an absurd amount of risk, much better buy now despite the large price gain"
2021-06-24 12:56:40,stocks,"Yes. The merger is supposed to be complete this year.  

https://www.reddit.com/r/AMD_Stock/comments/n9xnu2/regulatory_approval_status/?sort=new"
2021-06-24 15:40:20,stocks,They dominate CPU for now but it can change very quickly when people move to ARM.
2021-06-24 08:55:41,stocks,"Where do you get 100 from? last 4 quarters EPS is 1.29, making their P/E around 65. even using 2020 earnings of .98 gives a P/E of 85.

Info taken from their slide deck:

https://d1io3yog0oux5.cloudfront.net/\_7489b9449098b735f2246ff0edfed37e/amd/db/778/6634/file/AMD+Q1%2721+Financial+Results+Slides.pdf"
2021-06-24 10:21:27,stocks,"I don't think the death cross signifies a downward trend as long as the stock remains above support. If support is broken then I'm bearish obviously.

I like to look at the weight of the evidence and I believe that it points to AMD moving above resistance and out of consolidation into another multi year run."
2021-06-24 16:15:56,stocks,"Relative to what? Have you seen the valuation of Intel and NVDIA? $150 is still cheap in comparison. 

Now I do agree that all these tech stocks are delusionally over priced, but it’s the world we live in currently."
2021-06-24 13:28:19,stocks,"Wait until they decide to start manufacturing their own chips… then we’ll see what their debt looks like.

Like I said, they’ve had a clean slate for 3 years or so, but I don’t expect that to last"
2021-06-24 12:52:22,stocks,"Their eps is high because they didn't need to pay tax due to previous losses. If they were paying tax it would be lower. - that's his argument. iV seen it before too.    
Either way AMD is a growth company and should be viewed on forward PE which is good and they will dominate the space for 5 years imo. So it's good for 3 years growth imo at which point Intel updates may start to scare again."
2021-06-24 17:10:06,stocks,"Intel? Are you joking. AMD has a pe in the 100s, fwd of 40, compared to intels pe of 12. NVDA is its own beast but its pretty clearly overvalued."
2021-06-24 13:47:33,stocks,"Your thinking about AMD and Intel seems to be rooted 10-15 years in the past and doesn't take into account trends in the following years.

There is no conceivable reason or chance of AMD trying to get back into the foundry business with capacity additions on a years-long delay, R&D and construction costs in the 10s of billions per annum, and TSMC+Samsung taking over the world.

I'd advise you to look more into AMD and TSMC's roadmaps as well as Intel's history of delays since 2015. The world has changed and if you're investing based on old assumptions you're going to get hurt."
2021-06-24 12:58:58,stocks,my eps/pe numbers omit that one time tax benefit
2021-06-24 13:26:51,stocks,I do tax provisions for a living. The benefit is stated as mostly from the removal of a uncertain tax position that they get to release aka they get to take the benefit. In my experience to have that much removed likely means it is from the end of a federal tax audit. Based on my experience and their industry it probably related to R&D tax credits.
2021-06-24 18:50:12,stocks,"A discounted cash flow model shows that, based on the current amount of earnings AMD generates for shareholders, AMD is in no position to promise returns to shareholders. 

The company’s EV / EBIDTA shows a market multiple of 45x earnings. I’m not looking to wait 45 years until my investment has paid itself off.

What you’re saying is absolutely true - AMD has major manufacturing issues which they cannot even begin to address due to the same shortage worldwide.

AMD had a nice run for a short blip on its history, and they have some great products, but currently it’s trading at 115B market cap and generated 8B in revenue last year. When you compare that to Intel, who’s had a “bad run” over the last few years, with a market cap of 230B generating nearly 100B in revenue, it’s simply not even a fair comparison.

Any growth AMD sees in the near future is only because the company’s been fortunate enough to tap into some of Intels customer base."
2021-06-24 00:00:00,stocks,"Doximity IPO prices at $26 (above initial range of $20 - $23 a share) (Crossposted and slightly modified due to audience, from r/residents as DOCS was being offered to physicians)

I'm a new here but since I see some posts about it, might as well start with this.

I'm a physician in California, 20 years out from residency.

I've been investing with my Stafford Loan $ since MS I and endured several serious market crashes. I enjoy doing financial analysis and have successfully invested in multiple IPOs in the past, including google, mastercard, visa, interactive brokers, and evercore financial. I still HODL GOOG, MA, and V; sold EVR at a modest profit and roughly broke even on IBKR.

This is completely divorced from what I think about the app or the company (I don't like the fax function, don't usually read its articles, and primarily use it so that when I call patients they can't see my mobile #), I am focusing purely on the financials reported by the company. I would be interested in seeing if anyone else has picked up anything that I have blind spots for and cannot see. Thanks in advance.

**tl;dr**: DOCS hits every thing I want to see in (any) company going public. I committed a full 250 share allotment on Fidelity after I had passed on an opportunity to purchase pre-IPO shares through EquityZen

**First.** The [S-1](https://www.sec.gov/Archives/edgar/data/0001516513/000162828021011269/doximity-sx1.htm) filing is located here.

**Second,** Their financials. For any company you want to look at:

* Revenue (also called 'top line')
* Operating Expenses
* Profit (also called 'bottom line') which is more or less revenue - expenses
* Cash on hand
* Debt
* Why they are going IPO

You want to see that the company is making money both top line and bottom line, you want to see that their costs are not outstripping their revenue and profit growth. **When you are investing in a stock, you are basically laying an (educated) bet that the company will grow their profits. When they grow, your stock grows.**

For the last bullet, you want to see that they have money so that they won't go bankrupt. Generally for why IPO, if the prospectus says, ""to pay back debt"" or ""the company will not receive any proceeds"" then stay the hell away. You want the company to use the money they raise to fund new ventures or anything that will help them grow.

So, under the hood (and very simplified):

&#x200B;

||2019|2020|2021|
|:-|:-|:-|:-|
|Revenues|85.7mm|116.4mm (+30.7%)|206.9mm (+78%)|
|Expenses|67.9mm|79.3mm (+16.8%)|122.4mm (+54.3%)|
|Profit|7.8mm|23.5mm (+201%)|57.7mm (+145%)|

What do we see:

* Increasing rate of change growth in revenue from 2019 -> 2020, and 2020 -> 2021
* Increasing expenses but rate of change is not as much as rate of change of revenues
* Profit every year. Though 2020 - 2021 growth is not as much as 2019 - 2020, it's still more than doubled

DOCS has 142mm in cash on hand, and the only ""debt"" they have is in the form of convertible preferred stock - i.e. no loans taken out.

Why are they IPOing? They are going to use the funds to support growth and investments in the business, or to acquire or invest in complementary businesses or assets.

**In Summary**.

Solely from a financial perspective, the company grows revenues and profits year over year. Their expenses are growing but not as rapidly - plus if you dive into their S-1 they have a significant portion of those expenses used for research and development, which in my mind is actually not an expense but more of an investment in their future. They have cash on hand and no debt. It's a slam dunk and I am not surprised that the IPO priced 3 dollars above their upper range because everyone with financial know how and the ability to get their hands on the stock wanted it.

Cheers and best wishes.

*Obligatory not financial advice, do your own research, I like the stock, etc. etc.*"
