Timestamp,Subreddit,Post/Comment
2021-04-26 10:52:42,stocks,I see it as an opportunity. Taking profits from one bet and putting in another.
2021-04-26 13:36:25,stocks,Crazy
2021-04-26 13:37:54,stocks,Stock split rumours. Announcement may come at earning call.
2021-04-26 13:38:19,stocks,Rumors of a stock split as early as Thursday
2021-04-26 13:40:32,stocks,earnings coming up. and split rumors.
2021-04-26 13:56:58,stocks,"I feel like it’s a great time to get in.  If the split actually happens, it will be a huge catalyst.  And if it doesn’t, it’s still a great stock with plenty of upside."
2021-04-26 14:10:18,stocks,Good time to get in regardless
2021-04-26 14:13:35,stocks,FOMO into Alphabet too
2021-04-26 14:47:33,stocks,"never fomo, at least for me it's never worked out. I'd rather miss out on gains that do it"
2021-04-26 15:02:36,stocks,You mean like how I FOMO'd into ARK ETFs in the beginning of February?
2021-04-26 07:38:00,stocks,I would like to know if those extra shares are going to be available on the open market or strictly reserved for M&A. They've suggested it's for M&A which means it shouldn't affect the price a lot? Not sure tbh.
2021-04-26 11:46:54,stocks,I heard someone talking how about a stock split. Any truth to that?
2021-04-26 12:36:54,stocks,Always best to put in a little at a time (Dollar cost average) over a period of time.
2021-04-26 13:31:32,stocks,don't try to play the earnings. buy because it's a good long term investment.
2021-04-26 14:15:40,stocks,Stock split rumor
2021-04-26 16:02:41,stocks,Lots of fund managers shifting things by selling this afternoon after things popped off today. Some positions probably got too heavy so they trimmed.
2021-04-26 11:13:56,stocks,AMD was a no-brainer buy in the 70's.
2021-04-26 11:15:02,stocks,"Buy, I genuinely think AMD will hit 100-110 by EOY which is a nice profit."
2021-04-26 10:30:11,stocks,"i wonder if any good news and guidance is already priced in at $86

with chip shortage for the next year, AMD is constrained."
2021-04-26 11:11:08,stocks,Happy with PINS so far
2021-04-26 11:29:03,stocks,Buy PINS
2021-04-26 11:07:17,stocks,"Last Q, PINS jumped about 9% on a strong beat, the Q before that they jumped 30%.  I expect them to post another impressive beat.  Impossible to predict how the stock price reacts. I'm long."
2021-04-26 12:21:42,stocks,"PLTR does not justify a 40B market cap, not yet at least. They haven't got any meaningful contracts, there's better places to put your money imo."
2021-04-26 12:12:12,stocks,"Depends on if they can get more commercial contracts. While their main customer is govt, their revenue is capped. Currently making big losses per share in each earnings. priced like a growth stock but (in my PERSONAL opinion) they haven't shown growth in earning to justify growth pricing. Its not a new 'shaking things up' start up, its a several decades old company.

&#x200B;

There is also a bull case (plenty of dd on this sub and wsb for that). And I did own a few hundred shares that I sold for a small profit. But I'm no longer interested on buying the dip in PLTR, not at 40Bn."
2021-04-26 12:00:12,stocks,Idk but I'm selling as soon as I break even lol I'm tired of holding these bags.
2021-04-26 12:11:25,stocks,Do you feel their growth is over? If it is then sell. If you feel they have room to grow i'd hold. But seems like you got into it as a short term swing trade.
2021-04-26 13:21:57,stocks,"Probably rising due to earnings expectations tomorrow.

Also they announced some subscription price hikes.

Also they announced tighter facebook integration."
2021-04-26 13:21:37,stocks,"No way, that's not how anyone runs a business. They raised prices because it will make them more money than lost on users."
2021-04-26 14:03:29,stocks,But do you like the companies ?
2021-04-26 15:38:41,stocks,Geopolitics man
2021-04-26 15:57:53,stocks,"They went through their correction, hope you loaded up."
2021-04-26 15:26:00,stocks,"Nah it'll be fine, I thought the same thing on Friday."
2021-04-26 15:43:54,stocks,Do these count as consumer staples? If they do the consumer staples sector has been down all day.
2021-04-26 15:47:56,stocks,probably more people are selling than buying
2021-04-26 15:53:42,stocks,"They all had huge runs over the past month, so they were due for a pullback. Also money has been rotating back to growth over the past week. It happens."
2021-04-26 17:14:21,stocks,Why though? A week ago a lot of people on here were bashing that stock
2021-04-26 19:00:19,stocks,"In general it's just easiest to manage one fund instead of having to add in small cap yourself. Also VTI has outperformed by a couple percentage points over the past 5-10 years, and would continue to do so if large-cap growth stagnates"
2021-04-26 19:00:16,stocks,Which is why I own both
2021-04-26 19:48:47,stocks,We had a nice green day friday and it was followed by a nice green day today
2021-04-26 19:42:51,stocks,"I love that we can't trust green days anymore. We were all in love with the market, now I'd say 80% of us hate it"
2021-04-26 19:55:57,stocks,"I know it includes a red day in there but this was the 4th straight day that .IXIC actually led the Nasdaq-100. 

This may not be fake this time given how badly bruised up and beaten some small and mid-cap tech (aka: the favorite stock of the younger investor) has been. There's still some things to look for though, because .IXIC did get about 20 points from the highest its ever traded and ARKK (my favorite indicator for growth stocks) is still down a little over 18.4% from its ATH."
2021-04-26 13:48:55,stocks,goodbye shorts? how so?
2021-04-26 13:56:50,stocks,Where is it being reported that Amazon is going to split?
2021-04-26 10:49:24,stocks,There's a lot of stocks reddit hated last year that have done very very well. Basically all financials for example.
2021-04-26 11:44:31,stocks,"New to this, so historically, does it mean the price will drop?"
2021-04-26 12:17:20,stocks,"If so AMZN could easily hit 5k by EOY. They're genuinly an everything etf disguised as a single stock. Cloud, ecommerce, entertainment, pharmacy, live sports etc etc, they got it all. EPS only grows every earnings."
2021-04-26 11:39:33,stocks,Bloomberg just mentioned this as a possibility.
2021-04-26 11:53:40,stocks,"I'm selling puts at $220. I'm 100% ok buying at that level. I'm tempted to buy now at $230 but since I can't commit, the puts force me to pick a price. Even if it doesn't get assigned, $100/week in premiums is better than nothing."
2021-04-26 12:12:06,stocks,"Unless you've taken a time machine to 2025, no."
2021-04-26 12:53:23,stocks,"I wouldn't exactly label NIO as a stock you ""buy and forget."""
2021-04-26 13:09:26,stocks,Everything is inflating right now
2021-04-26 15:02:51,stocks,I'm about to fomo on this shit
2021-04-26 15:03:19,stocks,I bought at 30 and will laugh so hard if I end up making $$
2021-04-26 15:39:13,stocks,"It looks like a mini-rebalance into growth--defensive sectors are all generally lagging the market (Consumer, Utilities, Healthcare, Industrials) after a run up since January."
2021-04-26 16:08:34,stocks,Didn't even have to use my AK
2021-04-26 16:06:37,stocks,"Drunk as hell, but no throwin' up  
Halfway home and my pager still blowin' up  
Today I didn't even have to use my AK  
I gotta say, it was a good day"
2021-04-26 17:19:35,stocks,Still down 50% from recent ATH. That's no achievement...
2021-04-26 17:55:12,stocks,Cathie bought 2 huge chunks of shares in the last few days
2021-04-26 18:12:44,stocks,There was a short sell report that did not hold water; then ARK invested in it.  Earnings are coming out May 4th.
2021-04-26 06:54:44,stocks,"I'm worried of a dump around that fed meeting. But with this momentum, it feels either like most investors don't care or we're getting bull trapped. I'm new so just holding off overall for now, can't really read situations right yet."
2021-04-26 06:25:15,stocks,aLL ThE EArNINgs pLAys are PrICed in
2021-04-26 08:12:27,stocks,The only thing I'm buying before earnings announcement this week is Apple. I am real interested to hear Chevron on Friday. Wondering if I should buy more of that and average cost down.
2021-04-26 08:33:25,stocks,"Besides all the known ETFS, I'm slowly upping my position in  $CLF, $BOTZ AND $AACQ and also my pennystock of $HEPA."
2021-04-26 08:50:32,stocks,VST
2021-04-26 08:10:38,stocks,Guess I'll buy any earnings dip if possible.
2021-04-26 10:45:26,stocks,Rumor of partnership with Apple apparently
2021-04-26 11:10:21,stocks,"Bought in Feb, still bag holding at 17% down."
2021-04-26 10:56:34,stocks,">I am waiting for after earnings to buy in. I think it can fall more. It is still below 200 day moving average. I usually use that to get out of falling stocks, so on this one I will wait for it to cross up again before buying."
2021-04-26 13:35:35,stocks,walmart is a buy whenever and hold forever.
2021-04-26 12:15:12,stocks,"Being aware of your own limitations is a good idea in these situations.

Take myself. I know I'm just one monkeybrain retail investor who does this while slacking off at my real job, so me picking 40 stocks is unlikely to beat the market. The amount of time and research to keep up with all those companies is just not worth it. Sticking with a manageable number of high conviction plays will likely give you better results over time."
2021-04-26 12:08:58,stocks,"you'd probably be better off holding a broad market etf

40 is a lot to monitor"
2021-04-26 12:25:04,stocks,buy vti and schd. 50% of ur portfolio
2021-04-26 12:06:50,stocks,How much do you know about those 40 companies?
2021-04-26 12:13:37,stocks,"if you own 40 stocks...why not just own s&p or similar index? The problem with too many stocks is you have to keep up with them, with earnings, balance sheets, share dilutions/buy backs, when to buy/sell etc etc. You most likely won't do that and it will lead you to underperform the market. 

With indexes, other people do your homework for you. They rebalance, they buy new companies doing well, and sell old companies on their way out, and pay dividends from dividend stocks. All without you touching anything."
2021-04-26 13:51:23,stocks,"As someone who started started serious DIY investing in late January and used to hold that many stocks himself, take it from when I say that is not the way. While you don’t need to just make 80% of your portfolio VTI and call it a day, at the same time it’s really hard to make diversified portfolio full of many stocks that won’t just underperform the market anyway. And when correction happens and things drop left and right, you’ll be hard pressed thinking of what you should double down on and what needs to be cut off. 

While you don’t want all your eggs in one basket, it also pays not to have too many at once. You stretch your gains thin, make it more likely to pick up losers, and balancing will be a nightmare. I’ve since dumped like half those positions off and consolidated into the ones I like more and a few ETFs and I overall feel WAY more confident in my holdings. 

A portfolio you’re not confident is doomed to fail."
2021-04-26 12:05:03,stocks,Uh yeah
2021-04-26 12:29:45,stocks,No. Also it's going down right now
2021-04-26 12:53:04,stocks,I'd probably wait for earnings at this point. But it's a solid long term hold either way it goes.
2021-04-26 14:32:55,stocks,"Really hope this means we had a double bottom and now the IXIC can shoot past 14,000 going fwd. Zooming out on the chart, the top area looks almost like a smaller version of what happened after the 2020 crash and recovery."
2021-04-26 14:10:28,stocks,"Sold all my NVDA beginning of this year and put that money into ARK.K and ARK.G. Wont lie, its been the worst move I've made so far this year. Down around 8% combined.

However, personally I have no intention of selling. I do believe that ARKs days of absolutely insane growth are probably behind it, but I'm still expecting a steady return in the comming years. They have a 5 year time horizon and I plan on being patient. 

VOO has been amazingly consistent for me so if you do decide to go that route you should be great either way"
2021-04-26 13:56:50,stocks,"Dude, I'm absolutely not an expert and really have no right to give advice, but I know what I would do there. A lot of people make the mistake of holding onto losing stocks way too long, after the point they're past hope. However, with a reasonably strong ETF (like ARKs are, IMHO), I don't see any reason not to hold onto until it goes up unless you need the money now (which it sounds like you don't).

Basically, I think it's going to take a lot longer to recover your losses using an S&P tracking fund than from ARK_. I'm not sure what percentage of your portfolio these make up, but since you say ""only 600,"" I'm guessing it's not a huge share.

Edit:
(BTW, I don't have an answer about the TSLA earnings...I don't follow that stock closely, so not sure how it tends to behave, so I can't really help on if your sold selling now-ish.

ALSO, I just now read your final sentence about not being interested in playing these long. I completely get that...and actually have some ARKK shares I'm deciding what to do with, though they're all positive. I just think it's possible you're going to be paying a significant price for the privilege of not having to look at them in your portfolio each day, which will effectively cancel out the (likely) comparatively small short-term gains from elsewhere in your portfolio.)"
2021-04-26 16:59:41,stocks,Total (A 10% holder in TELL) pulled out of their LNG operations in Mozambique because of ISIS too.
2021-04-26 14:41:01,stocks,"One thing to consider is it will now be easier to do Covered Calls/CSPs on, but yes with fractional shares stock splits are no longer as big of a deal."
2021-04-26 14:58:48,stocks,"yes, it's all psychological.  Some people will see the lower price and just buy it, not understanding it's the same equity in the company 0.5 shares before compared to 1 share after.  So more demand for the few that don't understand this and price goes up."
2021-04-26 14:30:06,stocks,"stock splitting allows people who can't buy the stock but want to, to be able to buy the stock"
2021-04-26 14:27:27,stocks,"Fractional shares are not available everywhere. I live in Canada, not possible here."
2021-04-26 14:55:21,stocks,I use Merrill. They do not offer fractional shares
2021-04-26 19:08:40,stocks,"Can’t trade fractional options, so lower share price makes options more affordable"
2021-04-26 14:16:14,stocks,"It’s because more shares are added to the overall share pool. 

Say a company is valued at $100 and has 10 shares. Then each share is worth $10. If they do a stock split, what is happening is they add in 10 more shares. Company value is still $100, but now there’s 20 total shares so each share is now worth $5. 

There are different types of splits too but the basics is that fractional shares are dividing already existing shares, splits are adding more to the total number that exist"
2021-04-26 15:17:00,stocks,I can't find specific news. Growth stocks in general are doing very well today.
2021-04-26 17:15:43,stocks,I find it funny that a week ago a lot of people on here were bashing that stock pretty bad lol
2021-04-26 16:59:23,stocks,"Hmm.  That's interesting.  When's earnings call?

All paint has had great sales due to the pandemic and the current home sales/renovation/construction boom has to be helping them as well.

Not sure if what you're describing will really hurt their bottom line but you have a reasonable thought there."
2021-04-26 16:58:38,stocks,I dunno but I took a 7k position on them a month or two ago and I'm up about 15% as of close today. I'm very bullish. As you well know they have an awesome product and people are never gonna stop needing it. I've always exclusively used SW and probably always will. I've painted a ton over the years being a homeowner and owning multiple real estate investments. I've always thought their paint is superior to all the others I've tried.
2021-04-26 08:44:41,stocks,Doubling down happens when you're.........down
2021-04-26 09:13:44,stocks,do you think its a Great Value right now? 🤔
2021-04-26 09:53:50,stocks,I would maybe do dollar cost averaging. But if you wanted to get/expand a position I wouldn't let the price dissuade you totally.
2021-04-26 11:31:26,stocks,Consider IBM Red Hat with the others.
2021-04-26 11:34:05,stocks,BBKCF
2021-04-26 11:47:56,stocks,DMGI.V/DMGGF
2021-04-26 12:26:30,stocks,Oh he dead
2021-04-26 12:33:42,stocks,When you sell
2021-04-26 13:11:28,stocks,"how you liking that dead money?

you got leaps or shares?"
2021-04-26 14:20:10,stocks,they've been rumored forever. and this too is nothing but a rumor.
2021-04-26 14:48:02,stocks,"Wait, Nvidia is splitting?"
2021-04-26 16:09:28,stocks,Ah now today makes sense lol
2021-04-26 16:39:59,stocks,"I'm long, there's a ton of potential.  Just saw their Chief Scientific Officer is resigning, that might explain why it fell off a cliff after being green all day."
2021-04-26 09:28:29,stocks,"but what about the people thinking that other people think that it will fall, and then  dip, then probably rise, meaning it will probably just stay flat"
2021-04-26 10:23:46,stocks,"I fully recommend anyone give that Intel earning call a listen. Pat was doing the same sort of fluffing they've done in every press release since they hired him back on, but the analysts weren't having it.

It was the closest I can remember in awhile to someone calling a CEO a liar on an earnings call."
2021-04-26 10:53:32,stocks,Sold half of my position. If goes down I'll buy back. If goes up i make more profit.
2021-04-26 14:50:59,stocks,Insane run-up in minutes
2021-04-26 15:02:10,stocks,took my profits at 270. haven't looked back since
2021-04-26 17:03:27,stocks,"Starting to go back up a little. I think with low volume this could swing either way in AH. Could be people thinking they need to sell due to the ""sell after earnings"" that happened in Feb. But, there could also be people ready to buy after they hear what is said on the earnings call at 5:30."
2021-04-26 16:41:46,stocks,as is tradition
2021-04-26 09:57:49,stocks,Amazon too
2021-04-26 10:00:17,stocks,"What are you doing, step-apple?"
2021-04-26 10:11:55,stocks,Even after announcing a new east coast campus in NC
2021-04-26 10:54:05,stocks,Back in the green!
2021-04-26 11:41:38,stocks,:(
2021-04-26 17:01:46,stocks,AH is usually meaningless due to low volume (at least I hope) -- and I bet most are waiting to see what gets said on the earnings call. Interested to see how things will look after the call and during market hours.
2021-04-26 17:39:41,stocks,"Hey, it could be like Intel and be down like 6% on earnings beat."
2021-04-26 09:16:15,stocks,"Bid ask spreads are often very large outside of regular trading hours.

It looks like that etf has done 0 volume so far today."
2021-04-26 15:04:44,stocks,Just wait until the ticker changes \*devil emoji\*
2021-04-26 15:42:11,stocks,Thinking about getting in before the merger finalizes
2021-04-26 15:37:37,stocks,"everything suddenly and for no reason, tanked."
2021-04-26 15:57:39,stocks,TDAmeritrade has been the easiest and most straight forward in my expirence
2021-04-26 16:24:40,stocks,[deleted]
2021-04-26 16:40:55,stocks,Weak hands are green hands.
2021-04-26 16:40:46,stocks,"I sold my amd shares (70) today. I've been burned faar too many times playing earnings to try that again. You do you, but if the past few quarters are any indication, then it will go down the day after. Also, intels movements are a little worrying."
2021-04-26 17:00:27,stocks,I’m down on a 7/16 95c by only 43% now. At the bottom it was down like 80%. I’m debating if I should hold it or sell it right at close tomorrow.
2021-04-26 16:20:20,stocks,">But it looks like it's going to go down.

Maybe some profit taking. Earnings were still good enough that hopefully it won't kill the current rally."
2021-04-26 17:07:40,stocks,I would expect retail to pile into it tomorrow.
2021-04-26 07:25:11,stocks,Bri'ish stocks looking good
2021-04-26 06:49:09,stocks,"I'm curious to what the blackberry settlement will be regarding Facebook er. The settlement is said to be considerable but with nda's, no one knows. There is skepticism about if fbs er will reveal the payout to bb ....thoughts ?"
2021-04-26 07:05:09,stocks,I got into ARVL Thursday
2021-04-26 07:20:54,stocks,I'm not in love with FB as a company but I don't see any way they don't fucking crush earnings.
2021-04-26 11:08:59,stocks,currently up 18% on NIO here! I entered at the right time apparently :D
2021-04-26 08:07:34,stocks,"Reopening time was March at the latest, I'd be careful at this point"
2021-04-26 06:41:40,stocks,THIS IS HOW WE DO IT
2021-04-26 06:47:29,stocks,"After a quick scan, they do seem alright to me. Do you know when earnings for q1 will be? Looks the the past 2 quarters was very healthy for them. I think if they report a 3 in a row quarter position er , they could see a nice bump."
2021-04-26 07:04:25,stocks,Take a look at FCSMF + FTMDF + REEMF + AM/YZF + AB/ML + ILHMF
2021-04-26 11:18:21,stocks,"People were butthurt the CEO sold a large portion of his shares, not recognizing that's a reality for a PE firm exec, which is what MP was bought by.  Doesn't change the reality of the company, which I think is strong."
2021-04-26 08:16:45,stocks,That news they smashed delivery estimates came out 3 weeks ago. If you were gonna do an earnings play why wait until the day the earnings came out?
2021-04-26 08:42:14,stocks,Predicting earnings movement is super risky.
2021-04-26 08:43:44,stocks,"In theory, sure. But that assumes that we know with certainty how it’ll react to earnings which we don’t.

I feel like if the sentiment of “it’s definitely gonna dip after earnings” is common enough there’s a good chance the opposite happens."
2021-04-26 08:39:54,stocks,Don’t know if its a good idea to try to predict stock prices on earnings.
2021-04-26 08:42:04,stocks,"And if AAPL crush earnings and the stock price shoots up to around $140, then it'll be a pricey buy back. Hard to tell which way it'll go though."
2021-04-26 12:55:03,stocks,Really strong chance it dumps IMO.  When is the hard part.
2021-04-26 13:06:16,stocks,Could dip then moon once Robinhood users pile in. Who knows
2021-04-26 14:09:53,stocks,It was rumored this morning. Idk
2021-04-26 11:47:07,stocks,Enterprise value/EBITDA of almost 60. Its up over 200% past year. I have been following but waiting for a bigger pull back.
2021-04-26 11:12:38,stocks,I think people are going to be spending less on crafts and more on hospitality for the next year.
2021-04-26 12:40:00,stocks,"You could fall victim to IV crush. If I'm not mistaken, the day before earnings, big moves have been priced in on either end. The uncertainty goes away after earnings."
2021-04-26 15:21:45,stocks,">Should I hold through earnings?

Holding calls through earnings is a gamble that could go either way. Last earnings AAPL gave its best earnings ever, and stock went down. It went up when it announced a split a few quarters ago, but that kind of surprise good news is unlikely again so soon. Maybe they announce something special? I doubt it, I'd sell the news. you do you."
2021-04-26 13:10:15,stocks,"i can't see apple going any lower

but it also might not move after earnings.

high expectations and guidance have probably been priced in since its climb from $119 to current price."
2021-04-26 13:52:31,stocks,"I actually was recommending/considering that stock a month ago, the financials were great."
2021-04-26 14:59:53,stocks,"MTCH has been my 200IQ reopening play since February. Unfortunately it hasn’t worked out yet as I bought in at a terrible time, but I’ve been averaging down and finally broke even today. Feeling good about where things are going now.

I like them because the dating scene is going to be huge once most people are vaccinated and places start opening up. Think of how many people were afraid to even consider dating because they didn’t want to meet up with strangers or go out to a bar and get infected. Now in America at least it’s game on. They also own literally every popular dating app except Bumble. Monopolies are awesome! (for investors)"
2021-04-26 15:17:50,stocks,"Your brokerage should automatically clear those out, timeframe depends on the brokerage. Yes you will be paid."
2021-04-26 15:08:26,stocks,Why would you have to sell whole shares of a stock? It would be odd to have fractions of a stock and not be able to trade.
2021-04-26 15:37:13,stocks,who all seen the leprechaun say YEA
2021-04-26 07:03:00,stocks,MA/RA + RI/OT too
2021-04-26 07:44:35,stocks,"Bitcoin up 9%, I'm surprised it's only 5%. Might buy some calls at open"
2021-04-26 14:12:51,stocks,"It really shouldn't do anything but after Apple and Tesla announced their splits last year, the Nasdaq went on to wreck **** up until shortly after the splits were finalized, then got hit hard.

Which is why I said get the popcorn ready in the case of it being true."
2021-04-26 14:48:55,stocks,"Good afternoon, still bag holding my NIO shares @ $52"
2021-04-26 15:40:02,stocks,how dare someone sell
2021-04-26 07:59:22,stocks,Futures are red but I don't think it'll be worse than last week which recovered fine from a real bad Monday and Tuesday
2021-04-26 11:56:39,stocks,I love Donkey Kong.
2021-04-26 16:11:05,stocks,tsla flat (as of now). Literally what no one expected.
2021-04-26 11:07:34,stocks,Not if you're a long term holder
2021-04-26 11:04:09,stocks,Buy the rumor sell the news
2021-04-26 16:01:54,stocks,Hopefully earnings are good!
2021-04-26 16:17:41,stocks,what are you holding?
2021-04-26 09:48:03,stocks,Bought some thx
2021-04-26 14:34:35,stocks,this is how I know it'll be red by the end of the week
