Timestamp,Subreddit,Post/Comment
2021-06-07 19:49:11,stocks,"Start with fidelity. No fees, massive reputation. Your money is safe there. They have plenty of resources for analysis, advisement, support, and research. Decent enough app, clean website. Did I mention it's free?"
2021-06-07 19:57:48,stocks,Wealthsimple if Canadian. I use questrade. But I do alot of USD so it makes more sense.
2021-06-07 19:57:57,stocks,"Thanks! A quick look into Fidelity and it seems pretty reliable. May I ask if you know how it compares to the app I was looking at in Wealthsimple? They seem rather similar, however Fidelity does seem to have a more known reputation."
2021-06-07 19:59:30,stocks,Noted! May I ask why Wealthsimple is good specifically for Canadians (which I am one of)?
2021-06-07 19:33:55,stocks,"Peter Lynch ""worked at Fidelity"" is putting it lightly hahaha"
2021-06-07 19:00:31,stocks,"I love how much he weighs on fundamentals, since that’s the difference between a good and a bad company. That can make or break your investment."
2021-06-07 19:48:02,stocks,"His book was one of my key training materials early on. I don't necessarily follow him like a sheep, but there are some good lessons that can be learned right there."
2021-06-07 19:37:10,stocks,">	“It can’t go any lower.” Never make such an assumption. A bad company can and will go lower.

*AMC has entered the chat*"
2021-06-07 19:14:12,stocks,1st bullet point reminded me of COIN
2021-06-07 18:28:52,stocks,First *U.S. listed* psychedelic ETF (not the first globally).
2021-06-07 18:29:41,stocks,"Yes true, I’ll edit to say first US listed one."
2021-06-07 18:32:31,stocks,"Seems one thing that’s different from PSYK is that this one has more cannabis holdings, which is interesting and at least to me seems like a bit of a different space."
2021-06-07 19:12:56,stocks,"Id stick with low cost vanguard etfs. Here some to name a few. VOO, VTI, VBK, VOT, VGT, VUG."
2021-06-07 19:20:40,stocks,Vti vxus your done
2021-06-07 18:45:49,stocks,VXUS? Some more broad market exposure. QCLN may be in for a bit of a rough ride still.
2021-06-07 19:21:40,stocks,"I should then do only VT, or should I 60/40 VTI/VXUS"
2021-06-07 19:25:15,stocks,Don’t listen to me I don’t want to give you bad advice.... it will be something to research
2021-06-07 18:25:18,stocks,"If you no longer work for the employer you may not even be entitled to said shares, check your contract or contact your employer to sort it out."
2021-06-07 18:08:03,stocks,That a question for your employer. I was in a similar situation and they just bought us out without the option to keep them or convert them.
2021-06-07 19:20:36,stocks,What is the company?
2021-06-07 17:29:47,stocks,"If you're just buying stocks because you hear them on reddit/news sites, I'd go with an ETF.  Beyond that, if you want to actively track your investments and make changes based on quarterly reports, 3-5. If you just want a sampling of stocks from different sectors and you want to pick names that you think might win against their competitors, diversifying is fine"
2021-06-07 19:06:53,stocks,"You can't diversify too much. You can diversify *incorrectly*. Broad diversification should be done though ETFs, to *properly* manage a portfolio of 20 individual stocks you're basically committing to a lot of work. Possibly even as much as a part time job. If you were to replace 60-75% with broad market ETFs, then you have the time to do the research to find better quality companies to put that remaining 40-25% percent in. How big you make those pieces of the pie is determined by your risk tolerance and your willingness to do the initial DD to find positions and the time your wiling to spend to follow the companies to ensure the health of your investments."
2021-06-07 19:28:47,stocks,I'd be very careful to do my homework before investing in any stock hyped on Reddit or other social media. Plenty of times it's just a pump and dump scheme designed to take advantage of your FOMO to get you to buy in near the peak instead of the dip. They'll sell as soon as you buy in and then the price dumps.
2021-06-07 17:39:36,stocks,I would say buy the stocks you are willing to follow.
2021-06-07 17:40:32,stocks,"Don't buy every stock you hear about in reddit, or at least if you do do research first and come to that conclusion. Right now what is happening is a lot of stocks that are very beaten down/heavily shorted are rebounding and due to the nature of volatility, they're rebounding very fast. It's also easy for the rebounds to crash very shortly after.

Don't chase the money, you wouldn't have wanted to buy into any of these stocks 2 months ago when they were all down 40+% but now that they're jumping up you want in. If you did buy into these stocks that are all shooting up rn, you'd have wanted to get in about a month ago."
2021-06-07 18:07:25,stocks,"I diversified too much, and my Schwab IRA account was down 0.04% today and my TD Ameritrade account was up 0.04% today."
2021-06-07 18:22:50,stocks,"If you want stocks and are just getting started buy stocks in large companies that have little chance in disappearing in 10 years.  Buy the stocks.  Then forget about it.  Log in once q quarter and see how they are doing.

Look into dividend stocks.  Look into dividend reinvestment.

Don't look to get rich quick. 

It takes money to make money in the stock market.  (Plus time)"
2021-06-07 19:59:25,stocks,"3-5 is too few unless you're variance seeking (most people are variance averse). I think there are scenarios where it makes sense but I can't recommend it in general. 

If you're going to own more than say 30 you might as well buy a broad ETF.

If you want to assemble a portfolio I recommend targeting owning 12-24. Personally I'm in the lower end of that range."
2021-06-07 17:14:31,stocks,"Concentration builds wealth, diversification preserves wealth. Figure out what you're looking for and adjust accordingly."
2021-06-07 18:44:03,stocks,"15-30 holdings max with a 60% US stock holdings, 25% foreign stock holdings and 15% bonds/ETF's is my personal strategy."
2021-06-07 18:15:39,stocks,"I have a bunch of stocks that are doing relatively well but they're in smaller quantities. I think for now it doesn't matter if you diversified too much, just slim down and increase positions in companies you've really liked and are doing well. That's what I'm doing at least."
2021-06-07 17:30:22,stocks,"Modigliani and Miller had a take on this one. I’d however prefer an highly diversified ETF (e.g. MSCI WORLD, ACWI,...) over single stocks and look into the core satellite strategy if your portfolio is larger than 30k USD or equivalent."
2021-06-07 17:32:57,stocks,I add about $5-800 a month and am investing in small positions as you described but also putting some in ETFs for bonds. When I want to make a big investment in a concentrated sector I’ll sell the ETFs first. The ETFs go up when the market goes down and I get monthly dividends. I did the concentration for EV chargers and it’s finally paying off but I just wish I didn’t do it all at once. My goal is to be able to concentrate my investment closer to the floor without loosing gains in the mean time.
2021-06-07 19:34:55,stocks,Ray dalio has a few videos on diversification
2021-06-07 19:51:59,stocks,"It’s hard to keep track of everything if you’re not doing it full time. I was swing trading like 30 stocks earlier this year. Sometimes I’d see that something spiked for an hour or so (I’d usually sell at a spike) but I completely missed it because I can’t sit there and watch all my shit all day. Alerts help, but when you have that many, sometime they go off too often and go ignored.

Now I’m down to 5 or 6, plus an ETF for my long term holding. It’s much easier to track and trade like that throughout the day. I’m doing everything from my phone though. If I had a desk job when I could have my portfolio on a separate screen all day, maybe I’d do it differently."
2021-06-07 19:59:02,stocks,"Stop buying the stock that has gone up +5% every day for three days.   Consider stocks that have suffered for 3 days.  Look for good value, not popularity.

I honestly don’t trust Reddit at all, but I do trust the fact that if Reddit isn’t talking about a stock much or at all, it may be very good value."
2021-06-07 18:12:42,stocks,">If you're just buying stocks because you hear them on reddit/news sites, I'd go with an ETF.

what /u/PM_Me_Things_Yo_Like isn't saying but should be said, is that if you invest like an idiot you're better off just going with a safe ETF because you WILL get burned"
2021-06-07 19:56:38,stocks,"Concentration *can* build wealth. It can also make you poor.

Lots of people have built wealth through investing in widely diversified index funds."
2021-06-07 17:29:19,stocks,"That is just not true.

Diversification is very important and has a huge effect on risk-adjusted returns."
2021-06-07 17:33:36,stocks,You might factor in steadiness and things change again. Everything is just funny money until it’s hard cash or sitting on your bank account and sadly after tax.
2021-06-07 17:34:42,stocks,I see on your avatar that you are a man of culture as well. I also agree on your take.
2021-06-07 19:56:33,stocks,"Yeah, go and pick 30 stocks to diversify your $3,000 stock portfolio. You will grow that to a billion dollar in 1000 years.

Diversification only matters more once you build your wealth to a more respectable level where risk of losing a large amount is impactful. As of most new young audiences on reddit, they should be focusing on honing their skills to earn more incomes rather than to invest."
2021-06-07 19:59:05,stocks,"Risk-adjusted and total returns are two different things. Every academic and professional study unanimously confirms diversification to dilute total returns. None of that is to say diversification isn't important, but it's not the best way to build wealth."
2021-06-07 17:35:36,stocks,"Haha i’m not on WSB, i enjoy the madness over there though. Like the avatar"
2021-06-07 17:42:57,stocks,Couldn’t agree more!
2021-06-07 17:02:04,stocks,"Welcome to r/stocks!

For stock recommendations please see our portfolio sticky, sort by hot, it's the first sticky, or see [past portfolio stickies here.](https://www.reddit.com/r/stocks/search?q=author%3Aautomoderator+%22Rate+My+Portfolio%22+-+r%2FStocks+Quarterly+Thread&restrict_sr=on&include_over_18=on&sort=new&t=all)

For beginner advice, brokerage info, book recommendations, even advanced topics and more, please read our [Wiki here.](https://www.reddit.com/r/stocks/wiki/index)

If you're wondering **why a stock moved** a certain way, check out [Finviz](https://finviz.com/quote.ashx?t=spy) which aggregates the most news for almost every stock, but also see [Reuters](https://www.reuters.com/), and even [Yahoo Finance](https://finance.yahoo.com/).

Also include *some* [due diligence](https://www.investopedia.com/terms/d/duediligence.asp) to this post or it may be removed if it's low effort.

*I am a bot, and this action was performed automatically. Please [contact the moderators of this subreddit](/message/compose/?to=/r/stocks) if you have any questions or concerns.*"
2021-06-07 17:05:59,stocks,"Unless you need the money, there is no reason to sell, especially as you would be triggering a taxable event."
2021-06-07 17:03:53,stocks,Amazon is a buy and hold forever stock. So don't sell unless you need the money IMO.
2021-06-07 19:40:51,stocks,Wait to see if Bezos gets killed in the rocket launch.
2021-06-07 18:07:10,stocks,"Savings accounts don’t even pay enough to keep up with inflation, moving your money to one guarantees that you lose value over the long term. If you don’t need the money right now, hold that stock."
2021-06-07 17:59:08,stocks,"So I'm trying to understand this- why is Amazon a buy and hold stock at this price point and valuation.

I'm not bullish or bearish on it and I keep seeing this response when it comes to holding or selling it."
2021-06-07 17:26:39,stocks,HODL
2021-06-07 17:02:03,stocks,"Welcome to r/stocks!

For beginner advice, brokerage info, book recommendations, even advanced topics and more, please read our [Wiki here.](https://www.reddit.com/r/stocks/wiki/index)

If you're wondering **why a stock moved** a certain way, check out [Finviz](https://finviz.com/quote.ashx?t=spy) which aggregates the most news for almost every stock, but also see [Reuters](https://www.reuters.com/), and even [Yahoo Finance](https://finance.yahoo.com/).

Please direct all simple questions towards the stickied Daily Discussion and Quarterly Rate My Portfolio threads (sort by Hot, they're at the top).

Also include *some* [due diligence](https://www.investopedia.com/terms/d/duediligence.asp) to this post or it may be removed if it's low effort.

*I am a bot, and this action was performed automatically. Please [contact the moderators of this subreddit](/message/compose/?to=/r/stocks) if you have any questions or concerns.*"
2021-06-07 19:53:54,stocks,"The stock price does not matter. Price ≠ value. By that logic, people need to sell their $BRK.A shares."
2021-06-07 18:24:46,stocks,I am going to tell you exactly what to do with your AMZN stock... No I'm not.
2021-06-07 19:51:05,stocks,I'll take your remaining share off your hands for a dollar.
2021-06-07 17:06:33,stocks,Thanks for your input.
2021-06-07 17:06:17,stocks,I see. Thanks for your input
2021-06-07 18:08:09,stocks,Thanks for your input
2021-06-07 19:04:02,stocks,"Amazon has their hands in just about everything these days. They are not just a online retail space.

Will be a $10,000 stock someday."
2021-06-07 19:36:19,stocks,Maybe in like 20 years yea
2021-06-07 17:25:45,stocks,Are you sure you have a cash account?  Many brokers have margin as the default account type.  This is a special kind of margin that allows them to give you instant deposits and instant settlements etc but don't let you actually take out a margin loan or day trade.  Robinhood is one broker that does this.  Technically it is still a margin account and is subject to the margin agreement which allows them to loan out your shares.
2021-06-07 16:56:56,stocks,"What broker?

I am on Fidelity and they do not loan shares unless you have over 250K and approve the lending out!"
2021-06-07 17:01:12,stocks,"Who cares if they lend your stock?  If you have to worry about the few shares you own in a stock being shorted and you have to watch the daily movements, you're not doing this properly."
2021-06-07 17:31:30,stocks,"That sounds likely, I can’t buy on margin with my account at all, but given that they can loan my shares out that makes a ton of sense."
2021-06-07 17:02:18,stocks,"Stash, told me I was automatically enrolled."
2021-06-07 17:09:22,stocks,"Uh, clearly the OP? Doesn't matter how many shares he has, if he had not intended for them to be borrowed, then why would he be okay with it? Not only that but OP doesn't say how many shares he has or how often he looks at them, so I don't know how you make those assumptions."
2021-06-07 17:15:19,stocks,"I did mention I am a new investor, I’m still learning the ropes. I’m mostly bothered due to being automatically enrolled and then not informed about it. 

I was under the assumption that cash accounts couldn’t have their shares lent. I thought I’d ask here to check and see if I was wrong or not."
2021-06-07 17:22:09,stocks,"Move over to Fidelity is all I can recommend!

I am not familiar with Stash but if they are lending your shares out to potentially short your position they are not your friend!"
2021-06-07 17:13:25,stocks,"Obviously he is,  the point is that only someone who doesn't know what they are doing would worry about the day to day movements.  Sorry,  but my time is way too valuable to worry about whether my stocks went up or down every single day, and I would never spend even more time if I'm worried that it is being shorted. If that's the case,  I wouldn't be cut out for the market.

I would also consider it a safe educated assumption that he's not talking about having hundreds of thousands of shares of a particular security on a cash account without knowing the interworkings of the market.  When it comes to shorting, 100,000 shares is generally HTB if that's all that is left. If the security has more available short shares than you own,  again a waste of time worrying about. 

I didn't call and check to see if my house was worth more today either."
2021-06-07 17:25:51,stocks,"I transferred over to Ameritrade over a week ago, I was going to pick Fidelity (heard a lot of good things) but they don’t cover the Transfer fees. Unfortunately, the majority of my shares are still stuck behind in Stash due to them still being borrowed."
2021-06-07 17:15:38,stocks,Your time is too valuable yet you're here on Reddit. The OP asked a simple question and you're here trying to brag about yourself and not adding anything valuable.
2021-06-07 17:18:32,stocks,"Actually, my original post didn't even mention myself. I'll let you get back to watching your after hours tickers now."
2021-06-07 17:20:21,stocks,Except your second comment did. Notice how you again made an assumption when I didn't specify. I'll let you get back to your reading comprehension class now.
2021-06-07 17:32:12,stocks,"That company is Canadian and its share trade primarily on the TSE with the symbol WELL (or [WELL.TO](https://WELL.TO)). In the US, shares are only available on the OTC pink sheets market (sometimes referred to as PINX), and many brokerages don't cover pink sheet stocks and/or will charge additional fees for trading in this market."
2021-06-07 17:34:07,stocks,I see. That makes sense. I'm still kinda new to this and was unaware. Thank you for your response!
2021-06-07 17:11:28,stocks,"Maybe a stupid question, but why dilute to just rebuy?"
2021-06-07 19:12:09,stocks,"$120 cost basis here, really didn’t like overpaying for depop and now this…Do i dump on open tomorrow?"
2021-06-07 17:30:22,stocks,The cynical thought is they're trying to blunt the impact of the news release. The more optimistic thought is they consider their share price cheap and are willing to take on debt to buy back now. I'd guess the future price will ultimately dictate that narrative.
2021-06-07 17:33:42,stocks,"well only 150million is for buybacks out of 1billion. They think the stock is cheap and will go up in value, at which point they can sell them again if they please."
2021-06-07 18:04:37,stocks,"Despite their intentions, offerings always have a negative undertones and sensitive shareholders typically react bearishly. 

Disclaimer = bagholder at $199"
2021-06-07 16:38:07,stocks,"Read title read first sentence, confused. If you know it’s not good to time the market why are you trying to do it?"
2021-06-07 17:08:17,stocks,"I have some fundamental questions on what you are hoping to achieve but just to get to the point and answer your question

If you have shares that are over 1 year, then you should sell those out in FIFO order. This is especially so as you said you hold these stocks and it would be a trimming or rebalancing event. That gives the newer shares a chance to become older shares."
2021-06-07 16:52:54,stocks,"Same as u/funpolice99

Why you want to rebalance if you invest long term?"
2021-06-07 17:20:47,stocks,"If you had many shares, which you started buying many years ago and continued to buy every year, why wouldn’t you want to sell the shares just older than a year, so you would only pay long term capital gains, in order to pay less taxes this year? What is the benefit of using FIFO if you’re going to continue to hold as much as you can? Why wouldn’t you pay the least taxes possible now? (Sorry - this stuff easily confuses me! Thanks for any clarification)"
2021-06-07 17:31:48,stocks,"What I described is minimizing taxes. Anything over 1 year has the same tax rate so it doesn't matter if it's just over 1 year old vs 3 years old. If you use normal brokerages, you have the choice of FIFO or LIFO for your sales"
2021-06-07 17:36:05,stocks,"But everything over 1 year doesn’t necessarily have the same cost basis. If you chose a tax lot that was more recent than the oldest, but still older than 1 year, it would reduce your capital gains tax owed this year compared to selling FIFO, no? Because the cost basis of the more recent shares would be higher (maybe - obviously this could not be the case as well, I guess I’m assuming a near constantly appreciating stock, however slow, so maybe that’s not right,) or I have some other misunderstanding."
2021-06-07 17:44:17,stocks,"Your understanding is correct. So it really isn't so complex - theorically you can choose which cost basis you are selling if you do your taxes manually. Otherwise, its usually FIFO. Its up to you.

For taxes for long term, although the net tax amount will be higher for lower cost basis stocks, in the end whether that is next year or 10 years from now, it is tax you will have to pay. The assumption is that the total outlay of tax will remain the same for all long term stocks"
2021-06-07 17:49:14,stocks,"That is true, you do have to pay it eventually either way. I guess I’m thinking of it from my age, early 30s, and wanting to pay the least amount I can this year in order to preserve as much net worth as possible and gain time in the market but maybe that’s purely emotional with no rational reason. But maybe the tax hit won’t be as big if your income/net worth is higher then that it is today? Or it still doesn’t matter? I really can’t come to a conclusion haha"
2021-06-07 16:22:51,stocks,You could roll it and collect the premium. Also it might go down below 11 later on
2021-06-07 16:48:39,stocks,"If you don't want to exercise  your call, you can make a 'buy to close' for the same price and date you have your covered call open for.  You'll pay a premium, but if you really want to keep the shares and don't want to sell them, it's an option."
2021-06-07 16:35:59,stocks,"I saw the clov pump yesterday. Two separate bullish DD posted within an hour of each other. My advice: don't invest in anything you see pumped here, just use it for general finance news."
2021-06-07 17:44:38,stocks,I’m in the same situation with $11 Covered Calls but I’m happy to get exercised and take the free cash. This is the downside to selling Covered Calls but a win is a win. He is right though a roll out is what I’m gonna do if it’s not exercised. 90% of my monthly income is from selling Covered Calls and I rarely get exercised. It’s just part of the game. Plus $2 per share on a $9 stock is a fantastic return plus premium.
2021-06-07 16:53:52,stocks,"“, it’s an option”. Well played sir."
2021-06-07 17:48:58,stocks,His issue is that he won’t be able to realize the full gains from the pump you mentioned not that he lost money. In other words your advice is counterproductive here.
2021-06-07 16:46:25,stocks,Please can I ask where you’d recommend people go to get investment ideas?
2021-06-07 19:21:21,stocks,Wsb. Why spend time researching for boomer stocks when you can ride the wave  and be up 30% a day
2021-06-07 16:04:31,stocks,"Welcome to r/stocks!

For beginner advice, brokerage info, book recommendations, even advanced topics and more, please read our [Wiki here.](https://www.reddit.com/r/stocks/wiki/index)

If you're wondering **why a stock moved** a certain way, check out [Finviz](https://finviz.com/quote.ashx?t=spy) which aggregates the most news for almost every stock, but also see [Reuters](https://www.reuters.com/), and even [Yahoo Finance](https://finance.yahoo.com/).

Please direct all simple questions towards the stickied Daily Discussion and Quarterly Rate My Portfolio threads (sort by Hot, they're at the top).

Also include *some* [due diligence](https://www.investopedia.com/terms/d/duediligence.asp) to this post or it may be removed if it's low effort.

*I am a bot, and this action was performed automatically. Please [contact the moderators of this subreddit](/message/compose/?to=/r/stocks) if you have any questions or concerns.*"
2021-06-07 16:09:19,stocks,As a long term holder I wouldn’t worry at all. This is just good for you. If the company have exceeded your price target just sell it. If not this will probably just strengthen the company for the long term.
2021-06-07 16:17:36,stocks,They've announced tons of new and expanded partnerships lately
2021-06-07 16:27:45,stocks,"The price still hasn't hit the 52wk high from shortly after they IPO'd.

There were big run-ups in price in Sept/Oct 2020 and in Jan 2021 and the recent price action isn't as much as it was then, so I don't see any reason to worry. The stock has been volatile since the IPO."
2021-06-07 18:10:14,stocks,"I wouldn’t worry, BYND is relatively expensive for what the you see happening in the meme stock world. BYND also has a good looking future as it’s a popular brand that doesn’t have the stigma that impossible meats has and I believe will likely be the leader as they continue to grow and innovate in a market that has seen substantial growth yr after yr"
2021-06-07 19:44:36,stocks,"Might be a bit of a meme, but does not seem like they are going at it that hard.

There has been some positive news about partnerships, increasing supply chains etc.

There was so pretty big negative news for there main comp, impossible, that it has 11X the pesticides of beyond, no idea if it is just FUD.

Finally there does seem to be a small rotation happening back into some of these future growth stocks. 

So it is likely some combo of all of the above causing the moves."
2021-06-07 19:44:53,stocks,It’s good fundamental hold
2021-06-07 16:18:31,stocks,How much profit do they make?
2021-06-07 16:11:51,stocks,"All my investments are long term. I guess, you do have a good point."
2021-06-07 16:18:16,stocks,And new leadership too.
