Timestamp,Subreddit,Post/Comment
7/1/2021 15:49,stocks,no
7/1/2021 18:24,stocks,Downvoted for asking for upvotes.
7/1/2021 10:12,stocks,It was 57 to finra sorry I fat fingered it
7/1/2021 13:34,stocks,"This is Reddit, your math is not welcome here, only emotions and basing conclusions off the headlines are."
7/1/2021 17:08,stocks,$12.6M in restitution is what's supposed to go back to the customers who were harmed. The rest goes to FINRA.
7/1/2021 18:29,stocks,"I think the extent to which you're suggesting people do DD is probably a bit much for most folks, but I upvoted for being on the side of good sense by telling people they should learn from reputable sources rather than memes and echo chambers full of idiots.

Also for pointing out the advantages of PFOF. People don't realize that's what helped get rid of the trading fees, which disproportionately eat into the returns of retail investors. Everyone's mad at RH and other brokers for doing exactly what allows them to get into trading individual stocks and performing squeezes on GME shorts."
7/1/2021 8:15,stocks,"**[United_States_securities_regulation](https://en.m.wikipedia.org/wiki/United_States_securities_regulation)** 
 
 >Securities regulation in the United States is the field of U.S. law that covers transactions and other dealings with securities. The term is usually understood to include both federal and state-level regulation by governmental regulatory agencies, but sometimes may also encompass listing requirements of exchanges like the New York Stock Exchange and rules of self-regulatory organizations like the Financial Industry Regulatory Authority (FINRA). On the federal level, the primary securities regulator is the Securities and Exchange Commission (SEC). Futures and some aspects of derivatives are regulated by the Commodity Futures Trading Commission (CFTC).
 
^([ )[^(F.A.Q)](https://www.reddit.com/r/WikiSummarizer/wiki/index#wiki_f.a.q)^( | )[^(Opt Out)](https://reddit.com/message/compose?to=WikiSummarizerBot&message=OptOut&subject=OptOut)^( | )[^(Opt Out Of Subreddit)](https://np.reddit.com/r/stocks/about/banned)^( | )[^(GitHub)](https://github.com/Sujal-7/WikiSummarizerBot)^( ] Downvote to remove | v1.5)"
7/1/2021 18:46,stocks,"Stop spreading lies, NBBO provides traders the best price, not PFOF."
7/1/2021 17:09,stocks,"I call them bribes, same difference."
7/1/2021 15:18,stocks,I was already all in
7/1/2021 18:34,stocks,"Bullshit, they stopped the squeeze because they didn't buy the shares in the first place and couldn't possibly locate them. 

I'm out millions in gainz"
7/1/2021 10:56,stocks,"No PFOF, big time brokerage that backs itself. The app has been steadily improving, I think with the Exodus from RH they poured some funding into it. Also you can call and get personal financial advice. Bonus if you already have a 401k or HSA through them"
7/1/2021 13:37,stocks,Also may I add Vanguard and Charles Schwab are excellent choices as well
7/1/2021 11:27,stocks,"Apex imposed the trading halt on GME along with RBH.. mattered to me, cost me 250k"
7/1/2021 18:45,stocks,You didn't say it's addictive and causes the same mentality as a casino. You said it was an illegal casino. Which did you mean? That it's addictive or that it's an illegal casino?
7/1/2021 12:38,stocks,"You do realize FINRA isn’t a government agency correct… it doesn’t have the power to put anyone in jail or dissolve companies.


The SEC hasn’t assessed any fines or penalties yet but has an ongoing investigation."
7/1/2021 16:21,stocks,Exactly don't know why the fuck I'm getting downvoted for comment.
7/1/2021 16:23,stocks,"Regardless of this sentiment on Reddit, Robinhood has grown a ton in the last year

https://www.google.com/amp/s/www.cnbc.com/amp/2021/07/01/robinhood-has-18-million-accounts-managing-80-billion-after-rapid-one-year-growth-ipo-filing-shows.html"
7/1/2021 17:25,stocks,"90% of democrats don't share Elizabeth Warrens views. Hell, Elizabeth Warren doesn't even share Elizabeth Warrens 2019 views. She sold out to Biden and the DNC, who have backed down on repealing or changing many things that happened during the Trump administration.

Voting does nothing in this regard because at the moment, our top political parties are dominated by neoliberals and neoconservatives. Both groups are economically conservative."
7/1/2021 9:12,stocks,6 action figures
7/1/2021 17:48,stocks,"Just because you read some bullshit on investopedia doesn't make it true.

Shorting a stock is unethical on its own merits, manipulating a stock with a coordinated short among deep pocket market makers is illegal."
7/1/2021 7:00,stocks,"I doubt it since Robinhood likely did not do anything illegal with regard to the GME situation.








EDIT: To everyone downvoting me, please let me know what laws were broken and what Robinhood should have done instead. I have a feeling you don't actually know much about the GME situation."
7/1/2021 2:06,stocks,">If you see nothing wrong with a service executing orders during after hours when the contract I signed specifically stipulated after hours trading isn't available.  

Not sure how we're supposed to see something wrong with that when you didn't mention it at all until just now.   

>Furthermore, the actual stock did not decline by that amount. I'm not sure if it's just a visual error my end, but either way it's sloppy.

Sounds legit."
7/1/2021 16:39,stocks,"Oh ok , thanks for that correction.."
7/1/2021 12:27,stocks,He's a racist douche from his post history. Conservative subs and racist comments
7/1/2021 17:42,stocks,The people who are being paid can also sue if they think they can get more.
7/1/2021 15:21,stocks,Same here. In for as long as it takes.
7/1/2021 13:48,stocks,Schwab locked the buy button too.
7/1/2021 11:32,stocks,"I mean yeah I lost a shit ton of money myself. My point is, a lot of brokerages use or used APEX. They're not great. Any brokerage that uses them will essentially, when it REALLY matters, operate the same."
7/1/2021 17:55,stocks,How did it cost you money? You could always sell. There was no limit on cashing out.
7/1/2021 16:30,stocks,"> Exactly don't know why the fuck I'm getting downvoted for comment.  

Because personal anecdotes aren't reflective of the reality, which is that they've grown by leaps and bounds."
7/1/2021 18:03,stocks,"You should really brush up on your stock market 101 materials, bud"
7/1/2021 7:02,stocks,"Of course not, just like these fines they've received. Surely they wouldn't do anything illegal right?"
7/1/2021 14:49,stocks,"I didn’t see any racist comments, just things that people who call everything racist tend to disagree with."
7/1/2021 12:45,stocks,"ya, he's marked as deplorable by reddit pro tools...I'm just amazed at how he managed to turn this into an anti-mask thing and people are upvoting it."
7/1/2021 17:48,stocks,The point is that it's not 5x.
7/1/2021 17:07,stocks,Not true
7/1/2021 18:39,stocks,"I mean, I literally paid off my house, my vehicles and my cabin and looking at my accounts Today am still sitting on  [over $500K ](https://i.imgur.com/RLv5q6n.png) after brushing up on the market the past 2 years.

But go on, teach me your ways."
7/1/2021 7:11,stocks,I'm certain that you're clueless about the GME situation so let's start off simple. What did Robinhood do that was wrong or illegal in the GME situation?
7/1/2021 15:02,stocks,"He has removed comments in conservative for being too racist. That's a low bar for racism there.

Especially his comment chain that involved black and Chinese people."
7/1/2021 13:36,stocks,That's Reddit for you
7/1/2021 18:26,stocks,"OP didn't say victims were getting 5X their losses. He said RH was ordered to pay 5X what they cost the victims, and the victims are getting their claims back, plus interest.

The point is that RH does not profit from this in the end."
7/1/2021 17:56,stocks,"https://www.thinkadvisor.com/2021/01/28/schwab-td-ameritrade-put-brakes-on-some-gamestop-trading/

https://www.reddit.com/r/wallstreetbets/comments/l6xlw3/robinhood_td_ameritrade_charles_schwab_trading/?utm_source=amp&utm_medium=&utm_content=post_body"
7/1/2021 19:43,stocks,What does any of that have to do with you not knowing basic definitions and mechanics? Lmao
7/1/2021 7:18,stocks,"I’m a little confused friend, are you unaware that Robinhood turned off the buy button for Robinhood users and force-sold their GME shares?

Here’s some links, give it a few reads: https://www.google.com/amp/s/www.theverge.com/platform/amp/2021/1/28/22254102/robinhood-gamestop-bloc-stock-purchase-amc-reddit-wsb


https://www.google.com/amp/s/www.theverge.com/platform/amp/2021/1/28/22254857/robinhood-gamestop-amc-shares-sold-surprised-users"
7/1/2021 18:34,stocks,I didn’t finish the document- did you catch the interest that is being paid out?
7/1/2021 7:41,stocks,"First off,








>Robinhood users and force-sold their GME shares?





I have never seen anyone back this up on Reddit or otherwise. A Verge article that talks to a total of 1 person doesn't prove anything. Also, closing a trader's positions if they are using margin or implementing a strange option strategy is common practice by every single broker when markets get crazy. It is allowed and not illegal in any way. If they sold off actual shares and there was actual evidence of it happening to people then you may have an argument.







Second, 





>are you unaware that Robinhood turned off the buy button for Robinhood users









This also isn't illegal. And, Robinhood literally had to do this due to not being able to meet the new margin requirements set by the DTCC hours prior. Legally, all brokerages must clear their trades through a clearinghouse. So, either Robinhood breaks the law and doesn't clear their trades or it has to stop people from buying to lower the requirements. Pretty obvious choice and easily the right thing to do.






The point of the clearinghouse is to secure both sides of the trade. If a brokerage doesn't use a clearinghouse then there is a risk of you buying/selling a stock and getting nothing in return if the counterparty can't complete their side of the trade."
7/1/2021 18:35,stocks,"I didn't, I was just clarifying that the previous poster misunderstood the post he was responding to a bit up the thread. 

Ultimately, $70M seems to be a lot more than they made ripping people off, which makes this an effective punishment I'm sure RH is not happy about."
7/1/2021 8:46,stocks,">I have never seen anyone back this up on Reddit or otherwise.

Of course not.  You're assuming this reddit is a sensible crowd.  

That other sub that starts with a 'W' and ends with a 'B' blew up from 2MM to 9MM subscribers overnight... those and the people in the highbrow /stocks sub certainly didn't come armed with informed takes."
7/1/2021 18:02,stocks,"> This also isn't illegal. And, Robinhood literally had to do this due to not being able to meet the new margin requirements set by the DTCC hours prior. Legally, all brokerages must clear their trades through a clearinghouse. So, either Robinhood breaks the law and doesn't clear their trades or it has to stop people from buying to lower the requirements. Pretty obvious choice and easily the right thing to do.

Funny you should mention that, a Mr. Bodson with the DTCC specifically mentioned that requirement being waived for all DTCC members, contrary to what Robinhood CEO Vlad Tenev publicly announced....

[Page 4 last paragraph, I hate when users such as yourself spread lies.](https://www.dtcc.com/-/media/Files/PDFs/DTCC-Statement-February-2021-Mike-Bodson.pdf)"
7/1/2021 19:36,stocks,Dude you're seriously calling people out for not knowing the GME situation and you're spewing shit like you just read a marketwatch article for the first time about it last week.
7/1/2021 11:00,stocks,"while some brokerage firms are not self-clearing, RH is...wouldn’t that give them the flexibility to take steps less rash than outright banning buy orders for those particular stocks? Many other self-clearing firms (e.g. Fidelity and Vanguard) must have also been given the new collateral requirements from DTCC, yet they did not restrict GME or AMC buys."
7/1/2021 16:15,stocks,"You are completely correct. The only point I would raise is that when Robinhood shut down buying on GME, Vlad came out and specifically said it wasn’t because of liquidity issues, and from my understanding it definitely was because of that. Correct me if I’m wrong. So they mishandled the fuck out of that situation, which is why people are still upset."
7/1/2021 19:53,stocks,"Please point any problems in what I've written. Also it's pretty easy to check my previous posts and realize I've talking about this topic since it started.




Your comment is braindead."
7/1/2021 11:23,stocks,">while some brokerage firms are not self-clearing, RH is...wouldn’t that give them the flexibility to take steps less rash than outright banning buy orders for those particular stocks?






That doesn't matter at all. DTCC margin requirements aren't going to change based on who is doing the clearing. 








>Many other self-clearing firms (e.g. Fidelity and Vanguard) must have also been given the new collateral requirements from DTCC, yet they did not restrict GME or AMC buys.








Because collateral requirements are specific each brokerage based on the DTCC's risk calculations and the trades being done on each specific brokerage. If Robinhood's userbase was more active in trading GME and the other meme stocks during this period then the percent increase in the collateral requirement would reflect that and be much higher than other brokerages.






Robinhood had cash on hand for any potential increases in colleterial. They just didn't have 10x the typical requirement. And why would they? This type of increase in collateral is exceedingly rare and most brokerages probably haven't ever faced it."
7/1/2021 19:55,stocks,Hmm it's as though duration didn't improve your comprehension
7/1/2021 0:00,stocks,"Do all brokers charge for buying dtocks? So I'm still extremely new to investing, and I signednup for an account with Hargreaves Lansdown and put £100 into the account. But before I actually went to buy any stock I noticed that they charged £10 for each transaction. And I wasn't going to buy stock from a single company, I was going to buy some from multiple, but then thay would mean I would lose like 40% of the money I put into my investing pot. This seems very expensive, probably not a big deal for people who have been investing for a while or have just have more money, but I'm not super well off and that is a fairly large sum of money for me to just lose like that. 

Is this sort of thing the norm? Or is H&L just really expensive for some reason."
6/30/2021 23:39,stocks,Idk try r/dtocks
6/30/2021 23:45,stocks,"No most brokers are free US stock trades these days, at least for those living here.  If you are in the UK I'm sure they have similar.  Try Vanguard or Interactive Brokers."
7/1/2021 1:36,stocks,Firstrade been around since the 80s and has no fees for buying and selling. Their app's UI is superb
7/1/2021 4:59,stocks,"HL is expensive. Trading212 would be a good choice with your budget, it's cheap and you can use an ISA. Degiro and interactive brokers are also good choices, although interactive brokers does charge £6 on British stocks. Unless you use a broker with no transaction fees, like trading212, I would suggest only buying 2 stocks or ETFs at most, even a small fee of £1 is too much if you want to make a £10 transaction."
6/30/2021 23:43,stocks,"Nope that’s called “Paying to get the best price.” There are plenty of “free” trading platforms that make their money through “payment for order flow”. The rise of these platforms brought numerous millions of new retail traders to the space who wouldn’t have entered without them. In turn the millions have turned on them, because they dare offer a billion dollar service for “I guess... kinda not free.” So they are evil. 

But no for real, there are plenty of “free” trading platforms."
6/30/2021 23:43,stocks,"Thats a private sub.

Edit: lol I just saw my typo."
6/30/2021 23:46,stocks,So wait whats the difference between ones that chsrge and ones that don't? Surely theres some sort of small text on the free ones for them to make money.
6/30/2021 23:45,stocks,"What do you mean ""the best price?"" Are stocks cheaper on stuff like H&L than on these ""free"" ones? What one would you suggest for a poor newbie?"
6/30/2021 23:48,stocks,"Td ameritrade has no fees in the nasdaq, nyse, etc.. but its 5$ if you want foreign or otc markets

Edit:robinhood go get fuk"
7/1/2021 8:11,stocks,"Free brokers make money through various means. 

Loaning out your cash (to margin customers)

Loaning out your stock (to short sellers)

Pay for order flow (dark pools pay them to route your orders though them although they still have to guarantee you best possible execution)

Margin loans (they hope you will eventually become a margin customer and start having to pay for margin)

Note non-free brokers will also make money from these methods in addition to the fees they charge for trading.  Several years ago it became a race to the bottom when Robinhood started offering free trades and the other discount brokers that use to charge $7-$10 a trade started losing customers."
6/30/2021 23:49,stocks,"Many of the them make money on what you don't have invested like sitting in your money market account.    

Many also moved to free trades to compete with Robinhood and keep their customers."
6/30/2021 23:50,stocks,"Marginally cheaper in most cases. But marginally cheaper can mean hundreds, thousands, or more when buying in volume. Fidelity is free and I’m 95% sure it’s available in the UK. EToro probably is as well."
7/1/2021 9:36,stocks,Would you reccomend these free sellers over non free brokers?
7/1/2021 9:41,stocks,Yes.  The non-free ones do the same thing.  They always have.  They just make even more money from you.
7/1/2021 0:00,stocks,"Starlink plays   

TL;DR tickers: TSLA, ARKX, ROKT, UFO, INTEQ, IRDM, ASTS

We can’t invest in Starlink, and I wish we could. I’m looking for stocks & ETFs to benefit from Starlink and Starship. I am holding $TSLA IPO, and that’s good stuff.

First the ETFs. $ARKX. Kind of some out of the box choices, but it is clearly built around Starship being a big deal in coming years. Space will be much cheaper. I also have $ROKT & $UFO. Those aren’t geared around Starlink, but I want to own space stocks.

$GOGO. They sold their commercial aviation division to Iridium ($INTEQ.) The bankruptcy court approved INTEQ buying the division. I bought some INTEQ on the cheap, even though I know better than to buy a stock while in bankruptcy. (INTEQ is a huge government and military space server provider with lots of assets in orbit, btw.) Anyway, GOGO now only services private jets.  With no space assets and a dominant position for cell data, they could greatly benefit from Starlink.

While looking for Starlink plays, I found some stocks that seem to be outside of the reach of Starlink.

$IRDM. Iridium does old school sat phones. Pretty amazing for data emergencies if you are at sea or hiking on a mountain. These are places Starlink cannot cover well.

$ASTS. These cats are trying to send normal cell signals from satellites. Best I can tell, the tech looks legit. If it works, it will be very valuable. In fact, it will kill $IRDM, probably. I do not know if it will work, so this is a gamble. Worth the gamble, I think.

Got any other ideas for tickers that will greatly benefit from or immune to Starlink and SpaceX? Please share."
7/1/2021 0:14,stocks,What about the 7% stake Google has in SpaceX?
6/30/2021 23:09,stocks,take a look at SRAC as a possible related play
7/1/2021 0:07,stocks,ASTS is all I need. Easy 100 bagger. Legitimately expect to retire off my LEAPs in a couple of years.
7/1/2021 0:47,stocks,Thanks for reminding me to buy more ARKX <3
7/1/2021 9:58,stocks,Check out Scottish Mortgage Investment Trust. They hold a couple of interesting private companies and you’d currently get 1.2% SpaceX and 0.3% Relativity Space.
7/1/2021 10:27,stocks,Baron Partners Retail mutual fund BPTRX owns $340M of SpaceX
7/1/2021 0:20,stocks,I know about that.  Too diluted to buy Google to own SpaceX.  But it can't hurt too own Google.
6/30/2021 23:15,stocks,"That's a big pivot from going into weed, and I'll check it out.

E:  That's actual pie in the sky.  They are counting on Starship or some other cheap delivery solution before they go bankrupt.  I'm in!"
7/1/2021 0:49,stocks,Positions?
7/1/2021 0:45,stocks,It will work or it won't.   I bought some.  Please be my friend if your options hit.
7/1/2021 0:53,stocks,I'm going to buy some more based on your comment.  *tips hat*
7/1/2021 11:14,stocks,"So that would be 4.86% SpaceX based on their net assets being $7B, if I'm calculating correctly.  Interesting.

Looking at their top 10 holdings going down to as small as 3.22%, I don't see SpaceX in the list.  41.53% in Tesla, though.  Hrm.

Edit:  Other websites don't show it as a holding, but their own site includes it.  https://www.baronfunds.com/product-detail/baron-partners-fund-bptrx"
7/1/2021 0:56,stocks,"8K in LEAPs, and 80k in warrants, which are like LEAPs."
7/1/2021 11:21,stocks,Schwab has it as a holding of 805.7K shares valued at 338.4M. I really hope this is accurate because that’s the only reason I’m in this fund lol
7/1/2021 1:28,stocks,"Thanks - wow, big conviction play! I in & outed, but will be back at some stage. Was hoping this would be a ""sleepeer"" for longer and wanted to re-enter before the test launch."
7/1/2021 1:22,stocks,What is the value?  How much did you spend?  88k in options and other alternative plays?
7/1/2021 12:42,stocks,"I hope so, too.  I placed an order."
7/1/2021 1:31,stocks,"I know what you mean lol. I have some other stuff but I was planning to put it all into ASTS by the end of the year, because I wasn't expecting movement until the BW-3 launch at EOY."
7/1/2021 1:30,stocks,"88k is the value of my ASTS holdings right now, yeah. Cost basis is hard to count right now, but technically according to my broker I spent about 33k"
7/1/2021 3:29,stocks,"I'm curious as to what you think about this. I bought ASTS at 10$. I didn't put too much in, but Im considering to double down or even put in 3x the first amount. 

Would you wait or do would you put in an order at 12-13$? 

I work at a firm that's leading in the 5G area, in my country. I love the potential of this stock, but Im worried that my 30% gains are clouding my judgement."
7/1/2021 1:32,stocks,I love cost basis.
7/1/2021 4:05,stocks,"Tbh, I'm not sure how it will act from now on with its first price target it received from Deutsche Bank yesterday. That was huge for ASTS hence the 30ish% day it had.

12 could be the new floor, we'll see. I would wait for a day or two maybe to see how it stabilizes.

In the 10s, its an easy add for sure. 11s should be safeish too imo."
7/1/2021 4:08,stocks,"Thanks for the reply. Your thoughts run similar to my own. It seems like a good idea to watch how it acts these next few days.

I feel like 12 is a fair target. Taking into consideration that there's no product yet. 

Thanks for your thoughts."
7/1/2021 0:00,stocks,"Everyone is expecting a crash, so be greedy when others are fearful? So this week my email and youtube recommendations are full of ""THE BIGGEST CRASH IN THE HISTORY"", ""THE GUY WHO PREDICTED THE 2008 CRASH IS WARNING YOU"", and here on Reddit every day there is a post about an incoming crash, also the fear and greed index is the fear territory,   
so following the advice of the old man  "" Be fearful when others are greedy. Be greedy when others are fearful.""  
but on the other hand, the market is reaching a new ATH, so my question for the people who lived the previous crashes, was it fear the dominant emotion is driving the market? or everyone was partying and greedy and suddenly the sky fall on them?"
6/30/2021 22:59,stocks,"Predicting a crash is not what they mean when they say “fearful”

Fearful is when stocks are down so much that talking heads on TV start talking about whether stocks are even good long term investments anymore."
6/30/2021 23:39,stocks,"Be greedy when others are fearful means buying those stocks that are cheap because people have sold them.   (After a crash).  Before a crash,  be cautious when others are greedy. Build a cash reserve when others are greedy (if they are willing to pay for stocks that are significantly over priced,  then sell it to them)."
6/30/2021 23:17,stocks,"Yahoo has an article with the Rich Dad, Poor Dad author saying we are heading to the greatest crash in the history of the world.  IN THE HISTORY OF THE WORLD.... so presumably worse than 1929, worse than the 1930s... worse than 2009.  Worse than COVID nearly shutting down the global economy for a few months.   Worse than the Black Death, worse than the collapse of Rome.   All because of massive debts and endless spending.   But don't fret, because he's got it all sorted with some advice on how to prepare.  

Buy ammo and food and prep in a bunker full of batteries and drinking water?  Nope... buy gold, b***oin, start a business, and stop trying to live debt free...  I am not even joking.  His advice to prep for a near apocalyptic debt fueled economic collapse is to  leverage up and go put your life on the line by starting a business... a business that does well in economic collapses.  You know... for all of the customers that will be lining up for the end of the world."
