Timestamp,Subreddit,Post/Comment
04/01/2021,stocks,You used the phrase tits up wrong
04/01/2021,stocks,When are they expiring? Which etf/stock did u buy them to?
04/01/2021,stocks,"8 Tickers make up 45 % of the Nasdaq 100

7 if you count the alphabets as one

https://www.slickcharts.com/nasdaq100"
04/01/2021,stocks,"That’s because the are 4 of the worlds largest tech companies so barring any individual company news, they will have similar patterns. You can look at any similar companies in any sector and observe the same thing."
04/01/2021,stocks,"All these people pissing on your data. Idk man I think science projects like this are super cool. Yes more data is better but I don’t see anyone stepping up to offer you a job, pay your bills while you crunch stats. Thanks again for sharing."
04/01/2021,stocks,"Your website is a great tool for tracking your predictions, but claiming things like 'when Powell talks, stocks go down' is just as bad a predictor as any other singular factor is. I encourage you to back test the same thesis during every other month of 2020 and see how that holds up because 1 positive correlation over a short time frame can very easily be misleading.

There are a near infinite number of factors that affect the market as a whole and while Powell definitely has a lot of influence over prices, it's really just another small piece to the ever enlarging puzzle."
04/01/2021,stocks,"Yea I also thinking the early March lows were going to be the real lows for this correction and it's seeming that way now. I think more now we will see people entering back into the market and new investors not being as scared as they have shown online the past few weeks, which is dumb because they missed the lows but that's the market for ya, which will probably be more rising tide across markets then rotations. Just food for thought for your April predictions."
04/01/2021,stocks,TSLA better be lol
04/01/2021,stocks,Accurate username
04/01/2021,stocks,"Yes, but by how much?  It probably means we're entering a normal bull market instead of a raging one, but that's predicting the future, so no one can truly say."
04/01/2021,stocks,Did you try to profit on your predictions through short-expiry index options?
04/01/2021,stocks,"what do you mean?

like it we hit a new high theres a bigger chance of it going higher?

the same with the low?"
04/01/2021,stocks,Please DM me your portfolio and DM with every change you make so I can copy you and get money also.
04/01/2021,stocks,do you trade every day or how?
04/01/2021,stocks,Remindme! 3 months
04/01/2021,stocks,Your sample size of one month is surely going to repeat itself indefinitely.
04/01/2021,stocks,"Well, you predicted better than chance, so if if there's method to your madness you actually could predict the stock market, just not as well as you'd like to and not as often."
04/01/2021,stocks,"The big question is though, does this beat being in the market long term. It’s an excellent study, but it needs to be accurate. Can you provide info or a sub as to how you get along from here...?"
04/01/2021,stocks,">The highs and lows are more important than the direction.

This, right here. There are indicators that can predict to about 85% ish accuracy how high or low in lower time frames. Higher time frames, the accuracy drops."
04/01/2021,stocks,"That's true, but given the median error of the positive was lower than in the negative movements, and the market trended mostly sideways (average of 0), this should be a good enough estimate to make money."
04/01/2021,stocks,"Yeah, card counting gives you a 1% odds increase over the dealer in blackjack. And that's with the threat of bodily harm and being ejected from the casino."
04/01/2021,stocks,You realize you can be ~58% right just by purely predicting green every day? Green days are roughly 58% of the time.
04/01/2021,stocks,"Your comments mirror his in a lot of ways. I think you’d really enjoy the book. For sure different problems have different levels of complexity and the more variables there are the less accurate any one prediction can be. Modeling the behavior of these variables is sometimes extremely complex and a bug or bad assumption in your model can be difficult to trace. He concludes with Climate Change being the most difficult thing to predict because of the complexity and long time horizon - he caught a lot of flack for being a denier, which he’s not. People just have a hard time understanding things like confidence intervals."
04/01/2021,stocks,"My background is in IT and now behavioral psychology. I  tried in February and ended up being right about 88% with a +/- 1 day lag.

The one element that most analysts cannot account for is the emotional. It’s the logic vs creative issue (the mathematically gifted often are constrained by logic and therefore cannot think outside the box). 

I sold high and bought low February 88% of the time beginning with $1,500 and by the end was near $2,300. The biggest issue is when I started listening to other analysts’. My % when down in March. I’m still holding two stocks my gut was telling me to sell."
04/01/2021,stocks,"Awesome. I'll keep tabs on that and try to post a heads up in here. 

But no need to thank god, shorting is a thing. Or selling and rebuying..."
04/01/2021,stocks,The fact that you publicly posted it to let everyone criticize your methods is all the more impressive. Following so I can learn how to become a fortune teller too.
04/01/2021,stocks,"> only to find out he was a fund manager...

Thats a bit of stretch is it not? 

He was a chartered analyst that helped design financial analysis software."
04/01/2021,stocks,no he wasn't
04/01/2021,stocks,so I should sell everything today and buy back in monday morning
04/01/2021,stocks,"Since when does a worsening economy have any impact at all on the stock market? What is this, the sovjet union??"
04/01/2021,stocks,"Here's a thought on that:

Apple makes up \~11% of the NASDAQ by weight. So all else equal, a 1% move in Apple should cause a NASDAQ move of 0.11%.

If you see that they are correlated closer to 1:1 than to the weight 1:0.11 (so, a 1% move in the NASDAQ = a 1% move in the same direction in Apple), then that implies something more along the lines of what TrueFireOSP is saying - that this stock is mostly changing in step with the NASDAQ, or somehow driving sentiment for the whole NASDAQ .

I think the former is more likely than the latter, especially since it's estimated that 25-50% (maybe more) of the stock market is not individual stock holdings, but ETFs and mutual funds that track things like the NASDAQ."
04/01/2021,stocks,"Etfs and indexes hold almost half the stock market.

They used to track the stocks, now the stocks track them.

Michael Burry thinks there is a huge passive investing bubble where indexes prop up shitty companies because those companies track the index.

Idk if I believe that, results still matter, especially around earnings. But as the % of total investments in passive indexes and etfs rises, so too does the correlation.

Passive investing is safest play, but what if literally everyone does it?(not likely) Price discovery dies and it turns into a giant Ponzi scheme."
04/01/2021,stocks,"It doesn't make sense to me either, but when you look at graphs a lot of stuff looks identical to their indexes. I guess it could be coincidence, but I'm super new to this and still trying to understand."
04/01/2021,stocks,"Right. I think this is close, when in reality it's less the index, more the big weights in the jndex (specifically 🍎) which dictate direction of the majority. Apple and Microsoft have so much weight, but MSFT isn't nearly as volatile so it's really just ""which way Apple gon' go today?!"""
04/01/2021,stocks,"One thing that I'm questioning still, this is me just learning I guess at this point. I noticed people talking about shorting stocks and shorting ETF's with those stocks in them. How does an ETF being shorted impact the stock price?  


Those have been some of the outliers that don't trend with the index so far. At least on the stocks I'm watching."
04/01/2021,stocks,"I like that you use VTI as an example, as that's been my ""safe"" ETF that I harbor a good amount in for my IRA specifically. And I agree, if I see like a -0.5 move in my VTI, i can expect stocks that I have looked at within it to be amplified with movement."
04/01/2021,stocks,"is that why are you using google data and not power bi or something?

How does it scrape? Did you have to code anything?"
04/01/2021,stocks,"Interesting! I might steal a couple of those, namely tracking opening/closes for the past week. . A 65% win rate, if sustainable, is ""quit your day job"" level of accurate. Very impressive sir. 

I've been meaning to do pretty much what you're doing jusr on a dumbed down level for a while now I just haven't had the time. This is giving me some motivation to do it though :)"
04/01/2021,stocks,"I see a lot of people repeating those quotes from very old research like dogma, or worse, repeating recent research that is explicitly paid to confirm old research. Meanwhile some people are still outperforming the market.

Statistically, maybe not, but what do you care? You don't trade for your whole village."
04/01/2021,stocks,For 63% of their variance
04/01/2021,stocks,"I keep thinking ""Why isn't this a standard feature everywhere?"" And then I think ""Maybe it's not useful...""  

We shall see."
04/01/2021,stocks,"Spy, still holding, empire Tuesday"
04/01/2021,stocks,I don't get how the alphabets get away with being two.
04/01/2021,stocks,"Yeah, I have always found that to be a bit of over-influence.
Sometimes when I see the QQQ or COMP down heavy, I like to go to the heat map on ToS and see what else is happening. Sometimes it's just noise, sometimes loud noise, and sometimes a good opportunity to bargain hunt."
04/01/2021,stocks,"I read that part not as a prediction with future value, but more as a correlation from the last month. More as a proof of how hard the market is to predict, when stuff like this seems to correlate."
04/01/2021,stocks,"Need to make a multiple comparisons adjustment. When testing several hypotheses with the same data, it becomes more likely that one will be significant. if p value is 0.05, means roughly 5% chance it could be a false positive. Do that several times and the odds of no false positive becomes 0.95 x 0.95 x 0.95, etc. One conservative adjustment is Bonferroni correction"
04/01/2021,stocks,"But what about the triangle? There was a triangle pattern and then there wasn'tnt a triangle pattern.  
  
Difficult to argue with that."
04/01/2021,stocks,"Maybe it would be better to qualify the claim with something like “in the post-vaccine economic regime, investors are less likely to take Powell at his word.”"
04/01/2021,stocks,"Yes!

It works great!"
04/01/2021,stocks,">short-expiry index options?

Do you mean short term or short as in not long?"
04/01/2021,stocks,"1. Open a minute-by-minute chart of the NASDAQ
2. Draw horizontal lines at my forecast high and low
3. You should see that the NASDAQ value just bounces between the two lines.

Here's a screenshot of Monday's price with my forecast high and low:

[https://i.redd.it/mk5sn7i2x0q61.png](https://i.redd.it/mk5sn7i2x0q61.png)

You can use those lines to time entries and exits.

In my case, on that day, when I saw that the NASDAQ had hit my high at open and seemed like it was going to drop, I bought a put on QQQ. Then I just waited until it hit the bottom line and sold it for a significant profit.

I keep a small amount of money aside for these types of trades and put the profits into an index fund. The day trading provides revenue and the index fund is actual investing.

*^(One disclaimer -- when I'm wrong, I can tell and adjust my strategy accordingly. Don't try this if you aren't ready to second-guess my predictions.)*"
04/01/2021,stocks,"^(Posted by /wsb\_shitposting 3 months from now)

***I've lost everything.***"
04/01/2021,stocks,"I will be messaging you in 3 months on [**2021-07-01 17:17:01 UTC**](http://www.wolframalpha.com/input/?i=2021-07-01%2017:17:01%20UTC%20To%20Local%20Time) to remind you of [**this link**](https://www.reddit.com/r/stocks/comments/mhvteb/i_tried_to_predict_the_stock_market_every_day_in/gt1uzx9/?context=3)

[**16 OTHERS CLICKED THIS LINK**](https://www.reddit.com/message/compose/?to=RemindMeBot&subject=Reminder&message=%5Bhttps%3A%2F%2Fwww.reddit.com%2Fr%2Fstocks%2Fcomments%2Fmhvteb%2Fi_tried_to_predict_the_stock_market_every_day_in%2Fgt1uzx9%2F%5D%0A%0ARemindMe%21%202021-07-01%2017%3A17%3A01%20UTC) to send a PM to also be reminded and to reduce spam.

^(Parent commenter can ) [^(delete this message to hide from others.)](https://www.reddit.com/message/compose/?to=RemindMeBot&subject=Delete%20Comment&message=Delete%21%20mhvteb)

*****

|[^(Info)](https://www.reddit.com/r/RemindMeBot/comments/e1bko7/remindmebot_info_v21/)|[^(Custom)](https://www.reddit.com/message/compose/?to=RemindMeBot&subject=Reminder&message=%5BLink%20or%20message%20inside%20square%20brackets%5D%0A%0ARemindMe%21%20Time%20period%20here)|[^(Your Reminders)](https://www.reddit.com/message/compose/?to=RemindMeBot&subject=List%20Of%20Reminders&message=MyReminders%21)|[^(Feedback)](https://www.reddit.com/message/compose/?to=Watchful1&subject=RemindMeBot%20Feedback)|
|-|-|-|-|"
04/01/2021,stocks,Which indicators if I may ask?
04/01/2021,stocks,I don't see people card counting for a 1% advantage.
04/01/2021,stocks,"congratulations, you just discovered long-term index investing"
04/01/2021,stocks,"I'll put it on my reading list, thx!"
04/01/2021,stocks,"yep, you're right. Still more than someone on the spectrum with access to a Bloomberg terminal..."
04/01/2021,stocks,what if you're wrong. stop swing trading unless you know what you're doing.
04/01/2021,stocks,"Basically yeah, people see Apple move they figure Microsoft should move too."
04/01/2021,stocks,"I'm not an expert, but in smooth brain terms; 
if the Nasdaq movement leads the stocks within it, one should expect to see them all move in a similar way (which they do seem to, to an extent). If the inverse was true, the component stocks would move more independent of each other, and the Nasdaq as a whole would  correlate with the larger stocks proportional to their relative  size.

I think this agrees with what atrain13 said...."
04/01/2021,stocks,"Michael Burry has predicted the last 10 of the 2 bubbles we have had, so he isnt an ideal spokesperson for this, but interesting point"
04/01/2021,stocks,"I've wondered this too.  What if everyone only bought stocks and never sold through their entire lives and only sold once they reached the age of 65.  At 65, you wouldn't have to sell all of your stock, but you could begin selling.  I would think enough people, nationally, would turn 65 every day for enough action for price discovery.  However, since there is a far greater number of people under the age of 65, demand would far outweigh supply and stocks would only go up.  Just something I was thinking about...."
04/01/2021,stocks,Any source on how much of the market ETFs and indexes actually hold? Surely they don’t literally hold almost half the market
04/01/2021,stocks,It is an identical but a large portion of what happens in those stocks is similar to what's going on in the indices. Probably 70% of the motion The rest is going to be noise or people discovering old company news. The only real deviation is when the company does something big.
04/01/2021,stocks,"> How does an ETF being shorted impact the stock price? 

If the ETF drops, there will be an arbitrage opportunity between that and the component stocks. This will quickly be closed, maintaining their equivalence.

Supposedly the big NQ rally last friday was the fund that blew up closing their hedge (short NQ/ES). So that would be a case where futures rising will cause a rally in the component stocks.

Most of the time I think it works the other way around though - stocks lead, the index follows. And the charts only end up the same as arb opportunities get eaten away at quickly."
04/01/2021,stocks,"I'm still learning as well, but the ones that move more than the index would be because of volume of individual sales being more than the index. Some low volume stocks will be overwhelmed by the volume of the index buyers.

Shorting a whole etf would be much harder to affect prices because you have to effect the price of every stock in the etf and you would need huge volumes to overcome the index buyers."
04/01/2021,stocks,"[=IMPORTHTML](https://support.google.com/docs/answer/3093339?hl=en)

Plus a little data wrangling."
04/01/2021,stocks,"I'm not sure what your reply has to do with my comment, but I'm not impressed by people outperforming the market in the short-term. That will always be the case unless the number of market participants equals 1 and I'm in that class myself.

What I do not believe is that anyone can predict the market's average movement each day with any statistical advantage over random chance. There's a reason day traders lose so much damn money and it's not just tax drag."
04/01/2021,stocks,"Many companies have more than one type of stock, most of the times the difference is about voting rights.

""What is difference between alphabet class A and C?
GOOGL shares are its class-A shares, also known as common stock, which have the typical one-share-one-vote structure. GOOG shares are class-C shares, meaning that these shareholders have no voting rights."""
04/01/2021,stocks,What’s ToS?
04/01/2021,stocks,Creating blind specultive belief without verification is worse than stating what is.
04/01/2021,stocks,So... if just watching premarket was a slightly better indicator... just wait til 9:30 then immediately buy a slightly ITM broad index etf contract (either call or put depending on premarket) and sell it that afternoon?
04/01/2021,stocks,"Was that your main method? Curious what your moves were. I'm in this sub largely because I don't understand the options market very well, and am a little reticent to get into it. 

Could you have traded SQQQ and TQQQ over the past month and done similarly well?"
04/01/2021,stocks,So you are basically vegagang?
04/01/2021,stocks,"You failed to realize every time the pres has a press conference, the day of his speech, the day after is green AND sp500 hits a new record. This has happened 3 times so far and he's had a press conference 3 times this year."
04/01/2021,stocks,They mean short-term as in options which expire tomorrow (or even today).
04/01/2021,stocks,My guess is short term as short-expiry is hyphenated. Technically options aren't shorted
04/01/2021,stocks,"Yeah it's basic technical trading.  You can use a lot of things to draw the lines, all some flavor of moving averages, I like bollinger bands.  You're going to be right more often than you're wrong because fundamental changes do not happen often.  The problem is that when you're wrong you're very very wrong.  So I think the best version of this is to take highly leveraged positions on high beta underlyings and trade those based on the bounces/tests you describe above **while** setting stop losses at some level outside your position indicating a huge breakout, or having some similar kind of hedge.  Lots of other ways to manage risk, but ultimately I don't find this to be much more profitable than buy and hold, but it is much more stressful.  Plus it gets old after doing it full time for months or years"
04/01/2021,stocks,"Did you buy a weekly put? and if so was ur plan to just sell when the value of the contract increases or did u exercise ur option. Also when doing this did you have a particular strike price in mind from looking at technical analysis or did you play just it by ear? 

Interested bcs when trading options i usually go long term with LEAPS and I almost never look at the 1min chart."
04/01/2021,stocks,So youre basically timing entries on *other* stocks by using the Nasdaq chart?
04/01/2021,stocks,Do you say somewhere what strategies you’re using to make the high and low predictions? I’ll look through your history if I have to
04/01/2021,stocks,This is the way.
04/01/2021,stocks,I love you so much 😉
04/01/2021,stocks,But not a fund manager as you claim...
04/01/2021,stocks,Should have put /s I don’t really day trade but I realize a lot of people here do.
04/01/2021,stocks,"Yes, exactly"
04/01/2021,stocks,What a great quote
04/01/2021,stocks,His closet looks like the Hall of Prophesy in Harry Potter.
04/01/2021,stocks,"This is basically why ETFs while holding a decent chunk of the overall market don't actually effect price discovery.

To understand why you need to understand how ETFs work.
When you buy and sell and ETF it doesn't immediately buy and sell shares in the underlying companies. This wouldn't be efficient.
Instead what you are trading are ETF ""units"" which correspond to fractional shares in the underlying.

Special market participants called Authorized Participants (basically huge banks) are granted the ability by the ETF to create and redeem units for the underlying.

As such ETFs only lead to purchases or sales when there are flows in or out of the ETF causing units to be created or redeemed.

The price of the ETF units is simply calculated by using the Net Asset Value of the underlying securities so the ETF doesn't need to be actively traded for price discovery of the ETF units themselves, NAV does a good enough job of this and funds will take care of making sure the price stays consistent by exploiting any differences and arbitraging, which also provides liquidity.

TLDR: ETFs don't destroy price discovery because they don't actively trade in the underlying except on flows. Active trading still accounts for 99% of the actual volume."
04/01/2021,stocks,That happens a lot. The consistent and continuous cashflow through 401ks and IRAs to ETFs and index funds is funding almost all of the market's alpha over the past decade.
04/01/2021,stocks,"Something else to think about;

The number of Americans retiring daily has nearly doubled since the year 2000. Currently, roughly 10,000 people turn 65 each day.

And according to Census forecasts, that number is set to rise. It will reach nearly 12,000 people/day within the next 10 years. By 2030, according to the Census Bureau, all baby boomers will be older than 65.

Then that number will drop."
04/01/2021,stocks,"it's about 45% iirc. There were a lot of articles out last month about it, so may be worth a google."
04/01/2021,stocks,"Norway holds about 2% of all markets globally in their oil tax fund. Doesn't seem unreasonable that all banks, indexes, etc hold around half."
04/01/2021,stocks,"I figured the same but when you look at the GME saga for instance, you can see that someone/some firm appears to be doing that just to impact the underlying stock price."
04/01/2021,stocks,what I don't understand is why A and C are the same price when it seems like only A can vote. Why buy C in that case? And sometimes C is even more expensive. I'm sure I'm missing something but I don't know what it is.
04/01/2021,stocks,"I get that. I've explained it to others several times.

There's also a class B that doesn't trade, gets 10 votes per share, holds more than half the total voting power, and is owned by just a handful of people.

I just don't get why Google of all companies gets away with that confusion.

[They almost didn't.](https://economix.blogs.nytimes.com/2014/04/02/the-many-classes-of-google-stock/)

The mosquitos have a right to know which zebra they're aiming at."
04/01/2021,stocks,It's the name of the trading platform ThinkorSwim by TD AMERITRADE
04/01/2021,stocks,"Great question. I should clarify this.

If the premarket is green, there is a 74% chance that the market will close green. *However,* that doesn't necessarily mean that the market is going up after opening. It just means that it's going to close higher than it did yesterday.

There is about a 50% chance that the market will go *down* after opening if the premarket is green.

So that strategy wouldn't work.

*These numbers are based on data pulled from 2000-present, but it is my rough memory of the data so might not be 100% accurate.*"
04/01/2021,stocks,"Sounds lien picking up pennies from the railway tracks to me...

Surely the boys in Chicago also know what the premarket does and price it accordingly"
04/01/2021,stocks,And what exactly does watching the pre-market mean? Does it mean just use the difference between the close and the open? Or does it mean extend the slope that's occurring just before the market opens?
04/01/2021,stocks,"Yup, that what's I meant!"
04/01/2021,stocks,Gotcha
04/01/2021,stocks,"Gotcha, what would the benefit of short-expiry options? Just the volatility?"
04/01/2021,stocks,I am ever so pleased that there are still people who can properly hyphenate compound modifiers.
04/01/2021,stocks,"I buy a weekly and sell it ASAP. Usually, I don't hold it for more than 30 minutes.

That's partly to reduce risk and partly because I can't justify spending more than 30 minutes of a workday staring at stock charts. Sometimes I sell early just so that I can focus on my job."
04/01/2021,stocks,No he was buying puts for QQQ which tracks the Nasdaq 100
04/01/2021,stocks,If he started a fund he'd have three million apes signed up for it tomorrow.
04/01/2021,stocks,Awesome.  Thanks for the info!  I learned something today.
04/01/2021,stocks,"You sound like a moron, the world has no obligation to make sense to you."
04/01/2021,stocks,"So if you follow the company's that are green in the pre market, and buy them once they hit red that day, it's very possible they will end green and you will make a profit? :D"
04/01/2021,stocks,"So set limits based on the previous close and the premarket, for slightly ITM broad index etf contracts"
