Timestamp,Subreddit,Post/Comment
2021-06-24 09:56:08,stocks,"Out of curiosity is that your personal experience or is that data you have seen? I haven’t really seen any of the main fast food giants contracting growth. I do agree the space is getting more competitive and expensive though, which is why I see international growth as a huge pillar for success"
2021-06-24 09:59:41,stocks,"Sales have been declining and it seems fast casual restaurants like Chipotle seem to be the new trend. Applebee's, redrobins, these sit down restaurants have also seen a decline in recent years as well. 

The thing with going international is...it doesn't do too well. Asian market for fast food burgers don't do too well as the majority of Asians look down upon burgers as they are pictured as very unhealthy. Asians like burgers, but its not HUGE like the western countries.

So depending on how Wendy's approach the global market they will see success."
2021-06-24 10:58:34,stocks,"The only sales decline I see is from 2019-2020. It seems pretty obvious this would be due to the pandemic. Outside of that I’m not really seeing any decline trends. Where have you seen declines, outside of 2020 compared to 2019?

Fast food is not my favorite industry. I see challenges in higher costs of meat and increase of fast casual and higher quality dining. But I also don’t think fast food is going anywhere fast and international growth, IMO, is particularly important for the sector"
2021-06-24 11:38:00,stocks,"Fast service restaurants have stable sales in the US and continue to grow internationally.  US brands are only a modest percentage of the fast food marketplace overseas.  It is a huge and highly fragmented category.

Your comments about Asia are uninformed.  Fast food is a gigantic category in Asia, but American-style food is only a small percentage of it.  The most common fast foods in Asia are local favorites like dumplings, noodles, and fried tofu.  You are an ethnocentric American to believe hamburgers define fast food service.  Your remark that Asians ""look down"" on hamburgers is also not true.  I challenge you to provide any reliable industry or media sources that support such an assertion."
2021-06-24 10:02:40,stocks,None of this is remotely accurate.
2021-06-24 10:24:05,stocks,"It's 100% on point, but go on."
2021-06-24 13:44:15,stocks,"McDonald’s BTS success, shrimp burger was so popular it was banned. Yeah south east Asia is ravenous for fast food and guess what the menu changes by region. But all growth metrics for consumers of fast food are up."
2021-06-24 13:46:25,stocks,"Yes, regional, and you're talking about south korea. One specific country that happened rodo well because of the boy band craze. 

Shit, this sub is a black hole for actual facts."
2021-06-24 13:48:52,stocks,"Lol those are metrics I’m not talking just South Korea just simple oxcurance of marketing that proves your non fact based opinion as shit. 

You’ve been quoted CAGRs which is the source for determine growth. You are a black hole of your head up your ass.

Boy band success is a billion dollar global phenomenon and you think that’s not valid that fast food has branded that? You are dumb.

Yeah not a single non drooling on yourself in the comments."
2021-06-24 13:50:29,stocks,"I gotta stop interacting with ""diamond hand"" rejects on here. The amount of 16 year olds pretending to be vets on this sub is scary."
2021-06-24 13:51:19,stocks,"Lol I’ve quoted facts to you and you run again. You are sad and pathetic.

I don’t own amc or gme look at me arguing about how stupid amc is for not letting them issue shares.

But a simple search you’d have gotten this info.

You spewed a story with no facts got called out and you run like the bitch you are."
2021-06-24 13:53:41,stocks,"I haven't seen you post a single verifiable fact, ape hodlrer."
2021-06-24 13:54:42,stocks,"Lol 4.6% CAGR domestically 7% Latina America greater than 9% SEA.

Like your argument “non Americans don’t eat burgers or fast food” is clearly ape army leader lack of brains."
2021-06-24 13:55:40,stocks,Latina america? Lol
2021-06-24 13:56:58,stocks,"It’s a real place, are you a flat earther too? Anti latinxer? Or just generally too fucking stupid?

But keep not giving facts keep with this qtard argument technique."
2021-06-24 14:06:01,stocks,You've outed yourself as a teen. Lol
2021-06-24 14:19:51,stocks,"Again you can’t comment about facts everything you’ve done is run and hide from the facts. You are embarrassing. I genuinely hope your small brain can grasp that much. 

YOU CAN NOT DISCUSS FACTS ITS EMBARRASSING HOW MUCH YOU DEFLECT AND HIDE. 

You’ve outed yourself as a cuckhold."
2021-06-24 14:22:37,stocks,"Lol cuckhold? Ok, pepe."
2021-06-24 14:31:51,stocks,"You haven’t stated one fact. You came over her with a random nonsense story and you try to run and ignore how fucking stupid your comment is. Ignore every fact to deflect how stupid you are and your $3.50 account you are running go back to Robinhood you stooly

Fast food is expanding rapidly with a strong CAGR and global adoption. Strong margins strong branding it’s a strong choice.

Lol what’s your vendetta against McDonald’s you biased shit bag clown. I’m crying at your smooth brains comments."
2021-06-24 14:34:07,stocks,"Ok, shill."
2021-06-24 14:52:26,stocks,Lol you are a fucking idiot genuinely you should refund all tax money wasted on your education.
2021-06-24 14:53:31,stocks,You're really easy to get riled up!
2021-06-24 15:10:26,stocks,You spew bullshit for fun and run when presented with facts. Embarrassing
2021-06-24 15:10:48,stocks,You're definitely a troll. Lol
2021-06-24 00:00:00,stocks,"How was Warren Buffet allowed to invest when he was 11? Hello!

I've been reading increasingly more on investing and when reading about Warren Buffet, I read him saying that he bought his first stocks when he was only 11 years old. How? Was it just that back then you were allowed to invest at any age? Cause right now I don't think it's allowed to buy stocks or any type of investment without being 18 years old.

I apologise if it's a dumb question, but I've tried finding an answer in Google and got nothing, and it's just bugging my curiosity."
2021-06-24 09:16:22,stocks,"Welcome to r/stocks!

For stock recommendations please see our portfolio sticky, sort by hot, it's the first sticky, or see [past portfolio stickies here.](https://www.reddit.com/r/stocks/search?q=author%3Aautomoderator+%22Rate+My+Portfolio%22+-+r%2FStocks+Quarterly+Thread&restrict_sr=on&include_over_18=on&sort=new&t=all)

For beginner advice, brokerage info, book recommendations, even advanced topics and more, please read our [Wiki here.](https://www.reddit.com/r/stocks/wiki/index)

If you're wondering **why a stock moved** a certain way, check out [Finviz](https://finviz.com/quote.ashx?t=spy) which aggregates the most news for almost every stock, but also see [Reuters](https://www.reuters.com/), and even [Yahoo Finance](https://finance.yahoo.com/).

Also include *some* [due diligence](https://www.investopedia.com/terms/d/duediligence.asp) to this post or it may be removed if it's low effort.

*I am a bot, and this action was performed automatically. Please [contact the moderators of this subreddit](/message/compose/?to=/r/stocks) if you have any questions or concerns.*"
2021-06-24 09:19:11,stocks,"Unsure of the rules because he’s a dinosaur, but they have had custodian accounts for a while now. As long as there is an adult “managing” the account, a minor can legally invest and trade."
2021-06-24 11:23:36,stocks,If you read his book snowball. It’s explained how at the time his father worked as a salesman for shares and WB bought through his father.
2021-06-24 10:06:50,stocks,What were investment laws like in 1805?
2021-06-24 13:36:25,stocks,"When I was 8 (1975), my grandfather taught me about the stock market. He taught me about the rule of 72 and all the basics that I needed to know. I ended up teaching my 4th grade class about the stock market and set up a working stock exchange in the classroom. Read the stock section in the newspaper instead of the comics and ""paper traded"" for several years. My favorite stock was Exxon.

When I turned 12, my parents set up a UGMA account for me. I took my birthday gift money i had been saving and bought Toledo Edison stock (became Centerior Energy and is now First Energy). I reinvested everything, and ended up selling most of it in my 30s for $5000 (would be worth $13000 today.) 

Once I had the account set up, all I had to do was call the broker to place any orders. Traded regularly throughout jr high and high school.

Thank you, Grandpa George!"
2021-06-24 09:18:44,stocks,There weren’t as many rules back when he was 11.
2021-06-24 09:18:44,stocks,"Kids were going to war at 15-16, they didn’t really care about age.."
2021-06-24 11:50:28,stocks,"Back when he was 11, kids his age were married with 2 babies and they were 5 years into their job"
2021-06-24 12:28:26,stocks,"His father owned a brokerage firm, so its 10x easier"
2021-06-24 13:49:45,stocks,"Custodial account. I started when I was 10. My mom was the only one who could take money out though, and I did all my trades with my dad’s assistance. You can open a custodial account at any age."
2021-06-24 15:49:51,stocks,"So many speculative answers here about how it was easier for kids to trade back in the day.

No.

It was actually harder, because you had to have a direct relationship with an actual stockbroker. Kids in the 20th century weren’t running around day trading.

Buffett’s dad was in the game, that’s how he could get started at a young age."
2021-06-24 10:35:18,stocks,Because in the 1800s there weren't as many rules..
2021-06-24 14:59:35,stocks,"From the Warren Buffet [page](https://en.wikipedia.org/wiki/Warren_Buffett) on Wikipedia:

*""Buffett's interest in the stock market and investing dated to schoolboy days he spent in the customers' lounge of a regional stock brokerage near his father's own brokerage office.""*

It sounds like he might have simply been fortunate enough at 11yo to know the right adults to help him."
2021-06-24 10:46:37,stocks,Good question OP. I don't have anything to add I just like the look at history.
2021-06-24 15:32:21,stocks,I think 11 was considered middled age when he was young
2021-06-24 11:47:53,stocks,"Back when Warren Buffett was 11, all you had to do was go to the Tontine Coffee House to trade securities and they weren't really checking your age over there."
2021-06-24 13:36:04,stocks,Origin stories are rarely fully true
2021-06-24 13:44:56,stocks,His first put contract was on British tea stocks a couple days before the Boston Tea Party.
2021-06-24 13:59:44,stocks,He's old af and laws were much more relaxed when he was 11.
2021-06-24 14:11:27,stocks,Why would/should someone be prevented from buying shares before the age of 18?
2021-06-24 14:18:46,stocks,He's 91 years old. Things were a little different 80 years ago.
2021-06-24 14:28:41,stocks,I first started buying stocks when I was like 13. Dad gave me a small amount of money to invest and I remember going into the bank with him and sitting at a desk and telling a broker what I wanted to buy. And then checking the price in the newspaper everyday. Account was in my dads name obviously. I think I had paper stock certificates for at least one of the companies I bought into.
2021-06-24 15:23:37,stocks,He's old AF there were no rules back in the day. Heck there were boys sneaking and enlisting into the army at 15/16 back then for adventure.
2021-06-24 16:24:07,stocks,Im old not Buffet old and I started invest in my early teens and it was basically ”Here’s your my money now give me my shares”. Back in the 70’s  I remember running down the corner stores and buying cigarettes for my parents and I couldn’t have been much more than 7 or 8 years old. It different times my friends.
2021-06-24 18:56:30,stocks,I’m 16 and I have an account that is technically managed by my parents but all of the money and any asset in it is legally owned by me; so they can’t withdraw anything that isn’t used for things like my education/health etc…
2021-06-24 10:04:28,stocks,Parents….. not that hard to figure out
2021-06-24 10:01:01,stocks,"When he started investing stock's were actually pieces of paper, more like a bearer bond than the ownership style we know today.

You could go to a counter and buy stocks and they would give you a stock certificate.

Since the share was viewed more like physical property there was no reason to put age limits on it (anyway what kid wants to buy stocks and not baseball cards or bubble gum?)\_  


https://www.investopedia.com/ask/answers/06/stockcertificate.asp#:\~:text=When%20a%20company%20sold%20shares,the%20need%20to%20hold%20one."
2021-06-24 12:36:10,stocks,Just like that kid that made a crap ton off GME. His mom bought it for him.
2021-06-24 13:54:07,stocks,The NYSE at that time asked the permission to Buffet if they can operate.
2021-06-24 14:28:59,stocks,You think they had rules in 1756?
2021-06-24 14:31:52,stocks,His parent could have bought for him. Also it was like 100 years ago. The rules were loose back then
2021-06-24 14:33:50,stocks,He probably bought them under mom or dad
2021-06-24 15:22:30,stocks,"Gave his dad the money, his dad invested with the money in his own account. He goes on to share about how his first stock purchase was before school and when he came home, he had lost a significant amount."
2021-06-24 15:59:50,stocks,I assume he bought the stocks on someone else's account. That's what I did before I was old enough to trade on my own account.
2021-06-24 16:12:16,stocks,I'm guessing he used someone else's account(an adult)
2021-06-24 16:26:55,stocks,"he most likely used his parents to invest for him rather than doing it himself, thus creating a loophole"
2021-06-24 16:45:10,stocks,"I am sure on his time banks were not full of regulations , minors were able even to have a full time job , is different times . Today you need a custodial account ."
2021-06-24 17:04:47,stocks,Because he's fucking ancient.
2021-06-24 18:29:58,stocks,I was 9 when I first bought a stock. My father was already trading and I gave him some of the pocket money I saved to buy a stock that I liked the name of. He said it's a shit stock and offered me to buy different one. I accepted and never heard of that money again. Unrelated but if I can be the next Warren I could say that I bought my first stock when I was 9 and leave people wondering how I was allowed to do so.
2021-06-24 18:49:59,stocks,Back in the 1800’s Most people didn’t even live that long.. so he says..
2021-06-24 19:03:40,stocks,Haha his first stock was shorting at&t I think
2021-06-24 19:51:06,stocks,There was a time when stocks were pretty much a white mans game on the us. He is a early adopter to that life.
2021-06-24 19:59:47,stocks,"I could give 2 fucks about Warren Buffet. Most people don't live that life lol. I was worried about baseball, my dad drinking, the 14 year old that want to beat me up, and cartoons at 11. 

He hasn't made the world better."
2021-06-24 11:29:51,stocks,He used his money from working 18 hour days at the coal mine. Minus what he spent in cigarettes and whiskey for the day. He was 11 years old
2021-06-24 09:22:52,stocks,"I thought it could be something like that, but the way he phrases it just sounds like he straight up went, pulled money out of his pocket and said ""I would like to buy some equity, please."""
2021-06-24 11:01:40,stocks,I did that with my son. He was 16 and we set up a custodial account with $500 so he could get the feel of it and start learning.
2021-06-24 18:57:33,stocks,That makes more sense. I just always thought that they were like different times and he just bought a pack if cigs and started the morning by reading stock news with his coffee at 11.
2021-06-24 09:46:59,stocks,"Growing up I got a dividend check every month ranging from $100-120 for an “account” my grandparents had for me.

When I got older I realized it must have been stock related.  Idk what stocks, was just told it was dividends.

So perhaps something like that."
2021-06-24 18:47:11,stocks,"UGMAs were created in 1956. Warren would have been 26 by then.

UTMAs were created in 1986. Warren would have been 56.

The truth is probably a lot simpler! His dad probably bought some shit and let warren choose what was bought."
2021-06-24 13:34:36,stocks,So it's basically just cause his dad was already in the branch?
2021-06-24 10:08:34,stocks,"I mean...the dude's old, but not that old."
2021-06-24 10:28:34,stocks,"We saw something similar in early 2000s with every internet site offering an IPO which brought about more acts and tighter legislation. 

Basically John Wayne could offer stock certificates with his name on them and say I'll share in profits if there are from hunting down people if you give me some money."
2021-06-24 10:25:07,stocks,"More like lack there of really up until 1933 and 1934. 1933 began the start of congress really taking a good look at what was going on and what caused the big crash. Stock certificates were being sold without any real merit and everyone was dumping money in to things. 1933 act came in and really cleared a lot of that up followed by the 1934 act. 33 brought about the requirements for new public offerings, requiring prospectus usage so people could actually know what they were buying, what the company planned to do with the money brought in from the IPO etc. 1934 brought about some other rules/regs with regards to trading places. Roosevelt did all this stuff. Just search SEC 1933 and 1934 acts."
2021-06-24 13:37:37,stocks,Makes sense.
2021-06-24 12:33:47,stocks,"Yep, the 1700s were wild times."
2021-06-24 14:20:26,stocks,It's just how it is right now. You don't get the right to invest/vote/drink/etc. until you're 18.
2021-06-24 10:04:41,stocks,"I wonder how many people of Buffet's generation resented all their baseball cards and bubble gum later down the road, huh xD"
2021-06-24 10:18:12,stocks,"This. Basically you bought stock certificates at the counter. Typically a younger person with some chalk would be writing the bid/ask prices on a chalkboard and that was considered the exchange. We now know this as NYSE. Basically anyone with some money could walk in and buy the certificates. There wasn't quite so many rules in 1941. The 33, 34, 39, 40 acts were just really starting to get moving and further issues being addressed after the crash."
2021-06-24 09:57:54,stocks,"Things were different back then. I'm nowhere near as old as him, but I remember what it was like to buy stocks in the 1980s: you'd either call your broker and have them wire money from your bank account, or you could walk into the brokerage office and give them cash or a check. If you wanted, they'd mail you physical stock certificates.

And the commission for making a single trade something like $50. Day trading was still a thing then, but traders were basically on the phone all day with various brokers buying and selling.

Most people got stock quotes once a day though, they were in the newspaper. Otherwise if you wanted to know the price of a stock during the day you'd have to call your broker to ask."
2021-06-24 09:27:08,stocks,"Because that’s probably what he did. Then they gave him a piece of paper saying you own shares of this company, congratulations! 

Regulations hardly existed which is why so many people got rich during that time period"
2021-06-24 14:52:23,stocks,"Dude, kids as young as 10 worked in factories back in 1920. There werent any child labor laws till about the 1940s."
2021-06-24 11:06:34,stocks,"I got one set up when I turned 18, I just wish my parents would have helped me out a little earlier so I could truly get a feel for it (would’ve prepared me a little more for a stock market tank, too). 

I started investing into a Roth in the summer of 2019, brokerage in January of 2020. I’d have been 10’s of thousands of dollar richer if I would’ve understood a little more about the stock market and seen the pandemic as a perfect way to grow my money rather than worry about the economy crashing.

Good on you for starting your kids early."
2021-06-24 12:03:30,stocks,"Damn, must of been a chunk to get dividends like that"
2021-06-24 13:38:53,stocks,Essentially yeah. On a side note there is technically nothing wrong with a junior buying shares or having shares bought on their behalf.
2021-06-24 16:28:24,stocks,"There is always “a parent working in the branch”. Take any great person and check their parents. It is not necessary that parents have connections, but they should have some know-how in the field."
2021-06-24 10:10:21,stocks,Yeah I know. Just saying he could also probably bought a pack of smokes and a 6 pack with the ways laws were back then.
2021-06-24 14:16:13,stocks,Things were better in the 1600s when it was just me and the natives.
2021-06-24 10:05:56,stocks,"Well, some of those cards are worth a fortune.   


I would guess there are more people that regret using them as a bike tire noise maker at 12 only to find out it would be worth $50,000+ when they were retiring."
2021-06-24 11:03:17,stocks,Rule 34 is my favorite
2021-06-24 14:21:31,stocks,"I did a little in the 80's and a lot in the 90's.  This is pretty much how it was.  Except commissions were a lot more than $50.  That would be a base commission, then there was a per-share commission that could add hundreds to it.  

Regular investors were blind to intraday action and you had to trust that your broker had good traders in the pit who could negotiate your orders and get you a decent price.  

All we knew of stock prices was their end of day print, although financial newspapers would show a column with the low, high, and total volume.   Sometimes a stock's printed numbers would be behind by a day or two.

A big advance was getting quotes that were ""only"" 15 minutes old.  

You paid dearly for any and all analyst reports.  

When Google first gave real time prices for free it was mind-blowing."
2021-06-24 10:03:21,stocks,"Wow, that sounds so bizarre... I'm 22, but this makes me feel like I'm 4."
2021-06-24 15:11:35,stocks,"> And the commission for making a single trade something like $50.

You could also only buy/sell in 100 share lots, like options."
2021-06-24 12:38:41,stocks,I started trading in the 80s and touch tone phone orders were the latest tech. It took 2 buttons to enter a letter so 4 letter tick was 8 button pushes. $19.95 each way was a deal. Stock info was in the newspaper or library.   Now I just trade on candlesticks.
2021-06-24 11:03:58,stocks,">or you could walk into the brokerage office and give them cash or a check. If you wanted, they'd mail you physical stock certificates.  
>  
>And the commission for making a single trade something like $50. Day trading was still a thing then, but traders were basically on the phone all day with various brokers buying and selling.  
>  
>Most people got stock quotes once a day though, they were in the newspaper. Otherwise if you wanted to know the price of a stock during the day you'

so one couldnt day trade as we do now// $50 commissions and a static, 1 day late price to trade off of."
2021-06-24 10:41:55,stocks,">Regulations hardly existed which is why so many people got rich during that time period

Tell me, the founder of a restate company I worked for told me the sorry of the first property he purchased to started a former company of his in the late 70's (company ends up being worth $400M by the mid 90's when they sell) . He is like, ""I got 110% debt financing on the purchase cause I was think we would need it for the working capital."" WTF bank gives 110% financing...."
2021-06-24 10:01:54,stocks,Interesting. Thanks!
2021-06-24 11:43:46,stocks,And so many got fleeced... Only a few golden tickets. Keep the history real.
2021-06-24 10:51:31,stocks,Very true
2021-06-24 12:22:57,stocks,"lmao I started this year, at age 42. enjoy your early start ;)"
2021-06-24 15:29:11,stocks,I'm gonna open an account for my children when they are 5 or 6
2021-06-24 13:42:07,stocks,I have no idea.  Wish I did lol. Never saw a will or heard anything so don’t know where the stocks went.
2021-06-24 14:23:34,stocks,"Depending on the time frame, rates were different.  Bonds and dividends yielding 6-12% weren't that unusual."
2021-06-24 14:08:42,stocks,"Well yeah, I was just wondering how did it happen, cause right now you can't buy shares on your own unless you're 18 years old."
2021-06-24 10:15:29,stocks,"To be fair, 11 year olds are buying packs of smokes and alcohol now as well."
2021-06-24 17:54:36,stocks,"Your lucky, the 1500s were pretty rough."
2021-06-24 10:08:08,stocks,"Hah, good point."
2021-06-24 15:12:55,stocks,Wasn't there same late night talkshow guy who talked stocks and had CEOs on and told you the prices?
2021-06-24 19:35:25,stocks,The story of the Hadrocks and the Gotrocks makes more sense with this context.
2021-06-24 10:12:22,stocks,If you pay attention in old movies and shows you can get an idea of how it was. Seinfeld and Trading Places come to mind but there are probably many more with more references to it you can watch
2021-06-24 15:25:26,stocks,"It's quite literally Bud Fox's job description, what /u/irresponsible_owl described"
2021-06-24 19:12:43,stocks,"If it makes you feel any better, I’m 32 and also never had to experience any of that."
2021-06-24 11:21:53,stocks,I think 110% financing stopped in the 90s. I remember advertisement on how you could buy a house and money for remodeling with the mortgage.
