Timestamp,Subreddit,Post/Comment
2021-03-13 18:53:31,Wallstreetbets,"More Memes, Less “Adults” It’s the weekend! Congrats you made it through another week without having a heart attack while watching your favorite stonks drop into a seventh circle of hell. 

But why in holy hell have I already seen a handful of doom and gloom, “bE ResPonSiBlE” posts, and “be careful” DD that doesn’t even have DD to back the claims?! Goes for a few tickers.

This is a damn casino. Nobody is giving out financial advice, and neither should you, especially without actual charts that you draw fancy lines on and excel sheets with big numbers that I can pretend to understand.

So pick up your favorite crayon, get a banana, and wait for a dank meme to appear onto your screen, and laugh. 

It’s Saturday morning and I’m having to scroll through crap; better off watching Tom and Jerry and picking my own turds from my ass crack hair."
2021-03-13 18:42:40,Wallstreetbets,"This should be a shitpost because I almost shit my pants. Recently had an etf split 10:1 and it took Fidelity a second to catch up. The real loss was only a couple hundred bucks, but anyone else with Fidelity don’t be surprised if you see this one day: "
2021-03-13 18:39:21,Wallstreetbets,"The Neurobiology of Autism and its link with the GME saga. My dear fellow apes,

I couldn't find any thread discussing this but I believe this is a topic that can't be overlooked as it surely explains why many of us are bonding and showing similar behaviours in this GME / AMC saga. Plus, it may also explain why this is probably one of our greatest strength.I'm myself diagnosed Asperger myself and have spent years researching on the matter as I needed to understand why I couldn't feel and think the way my friends would. I'm sure I'm not the only one here.

SO...

# What is Autism and what is its prevalance in humans?

&#x200B;

**Autism Spectrum Disorder**\- Autism is a [developmental disorder](https://en.wikipedia.org/wiki/Developmental_disorder) characterized by difficulties with social interaction and communication, and by restricted and repetitive behavior.[\[3\]](https://en.wikipedia.org/wiki/Autism#cite_note-DSM5-3)[https://en.wikipedia.org/wiki/Autism](https://en.wikipedia.org/wiki/Autism)

\- ASD manifest in different forms and degrees. It can be low, mild, severe and isn't always manifesting as a severe mental disability.[https://www.webmd.com/brain/autism/autism-spectrum-disorders](https://www.webmd.com/brain/autism/autism-spectrum-disorders)*eg:* [*Asperger's syndrome*](https://www.webmd.com/brain/autism/mental-health-aspergers-syndrome) *is on the milder end of the* [*autism*](https://www.webmd.com/brain/autism/default.htm) \*spectrum. A person with Asperger's may be very intelligent and able to handle their daily life. They may be really focused on topics that interest them and discuss them nonstop. But they have a much harder time socially.

&#x200B;

**Prevalence**

\- About 1 percent of the world population has autism spectrum disorder. ([CDC, 2014](http://www.cdc.gov/ncbddd/autism/data.html))

\- Prevalence in the United States is estimated at 1 in 54 births. ([CDC, 2020](https://www.autism-society.org/releases/cdc-releases-new-prevalence-rates-of-people-with-autism-spectrum-disorder/))

\- More than 3.5 million Americans live with an autism spectrum disorder. ([Buescher et al., 2014](http://www.bloomberg.com/news/2014-06-09/autism-costs-more-than-2-million-over-patient-s-life.html))

\- Prevalence of autism in U.S. children increased by 119.4 percent from 2000 (1 in 150) to 2010 (1 in 68). ([CDC, 2014](http://www.cdc.gov/ncbddd/autism/data.html)) Autism is the fastest-growing developmental disability. ([CDC, 2020](https://www.autism-society.org/releases/cdc-releases-new-prevalence-rates-of-people-with-autism-spectrum-disorder/))

\- Prevalence has increased by 6-15 percent each year from 2002 to 2010. (Based on biennial numbers from the [CDC](http://www.cdc.gov/ncbddd/autism/data.html))

\-  25% of 4500 children showing ASD symptoms participating in a study were not diagnosed and didn't know know they're affected. [https://onlinelibrary.wiley.com/doi/abs/10.1002/aur.2255](https://onlinelibrary.wiley.com/doi/abs/10.1002/aur.2255)

\-  ASD can be seen on brain MRIs, ASD brains physically developed differently.  [https://www.ncbi.nlm.nih.gov/pmc/articles/PMC3081653/](https://www.ncbi.nlm.nih.gov/pmc/articles/PMC3081653/)

# ""Ok that's a lot but not all of us here have ASD... Even if one 1/54 or 1% of us on here did, how could this be proven and mean anything anyway?""

Well, the pourcentage of ASD apes on here is likely to be **higher** than in those studies... Why?

**Social Media Use and Happiness in Adults with Autism Spectrum Disorder**\*""Social Media use by adults with ASD, specifically Facebook use in moderation, may enhance well-being and may be a protective factor against secondary mental health concerns common in this population"".In a 2013 study\*[*,*](https://www.sciencedirect.com/science/article/pii/S0747563213000708) *researcher* ***Micah O. Mazurek*** ***found that the majority of adults with autism use social media to meet friends.***[^(https://pubmed.ncbi.nlm.nih.gov/29485900/)](https://pubmed.ncbi.nlm.nih.gov/29485900/)

**Social media use among adults with autism spectrum disorders***The purpose of this study was to examine patterns and social–emotional correlates of social media use in adults with ASD. Participants completed self-report measures of social media use, friendship quality and quantity, and loneliness.* ***The results indicated that the majority of participants (79.6%) used social networking sites (SNS)****, and that the most commonly cited reason for using SNS was social connection. Adults with ASD who used SNS were more likely to have close friends, and those who used SNS for social engagement reported closer friendship relationships.*

**Social Media help autistic children navigate the world***Dr. Szatmari: the human face doesn't have the same drawing power for an autistic child, and that something about technology triggers the motivation that's lacking in face-to-face contact.* ***This can really have a big impact in helping people with ASD navigate the world and be able to do things that we never thought possible before.***[^(https://www.theglobeandmail.com/news/national/social-media-helping-autistic-children-navigate-the-world/article4358736/)](https://www.theglobeandmail.com/news/national/social-media-helping-autistic-children-navigate-the-world/article4358736/)

**Yale study: 'Social media boosts friendship quality in adolescents with autism spectrum disorder'**[^(https://medicine.yale.edu/childstudy/news-article/15234/)](https://medicine.yale.edu/childstudy/news-article/15234/)

If you do some research, you will see that there's many other studies explaining why social medias are one of ASD favorite way to connect and communicate.

Maybe it would be interesting do a pol to see who's diagnosed or feel like being misdiagnosed here...

# ""Yeh ok but what's the link with GME or the stock market then?""

That's where things get interesting...There are hundreds of studies out there showing that **reward pathways** of autistic people are altered and therefore their social relationships but also their **relationship with money** is totally different than the TD brains.

**Reward Circuitry Function in Autism During Face Anticipation and Outcomes***The aim of this study was to investigate reward circuitry responses in autism during reward anticipation and outcomes for monetary and social rewards.* ***During monetary anticipation, participants with autism spectrum disorders (ASDs) showed hypoactivation in right nucleus accumbens and hyperactivation in right hippocampus, whereas during monetary outcomes, participants with ASDs showed hyperactivation in left midfrontal and anterior cingulate gyrus.*** *Groups did not differ in nucleus accumbens responses to faces. The ASD group demonstrated hyperactivation in bilateral amygdala during face anticipation that predicted social symptom severity and in bilateral insular cortex during face outcomes.* ***These results add to the growing body of evidence that autism is characterized by altered functioning of reward circuitry.*** *Additionally, atypical amygdala activation during the processing of social rewards may contribute to the development or expression of autistic features.*[^(https://link.springer.com/article/10.1007/s10803-011-1221-1)](https://link.springer.com/article/10.1007/s10803-011-1221-1)

**Risk-Aversion and Rationality in Autism Spectrum Disorders***Risk-aversion and rationality have both been highlighted as core features of decision making in individuals with Autism Spectrum Disorders (ASD). This study tested whether risk-aversion is related to rational decision-making in ASD individuals. ASD and matched control adults completed a decision-making task that discriminated between the use of risk-averse and rational strategies. Results showed that overall, ASD participants were more risk-averse than control participants. Specifically, both groups made similar choices when risk-aversion was the less rational strategy but* ***ASD participants chose more rational options than control participants when risk-aversion was the most rational strategy. This study confirmed that risk-aversion is a core feature of ASD and revealed that ASD individuals can switch their decision-making strategy adaptively to avoid negative consequences.***[^(https://link.springer.com/article/10.1007/s10803-018-3616-8)](https://link.springer.com/article/10.1007/s10803-018-3616-8)

**Reward system dysfunction in autism spectrum disorders**\*“Participants with ASD showed the expected hypoactivation in the mesocorticolimbic circuitry in response to both reward types. In particular, diminished activation in the nucleus accumbens was observed when money, but not when social reward, was at stake, whereas the amygdala and anterior cingulate cortex were hypoactivated within the ASD group in response to both rewards.\* ***These data indicate that the reward circuitry is compromised in ASD in social as well as in non-social, i.e. monetary conditions,*** ***which likely contributes to atypical motivated behaviour.”***[^(https://www.ncbi.nlm.nih.gov/pmc/articles/PMC3682440/)](https://www.ncbi.nlm.nih.gov/pmc/articles/PMC3682440/)

# ""Cool but it says ASD individuals can switch their decision-making strategy adaptively to avoid negative consequences... so it could also mean you could paperhand?""

Well, not exactly...

**Emotional decision-making in autism spectrum disorder: the roles of interoception and alexithymia.** [^(https://www.ncbi.nlm.nih.gov/pmc/articles/PMC5062918/)](https://www.ncbi.nlm.nih.gov/pmc/articles/PMC5062918/)""*These results demonstrate that although framing effects are associated with interoception and alexithymia in the neurotypical population,* ***emotional and interoceptive signals have less impact upon the decision-making process in ASD***\*.""\*

**Trait Autism is a Better Predictor of Empathy than Alexithymia***The study found that having more autistic traits is associated with lower empathy – even after factoring alexithymia into the analysis. In fact, the study provides some of the* \*\*\*best evidence so far that autism is definitely linked to lower empathy.\*\*\***Autism and Reactions to Provocation in a Social and Non-social Context**[^(https://link.springer.com/article/10.1007/s10803-019-04257-w)](https://link.springer.com/article/10.1007/s10803-019-04257-w)*Compared to Healthy controles, individuals with ASD showed similar externalizing behavior in the social context.* ***In the non-social context*** *(meaning non physical environment)* ***reactions after provocation were enhanced relative to non-provoking situations.*** *The findings implicate that the context is an important influencing variable when comparing individuals with ASD to HCs after being provoked.*

See where I'm going?

# ""Ok but it still doesn't mean you wouldn't give up at some point?""

ASD mostly characterised by Restrictive and Repetitive behaviours. We get even more obsessed when it comes to things we enjoy and distract us... or rather keep us in focus.

And what do ASD love more than everything? Yes Cramer, that's exactly what we like, the stock... because we love video games!

**The risk for pathological video game use appears larger in adults with ASD compared with TD ('traditional') adults**[https://pubmed.ncbi.nlm.nih.gov/29485900/](https://pubmed.ncbi.nlm.nih.gov/29485900/)

**Video game use in boys with autism spectrum disorder, ADHD, or typical development***Boys with ASD spend much more time playing video games than do boys with TD, and boys with ASD and ADHD are at greater risk for problematic video game use than are boys with TD.*[https://pubmed.ncbi.nlm.nih.gov/23897915/](https://pubmed.ncbi.nlm.nih.gov/23897915/)

**Video games from the perspective of adults with autism spectrum disorder**The most frequent all-time favorite video game genres were Role-Playing (31%) and Action-Adventure (19%).  *To the moon, right?*[https://www.sciencedirect.com/science/article/abs/pii/S0747563215003581](https://www.sciencedirect.com/science/article/abs/pii/S0747563215003581)

**Restricted and repetitive behaviors in autism spectrum disorders**[https://pubmed.ncbi.nlm.nih.gov/21574682/](https://pubmed.ncbi.nlm.nih.gov/21574682/)

# ""Mmmmmh... but if all of this is just a game to you, you'll still end up turning off the console when you'll realise you might not get what you want?""

Nope, not really... the funny thing about ASD RRBs is that we are excited by the reward anticipation itself, not the reward. As long as the adversaire isn't down its knees giving up, we won't turn off the console. Plus, the thing we'll miss the most and regret while being millionaires is the entertainment and excitement itself.

**Common alterations in sensitivity to type but not amount of reward in ADHD and autism spectrum disorders**\*'The results, while not supporting hyposensitivity to changes in reward amount in ADHD and ASD, do suggest that both groups are generally less motivated in settings where social as opposed to monetary rewards can be earned.'\*[https://pubmed.ncbi.nlm.nih.gov/21223259/](https://pubmed.ncbi.nlm.nih.gov/21223259/)

**Money motivates in autism, attention deficit**'*They also perform better when the reward is greater: for example, 15 cents rather than 5, or comments such as “You’re a star” as opposed to “Well done.”'*[https://www.spectrumnews.org/news/cognition-and-behavior-money-motivates-in-autism-attention-deficit/](https://www.spectrumnews.org/news/cognition-and-behavior-money-motivates-in-autism-attention-deficit/)

**Autistic Traits Affect Reward Anticipation but not Reception**[https://www.nature.com/articles/s41598-020-65345-x](https://www.nature.com/articles/s41598-020-65345-x)

I've lost a link to an amazing study showing that ASD individuals were more generous when it came to sharing their monetary reward with other participants compared to control. If anyone finds it, please post it in the comments :).

# Conclusion

Hedgies can try manipulate the ASD apes we are with FUD or any other techniques; ASD brains won’t react. We don't show improvement with hours of therapy not using reward as stimuli. And our stimuli here... well they are trying to take it away from us so all it does is increasing our obsession and make us buy more.

https://preview.redd.it/70mfnfqlatm61.jpg?width=560&format=pjpg&auto=webp&s=e5704ffb1f90a538c2f0e91accd0844c72856615

Anyway, I have no idea if all I just put together makes sense or is accurate but as having ASD, I'm relating to all of these facts 100%.

I also understand that there might just be only 10 of us with ASD here, as well as there could be 100k  but if you are not ASD and call yourself autist, make us proud with your diamond hands!

There's one thing I'm sure tho, it is that I love you all beautiful apes.

See you on the moon with unlimited crayons and video games.

 "
2021-03-13 18:39:16,Wallstreetbets,"Stimulus Check Hype I’ve see a lot of people hyping up the stimulus checks and I completely agree that it’s an amazing thing which will help in this fight against the hedges. I’ve also seen fellow apes think it will boost to 350 on Monday which I completely think is possible.

I just want to emphasise that, as said by many before me, hedges can see us hype so please do not get disappointed if after a bit of a boost they immediately push it back down again. All we have to do is buy and hold, then we can enjoy the sweet tendies of £100k per share.

Diamond hands apes, Diamond hand 🙌🏻 💎💎🚀🚀🚀

I also want to add that I have been using the Etoro app for a little while now (trash I know) but there is one mega ape invested who has been giving daily predictions and warnings and has been literally bang on every single day. Much respect to @stranden93 (etoro username) however recently he has been silenced, it could be etoro or bots but every time he makes a post now it is instantly flagged and taken down. Be careful with all the data and statements you see as it could be exactly what they want you to see

To the moon you filthy animals
Not financial advice I’ve got a brain smoother than a buffed floor"
2021-03-13 18:35:15,Wallstreetbets,I will either own GameStop or be living under a bridge by EOY. 
2021-03-13 18:30:08,Wallstreetbets,Blatant CNBC $TSLA FUD. It’s literally north of 80% IRL 
2021-03-13 18:14:58,Wallstreetbets,"first time option trading First time option trading, long time retard

https://preview.redd.it/b698invratm61.jpg?width=1125&format=pjpg&auto=webp&s=bf8b0a86751156cd707c46bcfe38c44d81af28b9"
2021-03-13 17:58:35,Wallstreetbets,"GME - option flow by the number - JUST HODL SMOOTH BRAINS **$GME - Option flow by the numbers**Aftermarket close yesterday I was feeling fried - not so much because of GME (-15k on tsla options woof). So I unplugged, and hung out with my family. I’m an Old  Ape. I’m an ape with wife ape, a child ape. I’m an ape that owns a few businesses, and properties. But most importantly - I’m an ape that is completely over the looseness of regulations in securities exchanges, and this ape isn’t fucking selling.Feeling recharged this morning, with a couple cups of coffee - I decided to jump into Option order flow from Cheddar Flow.

&#x200B;

I used the following parameters:3/1 to 3/15 OrdersRemoved everything that has expired and decided to do what gives me comfort as a wrinkle brain ape and just look at the concrete data.

&#x200B;

The Excel sheet I provided shows many things, is it accurate? No - probably not. This ape may have some wrinkles, but is too smooth calculate IV.The bulleted point of the sheet is this (NOT BANANA ADVICE, JUST WRINKLE BRAIN APE LOOKING FOR ANSWERS)

There are: 111,204 Volume picked up in options that have yet to expire - between calls & putsThere is: 538,434 Current option interest on the strikes in this sheet The Average strike price divided by the total number of contracts purchased is 18,665 (this accounts for puts as well as calls)

.Because ape only has some wrinkles, not all the wrinkles I can’t account for IV - but I can account for a banana to banana value at volatility less cost. So ape decided to account for that, to give himself a bigger view of the overall picture.

There was: $24million in buys in deep ITM and slightly OOTM options picked up on 3/4 (ape things hedges for hedges (double fuck you scumbag funds if you’re reading this btw)

On a banana for banana basis ape determined total value of all options right now is 94,854,461 bananas.

So wrinkle brain ape took out the value of the puts, and hedges - and determined that the actual value is 140,017,514 Bananas in value. That’s a lot of bananas. Like a lot.  


 **(( EDIT: $99,965,839 spent on these options. // Shorts/Hedge removed is 116,463,553 ))**  


With ape baseless speculation - I value The shorts/hedge (fuck you again btw) as -45,163,053 bananas. That’s quite a banana deficit before you account for IV and Theta.  


**(( EDIT: -16,497,714 with adjustments to formula  still not sure how to account for IV / Vega / Theta in all of this))**

&#x200B;

Other information I like:65.2 million outstanding sharesshort float is 54.16 million cccording to whale wisdom q4 filings there are 74.474 million shares held (LOL what? More shares than available - keep this in mind),short interest according to Morningstar is 52% . (**EDIT: updated to 26.22%)**

There are currently 8.2 million more shares than outstanding (before apes and dfv of course).Short total should be around 28million shares.**Meaning 36.437 million shares need to be bought in order to cover.**  


**(( EDIT: -22,474,752 total shares to be covered after adjusting SI -))**

**TLDR:** Just fucking holding your shares, they bring bananas.Stop bitching about gamma, stop bitching about options, stop bitching about the day to day - wrinkle brain ape says this. Shit is going to hit the fan. Be apart of history apes.

Go long, and stay strong

\*\*Positions:\*\*Was holding 365 shares, told wife i'd withdraw more money this weekend because she's sketched out as fuck about all of this (bigly bananas up for the year), down to 265 shares now.  with $30k in bananas to continue to add

Excel Sheet attached.[https://drive.google.com/file/d/1xV1iz8mq-srWhjQCZmZQvowXm8L3SEgk/view?usp=sharing](https://drive.google.com/file/d/1xV1iz8mq-srWhjQCZmZQvowXm8L3SEgk/view?usp=sharing)

If there are errors i'll adjust later. need more coffee.

&#x200B;

&#x200B;

**EDIT 1:**there are errors, please don't down vote people for pointing them out. We should want accurate information, not just information that makes us feel good.

u/Verb0182 and u/auspiciousham specifically pointing our correct inaccuracies.Adjusting and will re-upload my boomer excel sheet.  


**EDIT 2:** After correcting formula in P column (my bad, good eye auspiciousham) and adjusting the short interest to 26.22 (good eyes verb)  updated totals are:  


22,474,752 million shares to cover  


&#x200B;"
2021-03-13 17:54:05,Wallstreetbets,"I was inspired by u/pakistani_in_MURICA and adopted a 2 year old gorilla, too! Thank you GME tendies! (Linked the website) #ApesAdoptingApes "
2021-03-13 17:41:24,Wallstreetbets,Up $230k mostly on GME with some AMC on the side. I was in all cash for months. I was afraid of a COVID or election related market crash. Thanks WSB for getting me off the sidelines! 
2021-03-13 17:40:51,Wallstreetbets,"Wanda AMC hypothesis AMC filed Wanda's intent to convert it's class B shares into class A shares on Feb 5th to the SEC. AMC's CEO recently stated that this was triggered by share dilution causing Wanda's majority shares fell below 30% and currently only sits at 9%. On March 10th it seemed like shares appeared out of nowhere and the cost to borrow rate plummeted. If you assume that the filing becomes official on the first business day after filing then it would have been official Feb 8th. If you count 30 days from Feb 8th then it would be March 10th. On March 10th it seemed that shares appeared out of nowhere and the cost to borrow plummeted. 

Is it possible that Wanda had a 30 day period where they weren't allowed to sell shares? As a matter of fact it seems that Wanda may have sold ALL their shares all together. Motley Fools' website lists institutional ownership as of March 13 and Wanda isn't listed at all. 

Another thing I read is that Class B shareholders are the last to receive any compensation if the company goes bankrupt. Why would Wanda ok the dilution of AMC's shares knowing it would cause them to lose the majority control they paid 2.6 Billion dollars for? Could it be that AMC fully anticipated going bankrupt prior to the reddit rally? I know that hypothesis doesn't jive with what was said in the shareholders meeting but I don't think anything they said necessarily disproves anything I've hypothesized. Nor would anything they said be a lie. They did very specifically point out that Wanda's position was held as of March 3rd. 

Why is March 3rd significant? That is 30 days from Feb 1 which is the day that the original reporting states that Wanda announced to AMC they would be converting shares. Would the same 30 day rule apply? They had to wait 30 days to disclose to the company their intent to sell and then 30 days from the SEC filing date to officially sell?"
2021-03-13 17:19:49,Wallstreetbets,"$611k in three months. Thought I was out. Nah, bought the dip yesterday. The show continues. "
2021-03-13 17:09:07,Wallstreetbets,"Get away from the screen for a minute... Hey everyone, it’s been a stressful week staring at GME for the entirety of the week, the past few weeks. 

Here’s some ideas on how to destress: 
- Go for a walk in the Forrest, woods or just around the city. (Depending on where you live)

- Feed the homeless 

- Talk to the Humane Society about volunteering

- Listen to your favorite music while on a drive 

- Call your mom/dad for a chat, they probably miss you

- Thank someone who helped you in the past

- If you were a paper handed boy, Donate some 
tendies to help your community. 

- If you are a Diamond Handed Man, donate some money to your community (GME will pay you back in the near future)

- Learn to knit

- Paint something, and it doesn’t even have to be good because “there’s no such things as mistakes, just happy accidents.”

- “Don’t forget to tell these special people in your life in your life just how special they are”

Seriously though, get your face out of your screen. You only have one life to live, enjoy yourself. 
I love you all the same way my wife loves her boyfriend. Take care tards’"
