Timestamp,Subreddit,Post/Comment
2021-03-13 00:02:49,Wallstreetbets,"1-800-FLOWERS DD First of volume has been low and I think that this thing would bust with volume . I will sell options around $40 and shares around $43-45 post mothers day nut.

Full Disclosure I have 10 6/18 $28 Calls and 227 Shares of 1-800-Flowers

This is a shorter term play.

We just saw great earning in previous QTR, I expect another great round of earnings with valentines day, and not to be a piece of shit but the huge covid spikes causing death and sickness where flowers sales without contact will spike.

With the massive earning from Q4 we didn’t see much of a pop, it grew before the report. I expect similar situations for Q1 earnings

Once covid subsides I would expect 1-800 to take a nose dive so we are talking 3-6 months max! My wifes boyfriend sends these to her all the time and she loves it. I have sent feedback to request crayons added for the smooth brains.

The company has a few subs that compliment flowers. their indoor plant business has also had a large boom with people working from home.

I supported the cause and got my boo thang some for v day. The product was amazing so i felt comfortable holding.

TLDR: 40$ is exit, short term strategy, wifes boyfriend sends these to her all the time."
2021-03-13 00:01:39,Wallstreetbets,"Fellow Retards - Today I made my last 2 weeks of gains from shorting the pops on SPY, DISAPPEAR 🪄 "
2021-03-13 00:00:29,Wallstreetbets,Wtf is this misleading title ? What do they want to achieve ? 
2021-03-13 00:00:16,Wallstreetbets,"Weekend Discussion Thread for the Weekend of March 12, 2021 Your weekend discussion thread. Please keep the shitposting to a maximum!

Follow [@Official_WSB](https://twitter.com/Official_WSB) on Twitter, all other accounts are impersonators."
2021-03-13 00:00:05,Wallstreetbets,WHEN DO I STOP BUYING??????? WHEN HEDGYS START!!!!!!!!!! MARKET SINGLES TILL IM IN A BAG!!!!!!!!! 
2021-03-12 23:59:32,Wallstreetbets,All I’m asking for is $11 are y’all coming back for me ? 😂😂😂 
2021-03-12 23:57:19,Wallstreetbets,"GME: The most effective FUD comes from within. The most effective FUD is setting peoples' expectations and having the market consistently fail to deliver.  The most effective FUD comes from within.

Most apes ignore obvious shills.  Most apes upvote and get excited about ""liftoff tomorrow, squeeze starts today, etc.""

Don't set your fellow apes up for failure.  Stress and anxiety are the distance between expectation and reality.   Ignore posts with specific dates.  Stop upvoting them.

GME is fucking killing it.  GME will moon, but we don't know when. 🚀🚀🚀🚀🚀💎👐"
2021-03-12 23:54:44,Wallstreetbets,"Trading Tips for Novice Apes I scored me an Adderall yesterday and in my amphetamine-induced madness sat down and wrote a bunch of rambling crap about trading stonks and options for beginners. I know, let's let the newbies lose all their money and clean out this trash-heap, but come on, the paper trading competition is more effective than sheer stupidity. Anyways, here's some tips to not lose money, at least not as quickly as $800 GME calls.

  DiVeRsIfY!

Options are great. No, not those kind of options, but options like how normal people use the word. Basically when trading it’s hard to be right 100% of the time, so why risk your whole account by owning a single stock? It’s dangerous because *you will be wrong* and if you bet it all when you’re wrong, even if it is rare, you’re out of the game. All the money is gone. You might even *owe money to the broker* if you did something really dumb.

Diversification is sometimes laughed about, even by giants like Warren Buffet. He famously said something like, “Put all your eggs in one basket *and watch the basket*.” He’s not wrong, but most people don’t know what to look for regarding dangers to this basket. There could be a wolf about to eat all the eggs and we wouldn’t know it. *We wouldn’t even know what a wolf looks like!* My point is unless you’re an expert at knowing market conditions, economic conditions, and are great at reading 10-Ks and 10-Qs like a wizard, you probably can’t watch the basket very well.

Personally, I admit I don’t know shit about companies. I invest in meme stocks that have high options premium. That’s my investment strategy. My egg basket is, well, I don’t know what it is, but it sure isn’t something that has any business holding eggs. The eggs could be eaten, spoiled (there's probably an option expiration joke here), or be stolen at any moment and that’s why I have multiple baskets. One or two of the baskets can get stolen/eaten, and I still have eight more. I can and will be wrong, and at most it’ll wipe out 10% of my holdings. I, and you, can happily easily take a 10% hit to the investment account and be able to function.

This play more into my next tip: be stoic. By diversifying you can remove extreme emotion from your investing/trading.

## Be Calm. Be Chill. Be Stoic. It’s just money after all!

You are your main enemy to stock market success. It’s not market makers, shorts, or other traders; they only use you against yourself. Why? Because you’re a person. You have emotions. You’re stupid and irrational and emotional. Money is on the line; you know the thing we all trade for shelter, food, good, and everything? Money is fundamentally tied to emotion, so when your money starts to get messed with you get stupid. Think of all the silly shit you’ve done and said on an emotional high or low. You may have drunkenly told someone you loved them, kicked someone’s ass, bought something stupid, and apply this to your investment account. How are you going to treat hundreds or thousands of investment money if you’re emotional? When a stock you own (please be diversified!) drops 60% and your money disappears what do you do? You have a choice and emotion will only make the choice harder to make.

I don’t really have a tip here because it’s something you learn to deal with. There is no magical key to not being emotional when money is involved (besides shutting your phone off and going for a walk), but just know that it is immensely important, more than any other thing, to keep emotion in check in regards to investing. I do have a few tips on things to be aware of though. Luckily they have names so by labeling them you can recognize what’s happening and combat it.

## FOMO

Fear of Missing Out. You watch a stock you were kinda thinking about buying jump 300% in a few days. People at work are talking about their hot stock that's printing them tendies. You start to think that maybe you missed the boat -- you dragged your feet and are sitting out riding the rocket to the moon -- or did you? Maybe it’ll go up another 300% *if you get in ASAP!* Yeah, that’s a great idea. You’re not even greedy, you just want it to go up a little bit so you can feel like you were part of the moon mission, and that’s not hard to do, right? Surely if it went up so quickly, it’ll keep going up at least until you sell.

Wrong. This is a terrible idea. Hype is dangerous. FOMO is why people I work with are chucking money into \[redacted\] at $50,000 after it went up 1,000% in a year. This is why people are *still* bagholding GameStop at $450 per share. This is why a large portion of bagholders exist in the first place; their still holding onto their $18 AMCs they bought a few months ago no wanting to take the loss.

If you find yourself experiencing HARD FOMO and *just can’t resist*, buy yourself a small portion. Don’t go crazy. Don’t “invest” anything more than you’re willing to lose. Using \[redacted\] again, if you invested $1,000 at $50,000 and \[redacted\] went down to $5,000, would you be fine with it? You turned $1,000 into $100 and how would you feel? There is a low enough point where it’s stomachable, so invest that. I’m not buying \[redacted\] but if I did I’d be okay with a $500 ""investment."" If I lose it, it’s fine, and I won’t lose sleep over it. FOMO is dangerous so be aware of it.

## FUD/Dooming

The opposite of FOMO: Fear, Uncertainty, Doubt. This can be caused by your family questioning what the hell you bought, news stories, internet shitposts, etc. and make you scared to hold your stock/option because you're worried the price will crash. These pale in comparison to witnessing a beloved stock you owe totally collapse in price. You watch your thousands of dollars of gain disappear in a few days (or maybe hours) and what do you do? You panic sell. You're $10,000 profit is down to $7,000, $6,000 and $5,000 and *OMG how much worse can it get! I could lose all my profit!* You panic sell and realize a $2,000 gain, but oh how you kick yourself in the ass for not getting out at the top. You were greedy, you feel like shit. You're the worst trader ever.

Then the next day the stock goes up and you get a side of FOMO to go with your main-course FUD. *If only you held...but maybe it's not too late to jump back in?*

As before, no real tips on this one. It's also hard to give tips for when something emotional is happening. It's easy to say ""*don't panic sell!*"" but when you're on the verge of panic selling its hard to detach yourself from the numbers on your screen and actually not panic sell. Only with hindsight do you realize how much of a paper-handed bitch you were.

Like with FOMO, a good recipe for mitigating FUD is to give into your emotions just a little bit so you feel like you're doing something. If you want to sell as a stock is crashing, sell half. Sell a third. You don't need to sell it all and regret it later. And if you have truly massive balls, you can always *buy more shares on the way down!*

## No Regrets! No ""what ifs""!

There's few things worse than seeing an ""investment"" work out better than you expected but to not sell at the top. You're always haunted by the ""what if I just did this…"" A stock triples, you don't sell, and then it's back to where you bought it at. You could've raked in *so much money* but you held too long and raked in absolutely nothing.

Then there's the opposite problem: selling too early. You got greedy/scared and took a 10% gain when you could've had a 1000% gain. This was me with *GameStop* in January. I had 400 shares total and sold them around $30-40. Sure I made $5,000 but I could've had $150,000 if I held on for another week or so! Try not to kick yourself in the ass for missing like that and tell me how well it goes. It's hard.

At least I didn't FOMO back in. I realized my mistake -- I sold too early -- and am trying my best to not let it haunt me. Everything is clear with hindsight and what I did made sense at the time. Trading is stupidly hard and no one perfectly buys at the bottom or sells at the top and as long as you come out ahead, who cares? I'm not the guy holding bags at $450 a share, and at least I was in the play and made some significant cash. As always, easier said than done, but try not to be too hard on yourself for not being perfect.

My tip here is to take profits as you wish. You can probably tell that I'm a big fan of taking half-measures -- selling half, buying half -- because you're doing something and doing something feels good. If a stock goes up 20% and you want to sell, sell half. Realize some profits and let the rest ride. If it goes up even more, sell half of those, and so on. This isn't a rule, just an idea. You feel good taking profits but leaving some on the table does wonders for the ""what if"" thoughts that might haunt you.

The same is true for buying. Buy half of what you want and see how it plays out. If the stock goes down, buy more. This keeps you safe from tossing in a ton of money at a high price, but makes you feel good for getting some cash in the game.

Disclaimer: I like the stock. This is financial advice."
2021-03-12 23:51:30,Wallstreetbets,"I'm a -$9,300 tesloser, bought puts it went up bought more puts went up, bought more puts it went up, started buying calls so it stayed flat, lost big both ways this week. Ouch. "
2021-03-12 23:49:37,Wallstreetbets,SEAS Short YOLO - Free the 🐳🐳🐳 
2021-03-12 23:48:34,Wallstreetbets,BofA: GME shares remain very detached from fundamentals (Apes to the Moooon) 
2021-03-12 23:40:58,Wallstreetbets,Are y’all still doing loss porn? The VIXY got me.... 
2021-03-12 23:36:44,Wallstreetbets,Not a bad way to leave RH I guess 
2021-03-12 23:33:27,Wallstreetbets,I like the Stonk💎🖕🏾🙌🏾 
2021-03-12 23:30:26,Wallstreetbets,$301 please 🦍💎🙌🏻 
2021-03-12 23:27:59,Wallstreetbets,Ready to go into the weekend 😎💎🙌 🚀 
2021-03-12 23:27:57,Wallstreetbets,Seemed like a good idea at the time. But still holding 
2021-03-12 23:20:55,Wallstreetbets,"$30k 0DTE - Shoot for the moon, land among the retards "
2021-03-12 23:17:02,Wallstreetbets,46 more gme at 270 total of 50 let’s moon my fellow apes! 
2021-03-12 23:13:00,Wallstreetbets,Could you guess the day I found out about options?🤧 
2021-03-12 23:08:37,Wallstreetbets,CNBC guest says that r/wallstreetbets community is doing better financial analysis than Hedge Funds 
2021-03-12 23:09:02,Wallstreetbets,"Retarded CVS DD Title says it all. I am a simple Ape. I've been Swing Trading CVS calls for a while now and it's just consistently printing money for me.

Low Theta & High Delta = I Like the Stock.

COVID Vaccine/Biden Play = I Like the Stock.

Michael Burry owns 10% of CVS in his Portfolio (and favored by many other HFs) = I Like the Stock

Fundamentally Undervalued = I Like the Stock

Cheap Calls = I Like the Stock.

&#x200B;

Honestly, CVS Calls are my Hedging Strategy at this point, but it does really carry my portfolio a lot of the times but I never see CVS getting mentioned so wanted to hear your guys' opinions on this stock. I like the stock and am currently holding 4/16 calls that I will roll over very soon.

&#x200B;

EDIT: Also, call options for CVS have very low IV, so stock can barely move, and your Call Options will rally... "
2021-03-12 23:06:48,Wallstreetbets,"CLF Yolo Update. Bought these contracts yesterday, made some gains already.😀 "
2021-03-12 23:06:43,Wallstreetbets,Am I totally off my ass with this one? 
2021-03-12 23:01:25,Wallstreetbets,Can’t stop FOMOing! $200k in UWMC!!! 
2021-03-12 22:53:38,Wallstreetbets,got some more today 
2021-03-12 22:53:20,Wallstreetbets,"If you can’t beat them, join them 🤷🏽‍♂️ "
2021-03-12 22:46:20,Wallstreetbets,GOEV... CRAZY VOLUME ON OPTIONS FOR 3/19 CALLS... SOMEBODY KNOWS SOMETHING 
2021-03-12 22:38:47,Wallstreetbets,This is why you NEVER DOUBT ELON 
2021-03-12 22:28:19,Wallstreetbets,Is this good? I can't read 
2021-03-12 22:24:29,Wallstreetbets,DFV and the Trade of Destiny 
2021-03-12 22:23:07,Wallstreetbets,Made a simulator to visualize how we'll beat the hedge funds @350 BROTHERS WE ARE COMING TO GET YOU 🦍💎🦍 
2021-03-12 22:19:03,Wallstreetbets,Another Sea Shanty by Sw4y 
2021-03-12 22:09:54,Wallstreetbets,LEAPS.ai 
2021-03-12 21:57:08,Wallstreetbets,"GME Mothership Preparing for lift off🚀🚀 (next stop, intergalactic orbit)💎💎. Do you see what I see? "
2021-03-12 21:56:00,Wallstreetbets,GME After I get my stimmy this weekend (OC) 
2021-03-12 21:50:32,Wallstreetbets,Reinforcements coming in for you guys 
2021-03-12 21:49:21,Wallstreetbets,Diamond Hands and diamond balls 
2021-03-12 21:46:43,Wallstreetbets,"$UWMC: (Part 4) When the Squozes keep on squoozing, and shorties keep on shorting... **I'm not a financial advisor, nor am I giving any financial advise. This is an  entertainment/comedy-nonfactual post. I'm a retard  posting on WSB with a  bias due to having a large position in $UWMC. So, proceed on your own  risk... and don't act on anything written here.**

Part 1: [https://www.reddit.com/r/wallstreetbets/comments/m17a0w/uwmc\_when\_the\_squozes\_keep\_on\_squoozing\_and/](https://www.reddit.com/r/wallstreetbets/comments/m17a0w/uwmc_when_the_squozes_keep_on_squoozing_and/)

Part 2: [https://www.reddit.com/r/wallstreetbets/comments/m1yfbb/uwmc\_part\_2\_when\_the\_squozes\_keep\_on\_squoozing/](https://www.reddit.com/r/wallstreetbets/comments/m1yfbb/uwmc_part_2_when_the_squozes_keep_on_squoozing/)

Part 3: [https://www.reddit.com/r/wallstreetbets/comments/m2rqq0/uwmc\_part\_3\_when\_the\_squozes\_keep\_on\_squoozing/](https://www.reddit.com/r/wallstreetbets/comments/m2rqq0/uwmc_part_3_when_the_squozes_keep_on_squoozing/)

I highly recommend reading the Prequels before going ahead with the sequels. Disclaimer, this sequel will not be as good as the origin post!

So, shorts are still winning with the short volume ratio being 30.17 Yesterday(Fintel). Although some of the shorts had to cover to avoid paying the dividends, yesterday they got back at it with the ratio mentioned before. It's really inspiring how relentless they are! In addition, the borrow rate rose to 8.86%(Fintel).

**As of 03/11/2021(Fintel) the Short Volume Ratio is 30%.** To put things into perspective, If there's a short interest of %10, that's considered high. If there's a short interest of %20 or greater, **that's considered extremely high**. 

&#x200B;

[03\/11\/2021\(Fintel\) the Short Volume Ratio](https://preview.redd.it/ej84xpck5nm61.png?width=557&format=png&auto=webp&s=dc67440203d544cba39db6f3db68f0d3200870c3)

The only reason I could come up with as to why this is being shorted so much is due to institutional holders not wanting it reach the 10$+ where a Gamma squeeze could potentially happen on 03/19/2021 Calls. This would results in their premiums for Calls being lost(all opinion). Remember that there is a large institutional stake in $UWMC.(More on this paragraph in part 2)

**(NEWS)** Anyway, if you missed the recent [$UWMC news](https://nationalmortgageprofessional.com/news/76503/larger-broker-shops-already-signed-addendum), United Wholesale Mortgage reported that some large broker shops across the country have signed the UWM all-in addendum representing over 90% of broker shops who will no longer work with Rocket Mortgage and Fairway Independent Mortgage Corporation, exactly one week after the Facebook Live announcement.

The All-In addendum states that after **March 15**, broker-owners continuing to do doing business with UWM means they can no longer do business with both Rocket Mortgage and Fairway Independent Mortgage Corporation.

 ""The support and appreciation we have received over the last week has far exceeded our expectations,"" said Mat Ishbia(CEO).  ""Our partners understand the importance of working with a lender focused on the future growth of not only their business but the entire channel.""

**In summary, I'm very excited for next week. It'll prove to me either the CEO is as good as I expect him to be (He's a big reason why \~48% of my portfolio is in it) and he'll capitalize on the rare opportunity of a Gamma squeeze which could potentially happen on 03/19/2021 Calls (more on that in Part 2), or I would be very disappointed.**

 **I wouldn't buy any $UWMC 03/19 Calls anymore** because they are useless in my opinion towards the stock and have a high **risk of expiring worthless (More on that in Part 2).** On the other hand, **I would only buy shares** and maybe leaps if they are cheap enough.

**(Important Part):** If you like the stock and think it’s undervalued, you can share $UWMC posts or make your own DD to give this stock more exposure. If people believe in it as much as you do, they might buy it and we can hopefully all eat Tendies on the Moon(soon)🚀🌕🍗


**My short term Price target is still 39$** 🚀🌕"
2021-03-12 21:40:05,Wallstreetbets,GME - the last stand. I’ll be letting these options get exercised. Get squozed or go broke 
2021-03-12 21:35:29,Wallstreetbets,average one day till expiry option gains 
2021-03-12 21:34:20,Wallstreetbets,"A health guide for the storm we find ourselves in. Ok guys I get it and I have been there when it comes to making this money with GME. I have been the guy who hits the refresh button all day, who GUH's the dips, of course I have in the past had to use credit because I had spent more of my paycheck  than I should have.  I have seen a lot of people who are getting  obsessive to the point its could be unhealthy. We are one of the most chilled out group of autists  I have ever met. Which is why I made this guide to remind you all of a few things. I based this guide off of posts I have seen and replies to posts I have made. Please note I am not speaking about 1 stock in general, this applies to everything market related. I just use GME because its an easy example. 

1. It's a good thing the market closes on the Weekend. This cannot be the only thing you focus on. As your parents or wife's boyfriend would tell you "" Go outside"". You need to get out and do other things not related to the stock market. Keep your hobbies, play with your kids, go see your parents. You have to get out and do things other than WSB,and watching tickers all day.
2. Eat you Autistic pieces of shit. 3 Meals a day I dont care if its all Wendys, you have to eat 3 meals a day. On a serious note either eat some fruit or take a good multi vitamin. For the sake of not spending all of Melvins money on doctors visits please drink some water too.  

3. DON'T SPEND MONEY YOU DON'T HAVE. If I see one more question about how margin works ,how to get approved for margin or if they should yolo all their money on Margin im going to have a stroke.  If you thought losing more than half your initial investment sucks, Imagine losing all you invested because you now owe your broker their portion. Then of course you might owe some interest on that pending on the broker.

&#x200B;

4. Dont let this get in the way of your day job. I cleared near half my yearly salary on GME round one. I did this all the while working and not neglecting my responsibilities. I dont care if you're a  bagger at the grocery store or the stim man Crazy Joe. Do your shit so you can pay your bills. If you really cannot help it take some PTO on a day that you think you will need to watch it constantly. Just dont get fired.

&#x200B;

5. Your family probably thinks its cool you're in on something big ( GME for example),but they probably get sick of hearing about it. This should not be the only dialog you have with others around you. Keep that shit here, lets circle jerk. Told the wife today Im back in GME for 3k more ( I have been trying to swing trade it for RD 2 just to do something different all the while catching the squeeze). All she said was "" again?"". Now in RD 1 she was asking about it probably as much as I was looking at it . This is not nearly as cool as many of us think it is. Most people dont get whats happening or do not care. This is ok.

6. Know when to get out. I know this is hard for people from my generation but in this game there are winners and losers. Dont be a fuckin loser you fucking loser. When this shit can change your life take some profit. Stay in diamond hand the shit out of it but take care of you. Someone during this squeeze will still buy at the top Guaranteed . He/she will HODL and be stuck at sub 10% loss for sure.  Get in before its too late or just say this is not for me this time. 

7. Now this is kinda misinformation because the market makes no sense right now but.... Once something reaches the news,social media ,or is being talked about. Its usually too late. BUY the rumor sell the news.Someone out there already knew this before the media did, they got in when it was low. Once its common knowledge these people or firms are already selling leaving you bag holding. 

8. Do your DD. No!! not the DD your wife's boyfriend is giving her while you cuck looking at AH tickers on your phone. Research the stock , and decide for yourself. Go to investopedia and educate yourself on the vocabulary. You should know some basics behind stock fundamentals. If Im pushing a stock on here , you do not know me. I could just be trying to give you my bags to hold. 

&#x200B;

9. Exercise please , you need to move about during your day. It will help you mentally and physically .

10.Dont hate on others who dont invest in your stock. We are a support group, a fundamental group and above all else we eat crayons together. I bought GME in January at 40$ per share, got told I was a retard for doing so by my friends. Never said shit to them when it mooned,even though they told me WMT is where the money is. Not everyone is in GME, and those who are genuinely believe the hype. As my wife's boyfriend says to be when I get to be a grumpy gills "" If you dont have anything nice to say dont say anything at all.""

11. To make it simple if you dont know how to buy a Call option don't be buying call options. You need to do a lot more research into the fundamentals. You will lose your ass.

Positions

GME 11 @ 267, AMC 600 @ 14, BB 150 @ around 14 IDK it was a busy day, NOK 30 @ 8, NIO 8  @ 44, TSLA 2 @ 800, AAPL 140@ 134  ,AMD bought up to 20 over the past year down 11%.

Recent plays: 

GME 200@ 40$ cleared 30K at 140,RBLX 8 @ 68 sold at 75$ small profit."
2021-03-12 21:32:52,Wallstreetbets,Please drop to 200 so I can but 5 shares 
2021-03-12 21:28:18,Wallstreetbets,"I turned $1k into $87k with LOGI using sell and roll, and am now going YOLO on AMD. "
2021-03-12 21:25:50,Wallstreetbets,"$DISCA YOLO Call Options Trade! This stock will easily be over $200 by the end of year! &#x200B;

https://preview.redd.it/5b77s0dx3nm61.jpg?width=1079&format=pjpg&auto=webp&s=207173b1617323fb72f8f0ff5cede104d4355eef"
2021-03-12 21:23:58,Wallstreetbets,300 call 3/19 😤😤😤😤😤 LFGGGGGG! My wife’s boyfriend must not win! I must win! 
